-- MySQL dump 10.13  Distrib 8.0.43, for Win64 (x86_64)
--
-- Host: localhost    Database: base_2026
-- ------------------------------------------------------
-- Server version	8.0.43

/*!40101 SET @OLD_CHARACTER_SET_CLIENT=@@CHARACTER_SET_CLIENT */;
/*!40101 SET @OLD_CHARACTER_SET_RESULTS=@@CHARACTER_SET_RESULTS */;
/*!40101 SET @OLD_COLLATION_CONNECTION=@@COLLATION_CONNECTION */;
/*!50503 SET NAMES utf8mb4 */;
/*!40103 SET @OLD_TIME_ZONE=@@TIME_ZONE */;
/*!40103 SET TIME_ZONE='+00:00' */;
/*!40014 SET @OLD_UNIQUE_CHECKS=@@UNIQUE_CHECKS, UNIQUE_CHECKS=0 */;
/*!40014 SET @OLD_FOREIGN_KEY_CHECKS=@@FOREIGN_KEY_CHECKS, FOREIGN_KEY_CHECKS=0 */;
/*!40101 SET @OLD_SQL_MODE=@@SQL_MODE, SQL_MODE='NO_AUTO_VALUE_ON_ZERO' */;
/*!40111 SET @OLD_SQL_NOTES=@@SQL_NOTES, SQL_NOTES=0 */;

--
-- Table structure for table `can_2021`
--

DROP TABLE IF EXISTS `can_2021`;
/*!40101 SET @saved_cs_client     = @@character_set_client */;
/*!50503 SET character_set_client = utf8mb4 */;
CREATE TABLE `can_2021` (
  `CO_GRUPO` varchar(20) DEFAULT NULL,
  `IdPersona` int DEFAULT NULL,
  `FE_ALTA` varchar(11) DEFAULT NULL,
  `Monto` decimal(14,2) DEFAULT NULL,
  `FE_castigo` varchar(11) DEFAULT NULL,
  `Monto_castigado` decimal(14,2) DEFAULT NULL,
  `Fe_Alta_dep` date DEFAULT NULL,
  `Fe_castigo_dep` date DEFAULT NULL,
  `IMPORTE` decimal(12,2) DEFAULT '0.00',
  `COMISION` decimal(12,2) DEFAULT '0.00'
) ENGINE=InnoDB DEFAULT CHARSET=utf8mb4 COLLATE=utf8mb4_0900_ai_ci;
/*!40101 SET character_set_client = @saved_cs_client */;

--
-- Dumping data for table `can_2021`
--

LOCK TABLES `can_2021` WRITE;
/*!40000 ALTER TABLE `can_2021` DISABLE KEYS */;
INSERT INTO `can_2021` VALUES ('18RP',470476,'22/08/2021',587.00,'',0.00,'2021-08-22','1900-01-01',500.00,75.00),('0125',504282,'23/03/2021',1558.00,'',0.00,'2021-03-23','1900-01-01',1500.00,50.00),('0121',523357,'03/12/2021',2687.00,'',0.00,'2021-12-03','1900-01-01',2600.00,75.00),('0357',683854,'03/12/2021',5587.00,'',0.00,'2021-12-03','1900-01-01',5500.00,75.00),('0YOW',934976,'27/08/2021',2087.00,'',0.00,'2021-08-27','1900-01-01',2000.00,75.00),('0115',958330,'25/02/2021',758.00,'',0.00,'2021-02-25','1900-01-01',700.00,50.00),('15XA',980797,'27/08/2021',4587.00,'',0.00,'2021-08-27','1900-01-01',4500.00,75.00),('0155',990143,'11/07/2021',887.00,'',0.00,'2021-07-11','1900-01-01',800.00,75.00),('0108',998716,'23/12/2021',5287.00,'',0.00,'2021-12-23','1900-01-01',5200.00,75.00),('0126',1012079,'02/04/2021',1658.00,'',0.00,'2021-04-02','1900-01-01',1600.00,50.00),('0179',1122357,'06/06/2021',587.00,'',0.00,'2021-06-06','1900-01-01',500.00,75.00),('0191',1126499,'22/10/2021',6587.00,'',0.00,'2021-10-22','1900-01-01',6500.00,75.00),('0211',1150606,'05/01/2021',1458.00,'',0.00,'2021-01-05','1900-01-01',1400.00,50.00),('0121',1162080,'18/09/2021',2587.00,'',0.00,'2021-09-18','1900-01-01',2500.00,75.00),('0108',1173053,'02/02/2021',4058.00,'',0.00,'2021-02-02','1900-01-01',4000.00,50.00),('0221',1174259,'12/02/2021',1558.00,'',0.00,'2021-02-12','1900-01-01',1500.00,50.00),('0234',1215714,'07/04/2021',1458.00,'',0.00,'2021-04-07','1900-01-01',1400.00,50.00),('0248',1260785,'06/11/2021',6587.00,'',0.00,'2021-11-06','1900-01-01',6500.00,75.00),('0248',1262799,'14/09/2021',1887.00,'',0.00,'2021-09-14','1900-01-01',1800.00,75.00),('0248',1263755,'24/08/2021',5087.00,'',0.00,'2021-08-24','1900-01-01',5000.00,75.00),('0248',1264209,'05/10/2021',6587.00,'',0.00,'2021-10-05','1900-01-01',6500.00,75.00),('0248',1264498,'17/09/2021',2887.00,'',0.00,'2021-09-17','1900-01-01',2800.00,75.00),('0248',1264928,'03/09/2021',3687.00,'',0.00,'2021-09-03','1900-01-01',3600.00,75.00),('3437',1289255,'03/04/2021',4058.00,'',0.00,'2021-04-03','1900-01-01',4000.00,50.00),('10JZ',1289826,'21/11/2021',2087.00,'',0.00,'2021-11-21','1900-01-01',2000.00,75.00),('0ZRZ',1319961,'17/12/2021',1687.00,'',0.00,'2021-12-17','1900-01-01',1600.00,75.00),('0ZRZ',1319961,'17/04/2021',1558.00,'',0.00,'2021-04-17','1900-01-01',1500.00,50.00),('0289',1343813,'12/01/2021',1458.00,'',0.00,'2021-01-12','1900-01-01',1400.00,50.00),('0317',1398767,'22/12/2021',1987.00,'',0.00,'2021-12-22','1900-01-01',1900.00,75.00),('0063',1404060,'13/12/2021',3487.00,'',0.00,'2021-12-13','1900-01-01',3400.00,75.00),('0062',1411636,'12/02/2021',1558.00,'',0.00,'2021-02-12','1900-01-01',1500.00,50.00),('0334',1429273,'05/12/2021',987.00,'',0.00,'2021-12-05','1900-01-01',900.00,75.00),('0YJJ',1429323,'09/01/2021',2358.00,'',0.00,'2021-01-09','1900-01-01',2300.00,50.00),('0345',1456995,'23/09/2021',1487.00,'',0.00,'2021-09-23','1900-01-01',1400.00,75.00),('0345',1456995,'27/03/2021',1058.00,'',0.00,'2021-03-27','1900-01-01',1000.00,50.00),('0359',1457787,'01/01/2021',2558.00,'',0.00,'2021-01-01','1900-01-01',2500.00,50.00),('0357',1460559,'12/06/2021',2087.00,'',0.00,'2021-06-12','1900-01-01',2000.00,75.00),('0357',1460732,'21/01/2021',4058.00,'',0.00,'2021-01-21','1900-01-01',4000.00,50.00),('0PIF',1471002,'06/09/2021',587.00,'',0.00,'2021-09-06','1900-01-01',500.00,75.00),('0329',1476837,'19/08/2021',887.00,'',0.00,'2021-08-19','1900-01-01',800.00,75.00),('0419',1550607,'13/12/2021',2087.00,'',0.00,'2021-12-13','1900-01-01',2000.00,75.00),('0419',1550771,'23/03/2021',558.00,'',0.00,'2021-03-23','1900-01-01',500.00,50.00),('0419',1551464,'31/01/2021',658.00,'',0.00,'2021-01-31','1900-01-01',600.00,50.00),('0419',1551845,'25/06/2021',1587.00,'',0.00,'2021-06-25','1900-01-01',1500.00,75.00),('0419',1552033,'28/09/2021',1087.00,'',0.00,'2021-09-28','1900-01-01',1000.00,75.00),('0419',1552272,'11/02/2021',1058.00,'',0.00,'2021-02-11','1900-01-01',1000.00,50.00),('0419',1553072,'19/03/2021',1358.00,'',0.00,'2021-03-19','1900-01-01',1300.00,50.00),('0419',1553320,'28/10/2021',887.00,'',0.00,'2021-10-28','1900-01-01',800.00,75.00),('0108',1557719,'26/02/2021',1358.00,'',0.00,'2021-02-26','1900-01-01',1300.00,50.00),('0405',1560309,'20/09/2021',1187.00,'',0.00,'2021-09-20','1900-01-01',1100.00,75.00),('0405',1560507,'23/01/2021',558.00,'',0.00,'2021-01-23','1900-01-01',500.00,50.00),('0405',1560556,'10/01/2021',758.00,'',0.00,'2021-01-10','1900-01-01',700.00,50.00),('0405',1560853,'16/10/2021',1187.00,'',0.00,'2021-10-16','1900-01-01',1100.00,75.00),('0405',1561034,'22/06/2021',1587.00,'',0.00,'2021-06-22','1900-01-01',1500.00,75.00),('0405',1561182,'31/07/2021',987.00,'',0.00,'2021-07-31','1900-01-01',900.00,75.00),('0248',1565068,'25/08/2021',787.00,'',0.00,'2021-08-25','1900-01-01',700.00,75.00),('0452',1572908,'15/10/2021',1087.00,'',0.00,'2021-10-15','1900-01-01',1000.00,75.00),('0452',1572932,'27/12/2021',2987.00,'',0.00,'2021-12-27','1900-01-01',2900.00,75.00),('0452',1574250,'17/12/2021',3087.00,'',0.00,'2021-12-17','1900-01-01',3000.00,75.00),('0452',1574292,'04/12/2021',1087.00,'',0.00,'2021-12-04','1900-01-01',1000.00,75.00),('2305',1587021,'28/09/2021',1387.00,'',0.00,'2021-09-28','1900-01-01',1300.00,75.00),('0404',1592799,'14/02/2021',2958.00,'',0.00,'2021-02-14','1900-01-01',2900.00,50.00),('0095',1595461,'24/07/2021',587.00,'',0.00,'2021-07-24','1900-01-01',500.00,75.00),('1B9D',1618735,'02/12/2021',587.00,'',0.00,'2021-12-02','1900-01-01',500.00,75.00),('1B9D',1618735,'19/08/2021',787.00,'',0.00,'2021-08-19','1900-01-01',700.00,75.00),('0R5B',1636349,'15/11/2021',6587.00,'',0.00,'2021-11-15','1900-01-01',6500.00,75.00),('0430',1646389,'10/01/2021',858.00,'',0.00,'2021-01-10','1900-01-01',800.00,50.00),('0430',1646934,'03/02/2021',558.00,'',0.00,'2021-02-03','1900-01-01',500.00,50.00),('1019',1654649,'26/04/2021',858.00,'',0.00,'2021-04-26','1900-01-01',800.00,50.00),('1019',1676329,'29/01/2021',4058.00,'',0.00,'2021-01-29','1900-01-01',4000.00,50.00),('1019',1713312,'19/12/2021',1887.00,'',0.00,'2021-12-19','1900-01-01',1800.00,75.00),('5760',1727627,'22/11/2021',4587.00,'',0.00,'2021-11-22','1900-01-01',4500.00,75.00),('0559',1730340,'03/12/2021',3087.00,'',0.00,'2021-12-03','1900-01-01',3000.00,75.00),('0559',1730431,'06/07/2021',1187.00,'',0.00,'2021-07-06','1900-01-01',1100.00,75.00),('0218',1731710,'05/01/2021',3058.00,'',0.00,'2021-01-05','1900-01-01',3000.00,50.00),('0587',1761246,'08/12/2021',2487.00,'',0.00,'2021-12-08','1900-01-01',2400.00,75.00),('1B9D',1799089,'26/02/2021',558.00,'',0.00,'2021-02-26','1900-01-01',500.00,50.00),('1B9D',1799089,'17/02/2021',558.00,'',0.00,'2021-02-17','1900-01-01',500.00,50.00),('0616',1805266,'18/11/2021',1487.00,'',0.00,'2021-11-18','1900-01-01',1400.00,75.00),('0616',1805266,'09/11/2021',1287.00,'',0.00,'2021-11-09','1900-01-01',1200.00,75.00),('0121',1821438,'19/08/2021',6587.00,'',0.00,'2021-08-19','1900-01-01',6500.00,75.00),('0359',1828045,'02/10/2021',2987.00,'',0.00,'2021-10-02','1900-01-01',2900.00,75.00),('0248',1836543,'24/11/2021',587.00,'',0.00,'2021-11-24','1900-01-01',500.00,75.00),('1CQ8',1839901,'02/11/2021',2087.00,'',0.00,'2021-11-02','1900-01-01',2000.00,75.00),('16X6',1849363,'18/11/2021',1187.00,'',0.00,'2021-11-18','1900-01-01',1100.00,75.00),('0470',1862507,'06/12/2021',587.00,'',0.00,'2021-12-06','1900-01-01',500.00,75.00),('0021',1864594,'22/10/2021',2087.00,'',0.00,'2021-10-22','1900-01-01',2000.00,75.00),('0066',1877885,'07/02/2021',2758.00,'',0.00,'2021-02-07','1900-01-01',2700.00,50.00),('0254',1885094,'06/01/2021',3558.00,'',0.00,'2021-01-06','1900-01-01',3500.00,50.00),('0683',1886654,'03/11/2021',2787.00,'',0.00,'2021-11-03','1900-01-01',2700.00,75.00),('1019',1925700,'03/12/2021',1087.00,'',0.00,'2021-12-03','1900-01-01',1000.00,75.00),('0419',1942671,'31/01/2021',1058.00,'',0.00,'2021-01-31','1900-01-01',1000.00,50.00),('0289',1942689,'04/12/2021',987.00,'',0.00,'2021-12-04','1900-01-01',900.00,75.00),('1019',1995455,'03/02/2021',1958.00,'',0.00,'2021-02-03','1900-01-01',1900.00,50.00),('0767',2016038,'22/01/2021',2758.00,'',0.00,'2021-01-22','1900-01-01',2700.00,50.00),('0218',2021707,'21/12/2021',3187.00,'',0.00,'2021-12-21','1900-01-01',3100.00,75.00),('0804',2023109,'20/12/2021',2587.00,'',0.00,'2021-12-20','1900-01-01',2500.00,75.00),('5409',2051654,'16/10/2021',587.00,'',0.00,'2021-10-16','1900-01-01',500.00,75.00),('0815',2077550,'13/11/2021',2887.00,'',0.00,'2021-11-13','1900-01-01',2800.00,75.00),('0815',2077550,'30/09/2021',2887.00,'',0.00,'2021-09-30','1900-01-01',2800.00,75.00),('0108',2083897,'30/12/2021',6587.00,'',0.00,'2021-12-30','1900-01-01',6500.00,75.00),('0108',2083897,'08/01/2021',4058.00,'',0.00,'2021-01-08','1900-01-01',4000.00,50.00),('0859',2099562,'13/07/2021',4987.00,'',0.00,'2021-07-13','1900-01-01',4900.00,75.00),('0859',2099794,'16/07/2021',2087.00,'',0.00,'2021-07-16','1900-01-01',2000.00,75.00),('0859',2099943,'16/01/2021',4058.00,'',0.00,'2021-01-16','1900-01-01',4000.00,50.00),('0861',2103471,'21/05/2021',558.00,'',0.00,'2021-05-21','1900-01-01',471.00,75.00),('0861',2104453,'10/04/2021',558.00,'',0.00,'2021-04-10','1900-01-01',500.00,50.00),('8282',2171296,'09/01/2021',1458.00,'',0.00,'2021-01-09','1900-01-01',1400.00,50.00),('0419',2185288,'23/01/2021',1558.00,'',0.00,'2021-01-23','1900-01-01',1500.00,50.00),('2774',2195089,'12/01/2021',1158.00,'',0.00,'2021-01-12','1900-01-01',1100.00,50.00),('0663',2195444,'14/05/2021',758.00,'',0.00,'2021-05-14','1900-01-01',700.00,50.00),('18RP',2197705,'21/08/2021',587.00,'',0.00,'2021-08-21','1900-01-01',500.00,75.00),('0852',2219996,'16/12/2021',3587.00,'',0.00,'2021-12-16','1900-01-01',3500.00,75.00),('0191',2279065,'29/01/2021',1458.00,'',0.00,'2021-01-29','1900-01-01',1400.00,50.00),('1132',2356491,'17/01/2021',3058.00,'',0.00,'2021-01-17','1900-01-01',3000.00,50.00),('1132',2356707,'05/05/2021',1558.00,'',0.00,'2021-05-05','1900-01-01',1500.00,50.00),('1132',2356798,'25/03/2021',1058.00,'',0.00,'2021-03-25','1900-01-01',1000.00,50.00),('0YJJ',2392660,'26/12/2021',2987.00,'',0.00,'2021-12-26','1900-01-01',2900.00,75.00),('0YJJ',2392660,'09/12/2021',2687.00,'',0.00,'2021-12-09','1900-01-01',2600.00,75.00),('0588',2424026,'17/11/2021',1387.00,'',0.00,'2021-11-17','1900-01-01',1300.00,75.00),('159T',2424810,'26/09/2021',687.00,'',0.00,'2021-09-26','1900-01-01',600.00,75.00),('1AZI',2445682,'16/01/2021',2058.00,'',0.00,'2021-01-16','1900-01-01',2000.00,50.00),('1271',2447357,'19/12/2021',6587.00,'',0.00,'2021-12-19','1900-01-01',6500.00,75.00),('1019',2458115,'17/01/2021',2158.00,'',0.00,'2021-01-17','1900-01-01',2100.00,50.00),('1251',2462141,'07/08/2021',787.00,'',0.00,'2021-08-07','1900-01-01',700.00,75.00),('0221',2466308,'07/01/2021',2558.00,'',0.00,'2021-01-07','1900-01-01',2500.00,50.00),('2305',2466530,'02/03/2021',4058.00,'',0.00,'2021-03-02','1900-01-01',4000.00,50.00),('1291',2493021,'26/12/2021',2687.00,'',0.00,'2021-12-26','1900-01-01',2600.00,75.00),('9668',2499382,'16/01/2021',558.00,'',0.00,'2021-01-16','1900-01-01',500.00,50.00),('1354',2505154,'17/10/2021',5787.00,'',0.00,'2021-10-17','1900-01-01',5700.00,75.00),('1354',2505154,'23/04/2021',4058.00,'',0.00,'2021-04-23','1900-01-01',4000.00,50.00),('1IT4',2508158,'02/12/2021',1387.00,'',0.00,'2021-12-02','1900-01-01',1300.00,75.00),('1IT4',2508307,'10/09/2021',787.00,'',0.00,'2021-09-10','1900-01-01',700.00,75.00),('1274',2528925,'06/11/2021',2087.00,'',0.00,'2021-11-06','1900-01-01',2000.00,75.00),('0XB1',2581494,'17/11/2021',4387.00,'',0.00,'2021-11-17','1900-01-01',4300.00,75.00),('0OKU',2631547,'30/01/2021',1958.00,'',0.00,'2021-01-30','1900-01-01',1900.00,50.00),('0OKU',2631547,'10/01/2021',1958.00,'',0.00,'2021-01-10','1900-01-01',1900.00,50.00),('0405',2689529,'06/12/2021',1587.00,'',0.00,'2021-12-06','1900-01-01',1500.00,75.00),('0S29',2689685,'13/12/2021',1087.00,'',0.00,'2021-12-13','1900-01-01',1000.00,75.00),('0S29',2689685,'05/12/2021',787.00,'',0.00,'2021-12-05','1900-01-01',700.00,75.00),('1494',2695807,'26/12/2021',2987.00,'',0.00,'2021-12-26','1900-01-01',2900.00,75.00),('1040',2725331,'21/12/2021',1087.00,'',0.00,'2021-12-21','1900-01-01',1000.00,75.00),('1494',2725430,'18/01/2021',858.00,'',0.00,'2021-01-18','1900-01-01',800.00,50.00),('1B6W',2729895,'01/12/2021',787.00,'',0.00,'2021-12-01','1900-01-01',700.00,75.00),('1490',2734721,'26/04/2021',1258.00,'',0.00,'2021-04-26','1900-01-01',1200.00,50.00),('1019',2778124,'31/03/2021',1058.00,'',0.00,'2021-03-31','1900-01-01',1000.00,50.00),('1AZI',2865046,'01/09/2021',587.00,'',0.00,'2021-09-01','1900-01-01',500.00,75.00),('1723',2902187,'14/02/2021',558.00,'',0.00,'2021-02-14','1900-01-01',500.00,50.00),('0248',2909166,'30/12/2021',2587.00,'',0.00,'2021-12-30','1900-01-01',2500.00,75.00),('1019',2912517,'20/01/2021',3058.00,'',0.00,'2021-01-20','1900-01-01',3000.00,50.00),('1697',2914117,'13/06/2021',587.00,'',0.00,'2021-06-13','1900-01-01',500.00,75.00),('1717',2942878,'28/12/2021',2387.00,'',0.00,'2021-12-28','1900-01-01',2300.00,75.00),('1747',2968931,'30/01/2021',1158.00,'',0.00,'2021-01-30','1900-01-01',1100.00,50.00),('1747',2968931,'16/01/2021',1158.00,'',0.00,'2021-01-16','1900-01-01',1100.00,50.00),('0405',2971562,'04/09/2021',587.00,'',0.00,'2021-09-04','1900-01-01',500.00,75.00),('0732',3004520,'29/07/2021',687.00,'',0.00,'2021-07-29','1900-01-01',600.00,75.00),('0121',3023694,'16/11/2021',587.00,'',0.00,'2021-11-16','1900-01-01',500.00,75.00),('6807',3030640,'03/11/2021',1587.00,'',0.00,'2021-11-03','1900-01-01',1500.00,75.00),('0254',3039013,'10/11/2021',6587.00,'',0.00,'2021-11-10','1900-01-01',6500.00,75.00),('9668',3040367,'05/12/2021',1487.00,'',0.00,'2021-12-05','1900-01-01',1400.00,75.00),('1870',3072154,'08/10/2021',987.00,'',0.00,'2021-10-08','1900-01-01',900.00,75.00),('1909',3085958,'06/02/2021',1558.00,'',0.00,'2021-02-06','1900-01-01',1500.00,50.00),('1JSY',3086238,'03/11/2021',1487.00,'',0.00,'2021-11-03','1900-01-01',1400.00,75.00),('0254',3089711,'14/11/2021',887.00,'',0.00,'2021-11-14','1900-01-01',800.00,75.00),('6782',3100914,'22/07/2021',6087.00,'',0.00,'2021-07-22','1900-01-01',6000.00,75.00),('14OH',3108495,'31/12/2021',687.00,'',0.00,'2021-12-31','1900-01-01',600.00,75.00),('14OH',3108495,'26/02/2021',758.00,'',0.00,'2021-02-26','1900-01-01',700.00,50.00),('0VI4',3141652,'14/12/2021',2187.00,'',0.00,'2021-12-14','1900-01-01',2100.00,75.00),('0419',3156114,'29/10/2021',1387.00,'',0.00,'2021-10-29','1900-01-01',1300.00,75.00),('11VR',3191046,'19/02/2021',758.00,'',0.00,'2021-02-19','1900-01-01',700.00,50.00),('0WOM',3192135,'17/10/2021',1287.00,'',0.00,'2021-10-17','1900-01-01',1200.00,75.00),('0NO4',3192366,'29/01/2021',758.00,'',0.00,'2021-01-29','1900-01-01',700.00,50.00),('0NO4',3192374,'18/04/2021',758.00,'',0.00,'2021-04-18','1900-01-01',700.00,50.00),('0NO4',3192945,'16/02/2021',558.00,'',0.00,'2021-02-16','1900-01-01',500.00,50.00),('0WOM',3193182,'02/12/2021',887.00,'',0.00,'2021-12-02','1900-01-01',800.00,75.00),('0NO4',3193182,'17/03/2021',658.00,'',0.00,'2021-03-17','1900-01-01',600.00,50.00),('1747',3194438,'11/12/2021',1587.00,'',0.00,'2021-12-11','1900-01-01',1500.00,75.00),('1019',3212156,'17/11/2021',2287.00,'',0.00,'2021-11-17','1900-01-01',2200.00,75.00),('2139',3245495,'15/07/2021',987.00,'',0.00,'2021-07-15','1900-01-01',900.00,75.00),('2166',3246907,'19/01/2021',958.00,'',0.00,'2021-01-19','1900-01-01',900.00,50.00),('2163',3274867,'09/04/2021',1058.00,'',0.00,'2021-04-09','1900-01-01',1000.00,50.00),('2163',3274867,'07/03/2021',1058.00,'',0.00,'2021-03-07','1900-01-01',1000.00,50.00),('2163',3290020,'27/03/2021',658.00,'',0.00,'2021-03-27','1900-01-01',600.00,50.00),('2150',3372778,'15/11/2021',6587.00,'',0.00,'2021-11-15','1900-01-01',6500.00,75.00),('0419',3414679,'14/02/2021',1358.00,'',0.00,'2021-02-14','1900-01-01',1300.00,50.00),('0035',3424462,'10/10/2021',2087.00,'',0.00,'2021-10-10','1900-01-01',2000.00,75.00),('0WOM',3432408,'26/12/2021',687.00,'',0.00,'2021-12-26','1900-01-01',600.00,75.00),('0289',3477148,'19/12/2021',1187.00,'',0.00,'2021-12-19','1900-01-01',1100.00,75.00),('7302',3485505,'24/12/2021',2087.00,'',0.00,'2021-12-24','1900-01-01',2000.00,75.00),('9757',3495793,'13/08/2021',1087.00,'',0.00,'2021-08-13','1900-01-01',1000.00,75.00),('9668',3515053,'05/01/2021',1358.00,'',0.00,'2021-01-05','1900-01-01',1300.00,50.00),('0ZQ5',3516804,'01/07/2021',1187.00,'',0.00,'2021-07-01','1900-01-01',1100.00,75.00),('11AW',3524923,'13/12/2021',887.00,'',0.00,'2021-12-13','1900-01-01',800.00,75.00),('2423',3529609,'17/12/2021',1987.00,'',0.00,'2021-12-17','1900-01-01',1900.00,75.00),('2423',3529799,'15/01/2021',2558.00,'',0.00,'2021-01-15','1900-01-01',2500.00,50.00),('0YC1',3553245,'05/02/2021',2058.00,'',0.00,'2021-02-05','1900-01-01',2000.00,50.00),('1A2R',3556503,'16/12/2021',987.00,'',0.00,'2021-12-16','1900-01-01',900.00,75.00),('3638',3560075,'25/01/2021',1558.00,'',0.00,'2021-01-25','1900-01-01',1500.00,50.00),('1717',3563335,'03/06/2021',787.00,'',0.00,'2021-06-03','1900-01-01',700.00,75.00),('5383',3576147,'27/07/2021',787.00,'',0.00,'2021-07-27','1900-01-01',700.00,75.00),('2468',3582277,'14/01/2021',1258.00,'',0.00,'2021-01-14','1900-01-01',1200.00,50.00),('1019',3596012,'11/09/2021',1087.00,'',0.00,'2021-09-11','1900-01-01',1000.00,75.00),('0419',3598448,'13/12/2021',2087.00,'',0.00,'2021-12-13','1900-01-01',2000.00,75.00),('2552',3602612,'17/11/2021',1787.00,'',0.00,'2021-11-17','1900-01-01',1700.00,75.00),('0121',3619871,'10/01/2021',1958.00,'',0.00,'2021-01-10','1900-01-01',1900.00,50.00),('2117',3619913,'20/12/2021',1687.00,'',0.00,'2021-12-20','1900-01-01',1600.00,75.00),('2439',3633252,'12/12/2021',1087.00,'',0.00,'2021-12-12','1900-01-01',1000.00,75.00),('2439',3633351,'02/11/2021',2087.00,'',0.00,'2021-11-02','1900-01-01',2000.00,75.00),('3638',3636305,'07/10/2021',587.00,'',0.00,'2021-10-07','1900-01-01',500.00,75.00),('1DV6',3678018,'21/12/2021',687.00,'',0.00,'2021-12-21','1900-01-01',600.00,75.00),('1DV6',3678547,'14/12/2021',887.00,'',0.00,'2021-12-14','1900-01-01',800.00,75.00),('0WOM',3706074,'20/12/2021',3287.00,'',0.00,'2021-12-20','1900-01-01',3200.00,75.00),('0419',3794443,'15/11/2021',2487.00,'',0.00,'2021-11-15','1900-01-01',2400.00,75.00),('2305',3821592,'04/12/2021',1587.00,'',0.00,'2021-12-04','1900-01-01',1500.00,75.00),('2640',3835154,'10/07/2021',1087.00,'',0.00,'2021-07-10','1900-01-01',1000.00,75.00),('6412',3841624,'17/01/2021',558.00,'',0.00,'2021-01-17','1900-01-01',500.00,50.00),('2741',3845823,'19/08/2021',1787.00,'',0.00,'2021-08-19','1900-01-01',1700.00,75.00),('2741',3846276,'11/09/2021',1387.00,'',0.00,'2021-09-11','1900-01-01',1300.00,75.00),('2741',3847456,'29/08/2021',1287.00,'',0.00,'2021-08-29','1900-01-01',1200.00,75.00),('2741',3848918,'21/10/2021',587.00,'',0.00,'2021-10-21','1900-01-01',500.00,75.00),('5383',3861796,'21/08/2021',2587.00,'',0.00,'2021-08-21','1900-01-01',2500.00,75.00),('5383',3861879,'05/12/2021',987.00,'',0.00,'2021-12-05','1900-01-01',900.00,75.00),('5383',3862547,'03/10/2021',887.00,'',0.00,'2021-10-03','1900-01-01',800.00,75.00),('5383',3862984,'28/08/2021',787.00,'',0.00,'2021-08-28','1900-01-01',700.00,75.00),('1BAZ',3865706,'27/12/2021',1187.00,'',0.00,'2021-12-27','1900-01-01',1100.00,75.00),('1870',3901428,'15/01/2021',558.00,'',0.00,'2021-01-15','1900-01-01',500.00,50.00),('1870',3901659,'09/01/2021',758.00,'',0.00,'2021-01-09','1900-01-01',700.00,50.00),('1870',3901907,'26/02/2021',558.00,'',0.00,'2021-02-26','1900-01-01',500.00,50.00),('1870',3901907,'15/01/2021',558.00,'',0.00,'2021-01-15','1900-01-01',500.00,50.00),('1870',3902160,'11/10/2021',1187.00,'',0.00,'2021-10-11','1900-01-01',1100.00,75.00),('1870',3902350,'29/03/2021',558.00,'',0.00,'2021-03-29','1900-01-01',500.00,50.00),('6410',3904042,'22/10/2021',587.00,'',0.00,'2021-10-22','1900-01-01',500.00,75.00),('1265',3915972,'25/11/2021',2087.00,'',0.00,'2021-11-25','1900-01-01',2000.00,75.00),('1265',3915980,'02/05/2021',2158.00,'',0.00,'2021-05-02','1900-01-01',2100.00,50.00),('1265',3916079,'06/11/2021',3487.00,'',0.00,'2021-11-06','1900-01-01',3400.00,75.00),('1265',3916152,'22/04/2021',1758.00,'',0.00,'2021-04-22','1900-01-01',1700.00,50.00),('2749',3916988,'30/08/2021',687.00,'',0.00,'2021-08-30','1900-01-01',600.00,75.00),('0191',3932019,'25/08/2021',5087.00,'',0.00,'2021-08-25','1900-01-01',5000.00,75.00),('2167',3941119,'16/08/2021',1787.00,'',0.00,'2021-08-16','1900-01-01',1700.00,75.00),('2167',3941119,'24/04/2021',858.00,'',0.00,'2021-04-24','1900-01-01',800.00,50.00),('8282',3955192,'20/01/2021',558.00,'',0.00,'2021-01-20','1900-01-01',500.00,50.00),('8282',3956174,'11/01/2021',558.00,'',0.00,'2021-01-11','1900-01-01',500.00,50.00),('8282',3957503,'05/02/2021',2258.00,'',0.00,'2021-02-05','1900-01-01',2200.00,50.00),('8282',3957503,'08/01/2021',2358.00,'',0.00,'2021-01-08','1900-01-01',2300.00,50.00),('8282',3957875,'02/01/2021',758.00,'',0.00,'2021-01-02','1900-01-01',700.00,50.00),('2980',3985314,'04/05/2021',558.00,'',0.00,'2021-05-04','1900-01-01',500.00,50.00),('2980',3985314,'05/02/2021',658.00,'',0.00,'2021-02-05','1900-01-01',600.00,50.00),('18AY',3996527,'15/11/2021',1787.00,'',0.00,'2021-11-15','1900-01-01',1700.00,75.00),('3005',4013876,'31/10/2021',1087.00,'',0.00,'2021-10-31','1900-01-01',1000.00,75.00),('0OJC',4014684,'01/10/2021',6387.00,'',0.00,'2021-10-01','1900-01-01',6300.00,75.00),('3005',4015368,'02/03/2021',558.00,'',0.00,'2021-03-02','1900-01-01',500.00,50.00),('1019',4023248,'05/12/2021',1787.00,'',0.00,'2021-12-05','1900-01-01',1700.00,75.00),('3709',4025490,'05/03/2021',858.00,'',0.00,'2021-03-05','1900-01-01',800.00,50.00),('3044',4036422,'15/09/2021',6587.00,'',0.00,'2021-09-15','1900-01-01',6500.00,75.00),('3044',4036463,'22/09/2021',1587.00,'',0.00,'2021-09-22','1900-01-01',1500.00,75.00),('3044',4036992,'13/12/2021',587.00,'',0.00,'2021-12-13','1900-01-01',500.00,75.00),('3044',4037081,'08/12/2021',1987.00,'',0.00,'2021-12-08','1900-01-01',1900.00,75.00),('3044',4037289,'28/12/2021',2087.00,'',0.00,'2021-12-28','1900-01-01',2000.00,75.00),('0NFK',4069001,'25/11/2021',687.00,'',0.00,'2021-11-25','1900-01-01',600.00,75.00),('0053',4087698,'20/12/2021',1187.00,'',0.00,'2021-12-20','1900-01-01',1100.00,75.00),('1354',4193488,'21/08/2021',4087.00,'',0.00,'2021-08-21','1900-01-01',4000.00,75.00),('3010',4211645,'30/11/2021',3087.00,'',0.00,'2021-11-30','1900-01-01',3000.00,75.00),('3010',4211942,'15/07/2021',587.00,'',0.00,'2021-07-15','1900-01-01',500.00,75.00),('3010',4212288,'30/12/2021',787.00,'',0.00,'2021-12-30','1900-01-01',700.00,75.00),('1B9D',4230009,'01/11/2021',687.00,'',0.00,'2021-11-01','1900-01-01',600.00,75.00),('3325',4239471,'24/06/2021',687.00,'',0.00,'2021-06-24','1900-01-01',600.00,75.00),('3325',4239547,'01/10/2021',1387.00,'',0.00,'2021-10-01','1900-01-01',1300.00,75.00),('3325',4239620,'03/08/2021',587.00,'',0.00,'2021-08-03','1900-01-01',500.00,75.00),('1271',4242236,'14/10/2021',5087.00,'',0.00,'2021-10-14','1900-01-01',5000.00,75.00),('0108',4265690,'29/01/2021',2758.00,'',0.00,'2021-01-29','1900-01-01',2700.00,50.00),('0248',4431334,'29/08/2021',587.00,'',0.00,'2021-08-29','1900-01-01',500.00,75.00),('0S5I',4432126,'11/12/2021',5087.00,'',0.00,'2021-12-11','1900-01-01',5000.00,75.00),('5383',4437133,'22/09/2021',587.00,'',0.00,'2021-09-22','1900-01-01',500.00,75.00),('5383',4437208,'31/10/2021',587.00,'',0.00,'2021-10-31','1900-01-01',500.00,75.00),('0254',4470951,'30/01/2021',2958.00,'',0.00,'2021-01-30','1900-01-01',2900.00,50.00),('0254',4472395,'07/01/2021',1258.00,'',0.00,'2021-01-07','1900-01-01',1200.00,50.00),('0254',4472973,'18/12/2021',2587.00,'',0.00,'2021-12-18','1900-01-01',2500.00,75.00),('0254',4475042,'01/05/2021',1858.00,'',0.00,'2021-05-01','1900-01-01',1800.00,50.00),('0108',4496907,'26/10/2021',1287.00,'',0.00,'2021-10-26','1900-01-01',1200.00,75.00),('1I4M',4513669,'20/08/2021',687.00,'',0.00,'2021-08-20','1900-01-01',600.00,75.00),('2305',4519880,'17/07/2021',5087.00,'',0.00,'2021-07-17','1900-01-01',5000.00,75.00),('3468',4526992,'10/01/2021',1058.00,'',0.00,'2021-01-10','1900-01-01',1000.00,50.00),('2034',4529632,'01/08/2021',1587.00,'',0.00,'2021-08-01','1900-01-01',1500.00,75.00),('1271',4542106,'20/11/2021',6587.00,'',0.00,'2021-11-20','1900-01-01',6500.00,75.00),('1291',4563268,'06/08/2021',1287.00,'',0.00,'2021-08-06','1900-01-01',1200.00,75.00),('3429',4568283,'17/03/2021',1358.00,'',0.00,'2021-03-17','1900-01-01',1300.00,50.00),('3429',4568598,'23/11/2021',1787.00,'',0.00,'2021-11-23','1900-01-01',1700.00,75.00),('3429',4568648,'06/01/2021',1458.00,'',0.00,'2021-01-06','1900-01-01',1400.00,50.00),('3454',4570172,'18/11/2021',587.00,'',0.00,'2021-11-18','1900-01-01',500.00,75.00),('0404',4574380,'30/06/2021',4087.00,'',0.00,'2021-06-30','1900-01-01',4000.00,75.00),('0WVW',4574950,'17/02/2021',1358.00,'',0.00,'2021-02-17','1900-01-01',1300.00,50.00),('0WVW',4574950,'15/01/2021',1358.00,'',0.00,'2021-01-15','1900-01-01',1300.00,50.00),('3454',4576161,'30/11/2021',1087.00,'',0.00,'2021-11-30','1900-01-01',1000.00,75.00),('8282',4580155,'29/01/2021',1758.00,'',0.00,'2021-01-29','1900-01-01',1700.00,50.00),('0108',4593596,'04/01/2021',1058.00,'',0.00,'2021-01-04','1900-01-01',1000.00,50.00),('0108',4594479,'28/02/2021',4058.00,'',0.00,'2021-02-28','1900-01-01',4000.00,50.00),('0108',4597688,'25/11/2021',1087.00,'',0.00,'2021-11-25','1900-01-01',1000.00,75.00),('0108',4606604,'17/08/2021',4087.00,'',0.00,'2021-08-17','1900-01-01',4000.00,75.00),('0108',4613600,'01/01/2021',2658.00,'',0.00,'2021-01-01','1900-01-01',2600.00,50.00),('0108',4614210,'24/12/2021',3087.00,'',0.00,'2021-12-24','1900-01-01',3000.00,75.00),('0108',4614954,'14/05/2021',4058.00,'',0.00,'2021-05-14','1900-01-01',4000.00,50.00),('2257',4643383,'01/12/2021',2787.00,'',0.00,'2021-12-01','1900-01-01',2700.00,75.00),('2257',4643383,'24/07/2021',587.00,'',0.00,'2021-07-24','1900-01-01',500.00,75.00),('3429',4655254,'02/12/2021',2387.00,'',0.00,'2021-12-02','1900-01-01',2300.00,75.00),('3590',4658548,'16/11/2021',5687.00,'',0.00,'2021-11-16','1900-01-01',5600.00,75.00),('3590',4658761,'15/10/2021',2587.00,'',0.00,'2021-10-15','1900-01-01',2500.00,75.00),('1JQL',4678256,'29/12/2021',1787.00,'',0.00,'2021-12-29','1900-01-01',1700.00,75.00),('1JQL',4678256,'27/11/2021',1087.00,'',0.00,'2021-11-27','1900-01-01',1000.00,75.00),('3597',4679361,'05/01/2021',1358.00,'',0.00,'2021-01-05','1900-01-01',1300.00,50.00),('3597',4679510,'17/11/2021',1887.00,'',0.00,'2021-11-17','1900-01-01',1800.00,75.00),('3597',4679700,'05/11/2021',1387.00,'',0.00,'2021-11-05','1900-01-01',1300.00,75.00),('2167',4683694,'21/12/2021',2087.00,'',0.00,'2021-12-21','1900-01-01',2000.00,75.00),('0OBZ',4691960,'26/01/2021',958.00,'',0.00,'2021-01-26','1900-01-01',900.00,50.00),('5297',4763264,'13/07/2021',5787.00,'',0.00,'2021-07-13','1900-01-01',5700.00,75.00),('0330',4783841,'07/05/2021',3558.00,'',0.00,'2021-05-07','1900-01-01',3500.00,50.00),('2305',4784310,'28/01/2021',1058.00,'17/03/2021',1032.90,'2021-01-28','2021-03-17',1000.00,50.00),('1FHQ',4795456,'19/06/2021',2887.00,'',0.00,'2021-06-19','1900-01-01',2800.00,75.00),('15QL',4857900,'13/01/2021',658.00,'',0.00,'2021-01-13','1900-01-01',600.00,50.00),('0108',4866190,'02/12/2021',6287.00,'',0.00,'2021-12-02','1900-01-01',6200.00,75.00),('0108',4867768,'03/07/2021',4087.00,'',0.00,'2021-07-03','1900-01-01',4000.00,75.00),('0108',4878922,'29/01/2021',4058.00,'',0.00,'2021-01-29','1900-01-01',4000.00,50.00),('0108',4878922,'14/01/2021',4058.00,'',0.00,'2021-01-14','1900-01-01',4000.00,50.00),('3709',4884649,'20/10/2021',1187.00,'',0.00,'2021-10-20','1900-01-01',1100.00,75.00),('3706',4897294,'29/01/2021',3658.00,'',0.00,'2021-01-29','1900-01-01',3600.00,50.00),('3468',4905691,'23/11/2021',3087.00,'',0.00,'2021-11-23','1900-01-01',3000.00,75.00),('3468',4905691,'18/04/2021',2158.00,'',0.00,'2021-04-18','1900-01-01',2100.00,50.00),('3468',4905741,'06/12/2021',3987.00,'',0.00,'2021-12-06','1900-01-01',3900.00,75.00),('3722',4906467,'19/11/2021',2087.00,'',0.00,'2021-11-19','1900-01-01',2000.00,75.00),('3781',4945077,'15/12/2021',687.00,'',0.00,'2021-12-15','1900-01-01',600.00,75.00),('0NTD',4963955,'26/11/2021',1587.00,'',0.00,'2021-11-26','1900-01-01',1500.00,75.00),('19KR',4984787,'20/12/2021',987.00,'',0.00,'2021-12-20','1900-01-01',900.00,75.00),('2054',4994638,'17/12/2021',1287.00,'',0.00,'2021-12-17','1900-01-01',1200.00,75.00),('2054',4994638,'16/01/2021',1958.00,'',0.00,'2021-01-16','1900-01-01',1900.00,50.00),('0218',4999538,'03/02/2021',2058.00,'',0.00,'2021-02-03','1900-01-01',2000.00,50.00),('3860',5004353,'05/08/2021',887.00,'',0.00,'2021-08-05','1900-01-01',800.00,75.00),('0248',5013594,'13/08/2021',1287.00,'',0.00,'2021-08-13','1900-01-01',1200.00,75.00),('18IN',5013842,'04/01/2021',1558.00,'',0.00,'2021-01-04','1900-01-01',1500.00,50.00),('0VI4',5017215,'23/01/2021',758.00,'',0.00,'2021-01-23','1900-01-01',700.00,50.00),('3437',5023643,'14/01/2021',2058.00,'',0.00,'2021-01-14','1900-01-01',2000.00,50.00),('3437',5024146,'14/11/2021',1787.00,'',0.00,'2021-11-14','1900-01-01',1700.00,75.00),('3437',5024146,'05/01/2021',3058.00,'',0.00,'2021-01-05','1900-01-01',3000.00,50.00),('3855',5027784,'27/07/2021',1787.00,'',0.00,'2021-07-27','1900-01-01',1700.00,75.00),('2305',5034186,'17/03/2021',658.00,'',0.00,'2021-03-17','1900-01-01',600.00,50.00),('2305',5034186,'01/03/2021',1058.00,'',0.00,'2021-03-01','1900-01-01',1000.00,50.00),('3902',5045430,'06/12/2021',2887.00,'',0.00,'2021-12-06','1900-01-01',2800.00,75.00),('3776',5056551,'17/02/2021',558.00,'',0.00,'2021-02-17','1900-01-01',500.00,50.00),('1BVJ',5062047,'10/07/2021',2587.00,'',0.00,'2021-07-10','1900-01-01',2500.00,75.00),('0NQP',5069752,'01/12/2021',1587.00,'',0.00,'2021-12-01','1900-01-01',1500.00,75.00),('0254',5078332,'02/12/2021',3887.00,'',0.00,'2021-12-02','1900-01-01',3800.00,75.00),('2167',5118948,'14/02/2021',1058.00,'',0.00,'2021-02-14','1900-01-01',1000.00,50.00),('3972',5130687,'23/08/2021',987.00,'',0.00,'2021-08-23','1900-01-01',900.00,75.00),('3638',5194840,'29/01/2021',1658.00,'',0.00,'2021-01-29','1900-01-01',1600.00,50.00),('3709',5195086,'26/01/2021',658.00,'',0.00,'2021-01-26','1900-01-01',600.00,50.00),('0616',5216130,'02/11/2021',887.00,'',0.00,'2021-11-02','1900-01-01',800.00,75.00),('0021',5224803,'18/10/2021',1587.00,'',0.00,'2021-10-18','1900-01-01',1500.00,75.00),('0021',5224803,'15/01/2021',858.00,'',0.00,'2021-01-15','1900-01-01',800.00,50.00),('2305',5228606,'19/07/2021',1087.00,'',0.00,'2021-07-19','1900-01-01',1000.00,75.00),('0430',5234984,'12/12/2021',1387.00,'',0.00,'2021-12-12','1900-01-01',1300.00,75.00),('0430',5234984,'08/01/2021',558.00,'',0.00,'2021-01-08','1900-01-01',500.00,50.00),('0419',5241195,'23/01/2021',1358.00,'',0.00,'2021-01-23','1900-01-01',1300.00,50.00),('0289',5246822,'28/11/2021',1087.00,'',0.00,'2021-11-28','1900-01-01',1000.00,75.00),('0ZUP',5248331,'24/12/2021',1787.00,'',0.00,'2021-12-24','1900-01-01',1700.00,75.00),('17DY',5251327,'11/01/2021',2058.00,'',0.00,'2021-01-11','1900-01-01',2000.00,50.00),('3429',5252036,'29/01/2021',1258.00,'',0.00,'2021-01-29','1900-01-01',1200.00,50.00),('3429',5252036,'16/01/2021',1258.00,'',0.00,'2021-01-16','1900-01-01',1200.00,50.00),('0021',5283817,'09/03/2021',1058.00,'',0.00,'2021-03-09','1900-01-01',1000.00,50.00),('0083',5330469,'26/01/2021',658.00,'',0.00,'2021-01-26','1900-01-01',600.00,50.00),('0419',5330519,'01/07/2021',1887.00,'',0.00,'2021-07-01','1900-01-01',1800.00,75.00),('0419',5330782,'09/04/2021',958.00,'',0.00,'2021-04-09','1900-01-01',900.00,50.00),('0965',5352216,'18/10/2021',787.00,'',0.00,'2021-10-18','1900-01-01',700.00,75.00),('3855',5368204,'02/12/2021',1787.00,'',0.00,'2021-12-02','1900-01-01',1700.00,75.00),('0419',5402482,'26/02/2021',2458.00,'',0.00,'2021-02-26','1900-01-01',2400.00,50.00),('0419',5402508,'15/12/2021',5587.00,'',0.00,'2021-12-15','1900-01-01',5500.00,75.00),('2305',5424890,'19/12/2021',1787.00,'',0.00,'2021-12-19','1900-01-01',1700.00,75.00),('2305',5431549,'14/01/2021',1158.00,'',0.00,'2021-01-14','1900-01-01',1100.00,50.00),('0NO4',5447081,'03/02/2021',558.00,'',0.00,'2021-02-03','1900-01-01',500.00,50.00),('1IT4',5460811,'18/12/2021',1787.00,'',0.00,'2021-12-18','1900-01-01',1700.00,75.00),('2305',5461785,'11/02/2021',1658.00,'',0.00,'2021-02-11','1900-01-01',1600.00,50.00),('8300',5518055,'06/02/2021',858.00,'',0.00,'2021-02-06','1900-01-01',800.00,50.00),('4505',5540620,'21/12/2021',787.00,'',0.00,'2021-12-21','1900-01-01',700.00,75.00),('4505',5542501,'29/09/2021',587.00,'',0.00,'2021-09-29','1900-01-01',500.00,75.00),('4505',5543129,'13/09/2021',1487.00,'',0.00,'2021-09-13','1900-01-01',1400.00,75.00),('4505',5543376,'21/08/2021',887.00,'',0.00,'2021-08-21','1900-01-01',800.00,75.00),('4505',5543632,'12/07/2021',1087.00,'',0.00,'2021-07-12','1900-01-01',1000.00,75.00),('4505',5543889,'29/05/2021',1087.00,'',0.00,'2021-05-29','1900-01-01',1000.00,75.00),('4505',5543988,'20/06/2021',1087.00,'',0.00,'2021-06-20','1900-01-01',1000.00,75.00),('4505',5544093,'06/09/2021',1687.00,'',0.00,'2021-09-06','1900-01-01',1600.00,75.00),('4505',5544895,'28/11/2021',1087.00,'',0.00,'2021-11-28','1900-01-01',1000.00,75.00),('4505',5544903,'28/11/2021',1387.00,'',0.00,'2021-11-28','1900-01-01',1300.00,75.00),('4505',5568639,'26/07/2021',1187.00,'',0.00,'2021-07-26','1900-01-01',1100.00,75.00),('2305',5572227,'21/11/2021',5387.00,'',0.00,'2021-11-21','1900-01-01',5300.00,75.00),('0155',5574199,'23/10/2021',687.00,'',0.00,'2021-10-23','1900-01-01',600.00,75.00),('11U6',5576699,'06/12/2021',2987.00,'',0.00,'2021-12-06','1900-01-01',2900.00,75.00),('0289',5583810,'19/09/2021',1087.00,'',0.00,'2021-09-19','1900-01-01',1000.00,75.00),('0419',5593769,'15/02/2021',758.00,'',0.00,'2021-02-15','1900-01-01',700.00,50.00),('0419',5593785,'30/11/2021',1587.00,'',0.00,'2021-11-30','1900-01-01',1500.00,75.00),('0419',5593819,'11/12/2021',1587.00,'',0.00,'2021-12-11','1900-01-01',1500.00,75.00),('2305',5597976,'24/12/2021',2987.00,'',0.00,'2021-12-24','1900-01-01',2900.00,75.00),('1FHQ',5605423,'17/05/2021',758.00,'',0.00,'2021-05-17','1900-01-01',671.00,75.00),('1FHQ',5605423,'13/05/2021',758.00,'',0.00,'2021-05-13','1900-01-01',700.00,50.00),('1DVW',5630587,'14/11/2021',3387.00,'',0.00,'2021-11-14','1900-01-01',3300.00,75.00),('1DVW',5630587,'24/05/2021',987.00,'',0.00,'2021-05-24','1900-01-01',900.00,75.00),('4505',5656962,'16/07/2021',687.00,'',0.00,'2021-07-16','1900-01-01',600.00,75.00),('4505',5657341,'23/07/2021',1087.00,'',0.00,'2021-07-23','1900-01-01',1000.00,75.00),('1870',5661350,'04/09/2021',587.00,'',0.00,'2021-09-04','1900-01-01',500.00,75.00),('0842',5672944,'02/12/2021',1587.00,'',0.00,'2021-12-02','1900-01-01',1500.00,75.00),('5460',5678206,'01/05/2021',4058.00,'',0.00,'2021-05-01','1900-01-01',4000.00,50.00),('2139',5695770,'02/12/2021',2887.00,'',0.00,'2021-12-02','1900-01-01',2800.00,75.00),('0SLE',5707690,'03/08/2021',787.00,'',0.00,'2021-08-03','1900-01-01',700.00,75.00),('4687',5712039,'09/03/2021',1058.00,'',0.00,'2021-03-09','1900-01-01',1000.00,50.00),('0108',5722285,'03/08/2021',3087.00,'',0.00,'2021-08-03','1900-01-01',3000.00,75.00),('0063',5766498,'19/11/2021',1087.00,'',0.00,'2021-11-19','1900-01-01',1000.00,75.00),('5233',5774740,'07/02/2021',558.00,'',0.00,'2021-02-07','1900-01-01',500.00,50.00),('0P7P',5782552,'15/12/2021',2787.00,'',0.00,'2021-12-15','1900-01-01',2700.00,75.00),('0P7P',5782552,'04/01/2021',1158.00,'',0.00,'2021-01-04','1900-01-01',1100.00,50.00),('0221',5788088,'11/01/2021',1058.00,'',0.00,'2021-01-11','1900-01-01',1000.00,50.00),('11VR',5797857,'28/01/2021',758.00,'',0.00,'2021-01-28','1900-01-01',700.00,50.00),('0NO4',5797881,'02/03/2021',658.00,'',0.00,'2021-03-02','1900-01-01',600.00,50.00),('0248',5826284,'04/06/2021',1587.00,'',0.00,'2021-06-04','1900-01-01',1500.00,75.00),('1518',5831821,'11/03/2021',658.00,'',0.00,'2021-03-11','1900-01-01',600.00,50.00),('2305',5854609,'04/01/2021',2258.00,'',0.00,'2021-01-04','1900-01-01',2200.00,50.00),('2317',5857594,'15/01/2021',1858.00,'',0.00,'2021-01-15','1900-01-01',1800.00,50.00),('4856',5861570,'29/10/2021',1487.00,'',0.00,'2021-10-29','1900-01-01',1400.00,75.00),('0289',5875521,'04/12/2021',1187.00,'',0.00,'2021-12-04','1900-01-01',1100.00,75.00),('4948',5877998,'09/08/2021',2087.00,'',0.00,'2021-08-09','1900-01-01',2000.00,75.00),('2305',5884671,'21/03/2021',4058.00,'07/05/2021',4052.19,'2021-03-21','2021-05-07',4000.00,50.00),('1FWF',5885629,'04/12/2021',587.00,'',0.00,'2021-12-04','1900-01-01',500.00,75.00),('16X6',5938485,'07/01/2021',558.00,'',0.00,'2021-01-07','1900-01-01',500.00,50.00),('5036',5941059,'18/12/2021',1287.00,'',0.00,'2021-12-18','1900-01-01',1200.00,75.00),('2305',5941224,'18/12/2021',2687.00,'',0.00,'2021-12-18','1900-01-01',2600.00,75.00),('5034',5945845,'22/09/2021',3287.00,'',0.00,'2021-09-22','1900-01-01',3200.00,75.00),('5034',5945951,'31/10/2021',2187.00,'',0.00,'2021-10-31','1900-01-01',2100.00,75.00),('5034',5945951,'14/03/2021',1558.00,'',0.00,'2021-03-14','1900-01-01',1500.00,50.00),('11AY',5953880,'17/08/2021',587.00,'',0.00,'2021-08-17','1900-01-01',500.00,75.00),('0TQH',5953955,'23/02/2021',758.00,'',0.00,'2021-02-23','1900-01-01',700.00,50.00),('2305',5976527,'26/11/2021',687.00,'',0.00,'2021-11-26','1900-01-01',600.00,75.00),('2305',5976527,'27/10/2021',587.00,'',0.00,'2021-10-27','1900-01-01',500.00,75.00),('2305',5976527,'09/03/2021',1058.00,'',0.00,'2021-03-09','1900-01-01',1000.00,50.00),('4774',5986138,'18/01/2021',1358.00,'',0.00,'2021-01-18','1900-01-01',1300.00,50.00),('4774',5986369,'26/01/2021',1358.00,'',0.00,'2021-01-26','1900-01-01',1300.00,50.00),('0256',5989447,'20/12/2021',587.00,'',0.00,'2021-12-20','1900-01-01',500.00,75.00),('0TY3',5993712,'03/02/2021',558.00,'',0.00,'2021-02-03','1900-01-01',500.00,50.00),('5074',6007686,'31/10/2021',4087.00,'',0.00,'2021-10-31','1900-01-01',4000.00,75.00),('2305',6010466,'28/12/2021',6587.00,'',0.00,'2021-12-28','1900-01-01',6500.00,75.00),('2305',6010466,'09/08/2021',1087.00,'',0.00,'2021-08-09','1900-01-01',1000.00,75.00),('2980',6021497,'14/03/2021',558.00,'',0.00,'2021-03-14','1900-01-01',500.00,50.00),('07R3',6026611,'17/07/2021',2087.00,'',0.00,'2021-07-17','1900-01-01',2000.00,75.00),('5233',6031330,'23/09/2021',787.00,'',0.00,'2021-09-23','1900-01-01',700.00,75.00),('5233',6032163,'27/08/2021',2787.00,'',0.00,'2021-08-27','1900-01-01',2700.00,75.00),('5233',6032163,'15/01/2021',2658.00,'',0.00,'2021-01-15','1900-01-01',2600.00,50.00),('5233',6032171,'11/03/2021',558.00,'',0.00,'2021-03-11','1900-01-01',500.00,50.00),('5233',6033633,'08/01/2021',758.00,'',0.00,'2021-01-08','1900-01-01',700.00,50.00),('5233',6033740,'09/01/2021',1058.00,'',0.00,'2021-01-09','1900-01-01',1000.00,50.00),('5233',6033740,'01/01/2021',1058.00,'',0.00,'2021-01-01','1900-01-01',1000.00,50.00),('5193',6047112,'29/11/2021',1087.00,'',0.00,'2021-11-29','1900-01-01',1000.00,75.00),('2150',6077580,'31/01/2021',758.00,'',0.00,'2021-01-31','1900-01-01',700.00,50.00),('5259',6079461,'12/04/2021',658.00,'',0.00,'2021-04-12','1900-01-01',600.00,50.00),('1AZQ',6084446,'24/05/2021',1587.00,'',0.00,'2021-05-24','1900-01-01',1500.00,75.00),('1AZQ',6084776,'21/05/2021',658.00,'',0.00,'2021-05-21','1900-01-01',571.00,75.00),('1AZQ',6085138,'24/09/2021',2087.00,'',0.00,'2021-09-24','1900-01-01',2000.00,75.00),('5234',6113542,'13/04/2021',3758.00,'',0.00,'2021-04-13','1900-01-01',3700.00,50.00),('2166',6117006,'17/01/2021',1558.00,'',0.00,'2021-01-17','1900-01-01',1500.00,50.00),('1874',6133318,'08/01/2021',658.00,'',0.00,'2021-01-08','1900-01-01',600.00,50.00),('5328',6148969,'02/08/2021',1287.00,'',0.00,'2021-08-02','1900-01-01',1200.00,75.00),('5328',6148969,'10/03/2021',1058.00,'',0.00,'2021-03-10','1900-01-01',1000.00,50.00),('0VMR',6149272,'05/11/2021',5587.00,'',0.00,'2021-11-05','1900-01-01',5500.00,75.00),('0VMR',6149272,'31/05/2021',2787.00,'',0.00,'2021-05-31','1900-01-01',2700.00,75.00),('5368',6149512,'15/02/2021',1758.00,'',0.00,'2021-02-15','1900-01-01',1700.00,50.00),('5368',6149512,'03/01/2021',1758.00,'',0.00,'2021-01-03','1900-01-01',1700.00,50.00),('6782',6177356,'14/01/2021',1358.00,'',0.00,'2021-01-14','1900-01-01',1300.00,50.00),('0SX0',6198139,'31/12/2021',1987.00,'',0.00,'2021-12-31','1900-01-01',1900.00,75.00),('5052',6205918,'05/09/2021',587.00,'',0.00,'2021-09-05','1900-01-01',500.00,75.00),('5052',6205918,'31/07/2021',787.00,'',0.00,'2021-07-31','1900-01-01',700.00,75.00),('1BCJ',6214563,'05/03/2021',4058.00,'',0.00,'2021-03-05','1900-01-01',4000.00,50.00),('0X8T',6235709,'13/01/2021',2258.00,'',0.00,'2021-01-13','1900-01-01',2200.00,50.00),('0X8T',6235774,'25/01/2021',1458.00,'',0.00,'2021-01-25','1900-01-01',1400.00,50.00),('0X8T',6235881,'29/12/2021',2087.00,'',0.00,'2021-12-29','1900-01-01',2000.00,75.00),('0X8T',6235881,'08/01/2021',2558.00,'',0.00,'2021-01-08','1900-01-01',2500.00,50.00),('0X8T',6236012,'24/01/2021',1758.00,'',0.00,'2021-01-24','1900-01-01',1700.00,50.00),('4496',6240196,'26/09/2021',1087.00,'',0.00,'2021-09-26','1900-01-01',1000.00,75.00),('4505',6246268,'31/05/2021',587.00,'',0.00,'2021-05-31','1900-01-01',500.00,75.00),('0419',6250138,'18/09/2021',1087.00,'',0.00,'2021-09-18','1900-01-01',1000.00,75.00),('0419',6250138,'31/07/2021',1687.00,'',0.00,'2021-07-31','1900-01-01',1600.00,75.00),('5528',6251979,'07/12/2021',1087.00,'',0.00,'2021-12-07','1900-01-01',1000.00,75.00),('5528',6251979,'10/10/2021',987.00,'',0.00,'2021-10-10','1900-01-01',900.00,75.00),('2213',6255483,'15/12/2021',2387.00,'',0.00,'2021-12-15','1900-01-01',2300.00,75.00),('2213',6255483,'22/10/2021',1387.00,'',0.00,'2021-10-22','1900-01-01',1300.00,75.00),('2340',6257638,'15/09/2021',5087.00,'',0.00,'2021-09-15','1900-01-01',5000.00,75.00),('2166',6260384,'09/05/2021',1358.00,'',0.00,'2021-05-09','1900-01-01',1300.00,50.00),('1AZQ',6313100,'15/12/2021',1187.00,'',0.00,'2021-12-15','1900-01-01',1100.00,75.00),('4496',6322705,'12/12/2021',887.00,'',0.00,'2021-12-12','1900-01-01',800.00,75.00),('0108',6331490,'07/12/2021',1287.00,'',0.00,'2021-12-07','1900-01-01',1200.00,75.00),('1I3R',6345839,'30/10/2021',887.00,'',0.00,'2021-10-30','1900-01-01',800.00,75.00),('5447',6361141,'15/01/2021',1558.00,'',0.00,'2021-01-15','1900-01-01',1500.00,50.00),('5460',6363808,'01/12/2021',6587.00,'',0.00,'2021-12-01','1900-01-01',6500.00,75.00),('5460',6363808,'26/04/2021',4058.00,'',0.00,'2021-04-26','1900-01-01',4000.00,50.00),('5460',6363816,'10/04/2021',1558.00,'',0.00,'2021-04-10','1900-01-01',1500.00,50.00),('1132',6372916,'30/05/2021',887.00,'',0.00,'2021-05-30','1900-01-01',800.00,75.00),('5700',6374334,'09/08/2021',1087.00,'',0.00,'2021-08-09','1900-01-01',1000.00,75.00),('0QJR',6379176,'14/11/2021',6087.00,'',0.00,'2021-11-14','1900-01-01',6000.00,75.00),('5742',6400196,'09/01/2021',558.00,'',0.00,'2021-01-09','1900-01-01',500.00,50.00),('5597',6404867,'16/12/2021',2387.00,'',0.00,'2021-12-16','1900-01-01',2300.00,75.00),('5597',6404966,'01/12/2021',2887.00,'',0.00,'2021-12-01','1900-01-01',2800.00,75.00),('5597',6405112,'31/12/2021',2487.00,'',0.00,'2021-12-31','1900-01-01',2400.00,75.00),('5597',6405112,'05/02/2021',3358.00,'',0.00,'2021-02-05','1900-01-01',3300.00,50.00),('5597',6405112,'16/01/2021',1758.00,'',0.00,'2021-01-16','1900-01-01',1700.00,50.00),('1B7K',6419584,'20/03/2021',1458.00,'',0.00,'2021-03-20','1900-01-01',1400.00,50.00),('5460',6429294,'12/09/2021',1287.00,'',0.00,'2021-09-12','1900-01-01',1200.00,75.00),('5460',6429344,'14/01/2021',4058.00,'',0.00,'2021-01-14','1900-01-01',4000.00,50.00),('0662',6433577,'09/08/2021',987.00,'',0.00,'2021-08-09','1900-01-01',900.00,75.00),('0616',6435762,'05/06/2021',587.00,'',0.00,'2021-06-05','1900-01-01',500.00,75.00),('0108',6444756,'15/01/2021',3058.00,'',0.00,'2021-01-15','1900-01-01',3000.00,50.00),('1DV6',6458855,'17/07/2021',587.00,'',0.00,'2021-07-17','1900-01-01',500.00,75.00),('5629',6473490,'17/12/2021',3087.00,'',0.00,'2021-12-17','1900-01-01',3000.00,75.00),('5916',6482384,'06/12/2021',1287.00,'',0.00,'2021-12-06','1900-01-01',1200.00,75.00),('5916',6482426,'20/11/2021',2087.00,'',0.00,'2021-11-20','1900-01-01',2000.00,75.00),('5916',6482426,'11/03/2021',1058.00,'',0.00,'2021-03-11','1900-01-01',1000.00,50.00),('2305',6488134,'13/02/2021',2158.00,'',0.00,'2021-02-13','1900-01-01',2100.00,50.00),('0115',6500094,'02/12/2021',787.00,'',0.00,'2021-12-02','1900-01-01',700.00,75.00),('5916',6505465,'23/04/2021',2058.00,'',0.00,'2021-04-23','1900-01-01',2000.00,50.00),('5963',6508873,'05/01/2021',2458.00,'',0.00,'2021-01-05','1900-01-01',2400.00,50.00),('5974',6521546,'11/12/2021',887.00,'',0.00,'2021-12-11','1900-01-01',800.00,75.00),('194M',6530612,'29/11/2021',687.00,'',0.00,'2021-11-29','1900-01-01',600.00,75.00),('5963',6535694,'01/12/2021',3387.00,'',0.00,'2021-12-01','1900-01-01',3300.00,75.00),('5963',6535694,'07/02/2021',2958.00,'',0.00,'2021-02-07','1900-01-01',2900.00,50.00),('5297',6559652,'07/10/2021',587.00,'',0.00,'2021-10-07','1900-01-01',500.00,75.00),('5916',6567655,'17/09/2021',1887.00,'',0.00,'2021-09-17','1900-01-01',1800.00,75.00),('5916',6567655,'28/01/2021',4058.00,'',0.00,'2021-01-28','1900-01-01',4000.00,50.00),('5916',6567655,'15/01/2021',4058.00,'',0.00,'2021-01-15','1900-01-01',4000.00,50.00),('0452',6602692,'15/01/2021',558.00,'',0.00,'2021-01-15','1900-01-01',500.00,50.00),('0861',6602759,'19/04/2021',1158.00,'',0.00,'2021-04-19','1900-01-01',1100.00,50.00),('3638',6603468,'14/09/2021',1087.00,'',0.00,'2021-09-14','1900-01-01',1000.00,75.00),('134N',6604250,'27/12/2021',1587.00,'',0.00,'2021-12-27','1900-01-01',1500.00,75.00),('13QO',6625941,'04/08/2021',1487.00,'',0.00,'2021-08-04','1900-01-01',1400.00,75.00),('0NHH',6627327,'21/09/2021',1587.00,'',0.00,'2021-09-21','1900-01-01',1500.00,75.00),('0616',6631048,'09/10/2021',687.00,'',0.00,'2021-10-09','1900-01-01',600.00,75.00),('3855',6632483,'02/02/2021',958.00,'',0.00,'2021-02-02','1900-01-01',900.00,50.00),('0108',6634216,'01/10/2021',3587.00,'',0.00,'2021-10-01','1900-01-01',3500.00,75.00),('3498',6644579,'23/09/2021',2487.00,'',0.00,'2021-09-23','1900-01-01',2400.00,75.00),('1AZI',6657431,'26/03/2021',2858.00,'',0.00,'2021-03-26','1900-01-01',2800.00,50.00),('0748',6662530,'28/09/2021',1187.00,'',0.00,'2021-09-28','1900-01-01',1100.00,75.00),('0108',6681241,'23/03/2021',3058.00,'',0.00,'2021-03-23','1900-01-01',3000.00,50.00),('1870',6715809,'07/09/2021',1087.00,'',0.00,'2021-09-07','1900-01-01',1000.00,75.00),('2163',6716070,'04/11/2021',1587.00,'',0.00,'2021-11-04','1900-01-01',1500.00,75.00),('0254',6721542,'29/07/2021',6587.00,'',0.00,'2021-07-29','1900-01-01',6500.00,75.00),('6275',6732317,'27/12/2021',787.00,'',0.00,'2021-12-27','1900-01-01',700.00,75.00),('6275',6732820,'22/10/2021',587.00,'',0.00,'2021-10-22','1900-01-01',500.00,75.00),('6258',6732853,'30/09/2021',1087.00,'',0.00,'2021-09-30','1900-01-01',1000.00,75.00),('0298',6740997,'17/06/2021',4087.00,'',0.00,'2021-06-17','1900-01-01',4000.00,75.00),('1AIF',6753263,'18/02/2021',2358.00,'',0.00,'2021-02-18','1900-01-01',2300.00,50.00),('6286',6753487,'31/07/2021',987.00,'',0.00,'2021-07-31','1900-01-01',900.00,75.00),('6220',6761555,'04/08/2021',587.00,'',0.00,'2021-08-04','1900-01-01',500.00,75.00),('0PR6',6783716,'19/02/2021',1558.00,'',0.00,'2021-02-19','1900-01-01',1500.00,50.00),('4442',6789465,'02/02/2021',858.00,'',0.00,'2021-02-02','1900-01-01',800.00,50.00),('8300',6795363,'31/01/2021',1258.00,'',0.00,'2021-01-31','1900-01-01',1200.00,50.00),('0Z67',6795900,'07/02/2021',4058.00,'',0.00,'2021-02-07','1900-01-01',4000.00,50.00),('6275',6798532,'21/12/2021',1287.00,'',0.00,'2021-12-21','1900-01-01',1200.00,75.00),('4505',6807580,'04/11/2021',4987.00,'',0.00,'2021-11-04','1900-01-01',4900.00,75.00),('1FRA',6825210,'12/09/2021',587.00,'',0.00,'2021-09-12','1900-01-01',500.00,75.00),('1BM3',6826291,'15/10/2021',687.00,'',0.00,'2021-10-15','1900-01-01',600.00,75.00),('0UWD',6841472,'18/01/2021',2158.00,'',0.00,'2021-01-18','1900-01-01',2100.00,50.00),('6415',6841555,'06/05/2021',1658.00,'',0.00,'2021-05-06','1900-01-01',1600.00,50.00),('6411',6841670,'04/12/2021',887.00,'',0.00,'2021-12-04','1900-01-01',800.00,75.00),('6412',6841696,'06/06/2021',2687.00,'',0.00,'2021-06-06','1900-01-01',2600.00,75.00),('6410',6842041,'14/03/2021',558.00,'',0.00,'2021-03-14','1900-01-01',500.00,50.00),('6436',6847255,'02/08/2021',987.00,'',0.00,'2021-08-02','1900-01-01',900.00,75.00),('5979',6860340,'04/11/2021',1287.00,'',0.00,'2021-11-04','1900-01-01',1200.00,75.00),('5979',6860340,'27/03/2021',858.00,'',0.00,'2021-03-27','1900-01-01',800.00,50.00),('5979',6860340,'19/03/2021',858.00,'',0.00,'2021-03-19','1900-01-01',800.00,50.00),('5979',6861603,'29/11/2021',1287.00,'',0.00,'2021-11-29','1900-01-01',1200.00,75.00),('5979',6861611,'16/09/2021',1087.00,'',0.00,'2021-09-16','1900-01-01',1000.00,75.00),('6413',6866214,'12/12/2021',587.00,'',0.00,'2021-12-12','1900-01-01',500.00,75.00),('6502',6866420,'17/12/2021',2487.00,'',0.00,'2021-12-17','1900-01-01',2400.00,75.00),('6502',6866842,'15/01/2021',2358.00,'',0.00,'2021-01-15','1900-01-01',2300.00,50.00),('6502',6866958,'16/02/2021',1758.00,'',0.00,'2021-02-16','1900-01-01',1700.00,50.00),('6502',6867204,'01/12/2021',2487.00,'',0.00,'2021-12-01','1900-01-01',2400.00,75.00),('5383',6885685,'01/06/2021',887.00,'',0.00,'2021-06-01','1900-01-01',800.00,75.00),('0ZRN',6886998,'04/11/2021',1087.00,'',0.00,'2021-11-04','1900-01-01',1000.00,75.00),('0ZRN',6886998,'06/09/2021',587.00,'',0.00,'2021-09-06','1900-01-01',500.00,75.00),('9762',6892277,'06/11/2021',787.00,'',0.00,'2021-11-06','1900-01-01',700.00,75.00),('3860',6913370,'05/06/2021',1687.00,'',0.00,'2021-06-05','1900-01-01',1600.00,75.00),('2257',6918932,'09/09/2021',2087.00,'',0.00,'2021-09-09','1900-01-01',2000.00,75.00),('2257',6918932,'19/08/2021',2087.00,'',0.00,'2021-08-19','1900-01-01',2000.00,75.00),('1B7K',6919302,'19/03/2021',958.00,'',0.00,'2021-03-19','1900-01-01',900.00,50.00),('9757',6932958,'11/12/2021',987.00,'',0.00,'2021-12-11','1900-01-01',900.00,75.00),('3638',6938898,'25/11/2021',2487.00,'',0.00,'2021-11-25','1900-01-01',2400.00,75.00),('3638',6938898,'15/03/2021',2058.00,'',0.00,'2021-03-15','1900-01-01',2000.00,50.00),('3638',6938906,'15/01/2021',1858.00,'',0.00,'2021-01-15','1900-01-01',1800.00,50.00),('3638',6938914,'16/01/2021',1758.00,'',0.00,'2021-01-16','1900-01-01',1700.00,50.00),('5074',6939011,'17/02/2021',2658.00,'',0.00,'2021-02-17','1900-01-01',2600.00,50.00),('0S2T',6942783,'20/01/2021',1458.00,'',0.00,'2021-01-20','1900-01-01',1400.00,50.00),('0S2T',6942783,'02/01/2021',1458.00,'',0.00,'2021-01-02','1900-01-01',1400.00,50.00),('14NO',6953632,'04/10/2021',2487.00,'',0.00,'2021-10-04','1900-01-01',2400.00,75.00),('1FZ9',6968689,'03/08/2021',2887.00,'',0.00,'2021-08-03','1900-01-01',2800.00,75.00),('0108',6975932,'04/01/2021',4058.00,'',0.00,'2021-01-04','1900-01-01',4000.00,50.00),('2740',6983134,'11/06/2021',1087.00,'',0.00,'2021-06-11','1900-01-01',1000.00,75.00),('0419',6990816,'16/11/2021',2087.00,'',0.00,'2021-11-16','1900-01-01',2000.00,75.00),('0254',6991376,'12/02/2021',4058.00,'',0.00,'2021-02-12','1900-01-01',4000.00,50.00),('0254',6991376,'05/02/2021',4058.00,'',0.00,'2021-02-05','1900-01-01',4000.00,50.00),('0WNN',7007651,'10/04/2021',958.00,'',0.00,'2021-04-10','1900-01-01',900.00,50.00),('6697',7014897,'15/02/2021',558.00,'',0.00,'2021-02-15','1900-01-01',500.00,50.00),('6028',7017643,'03/12/2021',1887.00,'',0.00,'2021-12-03','1900-01-01',1800.00,75.00),('6711',7024763,'02/02/2021',1058.00,'',0.00,'2021-02-02','1900-01-01',1000.00,50.00),('5232',7034242,'10/01/2021',558.00,'',0.00,'2021-01-10','1900-01-01',500.00,50.00),('3429',7038672,'08/02/2021',1358.00,'',0.00,'2021-02-08','1900-01-01',1300.00,50.00),('0108',7041502,'11/07/2021',2587.00,'',0.00,'2021-07-11','1900-01-01',2500.00,75.00),('0335',7061153,'24/05/2021',4087.00,'',0.00,'2021-05-24','1900-01-01',4000.00,75.00),('9889',7062581,'12/08/2021',1587.00,'',0.00,'2021-08-12','1900-01-01',1500.00,75.00),('1518',7094352,'07/11/2021',1287.00,'',0.00,'2021-11-07','1900-01-01',1200.00,75.00),('1518',7094378,'18/10/2021',2587.00,'',0.00,'2021-10-18','1900-01-01',2500.00,75.00),('1518',7094378,'16/01/2021',2558.00,'',0.00,'2021-01-16','1900-01-01',2500.00,50.00),('2305',7096225,'09/10/2021',1287.00,'26/11/2021',1280.45,'2021-10-09','2021-11-26',1200.00,75.00),('2305',7096225,'05/01/2021',1458.00,'',0.00,'2021-01-05','1900-01-01',1400.00,50.00),('5460',7101751,'03/03/2021',2458.00,'',0.00,'2021-03-03','1900-01-01',2400.00,50.00),('1BVJ',7109333,'11/12/2021',6587.00,'',0.00,'2021-12-11','1900-01-01',6500.00,75.00),('2600',7113939,'14/01/2021',558.00,'',0.00,'2021-01-14','1900-01-01',500.00,50.00),('1265',7118276,'26/08/2021',2887.00,'',0.00,'2021-08-26','1900-01-01',2800.00,75.00),('1265',7118276,'10/07/2021',2387.00,'',0.00,'2021-07-10','1900-01-01',2300.00,75.00),('2305',7129299,'08/07/2021',2587.00,'',0.00,'2021-07-08','1900-01-01',2500.00,75.00),('4505',7129745,'06/06/2021',887.00,'',0.00,'2021-06-06','1900-01-01',800.00,75.00),('4505',7130404,'30/10/2021',1087.00,'',0.00,'2021-10-30','1900-01-01',1000.00,75.00),('4505',7130834,'27/11/2021',1487.00,'',0.00,'2021-11-27','1900-01-01',1400.00,75.00),('4505',7131030,'20/11/2021',1587.00,'',0.00,'2021-11-20','1900-01-01',1500.00,75.00),('6617',7145139,'16/01/2021',1658.00,'05/03/2021',1605.78,'2021-01-16','2021-03-05',1600.00,50.00),('6617',7146558,'18/01/2021',1758.00,'05/03/2021',1743.78,'2021-01-18','2021-03-05',1700.00,50.00),('6793',7165681,'27/12/2021',887.00,'',0.00,'2021-12-27','1900-01-01',800.00,75.00),('6795',7166028,'11/02/2021',1958.00,'',0.00,'2021-02-11','1900-01-01',1900.00,50.00),('0335',7169485,'06/07/2021',3487.00,'',0.00,'2021-07-06','1900-01-01',3400.00,75.00),('6780',7171812,'11/02/2021',2058.00,'',0.00,'2021-02-11','1900-01-01',2000.00,50.00),('0ND1',7203292,'22/09/2021',1187.00,'',0.00,'2021-09-22','1900-01-01',1100.00,75.00),('0021',7211436,'20/07/2021',687.00,'',0.00,'2021-07-20','1900-01-01',600.00,75.00),('6584',7218290,'01/02/2021',1058.00,'',0.00,'2021-02-01','1900-01-01',1000.00,50.00),('7016',7230204,'10/01/2021',3358.00,'',0.00,'2021-01-10','1900-01-01',3300.00,50.00),('9572',7239916,'17/12/2021',1687.00,'',0.00,'2021-12-17','1900-01-01',1600.00,75.00),('9572',7239916,'06/01/2021',1258.00,'',0.00,'2021-01-06','1900-01-01',1200.00,50.00),('6991',7244650,'21/11/2021',587.00,'',0.00,'2021-11-21','1900-01-01',500.00,75.00),('6991',7244650,'02/08/2021',587.00,'',0.00,'2021-08-02','1900-01-01',500.00,75.00),('6991',7244981,'27/12/2021',787.00,'',0.00,'2021-12-27','1900-01-01',700.00,75.00),('6991',7244981,'01/08/2021',587.00,'',0.00,'2021-08-01','1900-01-01',500.00,75.00),('6991',7246374,'14/11/2021',587.00,'',0.00,'2021-11-14','1900-01-01',500.00,75.00),('6410',7251325,'09/01/2021',558.00,'',0.00,'2021-01-09','1900-01-01',500.00,50.00),('7085',7267784,'07/02/2021',558.00,'',0.00,'2021-02-07','1900-01-01',500.00,50.00),('0083',7271885,'09/10/2021',1087.00,'',0.00,'2021-10-09','1900-01-01',1000.00,75.00),('6411',7274855,'23/07/2021',587.00,'',0.00,'2021-07-23','1900-01-01',500.00,75.00),('6411',7275373,'19/07/2021',587.00,'',0.00,'2021-07-19','1900-01-01',500.00,75.00),('0234',7279797,'04/12/2021',987.00,'',0.00,'2021-12-04','1900-01-01',900.00,75.00),('0108',7292014,'03/05/2021',558.00,'',0.00,'2021-05-03','1900-01-01',500.00,50.00),('1870',7293020,'28/12/2021',1887.00,'',0.00,'2021-12-28','1900-01-01',1800.00,75.00),('1870',7293020,'30/11/2021',1887.00,'',0.00,'2021-11-30','1900-01-01',1800.00,75.00),('3638',7306251,'02/01/2021',1358.00,'',0.00,'2021-01-02','1900-01-01',1300.00,50.00),('3638',7306285,'30/11/2021',1787.00,'',0.00,'2021-11-30','1900-01-01',1700.00,75.00),('7126',7333222,'10/03/2021',1058.00,'',0.00,'2021-03-10','1900-01-01',1000.00,50.00),('7126',7333891,'30/12/2021',1087.00,'',0.00,'2021-12-30','1900-01-01',1000.00,75.00),('7126',7333917,'06/02/2021',558.00,'',0.00,'2021-02-06','1900-01-01',500.00,50.00),('7249',7334972,'23/01/2021',658.00,'',0.00,'2021-01-23','1900-01-01',600.00,50.00),('7249',7334980,'11/04/2021',758.00,'',0.00,'2021-04-11','1900-01-01',700.00,50.00),('5034',7339617,'07/07/2021',4687.00,'',0.00,'2021-07-07','1900-01-01',4600.00,75.00),('5034',7339617,'05/06/2021',3087.00,'',0.00,'2021-06-05','1900-01-01',3000.00,75.00),('0248',7345697,'16/12/2021',1987.00,'',0.00,'2021-12-16','1900-01-01',1900.00,75.00),('9757',7346455,'02/08/2021',4087.00,'',0.00,'2021-08-02','1900-01-01',4000.00,75.00),('0419',7374812,'08/01/2021',1458.00,'',0.00,'2021-01-08','1900-01-01',1400.00,50.00),('0YAT',7381817,'08/09/2021',1287.00,'',0.00,'2021-09-08','1900-01-01',1200.00,75.00),('7305',7383003,'25/09/2021',587.00,'',0.00,'2021-09-25','1900-01-01',500.00,75.00),('7300',7388333,'17/09/2021',1287.00,'',0.00,'2021-09-17','1900-01-01',1200.00,75.00),('7300',7388671,'07/06/2021',587.00,'',0.00,'2021-06-07','1900-01-01',500.00,75.00),('0RDM',7389059,'05/01/2021',3058.00,'',0.00,'2021-01-05','1900-01-01',3000.00,50.00),('7302',7389141,'01/12/2021',2787.00,'',0.00,'2021-12-01','1900-01-01',2700.00,75.00),('7301',7393408,'23/04/2021',858.00,'',0.00,'2021-04-23','1900-01-01',800.00,50.00),('0419',7407919,'29/11/2021',2887.00,'',0.00,'2021-11-29','1900-01-01',2800.00,75.00),('1874',7417025,'07/01/2021',558.00,'',0.00,'2021-01-07','1900-01-01',500.00,50.00),('1019',7437718,'22/12/2021',2987.00,'',0.00,'2021-12-22','1900-01-01',2900.00,75.00),('0108',7449960,'25/03/2021',558.00,'',0.00,'2021-03-25','1900-01-01',500.00,50.00),('1H5X',7451180,'26/07/2021',587.00,'',0.00,'2021-07-26','1900-01-01',500.00,75.00),('1DDT',7490998,'06/01/2021',858.00,'',0.00,'2021-01-06','1900-01-01',800.00,50.00),('4687',7511272,'20/12/2021',687.00,'',0.00,'2021-12-20','1900-01-01',600.00,75.00),('0PY5',7512460,'03/12/2021',1887.00,'',0.00,'2021-12-03','1900-01-01',1800.00,75.00),('3671',7513740,'03/02/2021',1958.00,'',0.00,'2021-02-03','1900-01-01',1900.00,50.00),('13D3',7514268,'10/01/2021',558.00,'',0.00,'2021-01-10','1900-01-01',500.00,50.00),('0NGE',7517436,'18/11/2021',1187.00,'',0.00,'2021-11-18','1900-01-01',1100.00,75.00),('1AZI',7521115,'18/12/2021',2187.00,'',0.00,'2021-12-18','1900-01-01',2100.00,75.00),('0289',7523491,'22/12/2021',1687.00,'',0.00,'2021-12-22','1900-01-01',1600.00,75.00),('0289',7523491,'16/01/2021',1658.00,'',0.00,'2021-01-16','1900-01-01',1600.00,50.00),('0021',7529944,'02/12/2021',2187.00,'',0.00,'2021-12-02','1900-01-01',2100.00,75.00),('2305',7532542,'19/01/2021',1458.00,'',0.00,'2021-01-19','1900-01-01',1400.00,50.00),('6410',7538051,'03/12/2021',787.00,'',0.00,'2021-12-03','1900-01-01',700.00,75.00),('2305',7538267,'09/11/2021',2087.00,'',0.00,'2021-11-09','1900-01-01',2000.00,75.00),('2468',7549231,'16/01/2021',2158.00,'',0.00,'2021-01-16','1900-01-01',2100.00,50.00),('0WRW',7549819,'04/02/2021',2558.00,'',0.00,'2021-02-04','1900-01-01',2500.00,50.00),('2305',7553647,'24/12/2021',3087.00,'',0.00,'2021-12-24','1900-01-01',3000.00,75.00),('13V4',7558190,'19/10/2021',587.00,'',0.00,'2021-10-19','1900-01-01',500.00,75.00),('0UA2',7577760,'02/11/2021',2687.00,'',0.00,'2021-11-02','1900-01-01',2600.00,75.00),('3202',7583768,'04/12/2021',1087.00,'',0.00,'2021-12-04','1900-01-01',1000.00,75.00),('0NO4',7583859,'03/03/2021',558.00,'',0.00,'2021-03-03','1900-01-01',500.00,50.00),('2305',7595358,'02/02/2021',3358.00,'',0.00,'2021-02-02','1900-01-01',3300.00,50.00),('5979',7601412,'18/06/2021',6587.00,'',0.00,'2021-06-18','1900-01-01',6500.00,75.00),('1EYL',7603350,'12/12/2021',687.00,'',0.00,'2021-12-12','1900-01-01',600.00,75.00),('1EYL',7603350,'27/09/2021',787.00,'',0.00,'2021-09-27','1900-01-01',700.00,75.00),('1EYL',7603350,'22/09/2021',787.00,'',0.00,'2021-09-22','1900-01-01',700.00,75.00),('0248',7605421,'26/11/2021',3087.00,'',0.00,'2021-11-26','1900-01-01',3000.00,75.00),('5460',7605892,'06/02/2021',1558.00,'',0.00,'2021-02-06','1900-01-01',1500.00,50.00),('0W7R',7617244,'01/10/2021',887.00,'',0.00,'2021-10-01','1900-01-01',800.00,75.00),('14OH',7617962,'05/01/2021',1758.00,'',0.00,'2021-01-05','1900-01-01',1700.00,50.00),('3776',7623010,'08/01/2021',858.00,'',0.00,'2021-01-08','1900-01-01',800.00,50.00),('2796',7630098,'06/07/2021',587.00,'',0.00,'2021-07-06','1900-01-01',500.00,75.00),('3159',7641327,'15/02/2021',2258.00,'',0.00,'2021-02-15','1900-01-01',2200.00,50.00),('3159',7641327,'04/01/2021',2058.00,'',0.00,'2021-01-04','1900-01-01',2000.00,50.00),('5460',7652761,'25/11/2021',2087.00,'',0.00,'2021-11-25','1900-01-01',2000.00,75.00),('2749',7665615,'04/06/2021',1487.00,'',0.00,'2021-06-04','1900-01-01',1400.00,75.00),('7482',7674088,'21/08/2021',887.00,'',0.00,'2021-08-21','1900-01-01',800.00,75.00),('0VI4',7702467,'09/02/2021',3658.00,'',0.00,'2021-02-09','1900-01-01',3600.00,50.00),('07TX',7704141,'06/04/2021',858.00,'',0.00,'2021-04-06','1900-01-01',800.00,50.00),('3614',7708753,'02/04/2021',558.00,'',0.00,'2021-04-02','1900-01-01',500.00,50.00),('7126',7711575,'27/01/2021',558.00,'',0.00,'2021-01-27','1900-01-01',500.00,50.00),('0VI4',7715238,'16/12/2021',4387.00,'',0.00,'2021-12-16','1900-01-01',4300.00,75.00),('2305',7736135,'14/02/2021',958.00,'',0.00,'2021-02-14','1900-01-01',900.00,50.00),('0405',7748213,'04/05/2021',2558.00,'',0.00,'2021-05-04','1900-01-01',2500.00,50.00),('7860',7754476,'12/12/2021',1487.00,'',0.00,'2021-12-12','1900-01-01',1400.00,75.00),('7860',7754476,'08/01/2021',1258.00,'',0.00,'2021-01-08','1900-01-01',1200.00,50.00),('2305',7758832,'22/01/2021',858.00,'',0.00,'2021-01-22','1900-01-01',800.00,50.00),('0121',7775778,'01/01/2021',758.00,'',0.00,'2021-01-01','1900-01-01',700.00,50.00),('7916',7811656,'01/12/2021',3087.00,'',0.00,'2021-12-01','1900-01-01',3000.00,75.00),('3638',7818800,'01/12/2021',1987.00,'',0.00,'2021-12-01','1900-01-01',1900.00,75.00),('3638',7818842,'14/01/2021',1658.00,'',0.00,'2021-01-14','1900-01-01',1600.00,50.00),('5460',7819493,'31/10/2021',4687.00,'',0.00,'2021-10-31','1900-01-01',4600.00,75.00),('2305',7843618,'14/01/2021',4058.00,'',0.00,'2021-01-14','1900-01-01',4000.00,50.00),('5873',7844889,'11/04/2021',1058.00,'',0.00,'2021-04-11','1900-01-01',1000.00,50.00),('6502',7858947,'01/12/2021',2087.00,'',0.00,'2021-12-01','1900-01-01',2000.00,75.00),('3781',7865488,'18/12/2021',1187.00,'',0.00,'2021-12-18','1900-01-01',1100.00,75.00),('7302',7869167,'18/09/2021',787.00,'',0.00,'2021-09-18','1900-01-01',700.00,75.00),('2305',7871288,'26/11/2021',2487.00,'',0.00,'2021-11-26','1900-01-01',2400.00,75.00),('7689',7878804,'12/09/2021',687.00,'',0.00,'2021-09-12','1900-01-01',600.00,75.00),('8034',7901473,'21/11/2021',987.00,'',0.00,'2021-11-21','1900-01-01',900.00,75.00),('0SZ5',7916430,'20/12/2021',787.00,'',0.00,'2021-12-20','1900-01-01',700.00,75.00),('2305',7930308,'02/01/2021',758.00,'',0.00,'2021-01-02','1900-01-01',700.00,50.00),('0108',7940281,'01/09/2021',587.00,'',0.00,'2021-09-01','1900-01-01',500.00,75.00),('1C3B',7953243,'21/10/2021',1187.00,'',0.00,'2021-10-21','1900-01-01',1100.00,75.00),('16KC',7957038,'05/06/2021',1087.00,'',0.00,'2021-06-05','1900-01-01',1000.00,75.00),('0XST',7957301,'15/11/2021',1087.00,'',0.00,'2021-11-15','1900-01-01',1000.00,75.00),('0108',7958614,'26/01/2021',558.00,'',0.00,'2021-01-26','1900-01-01',500.00,50.00),('1EUY',7959562,'04/05/2021',1158.00,'',0.00,'2021-05-04','1900-01-01',1100.00,50.00),('1EUY',7972102,'25/09/2021',2087.00,'',0.00,'2021-09-25','1900-01-01',2000.00,75.00),('8114',7972706,'22/10/2021',587.00,'',0.00,'2021-10-22','1900-01-01',500.00,75.00),('1EUY',7984107,'24/09/2021',2087.00,'',0.00,'2021-09-24','1900-01-01',2000.00,75.00),('1EUY',7984164,'31/07/2021',1087.00,'',0.00,'2021-07-31','1900-01-01',1000.00,75.00),('7828',7984214,'26/04/2021',2058.00,'',0.00,'2021-04-26','1900-01-01',2000.00,50.00),('8140',7990294,'06/03/2021',3058.00,'',0.00,'2021-03-06','1900-01-01',3000.00,50.00),('8140',7990336,'09/02/2021',1658.00,'',0.00,'2021-02-09','1900-01-01',1600.00,50.00),('8140',7990922,'20/11/2021',1587.00,'',0.00,'2021-11-20','1900-01-01',1500.00,75.00),('8140',7991102,'05/12/2021',1687.00,'',0.00,'2021-12-05','1900-01-01',1600.00,75.00),('8140',7991250,'15/12/2021',987.00,'',0.00,'2021-12-15','1900-01-01',900.00,75.00),('8140',7991409,'02/12/2021',2087.00,'',0.00,'2021-12-02','1900-01-01',2000.00,75.00),('8140',7991573,'24/09/2021',1587.00,'',0.00,'2021-09-24','1900-01-01',1500.00,75.00),('8140',7991573,'27/08/2021',1587.00,'',0.00,'2021-08-27','1900-01-01',1500.00,75.00),('8140',7991581,'31/12/2021',1487.00,'',0.00,'2021-12-31','1900-01-01',1400.00,75.00),('8140',7991714,'15/02/2021',1558.00,'',0.00,'2021-02-15','1900-01-01',1500.00,50.00),('8140',7991839,'18/11/2021',2087.00,'',0.00,'2021-11-18','1900-01-01',2000.00,75.00),('8140',7991839,'06/07/2021',1787.00,'',0.00,'2021-07-06','1900-01-01',1700.00,75.00),('8140',7991847,'15/05/2021',1758.00,'',0.00,'2021-05-15','1900-01-01',1671.00,75.00),('8140',7991862,'08/01/2021',1658.00,'',0.00,'2021-01-08','1900-01-01',1600.00,50.00),('8140',7991920,'20/05/2021',1058.00,'',0.00,'2021-05-20','1900-01-01',971.00,75.00),('8140',7991995,'01/11/2021',887.00,'20/12/2021',453.14,'2021-11-01','2021-12-20',800.00,75.00),('8140',7992191,'02/10/2021',4087.00,'19/11/2021',4079.00,'2021-10-02','2021-11-19',4000.00,75.00),('8140',7993025,'12/11/2021',2787.00,'',0.00,'2021-11-12','1900-01-01',2700.00,75.00),('8140',7993140,'04/12/2021',2587.00,'',0.00,'2021-12-04','1900-01-01',2500.00,75.00),('8140',7993140,'16/01/2021',1858.00,'',0.00,'2021-01-16','1900-01-01',1800.00,50.00),('8140',7993140,'03/01/2021',1858.00,'',0.00,'2021-01-03','1900-01-01',1800.00,50.00),('8140',7993785,'27/01/2021',1458.00,'',0.00,'2021-01-27','1900-01-01',1400.00,50.00),('8140',7993793,'02/03/2021',1458.00,'',0.00,'2021-03-02','1900-01-01',1400.00,50.00),('8140',7994742,'28/12/2021',2087.00,'',0.00,'2021-12-28','1900-01-01',2000.00,75.00),('8140',7994742,'01/12/2021',2087.00,'',0.00,'2021-12-01','1900-01-01',2000.00,75.00),('8140',7994825,'23/07/2021',4887.00,'',0.00,'2021-07-23','1900-01-01',4800.00,75.00),('8140',7995061,'02/12/2021',4587.00,'',0.00,'2021-12-02','1900-01-01',4500.00,75.00),('8140',7995103,'15/01/2021',2658.00,'',0.00,'2021-01-15','1900-01-01',2600.00,50.00),('8140',7995947,'31/12/2021',987.00,'',0.00,'2021-12-31','1900-01-01',900.00,75.00),('8140',7995947,'15/01/2021',1458.00,'',0.00,'2021-01-15','1900-01-01',1400.00,50.00),('8140',7996382,'04/03/2021',4058.00,'',0.00,'2021-03-04','1900-01-01',4000.00,50.00),('8140',7996507,'17/12/2021',5087.00,'',0.00,'2021-12-17','1900-01-01',5000.00,75.00),('8140',7996689,'04/12/2021',5387.00,'',0.00,'2021-12-04','1900-01-01',5300.00,75.00),('8140',7996689,'08/01/2021',4058.00,'',0.00,'2021-01-08','1900-01-01',4000.00,50.00),('8140',7997018,'29/01/2021',3358.00,'',0.00,'2021-01-29','1900-01-01',3300.00,50.00),('8140',7997042,'05/11/2021',6587.00,'',0.00,'2021-11-05','1900-01-01',6500.00,75.00),('8140',7997448,'30/01/2021',2558.00,'',0.00,'2021-01-30','1900-01-01',2500.00,50.00),('8140',7997554,'02/12/2021',4387.00,'',0.00,'2021-12-02','1900-01-01',4300.00,75.00),('8140',7997554,'06/02/2021',3658.00,'',0.00,'2021-02-06','1900-01-01',3600.00,50.00),('8140',7997752,'25/12/2021',3387.00,'',0.00,'2021-12-25','1900-01-01',3300.00,75.00),('8140',7998131,'17/11/2021',1187.00,'',0.00,'2021-11-17','1900-01-01',1100.00,75.00),('8140',7999675,'19/12/2021',1587.00,'',0.00,'2021-12-19','1900-01-01',1500.00,75.00),('8140',7999790,'07/01/2021',1358.00,'',0.00,'2021-01-07','1900-01-01',1300.00,50.00),('8140',7999865,'01/03/2021',1658.00,'',0.00,'2021-03-01','1900-01-01',1600.00,50.00),('8140',7999931,'15/01/2021',1658.00,'',0.00,'2021-01-15','1900-01-01',1600.00,50.00),('8140',7999972,'19/12/2021',1987.00,'',0.00,'2021-12-19','1900-01-01',1900.00,75.00),('8140',8000044,'16/01/2021',1658.00,'',0.00,'2021-01-16','1900-01-01',1600.00,50.00),('8140',8000291,'17/05/2021',3058.00,'',0.00,'2021-05-17','1900-01-01',2971.00,75.00),('8140',8000622,'04/06/2021',1787.00,'',0.00,'2021-06-04','1900-01-01',1700.00,75.00),('8140',8001539,'25/12/2021',6087.00,'',0.00,'2021-12-25','1900-01-01',6000.00,75.00),('2305',8007213,'29/01/2021',2358.00,'',0.00,'2021-01-29','1900-01-01',2300.00,50.00),('5460',8013849,'09/06/2021',6587.00,'',0.00,'2021-06-09','1900-01-01',6500.00,75.00),('2305',8014656,'23/11/2021',787.00,'',0.00,'2021-11-23','1900-01-01',700.00,75.00),('1EUY',8021396,'30/07/2021',1787.00,'',0.00,'2021-07-30','1900-01-01',1700.00,75.00),('1EUY',8021404,'03/04/2021',1958.00,'',0.00,'2021-04-03','1900-01-01',1900.00,50.00),('0108',8022436,'11/12/2021',1087.00,'',0.00,'2021-12-11','1900-01-01',1000.00,75.00),('2166',8027930,'04/01/2021',1158.00,'',0.00,'2021-01-04','1900-01-01',1100.00,50.00),('0YIQ',8033797,'19/01/2021',2258.00,'',0.00,'2021-01-19','1900-01-01',2200.00,50.00),('2305',8033888,'13/12/2021',587.00,'',0.00,'2021-12-13','1900-01-01',500.00,75.00),('4627',8063646,'06/12/2021',1587.00,'',0.00,'2021-12-06','1900-01-01',1500.00,75.00),('3638',8068934,'12/11/2021',5087.00,'',0.00,'2021-11-12','1900-01-01',5000.00,75.00),('3638',8068934,'14/02/2021',3058.00,'',0.00,'2021-02-14','1900-01-01',3000.00,50.00),('3638',8068959,'12/11/2021',1787.00,'',0.00,'2021-11-12','1900-01-01',1700.00,75.00),('5597',8069114,'26/02/2021',4058.00,'',0.00,'2021-02-26','1900-01-01',4000.00,50.00),('5460',8075616,'17/11/2021',2187.00,'',0.00,'2021-11-17','1900-01-01',2100.00,75.00),('5460',8075632,'11/06/2021',1587.00,'',0.00,'2021-06-11','1900-01-01',1500.00,75.00),('5460',8075640,'26/05/2021',1087.00,'',0.00,'2021-05-26','1900-01-01',1000.00,75.00),('0OBT',8103830,'22/01/2021',3758.00,'',0.00,'2021-01-22','1900-01-01',3700.00,50.00),('1EUY',8131831,'31/03/2021',3358.00,'',0.00,'2021-03-31','1900-01-01',3300.00,50.00),('1EUY',8131849,'01/12/2021',5987.00,'',0.00,'2021-12-01','1900-01-01',5900.00,75.00),('1EUY',8131922,'30/11/2021',587.00,'',0.00,'2021-11-30','1900-01-01',500.00,75.00),('1EUY',8131922,'16/04/2021',1458.00,'',0.00,'2021-04-16','1900-01-01',1400.00,50.00),('3597',8134520,'03/11/2021',1487.00,'',0.00,'2021-11-03','1900-01-01',1400.00,75.00),('7860',8147761,'22/12/2021',1087.00,'',0.00,'2021-12-22','1900-01-01',1000.00,75.00),('1BVJ',8179830,'07/12/2021',3087.00,'',0.00,'2021-12-07','1900-01-01',3000.00,75.00),('1609',8183535,'22/02/2021',658.00,'',0.00,'2021-02-22','1900-01-01',600.00,50.00),('0RB7',8193211,'05/01/2021',2158.00,'',0.00,'2021-01-05','1900-01-01',2100.00,50.00),('7639',8201261,'13/02/2021',1658.00,'',0.00,'2021-02-13','1900-01-01',1600.00,50.00),('5074',8214298,'01/12/2021',2887.00,'',0.00,'2021-12-01','1900-01-01',2800.00,75.00),('8140',8237042,'17/12/2021',5387.00,'',0.00,'2021-12-17','1900-01-01',5300.00,75.00),('5233',8242778,'15/01/2021',658.00,'',0.00,'2021-01-15','1900-01-01',600.00,50.00),('1747',8265233,'31/03/2021',1558.00,'',0.00,'2021-03-31','1900-01-01',1500.00,50.00),('5233',8269540,'27/09/2021',687.00,'',0.00,'2021-09-27','1900-01-01',600.00,75.00),('0NCU',8276990,'28/09/2021',587.00,'',0.00,'2021-09-28','1900-01-01',500.00,75.00),('0OMU',8277295,'14/08/2021',587.00,'',0.00,'2021-08-14','1900-01-01',500.00,75.00),('1ACG',8283921,'10/01/2021',558.00,'',0.00,'2021-01-10','1900-01-01',500.00,50.00),('6782',8285983,'18/07/2021',587.00,'',0.00,'2021-07-18','1900-01-01',500.00,75.00),('3776',8289498,'09/01/2021',1058.00,'',0.00,'2021-01-09','1900-01-01',1000.00,50.00),('8140',8296535,'03/12/2021',5087.00,'',0.00,'2021-12-03','1900-01-01',5000.00,75.00),('8140',8296535,'03/02/2021',3258.00,'',0.00,'2021-02-03','1900-01-01',3200.00,50.00),('14OH',8312746,'04/07/2021',1087.00,'',0.00,'2021-07-04','1900-01-01',1000.00,75.00),('14OH',8312746,'30/01/2021',558.00,'',0.00,'2021-01-30','1900-01-01',500.00,50.00),('3902',8323198,'15/06/2021',587.00,'',0.00,'2021-06-15','1900-01-01',500.00,75.00),('1HTA',8330359,'12/10/2021',687.00,'',0.00,'2021-10-12','1900-01-01',600.00,75.00),('3597',8349391,'09/01/2021',1958.00,'',0.00,'2021-01-09','1900-01-01',1900.00,50.00),('9240',8349458,'03/01/2021',4058.00,'',0.00,'2021-01-03','1900-01-01',4000.00,50.00),('8250',8362204,'19/03/2021',1258.00,'',0.00,'2021-03-19','1900-01-01',1200.00,50.00),('8250',8364010,'06/12/2021',587.00,'',0.00,'2021-12-06','1900-01-01',500.00,75.00),('8140',8370504,'17/09/2021',1587.00,'',0.00,'2021-09-17','1900-01-01',1500.00,75.00),('3590',8378614,'06/07/2021',2487.00,'',0.00,'2021-07-06','1900-01-01',2400.00,75.00),('0QAS',8386872,'03/03/2021',3058.00,'',0.00,'2021-03-03','1900-01-01',3000.00,50.00),('0QAS',8386872,'10/02/2021',3058.00,'',0.00,'2021-02-10','1900-01-01',3000.00,50.00),('6711',8387714,'09/01/2021',958.00,'',0.00,'2021-01-09','1900-01-01',900.00,50.00),('0SDT',8388670,'22/10/2021',887.00,'',0.00,'2021-10-22','1900-01-01',800.00,75.00),('1DPZ',8388738,'15/08/2021',787.00,'',0.00,'2021-08-15','1900-01-01',700.00,75.00),('0SDT',8388845,'10/12/2021',787.00,'',0.00,'2021-12-10','1900-01-01',700.00,75.00),('0SDT',8389017,'20/12/2021',1287.00,'',0.00,'2021-12-20','1900-01-01',1200.00,75.00),('2054',8396731,'15/12/2021',1087.00,'',0.00,'2021-12-15','1900-01-01',1000.00,75.00),('5233',8403578,'15/01/2021',1058.00,'',0.00,'2021-01-15','1900-01-01',1000.00,50.00),('2439',8404022,'01/11/2021',587.00,'',0.00,'2021-11-01','1900-01-01',500.00,75.00),('8628',8414815,'19/02/2021',2058.00,'',0.00,'2021-02-19','1900-01-01',2000.00,50.00),('8628',8414815,'17/01/2021',2058.00,'',0.00,'2021-01-17','1900-01-01',2000.00,50.00),('0683',8416596,'16/01/2021',1558.00,'',0.00,'2021-01-16','1900-01-01',1500.00,50.00),('8350',8420374,'12/08/2021',3087.00,'',0.00,'2021-08-12','1900-01-01',3000.00,75.00),('8683',8420994,'25/12/2021',1387.00,'',0.00,'2021-12-25','1900-01-01',1300.00,75.00),('8584',8433229,'05/05/2021',858.00,'',0.00,'2021-05-05','1900-01-01',800.00,50.00),('8584',8433229,'27/03/2021',758.00,'',0.00,'2021-03-27','1900-01-01',700.00,50.00),('0419',8435539,'20/12/2021',3787.00,'',0.00,'2021-12-20','1900-01-01',3700.00,75.00),('0419',8435539,'07/05/2021',2458.00,'',0.00,'2021-05-07','1900-01-01',2400.00,50.00),('3610',8444184,'03/01/2021',1458.00,'',0.00,'2021-01-03','1900-01-01',1400.00,50.00),('6782',8444374,'24/12/2021',2587.00,'',0.00,'2021-12-24','1900-01-01',2500.00,75.00),('6782',8444374,'23/12/2021',2087.00,'',0.00,'2021-12-23','1900-01-01',2000.00,75.00),('0254',8467508,'23/09/2021',3087.00,'',0.00,'2021-09-23','1900-01-01',3000.00,75.00),('0063',8468738,'26/12/2021',1287.00,'',0.00,'2021-12-26','1900-01-01',1200.00,75.00),('0063',8468738,'19/12/2021',1287.00,'',0.00,'2021-12-19','1900-01-01',1200.00,75.00),('8140',8474314,'29/01/2021',1458.00,'',0.00,'2021-01-29','1900-01-01',1400.00,50.00),('3706',8480667,'29/01/2021',3858.00,'',0.00,'2021-01-29','1900-01-01',3800.00,50.00),('2980',8489668,'29/01/2021',1658.00,'',0.00,'2021-01-29','1900-01-01',1600.00,50.00),('0WOM',8500787,'02/12/2021',1287.00,'',0.00,'2021-12-02','1900-01-01',1200.00,75.00),('4687',8505208,'15/05/2021',2758.00,'',0.00,'2021-05-15','1900-01-01',2671.00,75.00),('0248',8509069,'23/08/2021',1487.00,'',0.00,'2021-08-23','1900-01-01',1400.00,75.00),('0248',8509085,'30/12/2021',1137.00,'',0.00,'2021-12-30','1900-01-01',1050.00,75.00),('5328',8515314,'08/01/2021',3058.00,'',0.00,'2021-01-08','1900-01-01',3000.00,50.00),('8858',8531444,'25/12/2021',2387.00,'',0.00,'2021-12-25','1900-01-01',2300.00,75.00),('8858',8531444,'04/06/2021',1787.00,'',0.00,'2021-06-04','1900-01-01',1700.00,75.00),('8858',8531485,'24/07/2021',687.00,'',0.00,'2021-07-24','1900-01-01',600.00,75.00),('3821',8536146,'17/12/2021',1387.00,'',0.00,'2021-12-17','1900-01-01',1300.00,75.00),('3821',8536146,'01/12/2021',1187.00,'',0.00,'2021-12-01','1900-01-01',1100.00,75.00),('3821',8536195,'03/12/2021',787.00,'',0.00,'2021-12-03','1900-01-01',700.00,75.00),('2305',8536815,'04/12/2021',1587.00,'',0.00,'2021-12-04','1900-01-01',1500.00,75.00),('2305',8536815,'18/11/2021',1087.00,'',0.00,'2021-11-18','1900-01-01',1000.00,75.00),('2305',8538332,'18/01/2021',1858.00,'',0.00,'2021-01-18','1900-01-01',1800.00,50.00),('6410',8547135,'13/07/2021',787.00,'',0.00,'2021-07-13','1900-01-01',700.00,75.00),('0156',8548893,'05/12/2021',2187.00,'',0.00,'2021-12-05','1900-01-01',2100.00,75.00),('8854',8570590,'15/01/2021',1358.00,'',0.00,'2021-01-15','1900-01-01',1300.00,50.00),('6410',8575771,'13/08/2021',787.00,'',0.00,'2021-08-13','1900-01-01',700.00,75.00),('8140',8581415,'24/05/2021',587.00,'',0.00,'2021-05-24','1900-01-01',500.00,75.00),('8140',8581514,'05/12/2021',5387.00,'',0.00,'2021-12-05','1900-01-01',5300.00,75.00),('12YZ',8590960,'06/12/2021',2587.00,'',0.00,'2021-12-06','1900-01-01',2500.00,75.00),('12YZ',8590960,'08/04/2021',2058.00,'',0.00,'2021-04-08','1900-01-01',2000.00,50.00),('0XZN',8603979,'09/01/2021',1458.00,'',0.00,'2021-01-09','1900-01-01',1400.00,50.00),('0W7R',8604175,'01/12/2021',2987.00,'',0.00,'2021-12-01','1900-01-01',2900.00,75.00),('14TD',8604589,'17/06/2021',6587.00,'04/08/2021',6586.23,'2021-06-17','2021-08-04',6500.00,75.00),('0UGI',8613150,'19/11/2021',1587.00,'',0.00,'2021-11-19','1900-01-01',1500.00,75.00),('0UGI',8613150,'02/11/2021',2087.00,'',0.00,'2021-11-02','1900-01-01',2000.00,75.00),('0UGI',8613150,'05/10/2021',2487.00,'',0.00,'2021-10-05','1900-01-01',2400.00,75.00),('5074',8629578,'13/01/2021',2058.00,'',0.00,'2021-01-13','1900-01-01',2000.00,50.00),('2305',8633588,'02/08/2021',587.00,'',0.00,'2021-08-02','1900-01-01',500.00,75.00),('2305',8633588,'02/08/2021',587.00,'',0.00,'2021-08-02','1900-01-01',500.00,75.00),('2305',8633638,'01/09/2021',587.00,'',0.00,'2021-09-01','1900-01-01',500.00,75.00),('2305',8633653,'28/09/2021',587.00,'',0.00,'2021-09-28','1900-01-01',500.00,75.00),('2305',8633653,'26/02/2021',1058.00,'',0.00,'2021-02-26','1900-01-01',1000.00,50.00),('2305',8633810,'18/12/2021',1987.00,'',0.00,'2021-12-18','1900-01-01',1900.00,75.00),('2305',8633810,'27/02/2021',858.00,'',0.00,'2021-02-27','1900-01-01',800.00,50.00),('2305',8634693,'27/06/2021',587.00,'',0.00,'2021-06-27','1900-01-01',500.00,75.00),('2305',8635138,'01/10/2021',1687.00,'',0.00,'2021-10-01','1900-01-01',1600.00,75.00),('2305',8635211,'18/09/2021',887.00,'',0.00,'2021-09-18','1900-01-01',800.00,75.00),('2305',8635757,'26/11/2021',2087.00,'',0.00,'2021-11-26','1900-01-01',2000.00,75.00),('2305',8636888,'11/11/2021',2587.00,'',0.00,'2021-11-11','1900-01-01',2500.00,75.00),('0254',8636896,'10/04/2021',3058.00,'',0.00,'2021-04-10','1900-01-01',3000.00,50.00),('2305',8636953,'21/12/2021',2987.00,'',0.00,'2021-12-21','1900-01-01',2900.00,75.00),('2305',8636953,'15/01/2021',2358.00,'',0.00,'2021-01-15','1900-01-01',2300.00,50.00),('2305',8637027,'25/01/2021',1058.00,'',0.00,'2021-01-25','1900-01-01',1000.00,50.00),('2305',8637076,'29/01/2021',958.00,'',0.00,'2021-01-29','1900-01-01',900.00,50.00),('2305',8637225,'29/09/2021',1587.00,'',0.00,'2021-09-29','1900-01-01',1500.00,75.00),('2305',8637472,'28/01/2021',2058.00,'',0.00,'2021-01-28','1900-01-01',2000.00,50.00),('2305',8639304,'30/10/2021',1187.00,'',0.00,'2021-10-30','1900-01-01',1100.00,75.00),('2305',8639338,'22/11/2021',1687.00,'',0.00,'2021-11-22','1900-01-01',1600.00,75.00),('2305',8639650,'07/03/2021',958.00,'',0.00,'2021-03-07','1900-01-01',900.00,50.00),('2305',8639742,'27/12/2021',1787.00,'',0.00,'2021-12-27','1900-01-01',1700.00,75.00),('2305',8639775,'15/11/2021',1087.00,'',0.00,'2021-11-15','1900-01-01',1000.00,75.00),('2305',8639775,'07/11/2021',1587.00,'',0.00,'2021-11-07','1900-01-01',1500.00,75.00),('2305',8639791,'21/04/2021',1758.00,'',0.00,'2021-04-21','1900-01-01',1700.00,50.00),('2305',8640773,'08/12/2021',3287.00,'',0.00,'2021-12-08','1900-01-01',3200.00,75.00),('6286',8642662,'14/08/2021',1587.00,'',0.00,'2021-08-14','1900-01-01',1500.00,75.00),('0PN4',8668469,'03/02/2021',2258.00,'',0.00,'2021-02-03','1900-01-01',2200.00,50.00),('5460',8676363,'06/04/2021',2158.00,'',0.00,'2021-04-06','1900-01-01',2100.00,50.00),('0419',8693053,'28/08/2021',1587.00,'',0.00,'2021-08-28','1900-01-01',1500.00,75.00),('0419',8693053,'28/07/2021',2387.00,'',0.00,'2021-07-28','1900-01-01',2300.00,75.00),('0108',8706129,'22/09/2021',587.00,'',0.00,'2021-09-22','1900-01-01',500.00,75.00),('2305',8728230,'03/02/2021',1258.00,'',0.00,'2021-02-03','1900-01-01',1200.00,50.00),('6275',8733677,'12/02/2021',558.00,'',0.00,'2021-02-12','1900-01-01',500.00,50.00),('2305',8741480,'22/01/2021',4058.00,'',0.00,'2021-01-22','1900-01-01',4000.00,50.00),('6410',8752792,'26/06/2021',787.00,'',0.00,'2021-06-26','1900-01-01',700.00,75.00),('11VR',8759169,'24/02/2021',758.00,'',0.00,'2021-02-24','1900-01-01',700.00,50.00),('1APE',8764276,'21/03/2021',558.00,'',0.00,'2021-03-21','1900-01-01',500.00,50.00),('0254',8768665,'11/12/2021',3587.00,'',0.00,'2021-12-11','1900-01-01',3500.00,75.00),('0254',8768665,'18/11/2021',3587.00,'',0.00,'2021-11-18','1900-01-01',3500.00,75.00),('0254',8768996,'31/07/2021',4487.00,'',0.00,'2021-07-31','1900-01-01',4400.00,75.00),('0254',8769267,'08/11/2021',2487.00,'',0.00,'2021-11-08','1900-01-01',2400.00,75.00),('2305',8770000,'31/05/2021',587.00,'',0.00,'2021-05-31','1900-01-01',500.00,75.00),('0248',8774549,'19/12/2021',1022.00,'',0.00,'2021-12-19','1900-01-01',935.00,75.00),('9145',8776569,'18/04/2021',858.00,'',0.00,'2021-04-18','1900-01-01',800.00,50.00),('9145',8776569,'05/04/2021',858.00,'',0.00,'2021-04-05','1900-01-01',800.00,50.00),('0419',8795056,'28/02/2021',1858.00,'',0.00,'2021-02-28','1900-01-01',1800.00,50.00),('0NO4',8797987,'06/02/2021',1058.00,'',0.00,'2021-02-06','1900-01-01',1000.00,50.00),('0NO4',8797987,'30/01/2021',1058.00,'',0.00,'2021-01-30','1900-01-01',1000.00,50.00),('1019',8801888,'01/12/2021',3987.00,'',0.00,'2021-12-01','1900-01-01',3900.00,75.00),('2305',8811341,'28/01/2021',2558.00,'',0.00,'2021-01-28','1900-01-01',2500.00,50.00),('9197',8812638,'30/04/2021',658.00,'',0.00,'2021-04-30','1900-01-01',600.00,50.00),('2305',8818874,'30/08/2021',787.00,'',0.00,'2021-08-30','1900-01-01',700.00,75.00),('7860',8833907,'15/02/2021',658.00,'',0.00,'2021-02-15','1900-01-01',600.00,50.00),('0V1Z',8843674,'07/10/2021',1087.00,'',0.00,'2021-10-07','1900-01-01',1000.00,75.00),('0254',8846719,'29/01/2021',1258.00,'',0.00,'2021-01-29','1900-01-01',1200.00,50.00),('9240',8871352,'25/01/2021',3058.00,'',0.00,'2021-01-25','1900-01-01',3000.00,50.00),('9240',8871501,'30/12/2021',3787.00,'',0.00,'2021-12-30','1900-01-01',3700.00,75.00),('9240',8871501,'19/06/2021',3087.00,'',0.00,'2021-06-19','1900-01-01',3000.00,75.00),('9240',8871667,'12/04/2021',2058.00,'',0.00,'2021-04-12','1900-01-01',2000.00,50.00),('9240',8877201,'16/08/2021',1887.00,'',0.00,'2021-08-16','1900-01-01',1800.00,75.00),('9240',8877326,'12/10/2021',1487.00,'',0.00,'2021-10-12','1900-01-01',1400.00,75.00),('9109',8883001,'24/10/2021',587.00,'',0.00,'2021-10-24','1900-01-01',500.00,75.00),('0O2E',8893687,'15/01/2021',1558.00,'',0.00,'2021-01-15','1900-01-01',1500.00,50.00),('6410',8903718,'09/01/2021',2058.00,'',0.00,'2021-01-09','1900-01-01',2000.00,50.00),('4687',8904310,'03/01/2021',1058.00,'',0.00,'2021-01-03','1900-01-01',1000.00,50.00),('9339',8909475,'07/08/2021',1087.00,'',0.00,'2021-08-07','1900-01-01',1000.00,75.00),('9339',8909681,'31/12/2021',587.00,'',0.00,'2021-12-31','1900-01-01',500.00,75.00),('1354',8921371,'22/11/2021',3587.00,'',0.00,'2021-11-22','1900-01-01',3500.00,75.00),('100W',8925182,'01/09/2021',1687.00,'',0.00,'2021-09-01','1900-01-01',1600.00,75.00),('3776',8928012,'12/02/2021',858.00,'',0.00,'2021-02-12','1900-01-01',800.00,50.00),('7681',8929168,'03/12/2021',787.00,'',0.00,'2021-12-03','1900-01-01',700.00,75.00),('7681',8929168,'01/06/2021',987.00,'',0.00,'2021-06-01','1900-01-01',900.00,75.00),('7681',8929580,'15/06/2021',987.00,'',0.00,'2021-06-15','1900-01-01',900.00,75.00),('8140',8930448,'17/11/2021',2087.00,'',0.00,'2021-11-17','1900-01-01',2000.00,75.00),('0248',8934937,'31/07/2021',2887.00,'',0.00,'2021-07-31','1900-01-01',2800.00,75.00),('4851',8935470,'15/11/2021',1087.00,'',0.00,'2021-11-15','1900-01-01',1000.00,75.00),('9349',8936650,'15/11/2021',2587.00,'',0.00,'2021-11-15','1900-01-01',2500.00,75.00),('9349',8936957,'02/12/2021',587.00,'',0.00,'2021-12-02','1900-01-01',500.00,75.00),('9349',8937294,'01/02/2021',1258.00,'',0.00,'2021-02-01','1900-01-01',1200.00,50.00),('2305',8946972,'04/10/2021',2087.00,'',0.00,'2021-10-04','1900-01-01',2000.00,75.00),('0419',8968752,'21/04/2021',1058.00,'',0.00,'2021-04-21','1900-01-01',1000.00,50.00),('0419',8968760,'20/04/2021',1458.00,'',0.00,'2021-04-20','1900-01-01',1400.00,50.00),('2034',8969560,'23/08/2021',1087.00,'',0.00,'2021-08-23','1900-01-01',1000.00,75.00),('8858',8970899,'19/09/2021',2087.00,'',0.00,'2021-09-19','1900-01-01',2000.00,75.00),('5979',8981326,'16/02/2021',958.00,'',0.00,'2021-02-16','1900-01-01',900.00,50.00),('3010',8991143,'25/07/2021',587.00,'',0.00,'2021-07-25','1900-01-01',500.00,75.00),('1HX3',8994410,'18/11/2021',3987.00,'',0.00,'2021-11-18','1900-01-01',3900.00,75.00),('2305',8996555,'21/10/2021',2087.00,'',0.00,'2021-10-21','1900-01-01',2000.00,75.00),('1APE',9007725,'09/10/2021',887.00,'',0.00,'2021-10-09','1900-01-01',800.00,75.00),('6617',9022930,'16/01/2021',958.00,'05/03/2021',913.35,'2021-01-16','2021-03-05',900.00,50.00),('0RKP',9025396,'05/11/2021',1587.00,'',0.00,'2021-11-05','1900-01-01',1500.00,75.00),('3072',9025578,'29/11/2021',1387.00,'',0.00,'2021-11-29','1900-01-01',1300.00,75.00),('2150',9026279,'20/12/2021',4487.00,'',0.00,'2021-12-20','1900-01-01',4400.00,75.00),('3776',9030297,'08/01/2021',758.00,'',0.00,'2021-01-08','1900-01-01',700.00,50.00),('7861',9030883,'03/02/2021',4058.00,'',0.00,'2021-02-03','1900-01-01',4000.00,50.00),('1274',9031329,'05/03/2021',558.00,'',0.00,'2021-03-05','1900-01-01',500.00,50.00),('9449',9031386,'27/12/2021',587.00,'',0.00,'2021-12-27','1900-01-01',500.00,75.00),('9449',9031642,'08/11/2021',1087.00,'',0.00,'2021-11-08','1900-01-01',1000.00,75.00),('0079',9031774,'04/01/2021',558.00,'',0.00,'2021-01-04','1900-01-01',500.00,50.00),('7194',9036500,'08/02/2021',558.00,'',0.00,'2021-02-08','1900-01-01',500.00,50.00),('0289',9040981,'04/05/2021',1458.00,'',0.00,'2021-05-04','1900-01-01',1400.00,50.00),('17KH',9041047,'08/05/2021',1058.00,'',0.00,'2021-05-08','1900-01-01',1000.00,50.00),('1B9D',9041500,'16/11/2021',587.00,'',0.00,'2021-11-16','1900-01-01',500.00,75.00),('1747',9041724,'13/07/2021',587.00,'',0.00,'2021-07-13','1900-01-01',500.00,75.00),('9668',9045287,'17/10/2021',6587.00,'',0.00,'2021-10-17','1900-01-01',6500.00,75.00),('0289',9045832,'14/04/2021',2058.00,'',0.00,'2021-04-14','1900-01-01',2000.00,50.00),('2305',9047713,'02/02/2021',1358.00,'',0.00,'2021-02-02','1900-01-01',1300.00,50.00),('0254',9074808,'14/01/2021',4058.00,'',0.00,'2021-01-14','1900-01-01',4000.00,50.00),('0NO4',9086158,'05/02/2021',558.00,'',0.00,'2021-02-05','1900-01-01',500.00,50.00),('2305',9086349,'03/02/2021',1158.00,'',0.00,'2021-02-03','1900-01-01',1100.00,50.00),('6617',9093501,'06/01/2021',1758.00,'',0.00,'2021-01-06','1900-01-01',1700.00,50.00),('9537',9095183,'23/07/2021',1287.00,'',0.00,'2021-07-23','1900-01-01',1200.00,75.00),('0254',9097163,'12/02/2021',858.00,'',0.00,'2021-02-12','1900-01-01',800.00,50.00),('0254',9097163,'01/01/2021',1158.00,'',0.00,'2021-01-01','1900-01-01',1100.00,50.00),('6412',9099953,'21/07/2021',787.00,'',0.00,'2021-07-21','1900-01-01',700.00,75.00),('6412',9099953,'05/07/2021',587.00,'',0.00,'2021-07-05','1900-01-01',500.00,75.00),('6617',9100447,'15/01/2021',3958.00,'04/03/2021',3956.73,'2021-01-15','2021-03-04',3900.00,50.00),('9305',9107467,'22/11/2021',1187.00,'',0.00,'2021-11-22','1900-01-01',1100.00,75.00),('0NO4',9117441,'08/01/2021',858.00,'',0.00,'2021-01-08','1900-01-01',800.00,50.00),('9551',9124900,'11/09/2021',787.00,'',0.00,'2021-09-11','1900-01-01',700.00,75.00),('9377',9130121,'21/11/2021',1087.00,'',0.00,'2021-11-21','1900-01-01',1000.00,75.00),('9377',9130394,'06/11/2021',1087.00,'',0.00,'2021-11-06','1900-01-01',1000.00,75.00),('0O1S',9145889,'16/04/2021',2258.00,'',0.00,'2021-04-16','1900-01-01',2200.00,50.00),('14YO',9146028,'31/10/2021',2387.00,'',0.00,'2021-10-31','1900-01-01',2300.00,75.00),('1EZM',9147687,'05/09/2021',887.00,'',0.00,'2021-09-05','1900-01-01',800.00,75.00),('3437',9155177,'01/12/2021',1787.00,'',0.00,'2021-12-01','1900-01-01',1700.00,75.00),('4505',9161860,'30/09/2021',1987.00,'',0.00,'2021-09-30','1900-01-01',1900.00,75.00),('2163',9174095,'15/12/2021',1187.00,'',0.00,'2021-12-15','1900-01-01',1100.00,75.00),('0R28',9188236,'13/12/2021',2087.00,'',0.00,'2021-12-13','1900-01-01',2000.00,75.00),('1019',9199514,'23/12/2021',4287.00,'',0.00,'2021-12-23','1900-01-01',4200.00,75.00),('1019',9199514,'04/12/2021',4087.00,'',0.00,'2021-12-04','1900-01-01',4000.00,75.00),('1019',9199514,'26/03/2021',2858.00,'',0.00,'2021-03-26','1900-01-01',2800.00,50.00),('0108',9199837,'06/02/2021',2458.00,'',0.00,'2021-02-06','1900-01-01',2400.00,50.00),('2305',9199977,'04/12/2021',987.00,'',0.00,'2021-12-04','1900-01-01',900.00,75.00),('2163',9206657,'17/11/2021',1187.00,'',0.00,'2021-11-17','1900-01-01',1100.00,75.00),('9234',9212416,'02/12/2021',3187.00,'',0.00,'2021-12-02','1900-01-01',3100.00,75.00),('6516',9218215,'25/10/2021',687.00,'',0.00,'2021-10-25','1900-01-01',600.00,75.00),('6617',9225087,'07/01/2021',2358.00,'',0.00,'2021-01-07','1900-01-01',2300.00,50.00),('2305',9247602,'12/11/2021',687.00,'',0.00,'2021-11-12','1900-01-01',600.00,75.00),('0108',9252586,'06/12/2021',3087.00,'',0.00,'2021-12-06','1900-01-01',3000.00,75.00),('0ZOG',9256082,'22/12/2021',1187.00,'',0.00,'2021-12-22','1900-01-01',1100.00,75.00),('0ZOG',9256157,'05/01/2021',958.00,'',0.00,'2021-01-05','1900-01-01',900.00,50.00),('0ZOG',9256413,'06/12/2021',887.00,'',0.00,'2021-12-06','1900-01-01',800.00,75.00),('9748',9256645,'18/12/2021',1187.00,'',0.00,'2021-12-18','1900-01-01',1100.00,75.00),('2305',9260423,'02/10/2021',4087.00,'',0.00,'2021-10-02','1900-01-01',4000.00,75.00),('2305',9260449,'25/10/2021',1387.00,'',0.00,'2021-10-25','1900-01-01',1300.00,75.00),('2305',9260613,'25/06/2021',2387.00,'',0.00,'2021-06-25','1900-01-01',2300.00,75.00),('2305',9260613,'31/03/2021',1758.00,'',0.00,'2021-03-31','1900-01-01',1700.00,50.00),('9757',9262544,'11/12/2021',787.00,'',0.00,'2021-12-11','1900-01-01',700.00,75.00),('15QS',9273434,'29/06/2021',987.00,'',0.00,'2021-06-29','1900-01-01',900.00,75.00),('0QZX',9280629,'10/01/2021',3258.00,'',0.00,'2021-01-10','1900-01-01',3200.00,50.00),('1AC3',9287855,'01/12/2021',5687.00,'',0.00,'2021-12-01','1900-01-01',5600.00,75.00),('9883',9292418,'04/10/2021',787.00,'',0.00,'2021-10-04','1900-01-01',700.00,75.00),('2305',9296955,'10/11/2021',587.00,'',0.00,'2021-11-10','1900-01-01',500.00,75.00),('2305',9296997,'24/07/2021',5087.00,'',0.00,'2021-07-24','1900-01-01',5000.00,75.00),('2305',9297011,'26/12/2021',2587.00,'',0.00,'2021-12-26','1900-01-01',2500.00,75.00),('9808',9309907,'26/01/2021',558.00,'',0.00,'2021-01-26','1900-01-01',500.00,50.00),('9808',9310293,'09/10/2021',1587.00,'',0.00,'2021-10-09','1900-01-01',1500.00,75.00),('9808',9310293,'25/09/2021',1387.00,'',0.00,'2021-09-25','1900-01-01',1300.00,75.00),('9377',9312075,'08/11/2021',1487.00,'',0.00,'2021-11-08','1900-01-01',1400.00,75.00),('9377',9312075,'22/03/2021',558.00,'',0.00,'2021-03-22','1900-01-01',500.00,50.00),('9808',9312851,'21/09/2021',4687.00,'',0.00,'2021-09-21','1900-01-01',4600.00,75.00),('9808',9312984,'31/03/2021',1458.00,'',0.00,'2021-03-31','1900-01-01',1400.00,50.00),('0419',9338617,'06/08/2021',2887.00,'',0.00,'2021-08-06','1900-01-01',2800.00,75.00),('14OT',9338773,'04/10/2021',2087.00,'',0.00,'2021-10-04','1900-01-01',2000.00,75.00),('9109',9348970,'29/10/2021',687.00,'',0.00,'2021-10-29','1900-01-01',600.00,75.00),('2305',9353368,'02/09/2021',1787.00,'',0.00,'2021-09-02','1900-01-01',1700.00,75.00),('2305',9353368,'08/08/2021',1887.00,'',0.00,'2021-08-08','1900-01-01',1800.00,75.00),('2305',9353459,'29/10/2021',1687.00,'',0.00,'2021-10-29','1900-01-01',1600.00,75.00),('2305',9353459,'06/03/2021',758.00,'',0.00,'2021-03-06','1900-01-01',700.00,50.00),('2305',9353475,'22/01/2021',1058.00,'',0.00,'2021-01-22','1900-01-01',1000.00,50.00),('2305',9353541,'20/06/2021',3887.00,'',0.00,'2021-06-20','1900-01-01',3800.00,75.00),('0404',9359050,'13/08/2021',6587.00,'',0.00,'2021-08-13','1900-01-01',6500.00,75.00),('2305',9365677,'06/11/2021',587.00,'',0.00,'2021-11-06','1900-01-01',500.00,75.00),('2305',9365677,'26/08/2021',2287.00,'',0.00,'2021-08-26','1900-01-01',2200.00,75.00),('3031',9377748,'15/01/2021',1158.00,'',0.00,'2021-01-15','1900-01-01',1100.00,50.00),('3638',9397225,'16/12/2021',1587.00,'',0.00,'2021-12-16','1900-01-01',1500.00,75.00),('3638',9397225,'04/01/2021',1558.00,'',0.00,'2021-01-04','1900-01-01',1500.00,50.00),('1329',9400292,'21/08/2021',587.00,'',0.00,'2021-08-21','1900-01-01',500.00,75.00),('8873',9414806,'19/01/2021',1858.00,'',0.00,'2021-01-19','1900-01-01',1800.00,50.00),('7359',9419672,'30/01/2021',1758.00,'',0.00,'2021-01-30','1900-01-01',1700.00,50.00),('2163',9426743,'17/12/2021',2687.00,'',0.00,'2021-12-17','1900-01-01',2600.00,75.00),('2305',9426917,'18/12/2021',2087.00,'',0.00,'2021-12-18','1900-01-01',2000.00,75.00),('2305',9426966,'07/11/2021',1087.00,'',0.00,'2021-11-07','1900-01-01',1000.00,75.00),('0289',9433491,'27/11/2021',3087.00,'',0.00,'2021-11-27','1900-01-01',3000.00,75.00),('2600',9433756,'03/02/2021',758.00,'',0.00,'2021-02-03','1900-01-01',700.00,50.00),('18EA',9441007,'20/02/2021',4058.00,'',0.00,'2021-02-20','1900-01-01',4000.00,50.00),('18EA',9441007,'09/01/2021',1058.00,'',0.00,'2021-01-09','1900-01-01',1000.00,50.00),('1870',9448465,'12/02/2021',658.00,'',0.00,'2021-02-12','1900-01-01',600.00,50.00),('0430',9453887,'05/02/2021',1158.00,'',0.00,'2021-02-05','1900-01-01',1100.00,50.00),('0PR6',9474800,'01/02/2021',558.00,'',0.00,'2021-02-01','1900-01-01',500.00,50.00),('8734',9475906,'04/01/2021',758.00,'',0.00,'2021-01-04','1900-01-01',700.00,50.00),('07Q9',9480971,'16/12/2021',1187.00,'',0.00,'2021-12-16','1900-01-01',1100.00,75.00),('1GYK',9481433,'09/10/2021',2587.00,'',0.00,'2021-10-09','1900-01-01',2500.00,75.00),('1GYK',9481946,'29/12/2021',1737.00,'',0.00,'2021-12-29','1900-01-01',1650.00,75.00),('1GYK',9481961,'30/11/2021',1587.00,'',0.00,'2021-11-30','1900-01-01',1500.00,75.00),('1GYK',9481961,'10/11/2021',587.00,'',0.00,'2021-11-10','1900-01-01',500.00,75.00),('07R0',9481961,'13/01/2021',558.00,'',0.00,'2021-01-13','1900-01-01',500.00,50.00),('07R0',9482357,'06/01/2021',1058.00,'',0.00,'2021-01-06','1900-01-01',1000.00,50.00),('07R0',9482407,'12/02/2021',958.00,'',0.00,'2021-02-12','1900-01-01',900.00,50.00),('1GYK',9484353,'05/12/2021',1587.00,'',0.00,'2021-12-05','1900-01-01',1500.00,75.00),('07R0',9484353,'11/01/2021',1558.00,'',0.00,'2021-01-11','1900-01-01',1500.00,50.00),('1GYK',9484510,'04/09/2021',1487.00,'',0.00,'2021-09-04','1900-01-01',1400.00,75.00),('07R0',9485137,'04/02/2021',4058.00,'',0.00,'2021-02-04','1900-01-01',4000.00,50.00),('07R0',9485178,'09/01/2021',658.00,'',0.00,'2021-01-09','1900-01-01',600.00,50.00),('1GYK',9485376,'14/08/2021',1887.00,'',0.00,'2021-08-14','1900-01-01',1800.00,75.00),('07R0',9485590,'15/02/2021',1658.00,'',0.00,'2021-02-15','1900-01-01',1600.00,50.00),('07R0',9486283,'30/01/2021',3058.00,'',0.00,'2021-01-30','1900-01-01',3000.00,50.00),('1GYK',9486739,'13/10/2021',587.00,'',0.00,'2021-10-13','1900-01-01',500.00,75.00),('1GYK',9486911,'14/08/2021',687.00,'',0.00,'2021-08-14','1900-01-01',600.00,75.00),('9880',9489899,'24/09/2021',1187.00,'',0.00,'2021-09-24','1900-01-01',1100.00,75.00),('0108',9490145,'02/05/2021',4058.00,'',0.00,'2021-05-02','1900-01-01',4000.00,50.00),('07R0',9496621,'06/02/2021',1358.00,'',0.00,'2021-02-06','1900-01-01',1300.00,50.00),('07R0',9496654,'05/01/2021',1258.00,'',0.00,'2021-01-05','1900-01-01',1200.00,50.00),('1GYK',9496662,'20/10/2021',687.00,'',0.00,'2021-10-20','1900-01-01',600.00,75.00),('07R0',9496837,'13/02/2021',2058.00,'',0.00,'2021-02-13','1900-01-01',2000.00,50.00),('1GYK',9496845,'08/09/2021',1087.00,'',0.00,'2021-09-08','1900-01-01',1000.00,75.00),('07R0',9497256,'13/02/2021',808.00,'',0.00,'2021-02-13','1900-01-01',750.00,50.00),('1GYK',9497876,'28/11/2021',2087.00,'',0.00,'2021-11-28','1900-01-01',2000.00,75.00),('07R0',9498023,'13/02/2021',3058.00,'',0.00,'2021-02-13','1900-01-01',3000.00,50.00),('1GYK',9498106,'12/11/2021',587.00,'',0.00,'2021-11-12','1900-01-01',500.00,75.00),('1GYK',9498411,'06/12/2021',887.00,'',0.00,'2021-12-06','1900-01-01',800.00,75.00),('07R0',9498411,'02/02/2021',558.00,'',0.00,'2021-02-02','1900-01-01',500.00,50.00),('07R0',9498643,'24/01/2021',1358.00,'',0.00,'2021-01-24','1900-01-01',1300.00,50.00),('1GYK',9498957,'21/08/2021',1587.00,'',0.00,'2021-08-21','1900-01-01',1500.00,75.00),('2305',9501388,'14/01/2021',2558.00,'',0.00,'2021-01-14','1900-01-01',2500.00,50.00),('6617',9502402,'16/01/2021',3958.00,'05/03/2021',3950.58,'2021-01-16','2021-03-05',3900.00,50.00),('5394',9511825,'15/01/2021',1258.00,'',0.00,'2021-01-15','1900-01-01',1200.00,50.00),('1EUY',9512641,'17/12/2021',3987.00,'',0.00,'2021-12-17','1900-01-01',3900.00,75.00),('1EUY',9512641,'16/06/2021',3087.00,'',0.00,'2021-06-16','1900-01-01',3000.00,75.00),('8140',9522327,'17/12/2021',5187.00,'',0.00,'2021-12-17','1900-01-01',5100.00,75.00),('8140',9522327,'15/01/2021',4058.00,'',0.00,'2021-01-15','1900-01-01',4000.00,50.00),('8140',9522343,'15/01/2021',3058.00,'',0.00,'2021-01-15','1900-01-01',3000.00,50.00),('1EUY',9524471,'17/12/2021',1087.00,'',0.00,'2021-12-17','1900-01-01',1000.00,75.00),('07SB',9528506,'24/02/2021',558.00,'',0.00,'2021-02-24','1900-01-01',500.00,50.00),('07SB',9528696,'03/09/2021',687.00,'',0.00,'2021-09-03','1900-01-01',600.00,75.00),('07SB',9528696,'07/01/2021',558.00,'',0.00,'2021-01-07','1900-01-01',500.00,50.00),('5760',9539495,'23/05/2021',3887.00,'',0.00,'2021-05-23','1900-01-01',3800.00,75.00),('1EUY',9547381,'04/12/2021',1787.00,'',0.00,'2021-12-04','1900-01-01',1700.00,75.00),('1EUY',9547381,'05/04/2021',1458.00,'',0.00,'2021-04-05','1900-01-01',1400.00,50.00),('1EUY',9561846,'21/12/2021',3587.00,'',0.00,'2021-12-21','1900-01-01',3500.00,75.00),('1EUY',9561846,'16/12/2021',2687.00,'',0.00,'2021-12-16','1900-01-01',2600.00,75.00),('2305',9565664,'09/01/2021',4058.00,'',0.00,'2021-01-09','1900-01-01',4000.00,50.00),('2305',9571886,'03/09/2021',2087.00,'',0.00,'2021-09-03','1900-01-01',2000.00,75.00),('6782',9572298,'12/02/2021',2958.00,'',0.00,'2021-02-12','1900-01-01',2900.00,50.00),('8140',9578741,'28/12/2021',5087.00,'',0.00,'2021-12-28','1900-01-01',5000.00,75.00),('9866',9579418,'20/07/2021',5087.00,'',0.00,'2021-07-20','1900-01-01',5000.00,75.00),('5232',9584558,'02/01/2021',658.00,'',0.00,'2021-01-02','1900-01-01',600.00,50.00),('15QL',9585191,'15/01/2021',558.00,'',0.00,'2021-01-15','1900-01-01',500.00,50.00),('6460',9585597,'17/08/2021',787.00,'',0.00,'2021-08-17','1900-01-01',700.00,75.00),('2150',9591934,'02/05/2021',3558.00,'',0.00,'2021-05-02','1900-01-01',3500.00,50.00),('2323',9592924,'03/02/2021',608.00,'',0.00,'2021-02-03','1900-01-01',550.00,50.00),('0419',9597022,'04/11/2021',1587.00,'',0.00,'2021-11-04','1900-01-01',1500.00,75.00),('0419',9597022,'08/03/2021',1158.00,'',0.00,'2021-03-08','1900-01-01',1100.00,50.00),('0108',9599036,'11/02/2021',3058.00,'',0.00,'2021-02-11','1900-01-01',3000.00,50.00),('0108',9599036,'07/01/2021',3058.00,'',0.00,'2021-01-07','1900-01-01',3000.00,50.00),('0Z70',9603671,'14/01/2021',1158.00,'',0.00,'2021-01-14','1900-01-01',1100.00,50.00),('5460',9608571,'28/01/2021',2158.00,'',0.00,'2021-01-28','1900-01-01',2100.00,50.00),('2305',9614181,'05/01/2021',1558.00,'',0.00,'2021-01-05','1900-01-01',1500.00,50.00),('2305',9614181,'02/01/2021',3158.00,'',0.00,'2021-01-02','1900-01-01',3100.00,50.00),('9412',9614769,'08/08/2021',1487.00,'',0.00,'2021-08-08','1900-01-01',1400.00,75.00),('5074',9624818,'07/11/2021',2587.00,'',0.00,'2021-11-07','1900-01-01',2500.00,75.00),('5074',9624818,'22/10/2021',2087.00,'',0.00,'2021-10-22','1900-01-01',2000.00,75.00),('4505',9634767,'12/06/2021',1787.00,'',0.00,'2021-06-12','1900-01-01',1700.00,75.00),('0645',9647025,'04/05/2021',1858.00,'',0.00,'2021-05-04','1900-01-01',1800.00,50.00),('0645',9647025,'20/03/2021',1458.00,'',0.00,'2021-03-20','1900-01-01',1400.00,50.00),('8282',9647488,'31/01/2021',1858.00,'',0.00,'2021-01-31','1900-01-01',1800.00,50.00),('8282',9647520,'15/01/2021',758.00,'',0.00,'2021-01-15','1900-01-01',700.00,50.00),('9377',9660077,'22/12/2021',887.00,'',0.00,'2021-12-22','1900-01-01',800.00,75.00),('9377',9660077,'06/05/2021',558.00,'',0.00,'2021-05-06','1900-01-01',500.00,50.00),('0254',9665555,'14/01/2021',3858.00,'',0.00,'2021-01-14','1900-01-01',3800.00,50.00),('5569',9665894,'07/12/2021',1287.00,'',0.00,'2021-12-07','1900-01-01',1200.00,75.00),('5569',9665894,'25/08/2021',687.00,'',0.00,'2021-08-25','1900-01-01',600.00,75.00),('07V7',9666819,'21/10/2021',5487.00,'',0.00,'2021-10-21','1900-01-01',5400.00,75.00),('7300',9675273,'18/01/2021',1258.00,'',0.00,'2021-01-18','1900-01-01',1200.00,50.00),('1FAX',9676370,'06/12/2021',687.00,'',0.00,'2021-12-06','1900-01-01',600.00,75.00),('17A6',9677428,'18/07/2021',787.00,'',0.00,'2021-07-18','1900-01-01',700.00,75.00),('1FAX',9677501,'28/12/2021',587.00,'',0.00,'2021-12-28','1900-01-01',500.00,75.00),('1FAX',9678012,'21/12/2021',587.00,'',0.00,'2021-12-21','1900-01-01',500.00,75.00),('1FAY',9678137,'12/02/2021',758.00,'',0.00,'2021-02-12','1900-01-01',700.00,50.00),('2305',9678814,'19/10/2021',1987.00,'',0.00,'2021-10-19','1900-01-01',1900.00,75.00),('0108',9680059,'26/10/2021',2587.00,'',0.00,'2021-10-26','1900-01-01',2500.00,75.00),('3454',9690959,'05/09/2021',1087.00,'',0.00,'2021-09-05','1900-01-01',1000.00,75.00),('9377',9696519,'19/12/2021',1587.00,'',0.00,'2021-12-19','1900-01-01',1500.00,75.00),('9377',9696519,'14/01/2021',1258.00,'',0.00,'2021-01-14','1900-01-01',1200.00,50.00),('9377',9696519,'03/01/2021',1258.00,'',0.00,'2021-01-03','1900-01-01',1200.00,50.00),('1BF0',9719097,'14/10/2021',1687.00,'',0.00,'2021-10-14','1900-01-01',1600.00,75.00),('1DJY',9727751,'06/02/2021',658.00,'',0.00,'2021-02-06','1900-01-01',600.00,50.00),('2305',9740903,'08/04/2021',1058.00,'',0.00,'2021-04-08','1900-01-01',1000.00,50.00),('3044',9747601,'18/01/2021',2758.00,'',0.00,'2021-01-18','1900-01-01',2700.00,50.00),('0108',9747635,'19/01/2021',3758.00,'',0.00,'2021-01-19','1900-01-01',3700.00,50.00),('0108',9747635,'04/01/2021',3558.00,'',0.00,'2021-01-04','1900-01-01',3500.00,50.00),('07VU',9752353,'21/08/2021',887.00,'',0.00,'2021-08-21','1900-01-01',800.00,75.00),('5233',9764606,'10/03/2021',558.00,'',0.00,'2021-03-10','1900-01-01',500.00,50.00),('0664',9767310,'21/07/2021',587.00,'',0.00,'2021-07-21','1900-01-01',500.00,75.00),('17DY',9769928,'10/11/2021',2087.00,'',0.00,'2021-11-10','1900-01-01',2000.00,75.00),('6412',9772443,'15/12/2021',1587.00,'',0.00,'2021-12-15','1900-01-01',1500.00,75.00),('6412',9772443,'15/11/2021',787.00,'',0.00,'2021-11-15','1900-01-01',700.00,75.00),('0W7R',9772716,'06/12/2021',587.00,'',0.00,'2021-12-06','1900-01-01',500.00,75.00),('9240',9773045,'03/12/2021',3087.00,'',0.00,'2021-12-03','1900-01-01',3000.00,75.00),('9240',9773045,'21/06/2021',587.00,'',0.00,'2021-06-21','1900-01-01',500.00,75.00),('9757',9773144,'03/08/2021',3087.00,'',0.00,'2021-08-03','1900-01-01',3000.00,75.00),('0X3P',9780578,'27/09/2021',1187.00,'',0.00,'2021-09-27','1900-01-01',1100.00,75.00),('0X3P',9780578,'18/09/2021',1187.00,'',0.00,'2021-09-18','1900-01-01',1100.00,75.00),('9240',9805359,'16/09/2021',1087.00,'',0.00,'2021-09-16','1900-01-01',1000.00,75.00),('2317',9806779,'15/10/2021',1087.00,'',0.00,'2021-10-15','1900-01-01',1000.00,75.00),('1GYK',9817214,'17/09/2021',2087.00,'',0.00,'2021-09-17','1900-01-01',2000.00,75.00),('2305',9818261,'23/11/2021',2087.00,'',0.00,'2021-11-23','1900-01-01',2000.00,75.00),('2305',9818261,'16/01/2021',1558.00,'',0.00,'2021-01-16','1900-01-01',1500.00,50.00),('8250',9825605,'11/12/2021',1687.00,'',0.00,'2021-12-11','1900-01-01',1600.00,75.00),('5074',9830647,'31/12/2021',1587.00,'',0.00,'2021-12-31','1900-01-01',1500.00,75.00),('6991',9836867,'11/10/2021',687.00,'',0.00,'2021-10-11','1900-01-01',600.00,75.00),('6991',9837725,'15/09/2021',687.00,'',0.00,'2021-09-15','1900-01-01',600.00,75.00),('5368',9841396,'01/05/2021',1058.00,'',0.00,'2021-05-01','1900-01-01',1000.00,50.00),('0PR6',9843996,'06/01/2021',558.00,'',0.00,'2021-01-06','1900-01-01',500.00,50.00),('5873',9844770,'08/03/2021',1158.00,'',0.00,'2021-03-08','1900-01-01',1100.00,50.00),('0VTW',9849936,'01/11/2021',587.00,'',0.00,'2021-11-01','1900-01-01',500.00,75.00),('1AJZ',9851528,'28/11/2021',1087.00,'',0.00,'2021-11-28','1900-01-01',1000.00,75.00),('3776',9862863,'08/01/2021',1458.00,'',0.00,'2021-01-08','1900-01-01',1400.00,50.00),('0874',9868159,'16/12/2021',1187.00,'',0.00,'2021-12-16','1900-01-01',1100.00,75.00),('0PY5',9869603,'30/03/2021',758.00,'',0.00,'2021-03-30','1900-01-01',700.00,50.00),('2305',9869876,'20/11/2021',2587.00,'',0.00,'2021-11-20','1900-01-01',2500.00,75.00),('2305',9870049,'18/12/2021',2487.00,'',0.00,'2021-12-18','1900-01-01',2400.00,75.00),('2305',9870049,'09/01/2021',558.00,'',0.00,'2021-01-09','1900-01-01',500.00,50.00),('2305',9870130,'19/08/2021',1187.00,'',0.00,'2021-08-19','1900-01-01',1100.00,75.00),('2305',9870254,'21/05/2021',1358.00,'',0.00,'2021-05-21','1900-01-01',1271.00,75.00),('9162',9872037,'17/12/2021',987.00,'',0.00,'2021-12-17','1900-01-01',900.00,75.00),('8140',9878323,'18/01/2021',2658.00,'',0.00,'2021-01-18','1900-01-01',2600.00,50.00),('8140',9878513,'17/12/2021',2087.00,'',0.00,'2021-12-17','1900-01-01',2000.00,75.00),('8140',9878513,'29/01/2021',4058.00,'',0.00,'2021-01-29','1900-01-01',4000.00,50.00),('0405',9883141,'08/01/2021',1158.00,'',0.00,'2021-01-08','1900-01-01',1100.00,50.00),('0TUK',9890575,'27/12/2021',587.00,'',0.00,'2021-12-27','1900-01-01',500.00,75.00),('0NO4',9895160,'19/03/2021',3058.00,'',0.00,'2021-03-19','1900-01-01',3000.00,50.00),('8300',9896390,'08/01/2021',1358.00,'',0.00,'2021-01-08','1900-01-01',1300.00,50.00),('9668',9898677,'14/11/2021',3087.00,'',0.00,'2021-11-14','1900-01-01',3000.00,75.00),('0NCB',9901141,'12/05/2021',2358.00,'',0.00,'2021-05-12','1900-01-01',2300.00,50.00),('2163',9909706,'17/12/2021',1487.00,'',0.00,'2021-12-17','1900-01-01',1400.00,75.00),('0S29',9921107,'03/12/2021',887.00,'',0.00,'2021-12-03','1900-01-01',800.00,75.00),('14OH',9925694,'04/08/2021',1087.00,'',0.00,'2021-08-04','1900-01-01',1000.00,75.00),('0NAS',9934498,'16/08/2021',2187.00,'',0.00,'2021-08-16','1900-01-01',2100.00,75.00),('0NO4',9940602,'08/01/2021',858.00,'',0.00,'2021-01-08','1900-01-01',800.00,50.00),('2305',9946021,'16/12/2021',1987.00,'',0.00,'2021-12-16','1900-01-01',1900.00,75.00),('6617',9953175,'15/01/2021',2458.00,'04/03/2021',2215.00,'2021-01-15','2021-03-04',2400.00,50.00),('0WVW',9964123,'19/01/2021',1258.00,'',0.00,'2021-01-19','1900-01-01',1200.00,50.00),('0NDH',9967829,'03/07/2021',3587.00,'',0.00,'2021-07-03','1900-01-01',3500.00,75.00),('0NDH',9967829,'10/02/2021',2958.00,'',0.00,'2021-02-10','1900-01-01',2900.00,50.00),('0NDH',9967936,'21/11/2021',1787.00,'',0.00,'2021-11-21','1900-01-01',1700.00,75.00),('0NDH',9967936,'10/02/2021',1058.00,'',0.00,'2021-02-10','1900-01-01',1000.00,50.00),('0NDH',9967944,'31/01/2021',558.00,'',0.00,'2021-01-31','1900-01-01',500.00,50.00),('0NDH',9967944,'10/01/2021',558.00,'',0.00,'2021-01-10','1900-01-01',500.00,50.00),('3776',9968959,'09/01/2021',558.00,'',0.00,'2021-01-09','1900-01-01',500.00,50.00),('0021',9977901,'07/11/2021',987.00,'',0.00,'2021-11-07','1900-01-01',900.00,75.00),('2305',9984519,'25/01/2021',1558.00,'',0.00,'2021-01-25','1900-01-01',1500.00,50.00),('2305',9984527,'14/02/2021',2358.00,'',0.00,'2021-02-14','1900-01-01',2300.00,50.00),('2305',9984568,'29/03/2021',2158.00,'',0.00,'2021-03-29','1900-01-01',2100.00,50.00),('8140',9985870,'06/10/2021',1687.00,'',0.00,'2021-10-06','1900-01-01',1600.00,75.00),('8140',9986019,'02/12/2021',5087.00,'',0.00,'2021-12-02','1900-01-01',5000.00,75.00),('0ZKC',9990680,'03/12/2021',2287.00,'',0.00,'2021-12-03','1900-01-01',2200.00,75.00),('0ZKC',9990680,'03/11/2021',2187.00,'',0.00,'2021-11-03','1900-01-01',2100.00,75.00),('1FAX',9997479,'31/07/2021',837.00,'',0.00,'2021-07-31','1900-01-01',750.00,75.00),('0NGE',10003184,'12/12/2021',2187.00,'',0.00,'2021-12-12','1900-01-01',2100.00,75.00),('0NGE',10003184,'15/01/2021',1858.00,'',0.00,'2021-01-15','1900-01-01',1800.00,50.00),('0419',10014504,'01/05/2021',958.00,'',0.00,'2021-05-01','1900-01-01',900.00,50.00),('0419',10014504,'26/04/2021',958.00,'',0.00,'2021-04-26','1900-01-01',900.00,50.00),('16PV',10021160,'31/12/2021',1287.00,'',0.00,'2021-12-31','1900-01-01',1200.00,75.00),('0317',10032316,'06/01/2021',858.00,'',0.00,'2021-01-06','1900-01-01',800.00,50.00),('1870',10032647,'29/11/2021',1587.00,'',0.00,'2021-11-29','1900-01-01',1500.00,75.00),('0PFT',10037588,'15/10/2021',687.00,'',0.00,'2021-10-15','1900-01-01',600.00,75.00),('2305',10037984,'06/12/2021',3087.00,'',0.00,'2021-12-06','1900-01-01',3000.00,75.00),('2305',10037984,'17/01/2021',858.00,'',0.00,'2021-01-17','1900-01-01',800.00,50.00),('0QUC',10044444,'02/12/2021',587.00,'',0.00,'2021-12-02','1900-01-01',500.00,75.00),('0QUC',10044444,'30/09/2021',2087.00,'',0.00,'2021-09-30','1900-01-01',2000.00,75.00),('0215',10047215,'01/08/2021',1687.00,'',0.00,'2021-08-01','1900-01-01',1600.00,75.00),('0NH9',10053213,'01/06/2021',687.00,'',0.00,'2021-06-01','1900-01-01',600.00,75.00),('0108',10058964,'10/01/2021',1058.00,'',0.00,'2021-01-10','1900-01-01',1000.00,50.00),('3497',10059194,'06/02/2021',3058.00,'',0.00,'2021-02-06','1900-01-01',3000.00,50.00),('0X8T',10079010,'11/08/2021',2087.00,'',0.00,'2021-08-11','1900-01-01',2000.00,75.00),('0254',10080208,'29/01/2021',2858.00,'',0.00,'2021-01-29','1900-01-01',2800.00,50.00),('0419',10093193,'09/08/2021',1887.00,'',0.00,'2021-08-09','1900-01-01',1800.00,75.00),('2305',10114718,'29/01/2021',2158.00,'',0.00,'2021-01-29','1900-01-01',2100.00,50.00),('2305',10115764,'03/01/2021',3158.00,'',0.00,'2021-01-03','1900-01-01',3100.00,50.00),('0NIA',10116481,'06/12/2021',787.00,'',0.00,'2021-12-06','1900-01-01',700.00,75.00),('7126',10118271,'17/01/2021',558.00,'',0.00,'2021-01-17','1900-01-01',500.00,50.00),('0TOM',10123578,'22/12/2021',687.00,'',0.00,'2021-12-22','1900-01-01',600.00,75.00),('7351',10133304,'29/05/2021',1187.00,'',0.00,'2021-05-29','1900-01-01',1100.00,75.00),('7351',10133304,'14/05/2021',1058.00,'',0.00,'2021-05-14','1900-01-01',1000.00,50.00),('0NGE',10133908,'07/03/2021',1358.00,'',0.00,'2021-03-07','1900-01-01',1300.00,50.00),('0NLJ',10142883,'13/02/2021',1058.00,'',0.00,'2021-02-13','1900-01-01',1000.00,50.00),('0NLJ',10142917,'19/01/2021',2958.00,'',0.00,'2021-01-19','1900-01-01',2900.00,50.00),('1IM9',10145415,'16/12/2021',687.00,'',0.00,'2021-12-16','1900-01-01',600.00,75.00),('17IG',10150415,'17/01/2021',758.00,'',0.00,'2021-01-17','1900-01-01',700.00,50.00),('5979',10151215,'22/07/2021',887.00,'',0.00,'2021-07-22','1900-01-01',800.00,75.00),('1HV3',10151371,'09/10/2021',1087.00,'',0.00,'2021-10-09','1900-01-01',1000.00,75.00),('1DDT',10151884,'11/12/2021',887.00,'',0.00,'2021-12-11','1900-01-01',800.00,75.00),('1DDT',10151884,'17/01/2021',558.00,'',0.00,'2021-01-17','1900-01-01',500.00,50.00),('1518',10157683,'07/01/2021',1058.00,'',0.00,'2021-01-07','1900-01-01',1000.00,50.00),('0VI4',10157782,'16/12/2021',1887.00,'',0.00,'2021-12-16','1900-01-01',1800.00,75.00),('0VI4',10157782,'20/08/2021',1887.00,'',0.00,'2021-08-20','1900-01-01',1800.00,75.00),('0616',10161073,'18/10/2021',587.00,'',0.00,'2021-10-18','1900-01-01',500.00,75.00),('0616',10161073,'24/07/2021',587.00,'',0.00,'2021-07-24','1900-01-01',500.00,75.00),('0T8P',10174340,'08/09/2021',1687.00,'',0.00,'2021-09-08','1900-01-01',1600.00,75.00),('0NO4',10180040,'09/02/2021',658.00,'',0.00,'2021-02-09','1900-01-01',600.00,50.00),('0NO4',10180040,'18/01/2021',658.00,'',0.00,'2021-01-18','1900-01-01',600.00,50.00),('0NO4',10180370,'24/06/2021',987.00,'',0.00,'2021-06-24','1900-01-01',900.00,75.00),('0NO4',10180420,'13/02/2021',1058.00,'',0.00,'2021-02-13','1900-01-01',1000.00,50.00),('0WOM',10180503,'05/12/2021',1087.00,'',0.00,'2021-12-05','1900-01-01',1000.00,75.00),('0WOM',10180560,'16/11/2021',887.00,'',0.00,'2021-11-16','1900-01-01',800.00,75.00),('0WOM',10180560,'08/11/2021',887.00,'',0.00,'2021-11-08','1900-01-01',800.00,75.00),('6617',10182137,'04/01/2021',1058.00,'',0.00,'2021-01-04','1900-01-01',1000.00,50.00),('0QEX',10189801,'12/09/2021',687.00,'',0.00,'2021-09-12','1900-01-01',600.00,75.00),('7126',10196277,'01/10/2021',2887.00,'',0.00,'2021-10-01','1900-01-01',2800.00,75.00),('2139',10198059,'15/11/2021',1087.00,'',0.00,'2021-11-15','1900-01-01',1000.00,75.00),('2117',10213122,'15/01/2021',4058.00,'',0.00,'2021-01-15','1900-01-01',4000.00,50.00),('8576',10218121,'17/12/2021',4387.00,'',0.00,'2021-12-17','1900-01-01',4300.00,75.00),('0NP9',10229029,'31/12/2021',2087.00,'',0.00,'2021-12-31','1900-01-01',2000.00,75.00),('0NP9',10229029,'18/12/2021',2187.00,'',0.00,'2021-12-18','1900-01-01',2100.00,75.00),('7861',10231256,'18/08/2021',2587.00,'',0.00,'2021-08-18','1900-01-01',2500.00,75.00),('0WOM',10242568,'24/12/2021',1487.00,'',0.00,'2021-12-24','1900-01-01',1400.00,75.00),('0WOM',10242675,'13/12/2021',1087.00,'',0.00,'2021-12-13','1900-01-01',1000.00,75.00),('0WOM',10242675,'17/11/2021',587.00,'',0.00,'2021-11-17','1900-01-01',500.00,75.00),('0NPB',10256485,'08/02/2021',1358.00,'',0.00,'2021-02-08','1900-01-01',1300.00,50.00),('0005',10260792,'29/01/2021',2158.00,'',0.00,'2021-01-29','1900-01-01',2100.00,50.00),('1EUY',10267250,'01/10/2021',3087.00,'',0.00,'2021-10-01','1900-01-01',3000.00,75.00),('1EUY',10267250,'28/08/2021',987.00,'',0.00,'2021-08-28','1900-01-01',900.00,75.00),('0NR9',10288074,'17/01/2021',758.00,'',0.00,'2021-01-17','1900-01-01',700.00,50.00),('0NR9',10288488,'24/08/2021',1087.00,'',0.00,'2021-08-24','1900-01-01',1000.00,75.00),('8282',10288892,'05/01/2021',2058.00,'',0.00,'2021-01-05','1900-01-01',2000.00,50.00),('0NMW',10305993,'21/09/2021',787.00,'',0.00,'2021-09-21','1900-01-01',700.00,75.00),('0NMW',10305993,'02/02/2021',658.00,'',0.00,'2021-02-02','1900-01-01',600.00,50.00),('0WOM',10307056,'19/10/2021',587.00,'',0.00,'2021-10-19','1900-01-01',500.00,75.00),('5979',10308112,'14/10/2021',1087.00,'',0.00,'2021-10-14','1900-01-01',1000.00,75.00),('0NS4',10316628,'23/08/2021',587.00,'',0.00,'2021-08-23','1900-01-01',500.00,75.00),('0SP5',10321602,'31/08/2021',587.00,'',0.00,'2021-08-31','1900-01-01',500.00,75.00),('0NSV',10330231,'28/04/2021',1258.00,'',0.00,'2021-04-28','1900-01-01',1200.00,50.00),('0NSV',10330397,'15/07/2021',1587.00,'',0.00,'2021-07-15','1900-01-01',1500.00,75.00),('0NSV',10330413,'05/07/2021',1587.00,'',0.00,'2021-07-05','1900-01-01',1500.00,75.00),('0NSV',10330454,'15/03/2021',2258.00,'',0.00,'2021-03-15','1900-01-01',2200.00,50.00),('0NSX',10331254,'19/04/2021',4058.00,'',0.00,'2021-04-19','1900-01-01',4000.00,50.00),('0NSX',10331528,'03/10/2021',2487.00,'',0.00,'2021-10-03','1900-01-01',2400.00,75.00),('0NT1',10331528,'05/01/2021',2158.00,'',0.00,'2021-01-05','1900-01-01',2100.00,50.00),('0ZX2',10331916,'26/12/2021',1487.00,'',0.00,'2021-12-26','1900-01-01',1400.00,75.00),('0ZX2',10331916,'24/01/2021',1358.00,'',0.00,'2021-01-24','1900-01-01',1300.00,50.00),('0ZX2',10332039,'17/12/2021',2487.00,'',0.00,'2021-12-17','1900-01-01',2400.00,75.00),('0ZX2',10332062,'29/12/2021',2087.00,'',0.00,'2021-12-29','1900-01-01',2000.00,75.00),('0ZX2',10332062,'19/08/2021',987.00,'',0.00,'2021-08-19','1900-01-01',900.00,75.00),('1717',10335313,'12/02/2021',2258.00,'',0.00,'2021-02-12','1900-01-01',2200.00,50.00),('0NRV',10341535,'21/12/2021',1087.00,'',0.00,'2021-12-21','1900-01-01',1000.00,75.00),('0NRV',10341535,'08/01/2021',958.00,'',0.00,'2021-01-08','1900-01-01',900.00,50.00),('0NSX',10341626,'05/10/2021',2587.00,'',0.00,'2021-10-05','1900-01-01',2500.00,75.00),('0NSX',10341634,'17/08/2021',2087.00,'',0.00,'2021-08-17','1900-01-01',2000.00,75.00),('0NSX',10341683,'21/11/2021',1587.00,'',0.00,'2021-11-21','1900-01-01',1500.00,75.00),('0NRV',10341683,'25/04/2021',3758.00,'',0.00,'2021-04-25','1900-01-01',3700.00,50.00),('0ZX4',10342830,'01/04/2021',4058.00,'',0.00,'2021-04-01','1900-01-01',4000.00,50.00),('0ZWR',10343333,'22/12/2021',1287.00,'',0.00,'2021-12-22','1900-01-01',1200.00,75.00),('0V25',10343382,'28/08/2021',1887.00,'',0.00,'2021-08-28','1900-01-01',1800.00,75.00),('0V25',10343382,'25/08/2021',1887.00,'',0.00,'2021-08-25','1900-01-01',1800.00,75.00),('0NSX',10343481,'19/08/2021',3087.00,'',0.00,'2021-08-19','1900-01-01',3000.00,75.00),('0ZWR',10343945,'23/02/2021',658.00,'',0.00,'2021-02-23','1900-01-01',600.00,50.00),('0NSX',10344455,'08/11/2021',1987.00,'',0.00,'2021-11-08','1900-01-01',1900.00,75.00),('1EWM',10344612,'31/07/2021',1487.00,'',0.00,'2021-07-31','1900-01-01',1400.00,75.00),('100Y',10344646,'02/06/2021',687.00,'',0.00,'2021-06-02','1900-01-01',600.00,75.00),('6782',10344687,'05/01/2021',3258.00,'',0.00,'2021-01-05','1900-01-01',3200.00,50.00),('0NSW',10344984,'14/05/2021',1958.00,'',0.00,'2021-05-14','1900-01-01',1900.00,50.00),('0NSW',10344992,'25/01/2021',1358.00,'',0.00,'2021-01-25','1900-01-01',1300.00,50.00),('0NSW',10345015,'18/03/2021',4058.00,'',0.00,'2021-03-18','1900-01-01',4000.00,50.00),('0NSX',10345106,'14/08/2021',687.00,'',0.00,'2021-08-14','1900-01-01',600.00,75.00),('100W',10345247,'23/12/2021',1087.00,'',0.00,'2021-12-23','1900-01-01',1000.00,75.00),('100W',10345247,'30/01/2021',858.00,'',0.00,'2021-01-30','1900-01-01',800.00,50.00),('0ZWZ',10345957,'13/02/2021',1758.00,'',0.00,'2021-02-13','1900-01-01',1700.00,50.00),('0NSX',10346062,'10/11/2021',587.00,'',0.00,'2021-11-10','1900-01-01',500.00,75.00),('0ZWZ',10346088,'02/06/2021',1587.00,'',0.00,'2021-06-02','1900-01-01',1500.00,75.00),('0NSX',10346096,'21/10/2021',787.00,'',0.00,'2021-10-21','1900-01-01',700.00,75.00),('0ZWZ',10346112,'05/12/2021',1187.00,'',0.00,'2021-12-05','1900-01-01',1100.00,75.00),('0ZWZ',10346229,'23/12/2021',1887.00,'',0.00,'2021-12-23','1900-01-01',1800.00,75.00),('0ZWZ',10346559,'28/08/2021',1087.00,'',0.00,'2021-08-28','1900-01-01',1000.00,75.00),('0NT0',10346880,'08/03/2021',1058.00,'',0.00,'2021-03-08','1900-01-01',1000.00,50.00),('0ZX1',10346922,'19/12/2021',2087.00,'',0.00,'2021-12-19','1900-01-01',2000.00,75.00),('0NT0',10346948,'05/01/2021',1158.00,'',0.00,'2021-01-05','1900-01-01',1100.00,50.00),('0NT0',10347052,'15/02/2021',2258.00,'',0.00,'2021-02-15','1900-01-01',2200.00,50.00),('0ZX1',10347078,'17/12/2021',4087.00,'',0.00,'2021-12-17','1900-01-01',4000.00,75.00),('0ZX1',10347607,'03/12/2021',4387.00,'',0.00,'2021-12-03','1900-01-01',4300.00,75.00),('0ZX1',10347649,'20/12/2021',2587.00,'',0.00,'2021-12-20','1900-01-01',2500.00,75.00),('0ZX1',10347672,'15/01/2021',2558.00,'',0.00,'2021-01-15','1900-01-01',2500.00,50.00),('0ZX1',10347680,'15/05/2021',2658.00,'',0.00,'2021-05-15','1900-01-01',2571.00,75.00),('0ZX1',10347839,'15/01/2021',1558.00,'',0.00,'2021-01-15','1900-01-01',1500.00,50.00),('0ZX1',10347847,'02/12/2021',1987.00,'',0.00,'2021-12-02','1900-01-01',1900.00,75.00),('0ZX1',10347847,'18/02/2021',1758.00,'',0.00,'2021-02-18','1900-01-01',1700.00,50.00),('0419',10354249,'05/03/2021',858.00,'',0.00,'2021-03-05','1900-01-01',800.00,50.00),('0404',10355725,'02/08/2021',4487.00,'',0.00,'2021-08-02','1900-01-01',4400.00,75.00),('0404',10355725,'14/01/2021',2158.00,'',0.00,'2021-01-14','1900-01-01',2100.00,50.00),('3202',10357705,'08/11/2021',787.00,'',0.00,'2021-11-08','1900-01-01',700.00,75.00),('3202',10357705,'13/03/2021',558.00,'',0.00,'2021-03-13','1900-01-01',500.00,50.00),('0NU8',10358497,'27/12/2021',887.00,'',0.00,'2021-12-27','1900-01-01',800.00,75.00),('0NU8',10358497,'02/02/2021',558.00,'',0.00,'2021-02-02','1900-01-01',500.00,50.00),('0NS2',10364578,'20/08/2021',687.00,'',0.00,'2021-08-20','1900-01-01',600.00,75.00),('3132',10368850,'22/11/2021',587.00,'',0.00,'2021-11-22','1900-01-01',500.00,75.00),('3132',10368850,'27/03/2021',1258.00,'',0.00,'2021-03-27','1900-01-01',1200.00,50.00),('8140',10372019,'31/12/2021',1787.00,'',0.00,'2021-12-31','1900-01-01',1700.00,75.00),('8140',10372019,'29/01/2021',2758.00,'',0.00,'2021-01-29','1900-01-01',2700.00,50.00),('8140',10372050,'18/11/2021',3787.00,'',0.00,'2021-11-18','1900-01-01',3700.00,75.00),('0NVF',10387264,'23/10/2021',587.00,'',0.00,'2021-10-23','1900-01-01',500.00,75.00),('0NUW',10390730,'18/08/2021',1487.00,'',0.00,'2021-08-18','1900-01-01',1400.00,75.00),('0NUW',10390797,'30/09/2021',3087.00,'',0.00,'2021-09-30','1900-01-01',3000.00,75.00),('8282',10393452,'08/02/2021',958.00,'',0.00,'2021-02-08','1900-01-01',900.00,50.00),('11G2',10393999,'22/11/2021',1587.00,'',0.00,'2021-11-22','1900-01-01',1500.00,75.00),('11G2',10393999,'27/10/2021',1587.00,'',0.00,'2021-10-27','1900-01-01',1500.00,75.00),('9572',10396042,'02/11/2021',4487.00,'',0.00,'2021-11-02','1900-01-01',4400.00,75.00),('12K1',10396042,'29/01/2021',4058.00,'',0.00,'2021-01-29','1900-01-01',4000.00,50.00),('2468',10412609,'15/02/2021',2358.00,'',0.00,'2021-02-15','1900-01-01',2300.00,50.00),('2468',10412609,'30/01/2021',1458.00,'',0.00,'2021-01-30','1900-01-01',1400.00,50.00),('0NO4',10420610,'03/02/2021',858.00,'',0.00,'2021-02-03','1900-01-01',800.00,50.00),('0NL1',10425924,'08/10/2021',1387.00,'',0.00,'2021-10-08','1900-01-01',1300.00,75.00),('0NIA',10428480,'06/04/2021',558.00,'',0.00,'2021-04-06','1900-01-01',500.00,50.00),('0NYC',10430080,'12/12/2021',787.00,'',0.00,'2021-12-12','1900-01-01',700.00,75.00),('0NYC',10430080,'16/07/2021',887.00,'',0.00,'2021-07-16','1900-01-01',800.00,75.00),('0NYI',10438554,'10/04/2021',1258.00,'',0.00,'2021-04-10','1900-01-01',1200.00,50.00),('17UJ',10443836,'03/12/2021',6587.00,'',0.00,'2021-12-03','1900-01-01',6500.00,75.00),('17UJ',10443836,'06/11/2021',6087.00,'',0.00,'2021-11-06','1900-01-01',6000.00,75.00),('07XB',10448124,'29/04/2021',558.00,'',0.00,'2021-04-29','1900-01-01',500.00,50.00),('1697',10451417,'30/11/2021',1987.00,'',0.00,'2021-11-30','1900-01-01',1900.00,75.00),('1697',10451417,'01/09/2021',1787.00,'',0.00,'2021-09-01','1900-01-01',1700.00,75.00),('3610',10451896,'13/08/2021',1987.00,'',0.00,'2021-08-13','1900-01-01',1900.00,75.00),('3610',10451896,'17/01/2021',1558.00,'',0.00,'2021-01-17','1900-01-01',1500.00,50.00),('3776',10451946,'08/01/2021',1058.00,'',0.00,'2021-01-08','1900-01-01',1000.00,50.00),('1BVJ',10452548,'17/11/2021',2587.00,'',0.00,'2021-11-17','1900-01-01',2500.00,75.00),('0083',10452803,'17/11/2021',1087.00,'',0.00,'2021-11-17','1900-01-01',1000.00,75.00),('0O1N',10456705,'16/01/2021',2058.00,'',0.00,'2021-01-16','1900-01-01',2000.00,50.00),('100Y',10460210,'22/01/2021',2658.00,'',0.00,'2021-01-22','1900-01-01',2600.00,50.00),('0O0R',10465862,'18/10/2021',887.00,'',0.00,'2021-10-18','1900-01-01',800.00,75.00),('0TQK',10470839,'17/07/2021',1187.00,'',0.00,'2021-07-17','1900-01-01',1100.00,75.00),('7016',10483949,'29/07/2021',587.00,'',0.00,'2021-07-29','1900-01-01',500.00,75.00),('3776',10491579,'11/01/2021',658.00,'',0.00,'2021-01-11','1900-01-01',600.00,50.00),('2305',10492353,'20/11/2021',2487.00,'',0.00,'2021-11-20','1900-01-01',2400.00,75.00),('2305',10492353,'19/06/2021',3087.00,'',0.00,'2021-06-19','1900-01-01',3000.00,75.00),('9387',10492429,'29/08/2021',687.00,'',0.00,'2021-08-29','1900-01-01',600.00,75.00),('0O4U',10498632,'02/12/2021',2787.00,'',0.00,'2021-12-02','1900-01-01',2700.00,75.00),('0O4U',10498723,'29/06/2021',1087.00,'',0.00,'2021-06-29','1900-01-01',1000.00,75.00),('0O4U',10498863,'20/05/2021',958.00,'',0.00,'2021-05-20','1900-01-01',871.00,75.00),('11QA',10498889,'03/02/2021',1458.00,'',0.00,'2021-02-03','1900-01-01',1400.00,50.00),('0O4U',10498939,'02/12/2021',3087.00,'',0.00,'2021-12-02','1900-01-01',3000.00,75.00),('0O4U',10499028,'01/12/2021',2387.00,'',0.00,'2021-12-01','1900-01-01',2300.00,75.00),('0O4U',10499028,'21/01/2021',1958.00,'',0.00,'2021-01-21','1900-01-01',1900.00,50.00),('0O4U',10499077,'01/10/2021',1187.00,'',0.00,'2021-10-01','1900-01-01',1100.00,75.00),('0O4U',10499077,'13/08/2021',1187.00,'',0.00,'2021-08-13','1900-01-01',1100.00,75.00),('0O4U',10499234,'23/12/2021',1087.00,'',0.00,'2021-12-23','1900-01-01',1000.00,75.00),('0O4U',10499267,'16/12/2021',787.00,'',0.00,'2021-12-16','1900-01-01',700.00,75.00),('0O4U',10499267,'31/01/2021',1458.00,'',0.00,'2021-01-31','1900-01-01',1400.00,50.00),('0T2V',10499275,'11/05/2021',958.00,'',0.00,'2021-05-11','1900-01-01',900.00,50.00),('0O4U',10499341,'20/12/2021',1787.00,'',0.00,'2021-12-20','1900-01-01',1700.00,75.00),('0O4U',10499432,'16/01/2021',1458.00,'',0.00,'2021-01-16','1900-01-01',1400.00,50.00),('0O4U',10499564,'06/12/2021',2187.00,'',0.00,'2021-12-06','1900-01-01',2100.00,75.00),('0O4U',10499580,'31/01/2021',1358.00,'',0.00,'2021-01-31','1900-01-01',1300.00,50.00),('0O4U',10499606,'16/12/2021',2487.00,'',0.00,'2021-12-16','1900-01-01',2400.00,75.00),('0O4U',10499614,'16/01/2021',3658.00,'',0.00,'2021-01-16','1900-01-01',3600.00,50.00),('0O4U',10499655,'14/03/2021',2058.00,'',0.00,'2021-03-14','1900-01-01',2000.00,50.00),('0O4U',10499655,'06/02/2021',2058.00,'',0.00,'2021-02-06','1900-01-01',2000.00,50.00),('0O4U',10499804,'15/05/2021',1658.00,'',0.00,'2021-05-15','1900-01-01',1571.00,75.00),('0O4U',10500114,'07/01/2021',1258.00,'',0.00,'2021-01-07','1900-01-01',1200.00,50.00),('0O4U',10500221,'30/04/2021',2458.00,'',0.00,'2021-04-30','1900-01-01',2400.00,50.00),('0O4U',10500239,'18/10/2021',3387.00,'',0.00,'2021-10-18','1900-01-01',3300.00,75.00),('0O4U',10500650,'17/12/2021',2187.00,'',0.00,'2021-12-17','1900-01-01',2100.00,75.00),('0O4U',10500692,'16/01/2021',1258.00,'',0.00,'2021-01-16','1900-01-01',1200.00,50.00),('0O4U',10500700,'17/11/2021',2287.00,'',0.00,'2021-11-17','1900-01-01',2200.00,75.00),('0O4U',10500700,'19/02/2021',1358.00,'',0.00,'2021-02-19','1900-01-01',1300.00,50.00),('0O4U',10500759,'11/02/2021',1358.00,'',0.00,'2021-02-11','1900-01-01',1300.00,50.00),('0O4U',10500973,'03/12/2021',2787.00,'',0.00,'2021-12-03','1900-01-01',2700.00,75.00),('0O4U',10501013,'18/12/2021',5787.00,'',0.00,'2021-12-18','1900-01-01',5700.00,75.00),('0O4U',10501062,'30/04/2021',1558.00,'',0.00,'2021-04-30','1900-01-01',1500.00,50.00),('0O4U',10501211,'01/02/2021',2558.00,'',0.00,'2021-02-01','1900-01-01',2500.00,50.00),('0O4U',10501757,'12/12/2021',1387.00,'',0.00,'2021-12-12','1900-01-01',1300.00,75.00),('0O4U',10501856,'05/01/2021',1658.00,'',0.00,'2021-01-05','1900-01-01',1600.00,50.00),('0O4U',10501898,'09/01/2021',858.00,'',0.00,'2021-01-09','1900-01-01',800.00,50.00),('0O4U',10501906,'24/11/2021',587.00,'',0.00,'2021-11-24','1900-01-01',500.00,75.00),('0O4U',10501914,'04/01/2021',958.00,'',0.00,'2021-01-04','1900-01-01',900.00,50.00),('0O4U',10502011,'20/11/2021',2787.00,'',0.00,'2021-11-20','1900-01-01',2700.00,75.00),('0O4U',10502037,'20/01/2021',2558.00,'',0.00,'2021-01-20','1900-01-01',2500.00,50.00),('0O4U',10502037,'09/01/2021',2558.00,'',0.00,'2021-01-09','1900-01-01',2500.00,50.00),('0O4U',10502193,'23/06/2021',587.00,'',0.00,'2021-06-23','1900-01-01',500.00,75.00),('0O4U',10502219,'03/11/2021',5687.00,'',0.00,'2021-11-03','1900-01-01',5600.00,75.00),('0O4U',10502243,'26/11/2021',2687.00,'',0.00,'2021-11-26','1900-01-01',2600.00,75.00),('0O4U',10502508,'19/11/2021',2087.00,'',0.00,'2021-11-19','1900-01-01',2000.00,75.00),('0O4U',10502565,'29/01/2021',3358.00,'',0.00,'2021-01-29','1900-01-01',3300.00,50.00),('0O4U',10502631,'17/12/2021',3687.00,'',0.00,'2021-12-17','1900-01-01',3600.00,75.00),('0O4U',10502631,'15/01/2021',2758.00,'',0.00,'2021-01-15','1900-01-01',2700.00,50.00),('0O4U',10502664,'01/11/2021',887.00,'',0.00,'2021-11-01','1900-01-01',800.00,75.00),('0O4U',10502706,'15/07/2021',1587.00,'',0.00,'2021-07-15','1900-01-01',1500.00,75.00),('0O4U',10502714,'28/08/2021',1087.00,'',0.00,'2021-08-28','1900-01-01',1000.00,75.00),('0O4U',10502797,'14/01/2021',1258.00,'',0.00,'2021-01-14','1900-01-01',1200.00,50.00),('0O4U',10502839,'12/01/2021',558.00,'',0.00,'2021-01-12','1900-01-01',500.00,50.00),('0O4U',10502862,'20/07/2021',1687.00,'',0.00,'2021-07-20','1900-01-01',1600.00,75.00),('0O4U',10502953,'20/01/2021',1058.00,'',0.00,'2021-01-20','1900-01-01',1000.00,50.00),('0O4U',10502979,'16/03/2021',558.00,'',0.00,'2021-03-16','1900-01-01',500.00,50.00),('0O4U',10503308,'01/01/2021',3258.00,'',0.00,'2021-01-01','1900-01-01',3200.00,50.00),('0O4U',10503324,'02/12/2021',4387.00,'',0.00,'2021-12-02','1900-01-01',4300.00,75.00),('0O4U',10503381,'16/06/2021',1087.00,'',0.00,'2021-06-16','1900-01-01',1000.00,75.00),('0O4U',10503381,'21/01/2021',1058.00,'',0.00,'2021-01-21','1900-01-01',1000.00,50.00),('0O4U',10503423,'02/10/2021',1887.00,'',0.00,'2021-10-02','1900-01-01',1800.00,75.00),('0O4U',10503431,'23/12/2021',937.00,'',0.00,'2021-12-23','1900-01-01',850.00,75.00),('0O4U',10503431,'15/12/2021',887.00,'',0.00,'2021-12-15','1900-01-01',800.00,75.00),('0O4U',10503431,'30/07/2021',687.00,'',0.00,'2021-07-30','1900-01-01',600.00,75.00),('0O4U',10503530,'03/01/2021',2158.00,'',0.00,'2021-01-03','1900-01-01',2100.00,50.00),('0O4U',10503597,'02/12/2021',1487.00,'',0.00,'2021-12-02','1900-01-01',1400.00,75.00),('0O4U',10503696,'16/01/2021',1758.00,'',0.00,'2021-01-16','1900-01-01',1700.00,50.00),('0O4U',10503878,'02/12/2021',3287.00,'',0.00,'2021-12-02','1900-01-01',3200.00,75.00),('0O4U',10503910,'17/12/2021',2187.00,'',0.00,'2021-12-17','1900-01-01',2100.00,75.00),('0O4U',10503928,'26/01/2021',558.00,'',0.00,'2021-01-26','1900-01-01',500.00,50.00),('0O4U',10503993,'01/01/2021',1058.00,'',0.00,'2021-01-01','1900-01-01',1000.00,50.00),('0O4U',10504041,'10/03/2021',558.00,'',0.00,'2021-03-10','1900-01-01',500.00,50.00),('0O4U',10504041,'08/02/2021',558.00,'',0.00,'2021-02-08','1900-01-01',500.00,50.00),('0O4U',10504041,'23/01/2021',658.00,'',0.00,'2021-01-23','1900-01-01',600.00,50.00),('0O4U',10504058,'03/12/2021',887.00,'',0.00,'2021-12-03','1900-01-01',800.00,75.00),('8683',10505246,'18/08/2021',687.00,'',0.00,'2021-08-18','1900-01-01',600.00,75.00),('0125',10506921,'05/06/2021',1087.00,'',0.00,'2021-06-05','1900-01-01',1000.00,75.00),('9109',10510535,'05/12/2021',687.00,'',0.00,'2021-12-05','1900-01-01',600.00,75.00),('1609',10513422,'20/02/2021',658.00,'',0.00,'2021-02-20','1900-01-01',600.00,50.00),('159U',10522738,'11/01/2021',558.00,'',0.00,'2021-01-11','1900-01-01',500.00,50.00),('159U',10522738,'05/01/2021',558.00,'',0.00,'2021-01-05','1900-01-01',500.00,50.00),('0O5J',10523017,'01/12/2021',587.00,'',0.00,'2021-12-01','1900-01-01',500.00,75.00),('0O5J',10523157,'11/05/2021',958.00,'',0.00,'2021-05-11','1900-01-01',900.00,50.00),('0O5J',10524346,'28/01/2021',858.00,'',0.00,'2021-01-28','1900-01-01',800.00,50.00),('0O1S',10531796,'20/12/2021',1087.00,'',0.00,'2021-12-20','1900-01-01',1000.00,75.00),('0O1S',10531861,'13/09/2021',3087.00,'',0.00,'2021-09-13','1900-01-01',3000.00,75.00),('0O4N',10532216,'18/12/2021',687.00,'',0.00,'2021-12-18','1900-01-01',600.00,75.00),('0WVW',10538411,'23/06/2021',887.00,'',0.00,'2021-06-23','1900-01-01',800.00,75.00),('0470',10539047,'06/05/2021',558.00,'',0.00,'2021-05-06','1900-01-01',500.00,50.00),('0470',10539047,'01/03/2021',558.00,'',0.00,'2021-03-01','1900-01-01',500.00,50.00),('0O1S',10540987,'07/11/2021',2587.00,'',0.00,'2021-11-07','1900-01-01',2500.00,75.00),('0O1S',10541043,'19/01/2021',1658.00,'',0.00,'2021-01-19','1900-01-01',1600.00,50.00),('0O1S',10541076,'19/09/2021',6087.00,'',0.00,'2021-09-19','1900-01-01',6000.00,75.00),('0O1S',10541118,'05/12/2021',1087.00,'',0.00,'2021-12-05','1900-01-01',1000.00,75.00),('0O1S',10541118,'23/01/2021',558.00,'',0.00,'2021-01-23','1900-01-01',500.00,50.00),('0O1S',10541142,'04/12/2021',4087.00,'',0.00,'2021-12-04','1900-01-01',4000.00,75.00),('0O1S',10541142,'16/01/2021',4058.00,'',0.00,'2021-01-16','1900-01-01',4000.00,50.00),('0O1S',10541217,'02/10/2021',1587.00,'',0.00,'2021-10-02','1900-01-01',1500.00,75.00),('0O1S',10541233,'08/02/2021',1458.00,'',0.00,'2021-02-08','1900-01-01',1400.00,50.00),('0O1S',10541423,'28/12/2021',1587.00,'',0.00,'2021-12-28','1900-01-01',1500.00,75.00),('0O1S',10541514,'10/04/2021',3058.00,'',0.00,'2021-04-10','1900-01-01',3000.00,50.00),('0O1S',10541555,'05/11/2021',1087.00,'',0.00,'2021-11-05','1900-01-01',1000.00,75.00),('0O1S',10541613,'30/01/2021',2258.00,'',0.00,'2021-01-30','1900-01-01',2200.00,50.00),('0O1S',10541845,'21/12/2021',1587.00,'',0.00,'2021-12-21','1900-01-01',1500.00,75.00),('0005',10547982,'18/01/2021',4058.00,'',0.00,'2021-01-18','1900-01-01',4000.00,50.00),('0O1S',10573301,'01/08/2021',2087.00,'',0.00,'2021-08-01','1900-01-01',2000.00,75.00),('0O1S',10573442,'18/12/2021',3687.00,'',0.00,'2021-12-18','1900-01-01',3600.00,75.00),('0NRZ',10575132,'08/04/2021',558.00,'',0.00,'2021-04-08','1900-01-01',500.00,50.00),('2305',10575546,'14/09/2021',1287.00,'',0.00,'2021-09-14','1900-01-01',1200.00,75.00),('4760',10578268,'26/11/2021',587.00,'',0.00,'2021-11-26','1900-01-01',500.00,75.00),('149T',10578623,'14/09/2021',587.00,'',0.00,'2021-09-14','1900-01-01',500.00,75.00),('0289',10582203,'22/03/2021',558.00,'',0.00,'2021-03-22','1900-01-01',500.00,50.00),('0O9I',10583615,'16/11/2021',1087.00,'',0.00,'2021-11-16','1900-01-01',1000.00,75.00),('07YZ',10589497,'16/01/2021',3358.00,'',0.00,'2021-01-16','1900-01-01',3300.00,50.00),('1IYE',10590586,'15/12/2021',787.00,'',0.00,'2021-12-15','1900-01-01',700.00,75.00),('0815',10596906,'20/11/2021',587.00,'',0.00,'2021-11-20','1900-01-01',500.00,75.00),('0815',10596906,'25/06/2021',1087.00,'',0.00,'2021-06-25','1900-01-01',1000.00,75.00),('0NO4',10599348,'03/04/2021',1558.00,'',0.00,'2021-04-03','1900-01-01',1500.00,50.00),('0O4U',10599702,'02/09/2021',2087.00,'',0.00,'2021-09-02','1900-01-01',2000.00,75.00),('0O4U',10599777,'03/02/2021',2358.00,'',0.00,'2021-02-03','1900-01-01',2300.00,50.00),('0O4U',10599835,'20/09/2021',587.00,'',0.00,'2021-09-20','1900-01-01',500.00,75.00),('0O4U',10599868,'30/01/2021',1858.00,'',0.00,'2021-01-30','1900-01-01',1800.00,50.00),('0O4U',10600187,'03/01/2021',2158.00,'',0.00,'2021-01-03','1900-01-01',2100.00,50.00),('0O4U',10600294,'23/09/2021',4387.00,'',0.00,'2021-09-23','1900-01-01',4300.00,75.00),('0NSX',10607976,'02/09/2021',6087.00,'',0.00,'2021-09-02','1900-01-01',6000.00,75.00),('0O4U',10610400,'02/12/2021',1587.00,'',0.00,'2021-12-02','1900-01-01',1500.00,75.00),('0O4U',10610533,'13/12/2021',1487.00,'',0.00,'2021-12-13','1900-01-01',1400.00,75.00),('0O4U',10610590,'18/12/2021',1987.00,'',0.00,'2021-12-18','1900-01-01',1900.00,75.00),('0O4U',10610590,'11/03/2021',858.00,'',0.00,'2021-03-11','1900-01-01',800.00,50.00),('0O4U',10610624,'26/11/2021',987.00,'',0.00,'2021-11-26','1900-01-01',900.00,75.00),('0O4U',10610657,'19/06/2021',587.00,'',0.00,'2021-06-19','1900-01-01',500.00,75.00),('0O4U',10610715,'26/11/2021',987.00,'',0.00,'2021-11-26','1900-01-01',900.00,75.00),('0O4U',10610723,'21/12/2021',1437.00,'',0.00,'2021-12-21','1900-01-01',1350.00,75.00),('0O4U',10610830,'25/03/2021',758.00,'',0.00,'2021-03-25','1900-01-01',700.00,50.00),('0OCR',10614022,'06/04/2021',558.00,'',0.00,'2021-04-06','1900-01-01',500.00,50.00),('175Z',10615128,'16/11/2021',3587.00,'',0.00,'2021-11-16','1900-01-01',3500.00,75.00),('175Z',10615128,'15/01/2021',3158.00,'',0.00,'2021-01-15','1900-01-01',3100.00,50.00),('0O6O',10625713,'21/02/2021',1158.00,'',0.00,'2021-02-21','1900-01-01',1100.00,50.00),('1271',10626703,'10/09/2021',787.00,'',0.00,'2021-09-10','1900-01-01',700.00,75.00),('07YZ',10628709,'06/08/2021',987.00,'',0.00,'2021-08-06','1900-01-01',900.00,75.00),('1I2Q',10628741,'31/10/2021',987.00,'',0.00,'2021-10-31','1900-01-01',900.00,75.00),('0O1S',10633634,'10/02/2021',958.00,'',0.00,'2021-02-10','1900-01-01',900.00,50.00),('0O1S',10633683,'04/12/2021',1087.00,'',0.00,'2021-12-04','1900-01-01',1000.00,75.00),('0O4U',10633709,'19/06/2021',1587.00,'',0.00,'2021-06-19','1900-01-01',1500.00,75.00),('0O1S',10633717,'07/09/2021',887.00,'',0.00,'2021-09-07','1900-01-01',800.00,75.00),('0NQP',10643013,'04/11/2021',587.00,'',0.00,'2021-11-04','1900-01-01',500.00,75.00),('8140',10646545,'13/03/2021',2558.00,'',0.00,'2021-03-13','1900-01-01',2500.00,50.00),('1019',10653020,'08/04/2021',558.00,'',0.00,'2021-04-08','1900-01-01',500.00,50.00),('1019',10653020,'06/04/2021',558.00,'',0.00,'2021-04-06','1900-01-01',500.00,50.00),('5597',10669711,'11/11/2021',1087.00,'',0.00,'2021-11-11','1900-01-01',1000.00,75.00),('5588',10677912,'16/01/2021',1658.00,'',0.00,'2021-01-16','1900-01-01',1600.00,50.00),('5588',10677912,'09/01/2021',1458.00,'',0.00,'2021-01-09','1900-01-01',1400.00,50.00),('0TKR',10682599,'21/12/2021',1987.00,'',0.00,'2021-12-21','1900-01-01',1900.00,75.00),('0TKR',10682599,'13/01/2021',558.00,'',0.00,'2021-01-13','1900-01-01',500.00,50.00),('0ODQ',10685428,'31/10/2021',1187.00,'',0.00,'2021-10-31','1900-01-01',1100.00,75.00),('0053',10693604,'04/05/2021',1058.00,'',0.00,'2021-05-04','1900-01-01',1000.00,50.00),('0N92',10696508,'22/05/2021',4087.00,'',0.00,'2021-05-22','1900-01-01',4000.00,75.00),('0NFM',10698108,'23/12/2021',2087.00,'',0.00,'2021-12-23','1900-01-01',2000.00,75.00),('2034',10701563,'20/09/2021',1287.00,'',0.00,'2021-09-20','1900-01-01',1200.00,75.00),('9435',10708527,'18/02/2021',2258.00,'',0.00,'2021-02-18','1900-01-01',2200.00,50.00),('5383',10710523,'09/10/2021',587.00,'',0.00,'2021-10-09','1900-01-01',500.00,75.00),('0PFT',10725604,'14/09/2021',787.00,'',0.00,'2021-09-14','1900-01-01',700.00,75.00),('0Z8X',10726883,'01/10/2021',1187.00,'',0.00,'2021-10-01','1900-01-01',1100.00,75.00),('8140',10740165,'16/01/2021',1458.00,'',0.00,'2021-01-16','1900-01-01',1400.00,50.00),('6410',10748655,'09/01/2021',558.00,'',0.00,'2021-01-09','1900-01-01',500.00,50.00),('0289',10753895,'13/12/2021',2687.00,'',0.00,'2021-12-13','1900-01-01',2600.00,75.00),('0UHJ',10755130,'19/06/2021',1687.00,'',0.00,'2021-06-19','1900-01-01',1600.00,75.00),('0T2M',10779338,'13/08/2021',687.00,'22/09/2021',172.44,'2021-08-13','2021-09-22',600.00,75.00),('10GP',10780955,'17/12/2021',2287.00,'',0.00,'2021-12-17','1900-01-01',2200.00,75.00),('10GP',10780955,'18/01/2021',1958.00,'',0.00,'2021-01-18','1900-01-01',1900.00,50.00),('0YOV',10790178,'24/08/2021',1687.00,'',0.00,'2021-08-24','1900-01-01',1600.00,75.00),('0NO4',10795896,'22/01/2021',1458.00,'',0.00,'2021-01-22','1900-01-01',1400.00,50.00),('0OC7',10818169,'04/09/2021',587.00,'',0.00,'2021-09-04','1900-01-01',500.00,75.00),('8140',10823805,'02/12/2021',5187.00,'',0.00,'2021-12-02','1900-01-01',5100.00,75.00),('0N9U',10830529,'12/12/2021',587.00,'',0.00,'2021-12-12','1900-01-01',500.00,75.00),('0N9U',10830529,'21/11/2021',587.00,'',0.00,'2021-11-21','1900-01-01',500.00,75.00),('0P4F',10831402,'05/12/2021',1587.00,'',0.00,'2021-12-05','1900-01-01',1500.00,75.00),('12LF',10832418,'09/02/2021',558.00,'',0.00,'2021-02-09','1900-01-01',500.00,50.00),('12LF',10832418,'13/01/2021',1558.00,'',0.00,'2021-01-13','1900-01-01',1500.00,50.00),('0ZX2',10832541,'29/12/2021',2487.00,'',0.00,'2021-12-29','1900-01-01',2400.00,75.00),('0OLO',10833143,'28/12/2021',1587.00,'',0.00,'2021-12-28','1900-01-01',1500.00,75.00),('2166',10839967,'09/01/2021',958.00,'',0.00,'2021-01-09','1900-01-01',900.00,50.00),('2055',10843175,'04/05/2021',758.00,'',0.00,'2021-05-04','1900-01-01',700.00,50.00),('2055',10843183,'05/12/2021',2587.00,'',0.00,'2021-12-05','1900-01-01',2500.00,75.00),('0UA2',10846400,'27/11/2021',587.00,'',0.00,'2021-11-27','1900-01-01',500.00,75.00),('0289',10852655,'29/10/2021',1387.00,'',0.00,'2021-10-29','1900-01-01',1300.00,75.00),('0ORW',10854297,'23/08/2021',587.00,'',0.00,'2021-08-23','1900-01-01',500.00,75.00),('2859',10870244,'29/06/2021',2387.00,'',0.00,'2021-06-29','1900-01-01',2300.00,75.00),('2139',10877454,'21/06/2021',1787.00,'',0.00,'2021-06-21','1900-01-01',1700.00,75.00),('0O5J',10888931,'24/06/2021',1287.00,'',0.00,'2021-06-24','1900-01-01',1200.00,75.00),('0O5J',10889038,'08/12/2021',987.00,'',0.00,'2021-12-08','1900-01-01',900.00,75.00),('0O5J',10889442,'24/11/2021',1587.00,'',0.00,'2021-11-24','1900-01-01',1500.00,75.00),('0O5J',10889574,'23/12/2021',887.00,'',0.00,'2021-12-23','1900-01-01',800.00,75.00),('0O5J',10889574,'09/08/2021',987.00,'',0.00,'2021-08-09','1900-01-01',900.00,75.00),('0O5J',10889962,'11/02/2021',1358.00,'',0.00,'2021-02-11','1900-01-01',1300.00,50.00),('0O5J',10889996,'27/11/2021',687.00,'',0.00,'2021-11-27','1900-01-01',600.00,75.00),('0O5J',10890051,'29/11/2021',1087.00,'',0.00,'2021-11-29','1900-01-01',1000.00,75.00),('1019',10891976,'04/12/2021',887.00,'',0.00,'2021-12-04','1900-01-01',800.00,75.00),('0OV1',10900116,'03/12/2021',587.00,'',0.00,'2021-12-03','1900-01-01',500.00,75.00),('0WVW',10900546,'26/04/2021',4058.00,'',0.00,'2021-04-26','1900-01-01',4000.00,50.00),('0OFY',10903995,'15/01/2021',1958.00,'',0.00,'2021-01-15','1900-01-01',1900.00,50.00),('0OFY',10904050,'01/03/2021',1458.00,'',0.00,'2021-03-01','1900-01-01',1400.00,50.00),('0OFY',10904084,'21/01/2021',2058.00,'',0.00,'2021-01-21','1900-01-01',2000.00,50.00),('0OFY',10904167,'23/09/2021',1987.00,'',0.00,'2021-09-23','1900-01-01',1900.00,75.00),('0OFY',10904191,'19/10/2021',1387.00,'',0.00,'2021-10-19','1900-01-01',1300.00,75.00),('0OFY',10904274,'02/12/2021',1087.00,'',0.00,'2021-12-02','1900-01-01',1000.00,75.00),('0OFY',10904308,'16/01/2021',2058.00,'',0.00,'2021-01-16','1900-01-01',2000.00,50.00),('0OFY',10904399,'17/11/2021',1987.00,'',0.00,'2021-11-17','1900-01-01',1900.00,75.00),('0OFY',10904720,'09/03/2021',1058.00,'',0.00,'2021-03-09','1900-01-01',1000.00,50.00),('0OFY',10904746,'16/05/2021',1358.00,'',0.00,'2021-05-16','1900-01-01',1271.00,75.00),('0OFY',10904753,'17/12/2021',2087.00,'',0.00,'2021-12-17','1900-01-01',2000.00,75.00),('0OFY',10904779,'17/12/2021',1087.00,'',0.00,'2021-12-17','1900-01-01',1000.00,75.00),('8140',10913705,'02/12/2021',2187.00,'',0.00,'2021-12-02','1900-01-01',2100.00,75.00),('8140',10913705,'15/01/2021',1458.00,'',0.00,'2021-01-15','1900-01-01',1400.00,50.00),('2150',10931293,'18/05/2021',2158.00,'',0.00,'2021-05-18','1900-01-01',2071.00,75.00),('9668',10933083,'02/01/2021',2258.00,'',0.00,'2021-01-02','1900-01-01',2200.00,50.00),('0OFY',10933612,'02/11/2021',1987.00,'',0.00,'2021-11-02','1900-01-01',1900.00,75.00),('0OS1',10939676,'31/01/2021',558.00,'',0.00,'2021-01-31','1900-01-01',500.00,50.00),('0OZ4',10941102,'22/03/2021',1058.00,'',0.00,'2021-03-22','1900-01-01',1000.00,50.00),('0OZ4',10941110,'23/11/2021',887.00,'',0.00,'2021-11-23','1900-01-01',800.00,75.00),('0OZ4',10941110,'23/10/2021',587.00,'',0.00,'2021-10-23','1900-01-01',500.00,75.00),('0OZ4',10941219,'29/12/2021',1287.00,'',0.00,'2021-12-29','1900-01-01',1200.00,75.00),('0OZ4',10941219,'05/12/2021',1187.00,'',0.00,'2021-12-05','1900-01-01',1100.00,75.00),('0OZ4',10941284,'17/10/2021',2187.00,'',0.00,'2021-10-17','1900-01-01',2100.00,75.00),('0OZ4',10941375,'30/12/2021',1587.00,'',0.00,'2021-12-30','1900-01-01',1500.00,75.00),('1H00',10947448,'13/12/2021',887.00,'',0.00,'2021-12-13','1900-01-01',800.00,75.00),('16KC',10947778,'02/12/2021',1587.00,'',0.00,'2021-12-02','1900-01-01',1500.00,75.00),('16KC',10947778,'19/08/2021',2187.00,'',0.00,'2021-08-19','1900-01-01',2100.00,75.00),('0005',10949972,'18/01/2021',1758.00,'',0.00,'2021-01-18','1900-01-01',1700.00,50.00),('0289',10954287,'29/12/2021',1987.00,'',0.00,'2021-12-29','1900-01-01',1900.00,75.00),('6991',10957546,'28/11/2021',787.00,'',0.00,'2021-11-28','1900-01-01',700.00,75.00),('0155',10988988,'04/10/2021',1587.00,'',0.00,'2021-10-04','1900-01-01',1500.00,75.00),('2305',11003464,'28/01/2021',1458.00,'',0.00,'2021-01-28','1900-01-01',1400.00,50.00),('0ZU4',11004876,'19/03/2021',758.00,'',0.00,'2021-03-19','1900-01-01',700.00,50.00),('1H3X',11005493,'18/12/2021',1987.00,'',0.00,'2021-12-18','1900-01-01',1900.00,75.00),('0NO4',11010220,'20/03/2021',1358.00,'',0.00,'2021-03-20','1900-01-01',1300.00,50.00),('0P46',11011749,'04/01/2021',558.00,'',0.00,'2021-01-04','1900-01-01',500.00,50.00),('0UHJ',11019098,'13/11/2021',3587.00,'',0.00,'2021-11-13','1900-01-01',3500.00,75.00),('8140',11025061,'30/01/2021',3058.00,'',0.00,'2021-01-30','1900-01-01',3000.00,50.00),('8140',11025541,'15/01/2021',1358.00,'',0.00,'2021-01-15','1900-01-01',1300.00,50.00),('8140',11025566,'01/05/2021',1458.00,'',0.00,'2021-05-01','1900-01-01',1400.00,50.00),('1FHQ',11028313,'11/06/2021',4087.00,'',0.00,'2021-06-11','1900-01-01',4000.00,75.00),('3242',11031960,'29/12/2021',587.00,'',0.00,'2021-12-29','1900-01-01',500.00,75.00),('1IM8',11035094,'07/11/2021',1087.00,'',0.00,'2021-11-07','1900-01-01',1000.00,75.00),('1IM8',11035607,'06/12/2021',1087.00,'',0.00,'2021-12-06','1900-01-01',1000.00,75.00),('1IM9',11036209,'18/09/2021',987.00,'',0.00,'2021-09-18','1900-01-01',900.00,75.00),('1AFR',11039641,'16/12/2021',1887.00,'',0.00,'2021-12-16','1900-01-01',1800.00,75.00),('5979',11043924,'25/04/2021',858.00,'',0.00,'2021-04-25','1900-01-01',800.00,50.00),('6793',11051224,'26/09/2021',1487.00,'',0.00,'2021-09-26','1900-01-01',1400.00,75.00),('0P3T',11051380,'18/02/2021',4058.00,'',0.00,'2021-02-18','1900-01-01',4000.00,50.00),('0O4U',11074457,'29/06/2021',587.00,'',0.00,'2021-06-29','1900-01-01',500.00,75.00),('0P7J',11078243,'03/08/2021',587.00,'',0.00,'2021-08-03','1900-01-01',500.00,75.00),('11A9',11079084,'21/06/2021',1287.00,'',0.00,'2021-06-21','1900-01-01',1200.00,75.00),('0WPT',11083060,'11/12/2021',1387.00,'',0.00,'2021-12-11','1900-01-01',1300.00,75.00),('0RSF',11083060,'09/02/2021',658.00,'',0.00,'2021-02-09','1900-01-01',600.00,50.00),('8131',11088382,'19/04/2021',558.00,'',0.00,'2021-04-19','1900-01-01',500.00,50.00),('6410',11088432,'09/01/2021',558.00,'',0.00,'2021-01-09','1900-01-01',500.00,50.00),('9218',11096351,'07/12/2021',2787.00,'',0.00,'2021-12-07','1900-01-01',2700.00,75.00),('2340',11106119,'31/10/2021',2087.00,'',0.00,'2021-10-31','1900-01-01',2000.00,75.00),('0961',11114006,'03/02/2021',3058.00,'',0.00,'2021-02-03','1900-01-01',3000.00,50.00),('7248',11114741,'02/12/2021',4187.00,'',0.00,'2021-12-02','1900-01-01',4100.00,75.00),('18RP',11122124,'20/12/2021',1287.00,'',0.00,'2021-12-20','1900-01-01',1200.00,75.00),('18RP',11122124,'09/05/2021',1358.00,'',0.00,'2021-05-09','1900-01-01',1300.00,50.00),('0PA2',11122132,'30/08/2021',987.00,'',0.00,'2021-08-30','1900-01-01',900.00,75.00),('0PA2',11122249,'14/12/2021',587.00,'',0.00,'2021-12-14','1900-01-01',500.00,75.00),('5233',11123205,'07/05/2021',758.00,'',0.00,'2021-05-07','1900-01-01',700.00,50.00),('5233',11123205,'01/01/2021',758.00,'',0.00,'2021-01-01','1900-01-01',700.00,50.00),('17LK',11134285,'26/07/2021',1087.00,'',0.00,'2021-07-26','1900-01-01',1000.00,75.00),('3690',11144375,'22/08/2021',1087.00,'',0.00,'2021-08-22','1900-01-01',1000.00,75.00),('0Z67',11157070,'02/01/2021',3058.00,'',0.00,'2021-01-02','1900-01-01',3000.00,50.00),('3776',11163953,'07/01/2021',558.00,'',0.00,'2021-01-07','1900-01-01',500.00,50.00),('0PCZ',11168853,'25/11/2021',587.00,'',0.00,'2021-11-25','1900-01-01',500.00,75.00),('0PCZ',11168853,'07/08/2021',687.00,'',0.00,'2021-08-07','1900-01-01',600.00,75.00),('0430',11182482,'07/01/2021',1058.00,'',0.00,'2021-01-07','1900-01-01',1000.00,50.00),('1EUY',11197753,'23/11/2021',887.00,'',0.00,'2021-11-23','1900-01-01',800.00,75.00),('0PF4',11203288,'26/12/2021',1187.00,'',0.00,'2021-12-26','1900-01-01',1100.00,75.00),('0O4U',11210150,'15/01/2021',1758.00,'',0.00,'2021-01-15','1900-01-01',1700.00,50.00),('4594',11210937,'20/12/2021',1187.00,'',0.00,'2021-12-20','1900-01-01',1100.00,75.00),('0108',11211869,'10/10/2021',2587.00,'',0.00,'2021-10-10','1900-01-01',2500.00,75.00),('1GYK',11215944,'11/09/2021',887.00,'21/10/2021',794.73,'2021-09-11','2021-10-21',800.00,75.00),('0OBK',11216884,'18/12/2021',587.00,'',0.00,'2021-12-18','1900-01-01',500.00,75.00),('175Z',11217999,'15/01/2021',2458.00,'',0.00,'2021-01-15','1900-01-01',2400.00,50.00),('175Z',11218013,'14/05/2021',2558.00,'',0.00,'2021-05-14','1900-01-01',2500.00,50.00),('175Z',11218138,'17/11/2021',3287.00,'',0.00,'2021-11-17','1900-01-01',3200.00,75.00),('1609',11219235,'09/01/2021',758.00,'',0.00,'2021-01-09','1900-01-01',700.00,50.00),('1B7K',11220159,'27/09/2021',587.00,'',0.00,'2021-09-27','1900-01-01',500.00,75.00),('2163',11238375,'20/10/2021',587.00,'',0.00,'2021-10-20','1900-01-01',500.00,75.00),('0PCL',11246212,'13/09/2021',1187.00,'',0.00,'2021-09-13','1900-01-01',1100.00,75.00),('0PCL',11246212,'29/08/2021',1287.00,'',0.00,'2021-08-29','1900-01-01',1200.00,75.00),('0289',11252830,'27/07/2021',1087.00,'',0.00,'2021-07-27','1900-01-01',1000.00,75.00),('2305',11255163,'28/01/2021',4058.00,'',0.00,'2021-01-28','1900-01-01',4000.00,50.00),('0SDT',11255841,'27/01/2021',858.00,'',0.00,'2021-01-27','1900-01-01',800.00,50.00),('2305',11256310,'23/12/2021',1087.00,'',0.00,'2021-12-23','1900-01-01',1000.00,75.00),('2305',11256724,'01/02/2021',558.00,'',0.00,'2021-02-01','1900-01-01',500.00,50.00),('0419',11261476,'18/10/2021',587.00,'',0.00,'2021-10-18','1900-01-01',500.00,75.00),('8140',11264272,'18/01/2021',2958.00,'',0.00,'2021-01-18','1900-01-01',2900.00,50.00),('0PI4',11272234,'25/10/2021',1087.00,'',0.00,'2021-10-25','1900-01-01',1000.00,75.00),('0WVW',11274982,'17/06/2021',3087.00,'',0.00,'2021-06-17','1900-01-01',3000.00,75.00),('0PJR',11304342,'17/09/2021',587.00,'',0.00,'2021-09-17','1900-01-01',500.00,75.00),('0616',11308566,'05/11/2021',1087.00,'',0.00,'2021-11-05','1900-01-01',1000.00,75.00),('6617',11320009,'06/01/2021',1858.00,'',0.00,'2021-01-06','1900-01-01',1800.00,50.00),('0254',11321049,'26/12/2021',3087.00,'',0.00,'2021-12-26','1900-01-01',3000.00,75.00),('0254',11321049,'13/08/2021',2087.00,'',0.00,'2021-08-13','1900-01-01',2000.00,75.00),('14OH',11326360,'04/12/2021',1887.00,'',0.00,'2021-12-04','1900-01-01',1800.00,75.00),('14OH',11326360,'18/07/2021',587.00,'',0.00,'2021-07-18','1900-01-01',500.00,75.00),('7301',11329711,'31/01/2021',1458.00,'',0.00,'2021-01-31','1900-01-01',1400.00,50.00),('7301',11329711,'05/01/2021',1458.00,'',0.00,'2021-01-05','1900-01-01',1400.00,50.00),('1FHQ',11333853,'26/05/2021',587.00,'',0.00,'2021-05-26','1900-01-01',500.00,75.00),('1FHQ',11333861,'09/05/2021',658.00,'',0.00,'2021-05-09','1900-01-01',600.00,50.00),('8625',11340874,'13/11/2021',587.00,'',0.00,'2021-11-13','1900-01-01',500.00,75.00),('17DY',11341146,'10/04/2021',4058.00,'',0.00,'2021-04-10','1900-01-01',4000.00,50.00),('17DY',11341179,'27/03/2021',4058.00,'',0.00,'2021-03-27','1900-01-01',4000.00,50.00),('0Z6U',11350576,'24/12/2021',1987.00,'',0.00,'2021-12-24','1900-01-01',1900.00,75.00),('0Z6U',11350576,'18/12/2021',1187.00,'',0.00,'2021-12-18','1900-01-01',1100.00,75.00),('0Z6U',11350600,'02/12/2021',3087.00,'',0.00,'2021-12-02','1900-01-01',3000.00,75.00),('0Z6U',11350600,'31/03/2021',2058.00,'',0.00,'2021-03-31','1900-01-01',2000.00,50.00),('8140',11352317,'26/02/2021',1458.00,'',0.00,'2021-02-26','1900-01-01',1400.00,50.00),('8140',11353216,'15/11/2021',1087.00,'',0.00,'2021-11-15','1900-01-01',1000.00,75.00),('0O4U',11357399,'23/09/2021',787.00,'',0.00,'2021-09-23','1900-01-01',700.00,75.00),('0289',11358447,'02/02/2021',2558.00,'',0.00,'2021-02-02','1900-01-01',2500.00,50.00),('0PRO',11370517,'02/12/2021',1387.00,'',0.00,'2021-12-02','1900-01-01',1300.00,75.00),('0PMK',11375599,'13/12/2021',2487.00,'',0.00,'2021-12-13','1900-01-01',2400.00,75.00),('0pmo',11383619,'29/05/2021',1087.00,'',0.00,'2021-05-29','1900-01-01',1000.00,75.00),('0SDT',11391083,'27/01/2021',1258.00,'',0.00,'2021-01-27','1900-01-01',1200.00,50.00),('0289',11395449,'23/11/2021',587.00,'',0.00,'2021-11-23','1900-01-01',500.00,75.00),('0PNG',11397163,'25/03/2021',1458.00,'',0.00,'2021-03-25','1900-01-01',1400.00,50.00),('0PLW',11404506,'20/11/2021',587.00,'',0.00,'2021-11-20','1900-01-01',500.00,75.00),('0RGQ',11405099,'22/12/2021',687.00,'',0.00,'2021-12-22','1900-01-01',600.00,75.00),('0RGQ',11405099,'25/09/2021',587.00,'',0.00,'2021-09-25','1900-01-01',500.00,75.00),('5383',11413168,'26/07/2021',1587.00,'',0.00,'2021-07-26','1900-01-01',1500.00,75.00),('0289',11418720,'19/12/2021',2487.00,'',0.00,'2021-12-19','1900-01-01',2400.00,75.00),('0289',11419231,'27/07/2021',1087.00,'',0.00,'2021-07-27','1900-01-01',1000.00,75.00),('0289',11419363,'18/07/2021',987.00,'',0.00,'2021-07-18','1900-01-01',900.00,75.00),('0289',11419363,'28/03/2021',858.00,'',0.00,'2021-03-28','1900-01-01',800.00,50.00),('0PE5',11419819,'16/01/2021',2158.00,'',0.00,'2021-01-16','1900-01-01',2100.00,50.00),('0PIN',11420122,'04/08/2021',3087.00,'',0.00,'2021-08-04','1900-01-01',3000.00,75.00),('0PIF',11420478,'21/10/2021',1287.00,'',0.00,'2021-10-21','1900-01-01',1200.00,75.00),('3044',11421633,'14/01/2021',1458.00,'',0.00,'2021-01-14','1900-01-01',1400.00,50.00),('5460',11421864,'29/04/2021',3458.00,'',0.00,'2021-04-29','1900-01-01',3400.00,50.00),('6617',11422060,'15/01/2021',2158.00,'04/03/2021',2148.50,'2021-01-15','2021-03-04',2100.00,50.00),('6617',11422235,'19/01/2021',4058.00,'10/03/2021',4009.25,'2021-01-19','2021-03-10',4000.00,50.00),('0PIN',11427325,'07/02/2021',2058.00,'',0.00,'2021-02-07','1900-01-01',2000.00,50.00),('0289',11432911,'30/09/2021',1187.00,'',0.00,'2021-09-30','1900-01-01',1100.00,75.00),('0289',11433265,'19/12/2021',1287.00,'',0.00,'2021-12-19','1900-01-01',1200.00,75.00),('0289',11433273,'30/11/2021',1087.00,'',0.00,'2021-11-30','1900-01-01',1000.00,75.00),('0108',11433455,'14/01/2021',3158.00,'',0.00,'2021-01-14','1900-01-01',3100.00,50.00),('0289',11433596,'12/12/2021',1387.00,'',0.00,'2021-12-12','1900-01-01',1300.00,75.00),('0289',11433778,'02/02/2021',2658.00,'',0.00,'2021-02-02','1900-01-01',2600.00,50.00),('0289',11433851,'29/01/2021',1058.00,'',0.00,'2021-01-29','1900-01-01',1000.00,50.00),('0289',11434008,'18/11/2021',787.00,'',0.00,'2021-11-18','1900-01-01',700.00,75.00),('0289',11434065,'12/12/2021',2087.00,'',0.00,'2021-12-12','1900-01-01',2000.00,75.00),('0SHH',11438710,'03/03/2021',2058.00,'',0.00,'2021-03-03','1900-01-01',2000.00,50.00),('0289',11441631,'04/12/2021',1887.00,'',0.00,'2021-12-04','1900-01-01',1800.00,75.00),('0YAT',11442282,'24/09/2021',787.00,'',0.00,'2021-09-24','1900-01-01',700.00,75.00),('0289',11442415,'25/03/2021',1258.00,'',0.00,'2021-03-25','1900-01-01',1200.00,50.00),('0VFT',11443603,'14/12/2021',5087.00,'',0.00,'2021-12-14','1900-01-01',5000.00,75.00),('3466',11446416,'05/07/2021',987.00,'',0.00,'2021-07-05','1900-01-01',900.00,75.00),('0P7P',11453602,'22/12/2021',3087.00,'',0.00,'2021-12-22','1900-01-01',3000.00,75.00),('0P7P',11453602,'24/01/2021',1258.00,'',0.00,'2021-01-24','1900-01-01',1200.00,50.00),('0P7P',11453610,'04/11/2021',1587.00,'',0.00,'2021-11-04','1900-01-01',1500.00,75.00),('2150',11458403,'16/11/2021',4287.00,'',0.00,'2021-11-16','1900-01-01',4200.00,75.00),('0PCL',11470242,'02/01/2021',2058.00,'19/02/2021',2017.50,'2021-01-02','2021-02-19',2000.00,50.00),('0289',11485836,'22/06/2021',587.00,'',0.00,'2021-06-22','1900-01-01',500.00,75.00),('0289',11485869,'18/11/2021',2487.00,'',0.00,'2021-11-18','1900-01-01',2400.00,75.00),('0289',11486487,'20/12/2021',2387.00,'',0.00,'2021-12-20','1900-01-01',2300.00,75.00),('0289',11486487,'16/02/2021',1658.00,'',0.00,'2021-02-16','1900-01-01',1600.00,50.00),('0289',11487022,'19/05/2021',558.00,'',0.00,'2021-05-19','1900-01-01',471.00,75.00),('0289',11487212,'21/12/2021',2087.00,'',0.00,'2021-12-21','1900-01-01',2000.00,75.00),('0289',11487212,'06/12/2021',2887.00,'',0.00,'2021-12-06','1900-01-01',2800.00,75.00),('0289',11487212,'01/09/2021',1887.00,'',0.00,'2021-09-01','1900-01-01',1800.00,75.00),('0WI4',11488087,'17/12/2021',1587.00,'',0.00,'2021-12-17','1900-01-01',1500.00,75.00),('6617',11491461,'15/01/2021',2058.00,'04/03/2021',37.25,'2021-01-15','2021-03-04',2000.00,50.00),('6617',11491560,'02/02/2021',3958.00,'',0.00,'2021-02-02','1900-01-01',3900.00,50.00),('14I6',11510062,'01/06/2021',587.00,'',0.00,'2021-06-01','1900-01-01',500.00,75.00),('0O4U',11525946,'01/02/2021',1958.00,'',0.00,'2021-02-01','1900-01-01',1900.00,50.00),('0WVW',11535663,'14/05/2021',1258.00,'',0.00,'2021-05-14','1900-01-01',1200.00,50.00),('5383',11538337,'02/09/2021',587.00,'',0.00,'2021-09-02','1900-01-01',500.00,75.00),('8140',11539400,'09/11/2021',4087.00,'',0.00,'2021-11-09','1900-01-01',4000.00,75.00),('8140',11539459,'17/12/2021',4487.00,'',0.00,'2021-12-17','1900-01-01',4400.00,75.00),('0PMV',11544061,'09/10/2021',687.00,'',0.00,'2021-10-09','1900-01-01',600.00,75.00),('0PMV',11544061,'20/02/2021',558.00,'',0.00,'2021-02-20','1900-01-01',500.00,50.00),('0YUG',11556016,'01/01/2021',2558.00,'',0.00,'2021-01-01','1900-01-01',2500.00,50.00),('0QCX',11559861,'19/11/2021',587.00,'',0.00,'2021-11-19','1900-01-01',500.00,75.00),('0QCX',11560877,'17/09/2021',3087.00,'',0.00,'2021-09-17','1900-01-01',3000.00,75.00),('0QCX',11561610,'17/12/2021',587.00,'',0.00,'2021-12-17','1900-01-01',500.00,75.00),('0QCX',11563798,'01/12/2021',1387.00,'',0.00,'2021-12-01','1900-01-01',1300.00,75.00),('0QCX',11563798,'19/09/2021',1387.00,'',0.00,'2021-09-19','1900-01-01',1300.00,75.00),('3614',11566833,'19/05/2021',658.00,'',0.00,'2021-05-19','1900-01-01',571.00,75.00),('175Z',11579182,'22/12/2021',5087.00,'',0.00,'2021-12-22','1900-01-01',5000.00,75.00),('0Q3K',11591039,'16/06/2021',2087.00,'',0.00,'2021-06-16','1900-01-01',2000.00,75.00),('0Q3K',11591039,'08/06/2021',1787.00,'',0.00,'2021-06-08','1900-01-01',1700.00,75.00),('7126',11591880,'04/05/2021',558.00,'',0.00,'2021-05-04','1900-01-01',500.00,50.00),('11VL',11593555,'16/11/2021',887.00,'',0.00,'2021-11-16','1900-01-01',800.00,75.00),('0P6X',11602695,'13/01/2021',658.00,'',0.00,'2021-01-13','1900-01-01',600.00,50.00),('2306',11613064,'23/11/2021',2287.00,'',0.00,'2021-11-23','1900-01-01',2200.00,75.00),('0PW6',11630134,'11/10/2021',3587.00,'',0.00,'2021-10-11','1900-01-01',3500.00,75.00),('1019',11630613,'15/03/2021',2058.00,'',0.00,'2021-03-15','1900-01-01',2000.00,50.00),('1019',11630621,'06/02/2021',958.00,'',0.00,'2021-02-06','1900-01-01',900.00,50.00),('1019',11630761,'11/09/2021',1387.00,'',0.00,'2021-09-11','1900-01-01',1300.00,75.00),('0108',11634052,'07/07/2021',587.00,'',0.00,'2021-07-07','1900-01-01',500.00,75.00),('0PYF',11639200,'19/12/2021',1587.00,'',0.00,'2021-12-19','1900-01-01',1500.00,75.00),('0Z67',11640141,'15/02/2021',4058.00,'',0.00,'2021-02-15','1900-01-01',4000.00,50.00),('8140',11640323,'02/11/2021',1287.00,'',0.00,'2021-11-02','1900-01-01',1200.00,75.00),('8140',11640562,'18/11/2021',3487.00,'',0.00,'2021-11-18','1900-01-01',3400.00,75.00),('8140',11640661,'02/12/2021',2987.00,'',0.00,'2021-12-02','1900-01-01',2900.00,75.00),('8140',11640661,'06/02/2021',2458.00,'',0.00,'2021-02-06','1900-01-01',2400.00,50.00),('5383',11648433,'06/12/2021',1087.00,'',0.00,'2021-12-06','1900-01-01',1000.00,75.00),('0108',11653292,'02/11/2021',1587.00,'',0.00,'2021-11-02','1900-01-01',1500.00,75.00),('0QCX',11655461,'05/03/2021',1058.00,'',0.00,'2021-03-05','1900-01-01',1000.00,50.00),('5974',11660214,'03/12/2021',587.00,'',0.00,'2021-12-03','1900-01-01',500.00,75.00),('7533',11667631,'30/12/2021',587.00,'',0.00,'2021-12-30','1900-01-01',500.00,75.00),('0POQ',11682663,'27/01/2021',568.00,'',0.00,'2021-01-27','1900-01-01',510.00,50.00),('0POQ',11684651,'14/01/2021',1658.00,'',0.00,'2021-01-14','1900-01-01',1600.00,50.00),('15KL',11687217,'11/02/2021',2958.00,'',0.00,'2021-02-11','1900-01-01',2900.00,50.00),('0108',11688439,'25/07/2021',1087.00,'',0.00,'2021-07-25','1900-01-01',1000.00,75.00),('3972',11696077,'28/08/2021',587.00,'',0.00,'2021-08-28','1900-01-01',500.00,75.00),('3972',11696077,'22/07/2021',787.00,'',0.00,'2021-07-22','1900-01-01',700.00,75.00),('1BDE',11699907,'14/06/2021',4387.00,'',0.00,'2021-06-14','1900-01-01',4300.00,75.00),('1BDE',11700234,'02/12/2021',2087.00,'',0.00,'2021-12-02','1900-01-01',2000.00,75.00),('1BDE',11700358,'23/12/2021',2787.00,'',0.00,'2021-12-23','1900-01-01',2700.00,75.00),('0NRZ',11701281,'12/02/2021',3058.00,'',0.00,'2021-02-12','1900-01-01',3000.00,50.00),('4687',11710274,'29/05/2021',587.00,'',0.00,'2021-05-29','1900-01-01',500.00,75.00),('0125',11714938,'11/11/2021',1087.00,'',0.00,'2021-11-11','1900-01-01',1000.00,75.00),('0Q1B',11718178,'20/12/2021',2287.00,'',0.00,'2021-12-20','1900-01-01',2200.00,75.00),('6617',11728300,'07/01/2021',2258.00,'',0.00,'2021-01-07','1900-01-01',2200.00,50.00),('17DY',11736121,'19/12/2021',1487.00,'',0.00,'2021-12-19','1900-01-01',1400.00,75.00),('14OH',11739695,'24/04/2021',558.00,'',0.00,'2021-04-24','1900-01-01',500.00,50.00),('0254',11743432,'14/01/2021',2058.00,'',0.00,'2021-01-14','1900-01-01',2000.00,50.00),('2305',11743663,'19/01/2021',2058.00,'',0.00,'2021-01-19','1900-01-01',2000.00,50.00),('0WOM',11750452,'19/10/2021',787.00,'',0.00,'2021-10-19','1900-01-01',700.00,75.00),('18IN',11752524,'02/02/2021',1558.00,'',0.00,'2021-02-02','1900-01-01',1500.00,50.00),('13XF',11764941,'21/08/2021',587.00,'',0.00,'2021-08-21','1900-01-01',500.00,75.00),('1HX3',11773447,'18/11/2021',1587.00,'',0.00,'2021-11-18','1900-01-01',1500.00,75.00),('1518',11782125,'23/07/2021',1087.00,'',0.00,'2021-07-23','1900-01-01',1000.00,75.00),('0PSC',11798360,'04/08/2021',1687.00,'',0.00,'2021-08-04','1900-01-01',1600.00,75.00),('6617',11800836,'16/01/2021',2158.00,'',0.00,'2021-01-16','1900-01-01',2100.00,50.00),('15KL',11807088,'29/01/2021',4058.00,'',0.00,'2021-01-29','1900-01-01',4000.00,50.00),('15KL',11808631,'12/02/2021',4058.00,'',0.00,'2021-02-12','1900-01-01',4000.00,50.00),('0POQ',11811411,'06/01/2021',2558.00,'',0.00,'2021-01-06','1900-01-01',2500.00,50.00),('8576',11813474,'16/11/2021',2387.00,'',0.00,'2021-11-16','1900-01-01',2300.00,75.00),('0O0T',11814530,'07/01/2021',558.00,'',0.00,'2021-01-07','1900-01-01',500.00,50.00),('0062',11818705,'14/11/2021',1387.00,'',0.00,'2021-11-14','1900-01-01',1300.00,75.00),('0062',11818739,'25/06/2021',587.00,'',0.00,'2021-06-25','1900-01-01',500.00,75.00),('1CQ8',11826930,'03/10/2021',1487.00,'',0.00,'2021-10-03','1900-01-01',1400.00,75.00),('0OED',11828951,'01/10/2021',2287.00,'',0.00,'2021-10-01','1900-01-01',2200.00,75.00),('8140',11834595,'15/11/2021',1987.00,'',0.00,'2021-11-15','1900-01-01',1900.00,75.00),('9240',11847654,'17/06/2021',3287.00,'',0.00,'2021-06-17','1900-01-01',3200.00,75.00),('9240',11847712,'05/02/2021',1058.00,'',0.00,'2021-02-05','1900-01-01',1000.00,50.00),('0WVW',11852928,'20/07/2021',4287.00,'17/09/2021',4278.55,'2021-07-20','2021-09-17',4200.00,75.00),('0WVW',11852928,'15/02/2021',1758.00,'',0.00,'2021-02-15','1900-01-01',1700.00,50.00),('0Q92',11853512,'20/01/2021',1258.00,'',0.00,'2021-01-20','1900-01-01',1200.00,50.00),('1DV6',11885134,'05/11/2021',587.00,'',0.00,'2021-11-05','1900-01-01',500.00,75.00),('4687',11891611,'17/01/2021',558.00,'',0.00,'2021-01-17','1900-01-01',500.00,50.00),('2335',11892726,'02/06/2021',887.00,'',0.00,'2021-06-02','1900-01-01',800.00,75.00),('0NSX',11896057,'16/09/2021',687.00,'',0.00,'2021-09-16','1900-01-01',600.00,75.00),('1GYK',11909298,'31/10/2021',1587.00,'',0.00,'2021-10-31','1900-01-01',1500.00,75.00),('07R0',11909298,'08/01/2021',2058.00,'',0.00,'2021-01-08','1900-01-01',2000.00,50.00),('0Z70',11915071,'24/07/2021',987.00,'',0.00,'2021-07-24','1900-01-01',900.00,75.00),('1274',11919909,'27/03/2021',558.00,'',0.00,'2021-03-27','1900-01-01',500.00,50.00),('8489',11925070,'24/10/2021',1087.00,'',0.00,'2021-10-24','1900-01-01',1000.00,75.00),('145H',11927449,'13/12/2021',3587.00,'',0.00,'2021-12-13','1900-01-01',3500.00,75.00),('5460',11930310,'04/12/2021',2687.00,'',0.00,'2021-12-04','1900-01-01',2600.00,75.00),('1BK0',11932977,'22/02/2021',558.00,'',0.00,'2021-02-22','1900-01-01',500.00,50.00),('8140',11934114,'03/12/2021',3787.00,'',0.00,'2021-12-03','1900-01-01',3700.00,75.00),('0289',11941234,'24/10/2021',687.00,'',0.00,'2021-10-24','1900-01-01',600.00,75.00),('0289',11941267,'13/08/2021',587.00,'',0.00,'2021-08-13','1900-01-01',500.00,75.00),('0289',11941267,'23/04/2021',1058.00,'',0.00,'2021-04-23','1900-01-01',1000.00,50.00),('1DCS',11941382,'23/12/2021',1787.00,'',0.00,'2021-12-23','1900-01-01',1700.00,75.00),('1DCS',11941382,'18/01/2021',658.00,'',0.00,'2021-01-18','1900-01-01',600.00,50.00),('2810',11943172,'18/12/2021',1787.00,'',0.00,'2021-12-18','1900-01-01',1700.00,75.00),('1BDT',11945243,'03/07/2021',1587.00,'',0.00,'2021-07-03','1900-01-01',1500.00,75.00),('3590',11945417,'04/01/2021',1658.00,'',0.00,'2021-01-04','1900-01-01',1600.00,50.00),('17DY',11946381,'06/03/2021',2158.00,'',0.00,'2021-03-06','1900-01-01',2100.00,50.00),('5974',11947355,'13/11/2021',1587.00,'',0.00,'2021-11-13','1900-01-01',1500.00,75.00),('0T4R',11950342,'18/12/2021',1087.00,'',0.00,'2021-12-18','1900-01-01',1000.00,75.00),('0T4R',11950342,'22/01/2021',958.00,'',0.00,'2021-01-22','1900-01-01',900.00,50.00),('0T4R',11950342,'12/01/2021',958.00,'',0.00,'2021-01-12','1900-01-01',900.00,50.00),('8350',11951829,'28/12/2021',587.00,'',0.00,'2021-12-28','1900-01-01',500.00,75.00),('0NLJ',11958287,'26/12/2021',3587.00,'',0.00,'2021-12-26','1900-01-01',3500.00,75.00),('2305',11964434,'04/01/2021',708.00,'',0.00,'2021-01-04','1900-01-01',650.00,50.00),('0NO4',11970936,'23/07/2021',1887.00,'',0.00,'2021-07-23','1900-01-01',1800.00,75.00),('0Z70',11971397,'26/01/2021',1158.00,'',0.00,'2021-01-26','1900-01-01',1100.00,50.00),('1HX3',11974961,'14/11/2021',5087.00,'',0.00,'2021-11-14','1900-01-01',5000.00,75.00),('6617',11981487,'20/01/2021',3958.00,'10/03/2021',3955.37,'2021-01-20','2021-03-10',3900.00,50.00),('0WVW',11986536,'20/07/2021',2487.00,'17/09/2021',2464.70,'2021-07-20','2021-09-17',2400.00,75.00),('17DY',11990975,'01/12/2021',2487.00,'',0.00,'2021-12-01','1900-01-01',2400.00,75.00),('1019',11992443,'05/08/2021',1787.00,'',0.00,'2021-08-05','1900-01-01',1700.00,75.00),('2117',11993524,'13/02/2021',1558.00,'',0.00,'2021-02-13','1900-01-01',1500.00,50.00),('0NSZ',12003943,'02/01/2021',1658.00,'',0.00,'2021-01-02','1900-01-01',1600.00,50.00),('8140',12010187,'02/07/2021',1087.00,'',0.00,'2021-07-02','1900-01-01',1000.00,75.00),('17SL',12022364,'24/12/2021',787.00,'',0.00,'2021-12-24','1900-01-01',700.00,75.00),('0QDE',12025516,'16/12/2021',3087.00,'',0.00,'2021-12-16','1900-01-01',3000.00,75.00),('0qen',12025946,'23/10/2021',6587.00,'',0.00,'2021-10-23','1900-01-01',6500.00,75.00),('0289',12033700,'22/04/2021',1058.00,'',0.00,'2021-04-22','1900-01-01',1000.00,50.00),('0108',12035838,'14/01/2021',1258.00,'',0.00,'2021-01-14','1900-01-01',1200.00,50.00),('0419',12041042,'16/02/2021',1258.00,'',0.00,'2021-02-16','1900-01-01',1200.00,50.00),('0419',12041042,'13/01/2021',558.00,'',0.00,'2021-01-13','1900-01-01',500.00,50.00),('12LF',12048245,'20/08/2021',4087.00,'',0.00,'2021-08-20','1900-01-01',4000.00,75.00),('8350',12057394,'07/07/2021',587.00,'',0.00,'2021-07-07','1900-01-01',500.00,75.00),('8140',12057568,'18/10/2021',2487.00,'06/12/2021',2480.35,'2021-10-18','2021-12-06',2400.00,75.00),('8140',12057568,'16/01/2021',1758.00,'',0.00,'2021-01-16','1900-01-01',1700.00,50.00),('0QEG',12063947,'19/03/2021',758.00,'',0.00,'2021-03-19','1900-01-01',700.00,50.00),('0WAJ',12064606,'15/02/2021',4058.00,'',0.00,'2021-02-15','1900-01-01',4000.00,50.00),('0254',12067906,'24/10/2021',1087.00,'',0.00,'2021-10-24','1900-01-01',1000.00,75.00),('0QEG',12076329,'07/12/2021',987.00,'',0.00,'2021-12-07','1900-01-01',900.00,75.00),('0Q78',12079059,'18/12/2021',1987.00,'',0.00,'2021-12-18','1900-01-01',1900.00,75.00),('0QCG',12080644,'27/12/2021',587.00,'',0.00,'2021-12-27','1900-01-01',500.00,75.00),('0QCG',12080644,'08/11/2021',587.00,'',0.00,'2021-11-08','1900-01-01',500.00,75.00),('5394',12085684,'10/08/2021',587.00,'',0.00,'2021-08-10','1900-01-01',500.00,75.00),('7861',12088605,'11/02/2021',758.00,'',0.00,'2021-02-11','1900-01-01',700.00,50.00),('4505',12089371,'01/06/2021',1787.00,'',0.00,'2021-06-01','1900-01-01',1700.00,75.00),('0NU8',12091526,'14/07/2021',587.00,'',0.00,'2021-07-14','1900-01-01',500.00,75.00),('0Q6B',12096400,'06/12/2021',587.00,'',0.00,'2021-12-06','1900-01-01',500.00,75.00),('8140',12101036,'23/03/2021',3058.00,'',0.00,'2021-03-23','1900-01-01',3000.00,50.00),('8140',12101168,'21/10/2021',1087.00,'',0.00,'2021-10-21','1900-01-01',1000.00,75.00),('10GP',12101663,'12/11/2021',1087.00,'',0.00,'2021-11-12','1900-01-01',1000.00,75.00),('14YB',12105219,'27/12/2021',2187.00,'',0.00,'2021-12-27','1900-01-01',2100.00,75.00),('0404',12105649,'21/08/2021',4087.00,'',0.00,'2021-08-21','1900-01-01',4000.00,75.00),('0QIP',12118121,'05/03/2021',2058.00,'',0.00,'2021-03-05','1900-01-01',2000.00,50.00),('0QIS',12118857,'29/05/2021',1887.00,'',0.00,'2021-05-29','1900-01-01',1800.00,75.00),('0QIS',12119178,'07/01/2021',2058.00,'',0.00,'2021-01-07','1900-01-01',2000.00,50.00),('0QIS',12119285,'14/08/2021',2087.00,'',0.00,'2021-08-14','1900-01-01',2000.00,75.00),('0QIS',12119293,'16/07/2021',2387.00,'',0.00,'2021-07-16','1900-01-01',2300.00,75.00),('0QIS',12119665,'05/11/2021',1287.00,'',0.00,'2021-11-05','1900-01-01',1200.00,75.00),('0317',12123907,'07/03/2021',758.00,'',0.00,'2021-03-07','1900-01-01',700.00,50.00),('4442',12130142,'06/03/2021',658.00,'15/04/2021',657.65,'2021-03-06','2021-04-15',600.00,50.00),('0QGB',12133906,'17/11/2021',1887.00,'',0.00,'2021-11-17','1900-01-01',1800.00,75.00),('5297',12135638,'01/12/2021',2087.00,'',0.00,'2021-12-01','1900-01-01',2000.00,75.00),('4605',12139457,'28/12/2021',1087.00,'',0.00,'2021-12-28','1900-01-01',1000.00,75.00),('6774',12142220,'08/11/2021',1387.00,'',0.00,'2021-11-08','1900-01-01',1300.00,75.00),('0QTX',12147930,'10/12/2021',987.00,'',0.00,'2021-12-10','1900-01-01',900.00,75.00),('0OOB',12149894,'25/08/2021',6587.00,'',0.00,'2021-08-25','1900-01-01',6500.00,75.00),('0NX1',12157061,'02/02/2021',1258.00,'',0.00,'2021-02-02','1900-01-01',1200.00,50.00),('3380',12163440,'19/07/2021',2087.00,'',0.00,'2021-07-19','1900-01-01',2000.00,75.00),('3380',12163473,'05/09/2021',1287.00,'',0.00,'2021-09-05','1900-01-01',1200.00,75.00),('0YP9',12169579,'14/01/2021',2158.00,'',0.00,'2021-01-14','1900-01-01',2100.00,50.00),('1HWV',12169595,'04/12/2021',1087.00,'',0.00,'2021-12-04','1900-01-01',1000.00,75.00),('1HWV',12169595,'22/11/2021',1187.00,'',0.00,'2021-11-22','1900-01-01',1100.00,75.00),('1HWV',12170130,'01/08/2021',1787.00,'',0.00,'2021-08-01','1900-01-01',1700.00,75.00),('1HWV',12170296,'04/08/2021',2087.00,'',0.00,'2021-08-04','1900-01-01',2000.00,75.00),('0YJV',12170296,'15/02/2021',1958.00,'',0.00,'2021-02-15','1900-01-01',1900.00,50.00),('0R2W',12173282,'04/12/2021',3187.00,'',0.00,'2021-12-04','1900-01-01',3100.00,75.00),('1F1A',12183489,'20/03/2021',858.00,'',0.00,'2021-03-20','1900-01-01',800.00,50.00),('0O4U',12184008,'11/12/2021',1287.00,'',0.00,'2021-12-11','1900-01-01',1200.00,75.00),('7266',12184636,'06/11/2021',1287.00,'',0.00,'2021-11-06','1900-01-01',1200.00,75.00),('0NIA',12188520,'07/10/2021',587.00,'',0.00,'2021-10-07','1900-01-01',500.00,75.00),('0Q7I',12190773,'17/12/2021',587.00,'',0.00,'2021-12-17','1900-01-01',500.00,75.00),('0Q7I',12190773,'01/11/2021',787.00,'',0.00,'2021-11-01','1900-01-01',700.00,75.00),('14MF',12203881,'13/04/2021',558.00,'',0.00,'2021-04-13','1900-01-01',500.00,50.00),('3638',12204335,'09/08/2021',5087.00,'',0.00,'2021-08-09','1900-01-01',5000.00,75.00),('3638',12204343,'16/12/2021',2187.00,'',0.00,'2021-12-16','1900-01-01',2100.00,75.00),('6188',12218103,'04/09/2021',1087.00,'',0.00,'2021-09-04','1900-01-01',1000.00,75.00),('3437',12219317,'01/10/2021',2587.00,'',0.00,'2021-10-01','1900-01-01',2500.00,75.00),('3706',12223756,'16/01/2021',558.00,'',0.00,'2021-01-16','1900-01-01',500.00,50.00),('07W9',12245304,'01/12/2021',1487.00,'',0.00,'2021-12-01','1900-01-01',1400.00,75.00),('07W9',12245304,'02/09/2021',1487.00,'',0.00,'2021-09-02','1900-01-01',1400.00,75.00),('0WVW',12246260,'18/06/2021',2087.00,'',0.00,'2021-06-18','1900-01-01',2000.00,75.00),('1BF0',12257242,'25/11/2021',987.00,'',0.00,'2021-11-25','1900-01-01',900.00,75.00),('9435',12263257,'04/12/2021',1487.00,'',0.00,'2021-12-04','1900-01-01',1400.00,75.00),('0QCP',12284196,'06/09/2021',2987.00,'',0.00,'2021-09-06','1900-01-01',2900.00,75.00),('0QPF',12286316,'02/03/2021',558.00,'',0.00,'2021-03-02','1900-01-01',500.00,50.00),('0QPF',12286852,'17/05/2021',4058.00,'',0.00,'2021-05-17','1900-01-01',3971.00,75.00),('0QPF',12286985,'25/02/2021',758.00,'',0.00,'2021-02-25','1900-01-01',700.00,50.00),('0QPF',12287397,'14/06/2021',1087.00,'',0.00,'2021-06-14','1900-01-01',1000.00,75.00),('0QPF',12287421,'07/03/2021',1558.00,'',0.00,'2021-03-07','1900-01-01',1500.00,50.00),('0QPF',12288601,'15/05/2021',1758.00,'',0.00,'2021-05-15','1900-01-01',1671.00,75.00),('0QPF',12288932,'18/02/2021',2058.00,'',0.00,'2021-02-18','1900-01-01',2000.00,50.00),('0QPF',12288957,'21/01/2021',2058.00,'',0.00,'2021-01-21','1900-01-01',2000.00,50.00),('0QPF',12290169,'17/01/2021',858.00,'',0.00,'2021-01-17','1900-01-01',800.00,50.00),('0QMC',12291670,'17/10/2021',787.00,'',0.00,'2021-10-17','1900-01-01',700.00,75.00),('0QMC',12297248,'04/07/2021',587.00,'',0.00,'2021-07-04','1900-01-01',500.00,75.00),('0QOY',12300455,'18/01/2021',1058.00,'',0.00,'2021-01-18','1900-01-01',1000.00,50.00),('0OBT',12303376,'26/11/2021',1087.00,'',0.00,'2021-11-26','1900-01-01',1000.00,75.00),('10BI',12303699,'02/01/2021',1658.00,'',0.00,'2021-01-02','1900-01-01',1600.00,50.00),('0QPR',12309878,'29/01/2021',2558.00,'',0.00,'2021-01-29','1900-01-01',2500.00,50.00),('0NSZ',12313508,'15/01/2021',2258.00,'',0.00,'2021-01-15','1900-01-01',2200.00,50.00),('1ALR',12313615,'18/11/2021',987.00,'',0.00,'2021-11-18','1900-01-01',900.00,75.00),('1IM8',12317269,'06/12/2021',1687.00,'',0.00,'2021-12-06','1900-01-01',1600.00,75.00),('1IM8',12317269,'17/10/2021',1387.00,'',0.00,'2021-10-17','1900-01-01',1300.00,75.00),('0430',12334835,'26/04/2021',1258.00,'',0.00,'2021-04-26','1900-01-01',1200.00,50.00),('0X58',12345443,'17/10/2021',2287.00,'',0.00,'2021-10-17','1900-01-01',2200.00,75.00),('0X58',12345708,'06/08/2021',587.00,'',0.00,'2021-08-06','1900-01-01',500.00,75.00),('0X58',12345989,'20/07/2021',887.00,'',0.00,'2021-07-20','1900-01-01',800.00,75.00),('0X58',12345989,'03/07/2021',887.00,'',0.00,'2021-07-03','1900-01-01',800.00,75.00),('0PSU',12349585,'05/12/2021',4087.00,'',0.00,'2021-12-05','1900-01-01',4000.00,75.00),('0QMC',12357398,'17/05/2021',558.00,'',0.00,'2021-05-17','1900-01-01',471.00,75.00),('0QDF',12361754,'28/08/2021',1387.00,'',0.00,'2021-08-28','1900-01-01',1300.00,75.00),('0QMC',12362521,'08/01/2021',558.00,'',0.00,'2021-01-08','1900-01-01',500.00,50.00),('11YG',12366720,'11/02/2021',858.00,'',0.00,'2021-02-11','1900-01-01',800.00,50.00),('4627',12369153,'13/08/2021',887.00,'',0.00,'2021-08-13','1900-01-01',800.00,75.00),('0108',12371332,'02/01/2021',4058.00,'',0.00,'2021-01-02','1900-01-01',4000.00,50.00),('0PCL',12371480,'19/06/2021',1987.00,'',0.00,'2021-06-19','1900-01-01',1900.00,75.00),('0OGB',12376042,'25/09/2021',887.00,'',0.00,'2021-09-25','1900-01-01',800.00,75.00),('0108',12378964,'12/12/2021',3187.00,'',0.00,'2021-12-12','1900-01-01',3100.00,75.00),('0O4U',12386108,'23/10/2021',2787.00,'',0.00,'2021-10-23','1900-01-01',2700.00,75.00),('4442',12414132,'03/10/2021',1287.00,'',0.00,'2021-10-03','1900-01-01',1200.00,75.00),('19PX',12428447,'22/02/2021',2158.00,'',0.00,'2021-02-22','1900-01-01',2100.00,50.00),('0O1D',12437877,'22/02/2021',858.00,'',0.00,'2021-02-22','1900-01-01',800.00,50.00),('0QMC',12444097,'20/03/2021',958.00,'',0.00,'2021-03-20','1900-01-01',900.00,50.00),('9551',12452934,'04/09/2021',687.00,'',0.00,'2021-09-04','1900-01-01',600.00,75.00),('5974',12458675,'09/08/2021',2087.00,'',0.00,'2021-08-09','1900-01-01',2000.00,75.00),('0289',12460226,'28/01/2021',1158.00,'',0.00,'2021-01-28','1900-01-01',1100.00,50.00),('1BKZ',12461422,'16/01/2021',558.00,'',0.00,'2021-01-16','1900-01-01',500.00,50.00),('0QUW',12466413,'02/11/2021',2087.00,'',0.00,'2021-11-02','1900-01-01',2000.00,75.00),('0QUW',12466413,'15/08/2021',1887.00,'',0.00,'2021-08-15','1900-01-01',1800.00,75.00),('1D5M',12479291,'16/01/2021',1358.00,'',0.00,'2021-01-16','1900-01-01',1300.00,50.00),('0QUS',12481487,'28/03/2021',658.00,'',0.00,'2021-03-28','1900-01-01',600.00,50.00),('0QT7',12488995,'08/01/2021',1258.00,'',0.00,'2021-01-08','1900-01-01',1200.00,50.00),('0QW9',12491585,'02/10/2021',987.00,'',0.00,'2021-10-02','1900-01-01',900.00,75.00),('0NA9',12497871,'24/03/2021',1058.00,'',0.00,'2021-03-24','1900-01-01',1000.00,50.00),('1AEQ',12509816,'08/08/2021',587.00,'',0.00,'2021-08-08','1900-01-01',500.00,75.00),('119I',12512356,'25/10/2021',1187.00,'',0.00,'2021-10-25','1900-01-01',1100.00,75.00),('6410',12517298,'27/12/2021',787.00,'',0.00,'2021-12-27','1900-01-01',700.00,75.00),('5979',12523858,'26/08/2021',1087.00,'',0.00,'2021-08-26','1900-01-01',1000.00,75.00),('17DY',12535589,'16/12/2021',1387.00,'',0.00,'2021-12-16','1900-01-01',1300.00,75.00),('17KH',12545471,'13/02/2021',958.00,'',0.00,'2021-02-13','1900-01-01',900.00,50.00),('6584',12555793,'24/11/2021',587.00,'',0.00,'2021-11-24','1900-01-01',500.00,75.00),('6584',12555793,'18/09/2021',1087.00,'',0.00,'2021-09-18','1900-01-01',1000.00,75.00),('3482',12558276,'25/08/2021',787.00,'',0.00,'2021-08-25','1900-01-01',700.00,75.00),('0UIQ',12567012,'12/02/2021',1458.00,'',0.00,'2021-02-12','1900-01-01',1400.00,50.00),('1DK6',12570875,'21/09/2021',787.00,'',0.00,'2021-09-21','1900-01-01',700.00,75.00),('1DK6',12570875,'10/03/2021',558.00,'',0.00,'2021-03-10','1900-01-01',500.00,50.00),('0Q6Q',12572772,'13/12/2021',687.00,'',0.00,'2021-12-13','1900-01-01',600.00,75.00),('0QZF',12576963,'22/11/2021',1587.00,'',0.00,'2021-11-22','1900-01-01',1500.00,75.00),('4373',12582193,'19/11/2021',2287.00,'',0.00,'2021-11-19','1900-01-01',2200.00,75.00),('4373',12582193,'30/07/2021',887.00,'',0.00,'2021-07-30','1900-01-01',800.00,75.00),('4373',12582201,'08/12/2021',1087.00,'',0.00,'2021-12-08','1900-01-01',1000.00,75.00),('0QLX',12584892,'27/03/2021',1358.00,'',0.00,'2021-03-27','1900-01-01',1300.00,50.00),('8357',12585519,'11/02/2021',558.00,'',0.00,'2021-02-11','1900-01-01',500.00,50.00),('3776',12586749,'08/01/2021',958.00,'',0.00,'2021-01-08','1900-01-01',900.00,50.00),('0P3H',12589792,'05/06/2021',1587.00,'',0.00,'2021-06-05','1900-01-01',1500.00,75.00),('0P3H',12589792,'19/03/2021',3558.00,'',0.00,'2021-03-19','1900-01-01',3500.00,50.00),('0X58',12596706,'23/12/2021',2987.00,'',0.00,'2021-12-23','1900-01-01',2900.00,75.00),('1B9D',12599254,'03/12/2021',1387.00,'',0.00,'2021-12-03','1900-01-01',1300.00,75.00),('0043',12603874,'15/02/2021',2758.00,'',0.00,'2021-02-15','1900-01-01',2700.00,50.00),('0O4U',12606323,'09/01/2021',1358.00,'',0.00,'2021-01-09','1900-01-01',1300.00,50.00),('5460',12613980,'23/12/2021',2587.00,'',0.00,'2021-12-23','1900-01-01',2500.00,75.00),('0254',12615985,'01/12/2021',2587.00,'',0.00,'2021-12-01','1900-01-01',2500.00,75.00),('0254',12615985,'07/01/2021',1458.00,'',0.00,'2021-01-07','1900-01-01',1400.00,50.00),('7126',12619656,'26/07/2021',1687.00,'',0.00,'2021-07-26','1900-01-01',1600.00,75.00),('7126',12619656,'16/05/2021',1558.00,'',0.00,'2021-05-16','1900-01-01',1471.00,75.00),('5297',12632436,'13/12/2021',2487.00,'',0.00,'2021-12-13','1900-01-01',2400.00,75.00),('0QCQ',12642716,'06/12/2021',887.00,'',0.00,'2021-12-06','1900-01-01',800.00,75.00),('0QCQ',12642716,'21/06/2021',887.00,'',0.00,'2021-06-21','1900-01-01',800.00,75.00),('0QCQ',12642716,'02/06/2021',587.00,'',0.00,'2021-06-02','1900-01-01',500.00,75.00),('0616',12643649,'13/12/2021',987.00,'',0.00,'2021-12-13','1900-01-01',900.00,75.00),('6275',12646014,'19/03/2021',558.00,'',0.00,'2021-03-19','1900-01-01',500.00,50.00),('6275',12646014,'14/03/2021',558.00,'',0.00,'2021-03-14','1900-01-01',500.00,50.00),('0NO4',12648820,'04/01/2021',558.00,'',0.00,'2021-01-04','1900-01-01',500.00,50.00),('0517',12650610,'24/12/2021',987.00,'',0.00,'2021-12-24','1900-01-01',900.00,75.00),('0517',12650610,'16/01/2021',558.00,'',0.00,'2021-01-16','1900-01-01',500.00,50.00),('2305',12652921,'18/12/2021',2587.00,'',0.00,'2021-12-18','1900-01-01',2500.00,75.00),('0R2L',12656377,'24/09/2021',1587.00,'',0.00,'2021-09-24','1900-01-01',1500.00,75.00),('0108',12678413,'23/08/2021',2087.00,'',0.00,'2021-08-23','1900-01-01',2000.00,75.00),('0R38',12687919,'22/11/2021',1087.00,'',0.00,'2021-11-22','1900-01-01',1000.00,75.00),('8140',12688370,'19/01/2021',1458.00,'',0.00,'2021-01-19','1900-01-01',1400.00,50.00),('17SZ',12691507,'11/11/2021',787.00,'',0.00,'2021-11-11','1900-01-01',700.00,75.00),('0942',12692083,'06/12/2021',1187.00,'',0.00,'2021-12-06','1900-01-01',1100.00,75.00),('19MX',12694691,'09/12/2021',687.00,'',0.00,'2021-12-09','1900-01-01',600.00,75.00),('19MX',12694691,'06/09/2021',787.00,'',0.00,'2021-09-06','1900-01-01',700.00,75.00),('0S77',12701611,'13/02/2021',1958.00,'',0.00,'2021-02-13','1900-01-01',1900.00,50.00),('0YJV',12712865,'28/01/2021',1058.00,'',0.00,'2021-01-28','1900-01-01',1000.00,50.00),('0R62',12720256,'11/05/2021',4058.00,'',0.00,'2021-05-11','1900-01-01',4000.00,50.00),('0WOM',12742888,'03/12/2021',987.00,'',0.00,'2021-12-03','1900-01-01',900.00,75.00),('0PFR',12746319,'18/10/2021',1187.00,'',0.00,'2021-10-18','1900-01-01',1100.00,75.00),('0108',12754495,'05/01/2021',4058.00,'',0.00,'2021-01-05','1900-01-01',4000.00,50.00),('0R3D',12754669,'26/09/2021',5387.00,'',0.00,'2021-09-26','1900-01-01',5300.00,75.00),('0108',12754677,'01/07/2021',4687.00,'',0.00,'2021-07-01','1900-01-01',4600.00,75.00),('0108',12754677,'06/01/2021',3758.00,'',0.00,'2021-01-06','1900-01-01',3700.00,50.00),('0R3D',12755435,'04/10/2021',3587.00,'',0.00,'2021-10-04','1900-01-01',3500.00,75.00),('0R4Q',12758371,'24/07/2021',687.00,'',0.00,'2021-07-24','1900-01-01',600.00,75.00),('5460',12784385,'30/04/2021',3558.00,'',0.00,'2021-04-30','1900-01-01',3500.00,50.00),('0QVB',12794921,'26/09/2021',587.00,'',0.00,'2021-09-26','1900-01-01',500.00,75.00),('0QVB',12794921,'28/08/2021',987.00,'',0.00,'2021-08-28','1900-01-01',900.00,75.00),('17GE',12796702,'04/05/2021',1058.00,'',0.00,'2021-05-04','1900-01-01',1000.00,50.00),('17GE',12796769,'04/10/2021',1787.00,'',0.00,'2021-10-04','1900-01-01',1700.00,75.00),('17GE',12796769,'15/01/2021',1658.00,'',0.00,'2021-01-15','1900-01-01',1600.00,50.00),('9377',12797635,'19/05/2021',1258.00,'',0.00,'2021-05-19','1900-01-01',1171.00,75.00),('9377',12797635,'21/04/2021',1058.00,'',0.00,'2021-04-21','1900-01-01',1000.00,50.00),('0NO4',12803581,'25/06/2021',2287.00,'',0.00,'2021-06-25','1900-01-01',2200.00,75.00),('0RAW',12806840,'01/12/2021',2187.00,'',0.00,'2021-12-01','1900-01-01',2100.00,75.00),('0RAW',12807103,'16/11/2021',1087.00,'',0.00,'2021-11-16','1900-01-01',1000.00,75.00),('0RAW',12807764,'05/04/2021',1758.00,'',0.00,'2021-04-05','1900-01-01',1700.00,50.00),('0RAW',12807772,'17/08/2021',987.00,'',0.00,'2021-08-17','1900-01-01',900.00,75.00),('14I6',12828216,'04/10/2021',587.00,'',0.00,'2021-10-04','1900-01-01',500.00,75.00),('0254',12829412,'08/12/2021',1087.00,'',0.00,'2021-12-08','1900-01-01',1000.00,75.00),('0RC9',12833687,'09/12/2021',2187.00,'',0.00,'2021-12-09','1900-01-01',2100.00,75.00),('0OBU',12834008,'23/12/2021',5687.00,'',0.00,'2021-12-23','1900-01-01',5600.00,75.00),('0NSD',12835641,'12/05/2021',2558.00,'',0.00,'2021-05-12','1900-01-01',2500.00,50.00),('0NSD',12835641,'01/03/2021',3858.00,'',0.00,'2021-03-01','1900-01-01',3800.00,50.00),('0289',12845699,'28/10/2021',4687.00,'',0.00,'2021-10-28','1900-01-01',4600.00,75.00),('5328',12858346,'29/11/2021',1587.00,'',0.00,'2021-11-29','1900-01-01',1500.00,75.00),('0RB7',12863999,'04/04/2021',3258.00,'',0.00,'2021-04-04','1900-01-01',3200.00,50.00),('0RB7',12864062,'17/12/2021',2787.00,'',0.00,'2021-12-17','1900-01-01',2700.00,75.00),('0RB7',12864138,'23/12/2021',3587.00,'',0.00,'2021-12-23','1900-01-01',3500.00,75.00),('0RB7',12864146,'17/12/2021',2387.00,'',0.00,'2021-12-17','1900-01-01',2300.00,75.00),('0RB7',12864385,'27/05/2021',1587.00,'',0.00,'2021-05-27','1900-01-01',1500.00,75.00),('0RB7',12864385,'22/03/2021',1058.00,'',0.00,'2021-03-22','1900-01-01',1000.00,50.00),('0RB7',12864484,'05/01/2021',2058.00,'',0.00,'2021-01-05','1900-01-01',2000.00,50.00),('0RB7',12864567,'16/12/2021',2287.00,'',0.00,'2021-12-16','1900-01-01',2200.00,75.00),('0RB7',12864567,'05/01/2021',1358.00,'',0.00,'2021-01-05','1900-01-01',1300.00,50.00),('0RB7',12864856,'16/12/2021',2687.00,'',0.00,'2021-12-16','1900-01-01',2600.00,75.00),('0RB7',12864856,'05/01/2021',1758.00,'',0.00,'2021-01-05','1900-01-01',1700.00,50.00),('0RB7',12864906,'20/02/2021',558.00,'',0.00,'2021-02-20','1900-01-01',500.00,50.00),('0RB7',12864948,'23/12/2021',4587.00,'',0.00,'2021-12-23','1900-01-01',4500.00,75.00),('0RB7',12864955,'05/01/2021',2558.00,'',0.00,'2021-01-05','1900-01-01',2500.00,50.00),('0RB7',12864963,'31/10/2021',1287.00,'',0.00,'2021-10-31','1900-01-01',1200.00,75.00),('0RB7',12864963,'26/02/2021',2058.00,'',0.00,'2021-02-26','1900-01-01',2000.00,50.00),('0RB7',12864963,'24/02/2021',1058.00,'',0.00,'2021-02-24','1900-01-01',1000.00,50.00),('0RB7',12865036,'02/05/2021',2558.00,'',0.00,'2021-05-02','1900-01-01',2500.00,50.00),('0RB7',12865218,'07/01/2021',3258.00,'',0.00,'2021-01-07','1900-01-01',3200.00,50.00),('0RB7',12865341,'16/05/2021',3258.00,'',0.00,'2021-05-16','1900-01-01',3171.00,75.00),('0RB7',12865374,'23/12/2021',3587.00,'',0.00,'2021-12-23','1900-01-01',3500.00,75.00),('0RB7',12865374,'16/12/2021',3887.00,'',0.00,'2021-12-16','1900-01-01',3800.00,75.00),('0RB7',12865390,'30/09/2021',3087.00,'',0.00,'2021-09-30','1900-01-01',3000.00,75.00),('0RB7',12865630,'16/12/2021',2287.00,'',0.00,'2021-12-16','1900-01-01',2200.00,75.00),('0RB7',12865697,'11/05/2021',558.00,'',0.00,'2021-05-11','1900-01-01',500.00,50.00),('0RB7',12865762,'15/03/2021',2358.00,'',0.00,'2021-03-15','1900-01-01',2300.00,50.00),('0RB7',12865762,'09/03/2021',2358.00,'',0.00,'2021-03-09','1900-01-01',2300.00,50.00),('0RB7',12865838,'23/12/2021',2087.00,'',0.00,'2021-12-23','1900-01-01',2000.00,75.00),('0RB7',12865838,'05/01/2021',4058.00,'',0.00,'2021-01-05','1900-01-01',4000.00,50.00),('0RB7',12866018,'21/10/2021',2087.00,'',0.00,'2021-10-21','1900-01-01',2000.00,75.00),('0RB7',12866034,'24/09/2021',1087.00,'',0.00,'2021-09-24','1900-01-01',1000.00,75.00),('0RB7',12866125,'04/12/2021',3087.00,'',0.00,'2021-12-04','1900-01-01',3000.00,75.00),('0RB7',12866158,'19/09/2021',687.00,'',0.00,'2021-09-19','1900-01-01',600.00,75.00),('0RB7',12866281,'31/07/2021',6587.00,'',0.00,'2021-07-31','1900-01-01',6500.00,75.00),('0RB7',12866406,'15/01/2021',2158.00,'',0.00,'2021-01-15','1900-01-01',2100.00,50.00),('0RB7',12866448,'25/02/2021',1058.00,'',0.00,'2021-02-25','1900-01-01',1000.00,50.00),('0Z6U',12866497,'17/12/2021',6587.00,'',0.00,'2021-12-17','1900-01-01',6500.00,75.00),('0RB7',12866588,'23/09/2021',4087.00,'',0.00,'2021-09-23','1900-01-01',4000.00,75.00),('0RE1',12875530,'13/11/2021',2487.00,'',0.00,'2021-11-13','1900-01-01',2400.00,75.00),('1BUJ',12883245,'05/01/2021',1758.00,'',0.00,'2021-01-05','1900-01-01',1700.00,50.00),('8140',12885109,'17/12/2021',2487.00,'',0.00,'2021-12-17','1900-01-01',2400.00,75.00),('1BXY',12901526,'20/12/2021',1887.00,'',0.00,'2021-12-20','1900-01-01',1800.00,75.00),('2054',12910972,'15/01/2021',2058.00,'',0.00,'2021-01-15','1900-01-01',2000.00,50.00),('0RB7',12912812,'18/01/2021',3958.00,'',0.00,'2021-01-18','1900-01-01',3900.00,50.00),('1249',12920393,'05/02/2021',1058.00,'',0.00,'2021-02-05','1900-01-01',1000.00,50.00),('0108',12923843,'27/01/2021',558.00,'',0.00,'2021-01-27','1900-01-01',500.00,50.00),('0289',12923900,'04/12/2021',2787.00,'',0.00,'2021-12-04','1900-01-01',2700.00,75.00),('6584',12927133,'23/02/2021',3658.00,'',0.00,'2021-02-23','1900-01-01',3600.00,50.00),('0WVW',12942140,'14/07/2021',587.00,'',0.00,'2021-07-14','1900-01-01',500.00,75.00),('0WVW',12942165,'10/02/2021',1258.00,'',0.00,'2021-02-10','1900-01-01',1200.00,50.00),('0WVW',12942272,'03/02/2021',1258.00,'',0.00,'2021-02-03','1900-01-01',1200.00,50.00),('0WVW',12942314,'23/01/2021',1258.00,'',0.00,'2021-01-23','1900-01-01',1200.00,50.00),('0WVW',12942389,'18/02/2021',1258.00,'',0.00,'2021-02-18','1900-01-01',1200.00,50.00),('0WVW',12942421,'18/01/2021',1758.00,'',0.00,'2021-01-18','1900-01-01',1700.00,50.00),('0WVW',12942504,'22/06/2021',3087.00,'',0.00,'2021-06-22','1900-01-01',3000.00,75.00),('0WVW',12942652,'19/01/2021',1258.00,'',0.00,'2021-01-19','1900-01-01',1200.00,50.00),('0WVW',12943072,'05/07/2021',3087.00,'',0.00,'2021-07-05','1900-01-01',3000.00,75.00),('0WVW',12943262,'20/04/2021',1258.00,'',0.00,'2021-04-20','1900-01-01',1200.00,50.00),('0WVW',12943361,'13/07/2021',2087.00,'',0.00,'2021-07-13','1900-01-01',2000.00,75.00),('0WVW',12943411,'25/06/2021',1587.00,'',0.00,'2021-06-25','1900-01-01',1500.00,75.00),('0WVW',12943601,'31/07/2021',3087.00,'',0.00,'2021-07-31','1900-01-01',3000.00,75.00),('0WVW',12943767,'29/06/2021',3087.00,'',0.00,'2021-06-29','1900-01-01',3000.00,75.00),('0WVW',12943767,'13/02/2021',1258.00,'',0.00,'2021-02-13','1900-01-01',1200.00,50.00),('0WVW',12944096,'12/02/2021',1258.00,'',0.00,'2021-02-12','1900-01-01',1200.00,50.00),('0WVW',12944351,'17/06/2021',2087.00,'',0.00,'2021-06-17','1900-01-01',2000.00,75.00),('0WVW',12944419,'09/08/2021',3087.00,'08/10/2021',3057.50,'2021-08-09','2021-10-08',3000.00,75.00),('0WVW',12944450,'20/01/2021',1258.00,'',0.00,'2021-01-20','1900-01-01',1200.00,50.00),('0WVW',12944500,'20/07/2021',3087.00,'17/09/2021',3085.70,'2021-07-20','2021-09-17',3000.00,75.00),('0WVW',12944658,'14/03/2021',1258.00,'',0.00,'2021-03-14','1900-01-01',1200.00,50.00),('0WVW',12944658,'19/01/2021',1258.00,'',0.00,'2021-01-19','1900-01-01',1200.00,50.00),('0WVW',12944856,'17/06/2021',3087.00,'',0.00,'2021-06-17','1900-01-01',3000.00,75.00),('0WVW',12945069,'24/06/2021',1287.00,'',0.00,'2021-06-24','1900-01-01',1200.00,75.00),('0WVW',12945069,'18/02/2021',1258.00,'',0.00,'2021-02-18','1900-01-01',1200.00,50.00),('0WVW',12945192,'29/06/2021',1287.00,'',0.00,'2021-06-29','1900-01-01',1200.00,75.00),('0WVW',12945366,'05/02/2021',1258.00,'',0.00,'2021-02-05','1900-01-01',1200.00,50.00),('0WVW',12945895,'06/02/2021',858.00,'',0.00,'2021-02-06','1900-01-01',800.00,50.00),('0WVW',12945994,'23/06/2021',3087.00,'',0.00,'2021-06-23','1900-01-01',3000.00,75.00),('0WVW',12945994,'11/02/2021',1258.00,'',0.00,'2021-02-11','1900-01-01',1200.00,50.00),('0WVW',12946182,'30/07/2021',3087.00,'',0.00,'2021-07-30','1900-01-01',3000.00,75.00),('0WVW',12946190,'30/01/2021',2558.00,'',0.00,'2021-01-30','1900-01-01',2500.00,50.00),('0WVW',12946331,'25/03/2021',1258.00,'',0.00,'2021-03-25','1900-01-01',1200.00,50.00),('0WVW',12946471,'22/07/2021',3087.00,'',0.00,'2021-07-22','1900-01-01',3000.00,75.00),('0WVW',12947065,'06/04/2021',1258.00,'',0.00,'2021-04-06','1900-01-01',1200.00,50.00),('0WVW',12947461,'28/05/2021',1087.00,'',0.00,'2021-05-28','1900-01-01',1000.00,75.00),('0WVW',12947743,'13/08/2021',3087.00,'13/10/2021',3043.33,'2021-08-13','2021-10-13',3000.00,75.00),('0WVW',12947966,'13/01/2021',1258.00,'',0.00,'2021-01-13','1900-01-01',1200.00,50.00),('0WVW',12947974,'06/01/2021',4058.00,'',0.00,'2021-01-06','1900-01-01',4000.00,50.00),('0WVW',12948238,'16/01/2021',1258.00,'',0.00,'2021-01-16','1900-01-01',1200.00,50.00),('0WVW',12948246,'02/03/2021',1258.00,'',0.00,'2021-03-02','1900-01-01',1200.00,50.00),('0WVW',12948386,'20/07/2021',3087.00,'',0.00,'2021-07-20','1900-01-01',3000.00,75.00),('0WVW',12948568,'15/02/2021',1258.00,'',0.00,'2021-02-15','1900-01-01',1200.00,50.00),('0WVW',12948675,'26/07/2021',1087.00,'24/09/2021',1063.97,'2021-07-26','2021-09-24',1000.00,75.00),('0WVW',12948907,'20/01/2021',1258.00,'',0.00,'2021-01-20','1900-01-01',1200.00,50.00),('0WVW',12949004,'16/08/2021',3087.00,'',0.00,'2021-08-16','1900-01-01',3000.00,75.00),('0WVW',12949269,'17/01/2021',1258.00,'',0.00,'2021-01-17','1900-01-01',1200.00,50.00),('2448',12950713,'24/12/2021',1787.00,'',0.00,'2021-12-24','1900-01-01',1700.00,75.00),('0289',12950853,'20/05/2021',1258.00,'',0.00,'2021-05-20','1900-01-01',1171.00,75.00),('0WVW',12958633,'25/06/2021',1087.00,'',0.00,'2021-06-25','1900-01-01',1000.00,75.00),('0WVW',12959250,'16/02/2021',1258.00,'',0.00,'2021-02-16','1900-01-01',1200.00,50.00),('0WVW',12959318,'27/01/2021',658.00,'',0.00,'2021-01-27','1900-01-01',600.00,50.00),('0WVW',12959607,'22/04/2021',1258.00,'',0.00,'2021-04-22','1900-01-01',1200.00,50.00),('11HT',12959722,'08/11/2021',1087.00,'',0.00,'2021-11-08','1900-01-01',1000.00,75.00),('0WVW',12959722,'11/03/2021',1258.00,'12/05/2021',1256.32,'2021-03-11','2021-05-12',1200.00,50.00),('0WVW',12960506,'18/01/2021',1258.00,'',0.00,'2021-01-18','1900-01-01',1200.00,50.00),('0WVW',12960662,'18/06/2021',3087.00,'',0.00,'2021-06-18','1900-01-01',3000.00,75.00),('0WVW',12960860,'23/07/2021',3087.00,'',0.00,'2021-07-23','1900-01-01',3000.00,75.00),('0WVW',12961009,'04/02/2021',1258.00,'',0.00,'2021-02-04','1900-01-01',1200.00,50.00),('0WVW',12961090,'24/02/2021',1258.00,'',0.00,'2021-02-24','1900-01-01',1200.00,50.00),('0WVW',12961892,'06/07/2021',1587.00,'',0.00,'2021-07-06','1900-01-01',1500.00,75.00),('0WVW',12961918,'22/01/2021',1258.00,'',0.00,'2021-01-22','1900-01-01',1200.00,50.00),('0WVW',12962072,'20/07/2021',3087.00,'',0.00,'2021-07-20','1900-01-01',3000.00,75.00),('0WVW',12962270,'19/04/2021',1258.00,'',0.00,'2021-04-19','1900-01-01',1200.00,50.00),('0WVW',12962320,'14/05/2021',1258.00,'',0.00,'2021-05-14','1900-01-01',1200.00,50.00),('0WVW',12962320,'17/02/2021',1258.00,'',0.00,'2021-02-17','1900-01-01',1200.00,50.00),('0WVW',12962619,'08/03/2021',558.00,'',0.00,'2021-03-08','1900-01-01',500.00,50.00),('0WVW',12962957,'13/06/2021',6587.00,'',0.00,'2021-06-13','1900-01-01',6500.00,75.00),('0WVW',12963104,'28/05/2021',687.00,'',0.00,'2021-05-28','1900-01-01',600.00,75.00),('0R53',12970976,'12/06/2021',1287.00,'',0.00,'2021-06-12','1900-01-01',1200.00,75.00),('2117',12978466,'30/06/2021',1087.00,'',0.00,'2021-06-30','1900-01-01',1000.00,75.00),('2117',12978466,'04/03/2021',858.00,'',0.00,'2021-03-04','1900-01-01',800.00,50.00),('4505',13006580,'11/09/2021',587.00,'',0.00,'2021-09-11','1900-01-01',500.00,75.00),('0ZX4',13014618,'17/08/2021',1187.00,'',0.00,'2021-08-17','1900-01-01',1100.00,75.00),('0NSX',13019054,'18/10/2021',1987.00,'',0.00,'2021-10-18','1900-01-01',1900.00,75.00),('0RKP',13022595,'26/02/2021',558.00,'',0.00,'2021-02-26','1900-01-01',500.00,50.00),('17DY',13023015,'17/07/2021',2687.00,'03/09/2021',2683.86,'2021-07-17','2021-09-03',2600.00,75.00),('1FHQ',13027677,'06/09/2021',6587.00,'',0.00,'2021-09-06','1900-01-01',6500.00,75.00),('2741',13041694,'25/07/2021',687.00,'',0.00,'2021-07-25','1900-01-01',600.00,75.00),('07R0',13042346,'04/01/2021',2058.00,'',0.00,'2021-01-04','1900-01-01',2000.00,50.00),('2163',13050703,'29/01/2021',1658.00,'',0.00,'2021-01-29','1900-01-01',1600.00,50.00),('0WVW',13053202,'28/02/2021',1258.00,'28/04/2021',1215.88,'2021-02-28','2021-04-28',1200.00,50.00),('0WVW',13053434,'17/06/2021',3087.00,'',0.00,'2021-06-17','1900-01-01',3000.00,75.00),('0RLP',13054895,'10/02/2021',558.00,'',0.00,'2021-02-10','1900-01-01',500.00,50.00),('0RLP',13054986,'07/01/2021',858.00,'',0.00,'2021-01-07','1900-01-01',800.00,50.00),('0RLP',13055330,'17/02/2021',858.00,'',0.00,'2021-02-17','1900-01-01',800.00,50.00),('0645',13060207,'17/10/2021',637.00,'',0.00,'2021-10-17','1900-01-01',550.00,75.00),('6617',13066568,'15/01/2021',1958.00,'04/03/2021',1947.12,'2021-01-15','2021-03-04',1900.00,50.00),('0RIF',13089172,'01/06/2021',1187.00,'',0.00,'2021-06-01','1900-01-01',1100.00,75.00),('0Z8X',13092689,'09/10/2021',787.00,'',0.00,'2021-10-09','1900-01-01',700.00,75.00),('0Z8X',13092689,'17/09/2021',787.00,'',0.00,'2021-09-17','1900-01-01',700.00,75.00),('4442',13097886,'02/02/2021',2058.00,'',0.00,'2021-02-02','1900-01-01',2000.00,50.00),('0XQR',13114681,'19/08/2021',1587.00,'',0.00,'2021-08-19','1900-01-01',1500.00,75.00),('6275',13116306,'02/09/2021',587.00,'',0.00,'2021-09-02','1900-01-01',500.00,75.00),('0086',13116322,'08/01/2021',858.00,'',0.00,'2021-01-08','1900-01-01',800.00,50.00),('1B9D',13131354,'25/06/2021',1087.00,'',0.00,'2021-06-25','1900-01-01',1000.00,75.00),('1B9D',13131461,'04/01/2021',558.00,'',0.00,'2021-01-04','1900-01-01',500.00,50.00),('1BUJ',13132444,'19/02/2021',1558.00,'',0.00,'2021-02-19','1900-01-01',1500.00,50.00),('1BUJ',13132444,'29/01/2021',1058.00,'',0.00,'2021-01-29','1900-01-01',1000.00,50.00),('5760',13145545,'09/10/2021',2587.00,'',0.00,'2021-10-09','1900-01-01',2500.00,75.00),('0248',13151253,'27/12/2021',2087.00,'',0.00,'2021-12-27','1900-01-01',2000.00,75.00),('0RR6',13159900,'16/11/2021',787.00,'',0.00,'2021-11-16','1900-01-01',700.00,75.00),('0RR6',13160007,'07/04/2021',558.00,'',0.00,'2021-04-07','1900-01-01',500.00,50.00),('0RLP',13160551,'26/11/2021',3087.00,'',0.00,'2021-11-26','1900-01-01',3000.00,75.00),('3044',13164124,'01/10/2021',2087.00,'',0.00,'2021-10-01','1900-01-01',2000.00,75.00),('0U3V',13171624,'21/06/2021',1987.00,'',0.00,'2021-06-21','1900-01-01',1900.00,75.00),('0U3V',13171624,'28/05/2021',1587.00,'',0.00,'2021-05-28','1900-01-01',1500.00,75.00),('0O7L',13175013,'21/09/2021',987.00,'',0.00,'2021-09-21','1900-01-01',900.00,75.00),('0U3V',13182985,'05/12/2021',1187.00,'',0.00,'2021-12-05','1900-01-01',1100.00,75.00),('0U3V',13183264,'26/11/2021',987.00,'',0.00,'2021-11-26','1900-01-01',900.00,75.00),('0U3V',13183397,'15/10/2021',587.00,'',0.00,'2021-10-15','1900-01-01',500.00,75.00),('0WVW',13192778,'03/07/2021',3087.00,'',0.00,'2021-07-03','1900-01-01',3000.00,75.00),('0WVW',13192778,'13/02/2021',2258.00,'',0.00,'2021-02-13','1900-01-01',2200.00,50.00),('0RSP',13196837,'26/10/2021',1187.00,'',0.00,'2021-10-26','1900-01-01',1100.00,75.00),('0RAW',13215330,'04/01/2021',2058.00,'',0.00,'2021-01-04','1900-01-01',2000.00,50.00),('5233',13216650,'08/01/2021',658.00,'',0.00,'2021-01-08','1900-01-01',600.00,50.00),('1019',13235668,'18/07/2021',1687.00,'',0.00,'2021-07-18','1900-01-01',1600.00,75.00),('1019',13235676,'12/05/2021',558.00,'',0.00,'2021-05-12','1900-01-01',500.00,50.00),('11XR',13240320,'19/12/2021',587.00,'',0.00,'2021-12-19','1900-01-01',500.00,75.00),('0RUM',13243621,'10/01/2021',858.00,'',0.00,'2021-01-10','1900-01-01',800.00,50.00),('1ELO',13247150,'05/12/2021',1887.00,'',0.00,'2021-12-05','1900-01-01',1800.00,75.00),('0PSC',13264056,'27/10/2021',2187.00,'',0.00,'2021-10-27','1900-01-01',2100.00,75.00),('0PSC',13264056,'07/10/2021',2087.00,'',0.00,'2021-10-07','1900-01-01',2000.00,75.00),('14LM',13270103,'14/09/2021',787.00,'',0.00,'2021-09-14','1900-01-01',700.00,75.00),('0517',13277538,'01/06/2021',3087.00,'',0.00,'2021-06-01','1900-01-01',3000.00,75.00),('0ZWS',13277546,'02/12/2021',687.00,'',0.00,'2021-12-02','1900-01-01',600.00,75.00),('1317',13278312,'16/07/2021',687.00,'',0.00,'2021-07-16','1900-01-01',600.00,75.00),('8034',13282595,'21/12/2021',587.00,'',0.00,'2021-12-21','1900-01-01',500.00,75.00),('12I3',13287719,'22/10/2021',2387.00,'',0.00,'2021-10-22','1900-01-01',2300.00,75.00),('0405',13306063,'02/09/2021',787.00,'',0.00,'2021-09-02','1900-01-01',700.00,75.00),('0419',13306162,'05/02/2021',1158.00,'',0.00,'2021-02-05','1900-01-01',1100.00,50.00),('0RPG',13306345,'21/08/2021',687.00,'',0.00,'2021-08-21','1900-01-01',600.00,75.00),('126U',13307079,'09/01/2021',758.00,'',0.00,'2021-01-09','1900-01-01',700.00,50.00),('126U',13307079,'05/01/2021',758.00,'',0.00,'2021-01-05','1900-01-01',700.00,50.00),('0404',13316138,'02/07/2021',2887.00,'',0.00,'2021-07-02','1900-01-01',2800.00,75.00),('2741',13321542,'27/07/2021',587.00,'',0.00,'2021-07-27','1900-01-01',500.00,75.00),('0QON',13323118,'01/07/2021',687.00,'',0.00,'2021-07-01','1900-01-01',600.00,75.00),('0QON',13323118,'05/02/2021',558.00,'',0.00,'2021-02-05','1900-01-01',500.00,50.00),('19UU',13344874,'19/12/2021',1087.00,'',0.00,'2021-12-19','1900-01-01',1000.00,75.00),('0WVW',13357629,'23/06/2021',1887.00,'',0.00,'2021-06-23','1900-01-01',1800.00,75.00),('0WVW',13357793,'18/06/2021',3087.00,'',0.00,'2021-06-18','1900-01-01',3000.00,75.00),('0WVW',13357793,'15/01/2021',1258.00,'',0.00,'2021-01-15','1900-01-01',1200.00,50.00),('0RRD',13358254,'17/12/2021',587.00,'',0.00,'2021-12-17','1900-01-01',500.00,75.00),('0RUV',13359591,'15/01/2021',758.00,'',0.00,'2021-01-15','1900-01-01',700.00,50.00),('0XYU',13359740,'28/07/2021',587.00,'',0.00,'2021-07-28','1900-01-01',500.00,75.00),('0RUV',13359773,'27/07/2021',1587.00,'',0.00,'2021-07-27','1900-01-01',1500.00,75.00),('0RUV',13359773,'15/02/2021',1058.00,'',0.00,'2021-02-15','1900-01-01',1000.00,50.00),('15MT',13361852,'07/05/2021',2058.00,'',0.00,'2021-05-07','1900-01-01',2000.00,50.00),('0RYQ',13362744,'27/09/2021',587.00,'',0.00,'2021-09-27','1900-01-01',500.00,75.00),('0RYQ',13362744,'22/01/2021',858.00,'',0.00,'2021-01-22','1900-01-01',800.00,50.00),('0RYQ',13362793,'06/02/2021',558.00,'',0.00,'2021-02-06','1900-01-01',500.00,50.00),('0NO4',13377627,'12/07/2021',587.00,'',0.00,'2021-07-12','1900-01-01',500.00,75.00),('1195',13383377,'21/07/2021',3587.00,'',0.00,'2021-07-21','1900-01-01',3500.00,75.00),('1IEO',13388681,'20/12/2021',1587.00,'',0.00,'2021-12-20','1900-01-01',1500.00,75.00),('0XST',13392857,'23/08/2021',587.00,'',0.00,'2021-08-23','1900-01-01',500.00,75.00),('14I6',13393079,'21/12/2021',787.00,'',0.00,'2021-12-21','1900-01-01',700.00,75.00),('175Z',13395850,'15/05/2021',1758.00,'',0.00,'2021-05-15','1900-01-01',1671.00,75.00),('0QZX',13408422,'25/01/2021',4058.00,'',0.00,'2021-01-25','1900-01-01',4000.00,50.00),('1B9D',13410964,'06/12/2021',787.00,'',0.00,'2021-12-06','1900-01-01',700.00,75.00),('1B9D',13410964,'13/09/2021',587.00,'',0.00,'2021-09-13','1900-01-01',500.00,75.00),('1B9D',13410964,'07/09/2021',587.00,'',0.00,'2021-09-07','1900-01-01',500.00,75.00),('1609',13412457,'01/12/2021',887.00,'',0.00,'2021-12-01','1900-01-01',800.00,75.00),('0PHG',13416383,'06/12/2021',1087.00,'',0.00,'2021-12-06','1900-01-01',1000.00,75.00),('0PHG',13416383,'09/05/2021',858.00,'',0.00,'2021-05-09','1900-01-01',800.00,50.00),('8350',13426200,'09/12/2021',4587.00,'',0.00,'2021-12-09','1900-01-01',4500.00,75.00),('6410',13430350,'16/07/2021',787.00,'25/08/2021',767.68,'2021-07-16','2021-08-25',700.00,75.00),('6410',13430350,'16/01/2021',558.00,'',0.00,'2021-01-16','1900-01-01',500.00,50.00),('6412',13430368,'30/04/2021',758.00,'',0.00,'2021-04-30','1900-01-01',700.00,50.00),('0RVN',13431721,'26/10/2021',1087.00,'',0.00,'2021-10-26','1900-01-01',1000.00,75.00),('0RVN',13431721,'04/06/2021',987.00,'',0.00,'2021-06-04','1900-01-01',900.00,75.00),('0PW6',13450028,'17/08/2021',787.00,'',0.00,'2021-08-17','1900-01-01',700.00,75.00),('0PW6',13450382,'24/06/2021',1487.00,'',0.00,'2021-06-24','1900-01-01',1400.00,75.00),('0S29',13457734,'28/11/2021',687.00,'07/01/2022',677.17,'2021-11-28','2022-01-07',600.00,75.00),('0419',13471172,'13/08/2021',687.00,'',0.00,'2021-08-13','1900-01-01',600.00,75.00),('0WVW',13471289,'20/05/2021',1258.00,'',0.00,'2021-05-20','1900-01-01',1171.00,75.00),('9292',13483342,'07/12/2021',1087.00,'',0.00,'2021-12-07','1900-01-01',1000.00,75.00),('9292',13483342,'22/02/2021',1558.00,'',0.00,'2021-02-22','1900-01-01',1500.00,50.00),('10T1',13502711,'30/12/2021',687.00,'',0.00,'2021-12-30','1900-01-01',600.00,75.00),('0S23',13510680,'30/11/2021',587.00,'',0.00,'2021-11-30','1900-01-01',500.00,75.00),('0S23',13510680,'13/05/2021',558.00,'',0.00,'2021-05-13','1900-01-01',500.00,50.00),('0RSF',13515937,'08/01/2021',558.00,'',0.00,'2021-01-08','1900-01-01',500.00,50.00),('0RSF',13516133,'03/01/2021',558.00,'',0.00,'2021-01-03','1900-01-01',500.00,50.00),('0RSF',13516232,'01/02/2021',558.00,'',0.00,'2021-02-01','1900-01-01',500.00,50.00),('0RSF',13516471,'05/02/2021',558.00,'',0.00,'2021-02-05','1900-01-01',500.00,50.00),('0WPT',13516547,'18/03/2021',958.00,'',0.00,'2021-03-18','1900-01-01',900.00,50.00),('0RSF',13516638,'21/10/2021',887.00,'',0.00,'2021-10-21','1900-01-01',800.00,75.00),('0RSF',13516638,'11/10/2021',787.00,'',0.00,'2021-10-11','1900-01-01',700.00,75.00),('0RSF',13516638,'09/02/2021',558.00,'',0.00,'2021-02-09','1900-01-01',500.00,50.00),('0RSF',13516703,'05/10/2021',1087.00,'',0.00,'2021-10-05','1900-01-01',1000.00,75.00),('0RSF',13517040,'13/12/2021',1087.00,'',0.00,'2021-12-13','1900-01-01',1000.00,75.00),('0RSF',13517446,'01/03/2021',958.00,'',0.00,'2021-03-01','1900-01-01',900.00,50.00),('0RSF',13517537,'23/01/2021',1858.00,'',0.00,'2021-01-23','1900-01-01',1800.00,50.00),('0RSF',13517933,'05/11/2021',1687.00,'',0.00,'2021-11-05','1900-01-01',1600.00,75.00),('0RSF',13518188,'05/12/2021',1487.00,'',0.00,'2021-12-05','1900-01-01',1400.00,75.00),('0RSF',13518220,'13/08/2021',3087.00,'',0.00,'2021-08-13','1900-01-01',3000.00,75.00),('0RSF',13518345,'22/11/2021',1187.00,'',0.00,'2021-11-22','1900-01-01',1100.00,75.00),('0RSF',13518410,'11/11/2021',1587.00,'',0.00,'2021-11-11','1900-01-01',1500.00,75.00),('0RSF',13518410,'08/01/2021',1258.00,'',0.00,'2021-01-08','1900-01-01',1200.00,50.00),('0RSF',13518501,'16/04/2021',558.00,'',0.00,'2021-04-16','1900-01-01',500.00,50.00),('0RSF',13518501,'20/01/2021',558.00,'',0.00,'2021-01-20','1900-01-01',500.00,50.00),('0RSF',13518683,'01/12/2021',587.00,'',0.00,'2021-12-01','1900-01-01',500.00,75.00),('0RSF',13519053,'03/11/2021',787.00,'',0.00,'2021-11-03','1900-01-01',700.00,75.00),('0WPT',13519178,'27/11/2021',1887.00,'',0.00,'2021-11-27','1900-01-01',1800.00,75.00),('0RSF',13519178,'19/02/2021',958.00,'',0.00,'2021-02-19','1900-01-01',900.00,50.00),('0RSF',13519400,'21/12/2021',1187.00,'',0.00,'2021-12-21','1900-01-01',1100.00,75.00),('0RSF',13519442,'11/12/2021',987.00,'',0.00,'2021-12-11','1900-01-01',900.00,75.00),('0RSF',13519863,'09/03/2021',658.00,'',0.00,'2021-03-09','1900-01-01',600.00,50.00),('0RSF',13519889,'20/11/2021',1087.00,'',0.00,'2021-11-20','1900-01-01',1000.00,75.00),('0RSF',13519947,'16/01/2021',558.00,'',0.00,'2021-01-16','1900-01-01',500.00,50.00),('0WPT',13520077,'11/12/2021',1087.00,'',0.00,'2021-12-11','1900-01-01',1000.00,75.00),('0RSF',13520606,'09/12/2021',587.00,'',0.00,'2021-12-09','1900-01-01',500.00,75.00),('0RSF',13520606,'30/03/2021',558.00,'',0.00,'2021-03-30','1900-01-01',500.00,50.00),('0RSF',13520788,'21/11/2021',1087.00,'',0.00,'2021-11-21','1900-01-01',1000.00,75.00),('0RSF',13520788,'04/02/2021',858.00,'',0.00,'2021-02-04','1900-01-01',800.00,50.00),('0RSF',13520986,'25/07/2021',1087.00,'',0.00,'2021-07-25','1900-01-01',1000.00,75.00),('0RSF',13521075,'11/11/2021',1787.00,'',0.00,'2021-11-11','1900-01-01',1700.00,75.00),('0RSF',13521422,'22/04/2021',658.00,'',0.00,'2021-04-22','1900-01-01',600.00,50.00),('0WPT',13521562,'11/09/2021',787.00,'',0.00,'2021-09-11','1900-01-01',700.00,75.00),('0RSF',13522040,'08/05/2021',1058.00,'',0.00,'2021-05-08','1900-01-01',1000.00,50.00),('0RSF',13522180,'08/01/2021',658.00,'',0.00,'2021-01-08','1900-01-01',600.00,50.00),('0RSF',13522446,'08/03/2021',1258.00,'',0.00,'2021-03-08','1900-01-01',1200.00,50.00),('0RSF',13522487,'21/07/2021',887.00,'',0.00,'2021-07-21','1900-01-01',800.00,75.00),('0RSF',13522511,'04/11/2021',787.00,'',0.00,'2021-11-04','1900-01-01',700.00,75.00),('0WPT',13522859,'09/01/2021',658.00,'',0.00,'2021-01-09','1900-01-01',600.00,50.00),('0RSF',13523238,'27/07/2021',787.00,'',0.00,'2021-07-27','1900-01-01',700.00,75.00),('0RSF',13523279,'31/08/2021',1587.00,'',0.00,'2021-08-31','1900-01-01',1500.00,75.00),('0RSF',13523428,'04/10/2021',587.00,'',0.00,'2021-10-04','1900-01-01',500.00,75.00),('0RSF',13523428,'07/01/2021',558.00,'',0.00,'2021-01-07','1900-01-01',500.00,50.00),('0RSF',13523436,'23/12/2021',1287.00,'',0.00,'2021-12-23','1900-01-01',1200.00,75.00),('0RSF',13523550,'04/02/2021',558.00,'',0.00,'2021-02-04','1900-01-01',500.00,50.00),('0RSF',13523832,'20/11/2021',1087.00,'',0.00,'2021-11-20','1900-01-01',1000.00,75.00),('0RSF',13523964,'01/12/2021',687.00,'',0.00,'2021-12-01','1900-01-01',600.00,75.00),('0RSF',13524046,'19/01/2021',658.00,'',0.00,'2021-01-19','1900-01-01',600.00,50.00),('0RSF',13524186,'23/11/2021',1387.00,'',0.00,'2021-11-23','1900-01-01',1300.00,75.00),('0RSF',13524236,'20/12/2021',587.00,'',0.00,'2021-12-20','1900-01-01',500.00,75.00),('0RSF',13524574,'07/01/2021',758.00,'',0.00,'2021-01-07','1900-01-01',700.00,50.00),('0RSF',13524657,'11/11/2021',787.00,'',0.00,'2021-11-11','1900-01-01',700.00,75.00),('0RSF',13524657,'19/02/2021',658.00,'',0.00,'2021-02-19','1900-01-01',600.00,50.00),('0RSF',13524970,'20/12/2021',687.00,'',0.00,'2021-12-20','1900-01-01',600.00,75.00),('0RSF',13525720,'04/12/2021',1087.00,'',0.00,'2021-12-04','1900-01-01',1000.00,75.00),('0RSF',13525720,'20/10/2021',587.00,'',0.00,'2021-10-20','1900-01-01',500.00,75.00),('0RSF',13525720,'10/08/2021',987.00,'',0.00,'2021-08-10','1900-01-01',900.00,75.00),('0RSF',13526223,'01/09/2021',1187.00,'',0.00,'2021-09-01','1900-01-01',1100.00,75.00),('0RSF',13526496,'01/09/2021',787.00,'',0.00,'2021-09-01','1900-01-01',700.00,75.00),('0RSF',13526496,'03/03/2021',558.00,'',0.00,'2021-03-03','1900-01-01',500.00,50.00),('0RSF',13526579,'21/01/2021',1258.00,'',0.00,'2021-01-21','1900-01-01',1200.00,50.00),('0RSF',13526579,'11/01/2021',1258.00,'',0.00,'2021-01-11','1900-01-01',1200.00,50.00),('0WPT',13526660,'11/12/2021',787.00,'',0.00,'2021-12-11','1900-01-01',700.00,75.00),('0RSF',13526660,'03/03/2021',558.00,'',0.00,'2021-03-03','1900-01-01',500.00,50.00),('0RSF',13526728,'03/02/2021',558.00,'',0.00,'2021-02-03','1900-01-01',500.00,50.00),('0WPT',13526751,'16/08/2021',987.00,'',0.00,'2021-08-16','1900-01-01',900.00,75.00),('0RSF',13526801,'21/11/2021',687.00,'',0.00,'2021-11-21','1900-01-01',600.00,75.00),('0RSF',13526801,'20/01/2021',1458.00,'',0.00,'2021-01-20','1900-01-01',1400.00,50.00),('0RSF',13526934,'30/11/2021',887.00,'',0.00,'2021-11-30','1900-01-01',800.00,75.00),('0WPT',13527007,'18/01/2021',558.00,'',0.00,'2021-01-18','1900-01-01',500.00,50.00),('1377',13527874,'06/12/2021',5987.00,'',0.00,'2021-12-06','1900-01-01',5900.00,75.00),('1494',13541750,'18/01/2021',858.00,'',0.00,'2021-01-18','1900-01-01',800.00,50.00),('07UB',13542428,'04/01/2021',1558.00,'',0.00,'2021-01-04','1900-01-01',1500.00,50.00),('0QDL',13542758,'26/01/2021',558.00,'',0.00,'2021-01-26','1900-01-01',500.00,50.00),('1019',13557285,'01/12/2021',2987.00,'',0.00,'2021-12-01','1900-01-01',2900.00,75.00),('0S5X',13566856,'12/04/2021',1058.00,'',0.00,'2021-04-12','1900-01-01',1000.00,50.00),('3148',13579784,'06/12/2021',787.00,'',0.00,'2021-12-06','1900-01-01',700.00,75.00),('0108',13580709,'25/07/2021',987.00,'',0.00,'2021-07-25','1900-01-01',900.00,75.00),('175Z',13592183,'12/03/2021',958.00,'',0.00,'2021-03-12','1900-01-01',900.00,50.00),('1F68',13593033,'05/10/2021',787.00,'',0.00,'2021-10-05','1900-01-01',700.00,75.00),('16QZ',13606421,'03/12/2021',1087.00,'',0.00,'2021-12-03','1900-01-01',1000.00,75.00),('19A8',13637962,'30/12/2021',987.00,'',0.00,'2021-12-30','1900-01-01',900.00,75.00),('0289',13638473,'14/01/2021',1358.00,'',0.00,'2021-01-14','1900-01-01',1300.00,50.00),('0SAB',13642921,'30/05/2021',887.00,'',0.00,'2021-05-30','1900-01-01',800.00,75.00),('0P4F',13646377,'15/01/2021',1158.00,'',0.00,'2021-01-15','1900-01-01',1100.00,50.00),('0NRV',13651138,'02/12/2021',1087.00,'',0.00,'2021-12-02','1900-01-01',1000.00,75.00),('0SAB',13652169,'19/07/2021',3087.00,'',0.00,'2021-07-19','1900-01-01',3000.00,75.00),('7861',13659289,'02/12/2021',1487.00,'',0.00,'2021-12-02','1900-01-01',1400.00,75.00),('9292',13666375,'07/08/2021',1587.00,'',0.00,'2021-08-07','1900-01-01',1500.00,75.00),('9292',13666375,'28/07/2021',1587.00,'',0.00,'2021-07-28','1900-01-01',1500.00,75.00),('9757',13670260,'07/08/2021',1687.00,'',0.00,'2021-08-07','1900-01-01',1600.00,75.00),('1E21',13677232,'02/02/2021',1058.00,'',0.00,'2021-02-02','1900-01-01',1000.00,50.00),('0WVW',13699848,'13/02/2021',758.00,'',0.00,'2021-02-13','1900-01-01',700.00,50.00),('0WVW',13701115,'18/06/2021',3087.00,'',0.00,'2021-06-18','1900-01-01',3000.00,75.00),('0WVW',13701115,'18/01/2021',1258.00,'',0.00,'2021-01-18','1900-01-01',1200.00,50.00),('0SDT',13708391,'24/09/2021',1687.00,'',0.00,'2021-09-24','1900-01-01',1600.00,75.00),('0SDT',13709241,'06/11/2021',2987.00,'',0.00,'2021-11-06','1900-01-01',2900.00,75.00),('0SDT',13709290,'19/09/2021',1087.00,'',0.00,'2021-09-19','1900-01-01',1000.00,75.00),('0SDT',13709423,'31/12/2021',3487.00,'',0.00,'2021-12-31','1900-01-01',3400.00,75.00),('0SDT',13709423,'17/12/2021',3487.00,'',0.00,'2021-12-17','1900-01-01',3400.00,75.00),('0SDT',13709464,'07/01/2021',658.00,'',0.00,'2021-01-07','1900-01-01',600.00,50.00),('0298',13709688,'31/12/2021',1087.00,'',0.00,'2021-12-31','1900-01-01',1000.00,75.00),('0SDT',13710546,'13/04/2021',3058.00,'',0.00,'2021-04-13','1900-01-01',3000.00,50.00),('0SDT',13710652,'01/10/2021',587.00,'',0.00,'2021-10-01','1900-01-01',500.00,75.00),('3132',13711049,'06/01/2021',1258.00,'',0.00,'2021-01-06','1900-01-01',1200.00,50.00),('1AIF',13731039,'18/06/2021',1587.00,'',0.00,'2021-06-18','1900-01-01',1500.00,75.00),('0SF1',13734074,'17/12/2021',2187.00,'',0.00,'2021-12-17','1900-01-01',2100.00,75.00),('0SEV',13734348,'16/12/2021',3587.00,'',0.00,'2021-12-16','1900-01-01',3500.00,75.00),('0SEV',13734389,'21/09/2021',2087.00,'',0.00,'2021-09-21','1900-01-01',2000.00,75.00),('0SEV',13734389,'30/01/2021',2658.00,'',0.00,'2021-01-30','1900-01-01',2600.00,50.00),('0SEV',13734769,'30/09/2021',2387.00,'',0.00,'2021-09-30','1900-01-01',2300.00,75.00),('0SEV',13734835,'15/01/2021',3658.00,'',0.00,'2021-01-15','1900-01-01',3600.00,50.00),('0SEV',13734843,'17/08/2021',4087.00,'',0.00,'2021-08-17','1900-01-01',4000.00,75.00),('0SEV',13734959,'17/12/2021',1687.00,'',0.00,'2021-12-17','1900-01-01',1600.00,75.00),('0SEV',13734967,'19/07/2021',3087.00,'',0.00,'2021-07-19','1900-01-01',3000.00,75.00),('0SAQ',13750914,'18/03/2021',1258.00,'',0.00,'2021-03-18','1900-01-01',1200.00,50.00),('0SAQ',13751045,'04/12/2021',2487.00,'',0.00,'2021-12-04','1900-01-01',2400.00,75.00),('0SAQ',13751045,'14/02/2021',1058.00,'',0.00,'2021-02-14','1900-01-01',1000.00,50.00),('0SAQ',13751219,'21/01/2021',1558.00,'',0.00,'2021-01-21','1900-01-01',1500.00,50.00),('0VI4',13755103,'15/12/2021',4287.00,'',0.00,'2021-12-15','1900-01-01',4200.00,75.00),('0RAW',13762539,'23/12/2021',2687.00,'',0.00,'2021-12-23','1900-01-01',2600.00,75.00),('0NL1',13773288,'25/11/2021',1287.00,'',0.00,'2021-11-25','1900-01-01',1200.00,75.00),('0SEX',13776158,'22/09/2021',2787.00,'',0.00,'2021-09-22','1900-01-01',2700.00,75.00),('0SEX',13776315,'18/09/2021',2287.00,'',0.00,'2021-09-18','1900-01-01',2200.00,75.00),('0TEO',13776364,'20/01/2021',1058.00,'',0.00,'2021-01-20','1900-01-01',1000.00,50.00),('0TEO',13776422,'26/01/2021',2058.00,'',0.00,'2021-01-26','1900-01-01',2000.00,50.00),('0345',13779723,'17/09/2021',1587.00,'',0.00,'2021-09-17','1900-01-01',1500.00,75.00),('13EG',13780796,'02/11/2021',587.00,'',0.00,'2021-11-02','1900-01-01',500.00,75.00),('14JA',13785563,'13/05/2021',1058.00,'',0.00,'2021-05-13','1900-01-01',1000.00,50.00),('9292',13787726,'21/06/2021',4087.00,'',0.00,'2021-06-21','1900-01-01',4000.00,75.00),('0RUZ',13802731,'02/12/2021',1687.00,'',0.00,'2021-12-02','1900-01-01',1600.00,75.00),('0SI0',13805957,'09/01/2021',558.00,'',0.00,'2021-01-09','1900-01-01',500.00,50.00),('0RJW',13810312,'01/11/2021',587.00,'',0.00,'2021-11-01','1900-01-01',500.00,75.00),('0PLW',13813365,'17/02/2021',558.00,'',0.00,'2021-02-17','1900-01-01',500.00,50.00),('0289',13816004,'15/03/2021',2058.00,'',0.00,'2021-03-15','1900-01-01',2000.00,50.00),('0OSA',13824644,'14/03/2021',858.00,'',0.00,'2021-03-14','1900-01-01',800.00,50.00),('1GYK',13831516,'18/10/2021',1487.00,'',0.00,'2021-10-18','1900-01-01',1400.00,75.00),('0NME',13835061,'23/12/2021',6587.00,'',0.00,'2021-12-23','1900-01-01',6500.00,75.00),('4520',13846720,'20/11/2021',687.00,'',0.00,'2021-11-20','1900-01-01',600.00,75.00),('16KC',13853650,'17/12/2021',3387.00,'',0.00,'2021-12-17','1900-01-01',3300.00,75.00),('16KC',13853650,'17/08/2021',3287.00,'',0.00,'2021-08-17','1900-01-01',3200.00,75.00),('9732',13854088,'28/05/2021',1187.00,'',0.00,'2021-05-28','1900-01-01',1100.00,75.00),('8140',13860051,'04/12/2021',2887.00,'',0.00,'2021-12-04','1900-01-01',2800.00,75.00),('3202',13865522,'10/09/2021',587.00,'',0.00,'2021-09-10','1900-01-01',500.00,75.00),('0WVW',13865902,'08/04/2021',608.00,'',0.00,'2021-04-08','1900-01-01',550.00,50.00),('0WVW',13866025,'17/06/2021',4287.00,'',0.00,'2021-06-17','1900-01-01',4200.00,75.00),('0WVW',13866025,'29/04/2021',1758.00,'',0.00,'2021-04-29','1900-01-01',1700.00,50.00),('0WVW',13866223,'17/06/2021',3087.00,'',0.00,'2021-06-17','1900-01-01',3000.00,75.00),('0WVW',13866231,'14/05/2021',1258.00,'',0.00,'2021-05-14','1900-01-01',1200.00,50.00),('0WVW',13866280,'17/06/2021',2087.00,'',0.00,'2021-06-17','1900-01-01',2000.00,75.00),('0NOU',13875034,'05/12/2021',887.00,'',0.00,'2021-12-05','1900-01-01',800.00,75.00),('0SG5',13875034,'01/08/2021',887.00,'',0.00,'2021-08-01','1900-01-01',800.00,75.00),('6410',13889589,'13/02/2021',658.00,'25/03/2021',632.82,'2021-02-13','2021-03-25',600.00,50.00),('0PEM',13895685,'29/01/2021',1458.00,'',0.00,'2021-01-29','1900-01-01',1400.00,50.00),('0663',13921143,'16/01/2021',1058.00,'',0.00,'2021-01-16','1900-01-01',1000.00,50.00),('0517',13924899,'11/09/2021',887.00,'',0.00,'2021-09-11','1900-01-01',800.00,75.00),('0517',13924899,'08/05/2021',758.00,'',0.00,'2021-05-08','1900-01-01',700.00,50.00),('0O4U',13929211,'03/05/2021',858.00,'',0.00,'2021-05-03','1900-01-01',800.00,50.00),('0O4U',13929211,'19/04/2021',858.00,'',0.00,'2021-04-19','1900-01-01',800.00,50.00),('0234',13934286,'04/05/2021',1358.00,'',0.00,'2021-05-04','1900-01-01',1300.00,50.00),('17IW',13935416,'04/08/2021',987.00,'',0.00,'2021-08-04','1900-01-01',900.00,75.00),('1FNL',13935739,'02/04/2021',1358.00,'',0.00,'2021-04-02','1900-01-01',1300.00,50.00),('1FNL',13936117,'08/05/2021',558.00,'',0.00,'2021-05-08','1900-01-01',500.00,50.00),('17IW',13936133,'18/09/2021',1087.00,'',0.00,'2021-09-18','1900-01-01',1000.00,75.00),('2163',13939368,'30/04/2021',758.00,'',0.00,'2021-04-30','1900-01-01',700.00,50.00),('9302',13943808,'15/11/2021',987.00,'',0.00,'2021-11-15','1900-01-01',900.00,75.00),('0SD7',13950753,'20/05/2021',558.00,'',0.00,'2021-05-20','1900-01-01',471.00,75.00),('2257',13958236,'17/12/2021',1787.00,'',0.00,'2021-12-17','1900-01-01',1700.00,75.00),('0RUZ',13959036,'15/01/2021',958.00,'',0.00,'2021-01-15','1900-01-01',900.00,50.00),('8140',13961982,'20/12/2021',1987.00,'',0.00,'2021-12-20','1900-01-01',1900.00,75.00),('0SU4',13966098,'26/09/2021',587.00,'',0.00,'2021-09-26','1900-01-01',500.00,75.00),('0WVW',13971460,'15/02/2021',1258.00,'',0.00,'2021-02-15','1900-01-01',1200.00,50.00),('0SPM',13972765,'26/01/2021',1258.00,'',0.00,'2021-01-26','1900-01-01',1200.00,50.00),('8478',13983200,'23/07/2021',1287.00,'',0.00,'2021-07-23','1900-01-01',1200.00,75.00),('0QYK',13994116,'11/01/2021',858.00,'',0.00,'2021-01-11','1900-01-01',800.00,50.00),('0PQU',14002786,'11/09/2021',987.00,'',0.00,'2021-09-11','1900-01-01',900.00,75.00),('0YAT',14002828,'15/04/2021',558.00,'',0.00,'2021-04-15','1900-01-01',500.00,50.00),('0OBT',14003081,'13/12/2021',2487.00,'',0.00,'2021-12-13','1900-01-01',2400.00,75.00),('9292',14009724,'14/08/2021',2087.00,'',0.00,'2021-08-14','1900-01-01',2000.00,75.00),('2740',14014518,'09/11/2021',887.00,'',0.00,'2021-11-09','1900-01-01',800.00,75.00),('0PRJ',14019293,'06/05/2021',2058.00,'',0.00,'2021-05-06','1900-01-01',2000.00,50.00),('8858',14019707,'31/08/2021',587.00,'',0.00,'2021-08-31','1900-01-01',500.00,75.00),('0SQX',14020861,'21/12/2021',1287.00,'',0.00,'2021-12-21','1900-01-01',1200.00,75.00),('0SQX',14020861,'01/12/2021',1387.00,'',0.00,'2021-12-01','1900-01-01',1300.00,75.00),('0SQX',14021315,'13/11/2021',2037.00,'',0.00,'2021-11-13','1900-01-01',1950.00,75.00),('0Q92',14025100,'18/10/2021',987.00,'',0.00,'2021-10-18','1900-01-01',900.00,75.00),('0SMQ',14034151,'07/10/2021',1087.00,'',0.00,'2021-10-07','1900-01-01',1000.00,75.00),('0SMQ',14034292,'15/11/2021',1087.00,'',0.00,'2021-11-15','1900-01-01',1000.00,75.00),('0SMQ',14034318,'25/08/2021',2087.00,'',0.00,'2021-08-25','1900-01-01',2000.00,75.00),('1CK4',14034326,'09/06/2021',587.00,'',0.00,'2021-06-09','1900-01-01',500.00,75.00),('0ST0',14037998,'25/05/2021',1987.00,'',0.00,'2021-05-25','1900-01-01',1900.00,75.00),('0860',14038210,'15/05/2021',558.00,'',0.00,'2021-05-15','1900-01-01',471.00,75.00),('1BCJ',14046023,'17/09/2021',3787.00,'',0.00,'2021-09-17','1900-01-01',3700.00,75.00),('1E2I',14050611,'10/10/2021',1587.00,'',0.00,'2021-10-10','1900-01-01',1500.00,75.00),('0SOH',14057442,'09/02/2021',3658.00,'',0.00,'2021-02-09','1900-01-01',3600.00,50.00),('0X6F',14066369,'20/05/2021',558.00,'',0.00,'2021-05-20','1900-01-01',471.00,75.00),('5916',14074116,'27/12/2021',3087.00,'',0.00,'2021-12-27','1900-01-01',3000.00,75.00),('5916',14074116,'04/01/2021',1358.00,'',0.00,'2021-01-04','1900-01-01',1300.00,50.00),('0WVW',14077150,'16/02/2021',1358.00,'',0.00,'2021-02-16','1900-01-01',1300.00,50.00),('0WVW',14077176,'24/01/2021',1258.00,'',0.00,'2021-01-24','1900-01-01',1200.00,50.00),('0WVW',14077291,'15/03/2021',3758.00,'',0.00,'2021-03-15','1900-01-01',3700.00,50.00),('07TX',14082184,'05/12/2021',987.00,'',0.00,'2021-12-05','1900-01-01',900.00,75.00),('0234',14093785,'16/01/2021',1158.00,'',0.00,'2021-01-16','1900-01-01',1100.00,50.00),('0PIG',14110159,'04/09/2021',1187.00,'',0.00,'2021-09-04','1900-01-01',1100.00,75.00),('2117',14111579,'23/01/2021',1058.00,'',0.00,'2021-01-23','1900-01-01',1000.00,50.00),('0248',14118178,'22/07/2021',737.00,'',0.00,'2021-07-22','1900-01-01',650.00,75.00),('2163',14119143,'04/12/2021',1587.00,'',0.00,'2021-12-04','1900-01-01',1500.00,75.00),('3010',14126007,'11/12/2021',687.00,'',0.00,'2021-12-11','1900-01-01',600.00,75.00),('7301',14131981,'20/01/2021',858.00,'',0.00,'2021-01-20','1900-01-01',800.00,50.00),('1HZJ',14132104,'09/12/2021',3087.00,'',0.00,'2021-12-09','1900-01-01',3000.00,75.00),('0YJV',14132104,'18/01/2021',1058.00,'',0.00,'2021-01-18','1900-01-01',1000.00,50.00),('0NMW',14137574,'19/01/2021',858.00,'',0.00,'2021-01-19','1900-01-01',800.00,50.00),('1019',14138200,'18/10/2021',1887.00,'',0.00,'2021-10-18','1900-01-01',1800.00,75.00),('7861',14139679,'02/12/2021',1787.00,'',0.00,'2021-12-02','1900-01-01',1700.00,75.00),('1132',14146948,'07/01/2021',1058.00,'',0.00,'2021-01-07','1900-01-01',1000.00,50.00),('6411',14156012,'16/04/2021',658.00,'',0.00,'2021-04-16','1900-01-01',600.00,50.00),('1DZD',14156699,'15/05/2021',3158.00,'',0.00,'2021-05-15','1900-01-01',3071.00,75.00),('0S77',14157184,'29/01/2021',4058.00,'',0.00,'2021-01-29','1900-01-01',4000.00,50.00),('0S77',14157184,'14/01/2021',4058.00,'',0.00,'2021-01-14','1900-01-01',4000.00,50.00),('9240',14159891,'15/05/2021',2658.00,'',0.00,'2021-05-15','1900-01-01',2571.00,75.00),('0O5J',14165260,'17/11/2021',687.00,'',0.00,'2021-11-17','1900-01-01',600.00,75.00),('0430',14168819,'02/12/2021',1387.00,'',0.00,'2021-12-02','1900-01-01',1300.00,75.00),('0O4U',14174692,'16/04/2021',1058.00,'',0.00,'2021-04-16','1900-01-01',1000.00,50.00),('0RLP',14177885,'27/03/2021',858.00,'',0.00,'2021-03-27','1900-01-01',800.00,50.00),('1494',14181291,'06/04/2021',658.00,'',0.00,'2021-04-06','1900-01-01',600.00,50.00),('0RFZ',14185540,'10/05/2021',1158.00,'',0.00,'2021-05-10','1900-01-01',1100.00,50.00),('0SYI',14189237,'16/02/2021',958.00,'',0.00,'2021-02-16','1900-01-01',900.00,50.00),('0289',14197628,'27/01/2021',2058.00,'',0.00,'2021-01-27','1900-01-01',2000.00,50.00),('0WVW',14203830,'04/04/2021',4058.00,'',0.00,'2021-04-04','1900-01-01',4000.00,50.00),('5203',14207070,'24/05/2021',987.00,'',0.00,'2021-05-24','1900-01-01',900.00,75.00),('0O4U',14231591,'16/12/2021',1387.00,'',0.00,'2021-12-16','1900-01-01',1300.00,75.00),('0O4U',14231591,'02/12/2021',1387.00,'',0.00,'2021-12-02','1900-01-01',1300.00,75.00),('0T16',14247571,'05/01/2021',1258.00,'',0.00,'2021-01-05','1900-01-01',1200.00,50.00),('0T16',14247720,'01/01/2021',1958.00,'',0.00,'2021-01-01','1900-01-01',1900.00,50.00),('0PJU',14252902,'15/02/2021',858.00,'',0.00,'2021-02-15','1900-01-01',800.00,50.00),('0NAS',14253215,'03/08/2021',1387.00,'',0.00,'2021-08-03','1900-01-01',1300.00,75.00),('0O4U',14253876,'12/11/2021',1087.00,'',0.00,'2021-11-12','1900-01-01',1000.00,75.00),('0OTQ',14256085,'18/10/2021',3387.00,'',0.00,'2021-10-18','1900-01-01',3300.00,75.00),('0OTQ',14256085,'19/09/2021',3087.00,'',0.00,'2021-09-19','1900-01-01',3000.00,75.00),('0OTQ',14256085,'17/08/2021',3387.00,'',0.00,'2021-08-17','1900-01-01',3300.00,75.00),('0T2M',14257851,'31/05/2021',887.00,'',0.00,'2021-05-31','1900-01-01',800.00,75.00),('0T2M',14258016,'06/12/2021',1287.00,'',0.00,'2021-12-06','1900-01-01',1200.00,75.00),('0T2M',14258016,'06/07/2021',1287.00,'',0.00,'2021-07-06','1900-01-01',1200.00,75.00),('0T2M',14258024,'03/11/2021',687.00,'',0.00,'2021-11-03','1900-01-01',600.00,75.00),('0T2M',14258131,'20/09/2021',787.00,'',0.00,'2021-09-20','1900-01-01',700.00,75.00),('0T2M',14258198,'28/06/2021',587.00,'',0.00,'2021-06-28','1900-01-01',500.00,75.00),('0OOZ',14268585,'28/11/2021',1287.00,'',0.00,'2021-11-28','1900-01-01',1200.00,75.00),('9305',14284087,'05/12/2021',2487.00,'',0.00,'2021-12-05','1900-01-01',2400.00,75.00),('9305',14284087,'02/01/2021',2058.00,'',0.00,'2021-01-02','1900-01-01',2000.00,50.00),('0S77',14284822,'06/01/2021',1058.00,'',0.00,'2021-01-06','1900-01-01',1000.00,50.00),('0T4O',14298400,'09/02/2021',558.00,'',0.00,'2021-02-09','1900-01-01',500.00,50.00),('0WYX',14299192,'25/09/2021',1087.00,'',0.00,'2021-09-25','1900-01-01',1000.00,75.00),('2117',14300909,'01/12/2021',1887.00,'',0.00,'2021-12-01','1900-01-01',1800.00,75.00),('0WC0',14305353,'19/11/2021',1087.00,'',0.00,'2021-11-19','1900-01-01',1000.00,75.00),('0WC0',14305429,'06/09/2021',2287.00,'',0.00,'2021-09-06','1900-01-01',2200.00,75.00),('0NIA',14308464,'19/11/2021',587.00,'',0.00,'2021-11-19','1900-01-01',500.00,75.00),('8350',14316236,'27/12/2021',2087.00,'',0.00,'2021-12-27','1900-01-01',2000.00,75.00),('5873',14323240,'26/06/2021',1187.00,'',0.00,'2021-06-26','1900-01-01',1100.00,75.00),('0NIA',14326847,'16/03/2021',558.00,'',0.00,'2021-03-16','1900-01-01',500.00,50.00),('1A31',14328264,'16/12/2021',887.00,'',0.00,'2021-12-16','1900-01-01',800.00,75.00),('1A31',14328264,'17/11/2021',887.00,'',0.00,'2021-11-17','1900-01-01',800.00,75.00),('6412',14336184,'21/11/2021',687.00,'',0.00,'2021-11-21','1900-01-01',600.00,75.00),('0T75',14344626,'22/04/2021',1658.00,'',0.00,'2021-04-22','1900-01-01',1600.00,50.00),('0SH4',14346423,'02/02/2021',1858.00,'',0.00,'2021-02-02','1900-01-01',1800.00,50.00),('0SH4',14346423,'07/01/2021',1858.00,'',0.00,'2021-01-07','1900-01-01',1800.00,50.00),('0248',14348015,'20/11/2021',987.00,'',0.00,'2021-11-20','1900-01-01',900.00,75.00),('1195',14349807,'19/10/2021',1487.00,'',0.00,'2021-10-19','1900-01-01',1400.00,75.00),('0SX0',14355325,'16/12/2021',1287.00,'',0.00,'2021-12-16','1900-01-01',1200.00,75.00),('0SX0',14355374,'10/09/2021',2587.00,'',0.00,'2021-09-10','1900-01-01',2500.00,75.00),('0SX0',14355408,'15/11/2021',1787.00,'',0.00,'2021-11-15','1900-01-01',1700.00,75.00),('0SX0',14355416,'24/01/2021',2458.00,'',0.00,'2021-01-24','1900-01-01',2400.00,50.00),('0SX0',14355473,'31/12/2021',1087.00,'',0.00,'2021-12-31','1900-01-01',1000.00,75.00),('0SX0',14355580,'02/12/2021',1087.00,'',0.00,'2021-12-02','1900-01-01',1000.00,75.00),('0SX0',14355663,'03/12/2021',787.00,'',0.00,'2021-12-03','1900-01-01',700.00,75.00),('0SX0',14355838,'06/11/2021',4687.00,'',0.00,'2021-11-06','1900-01-01',4600.00,75.00),('8140',14360895,'02/01/2021',3258.00,'',0.00,'2021-01-02','1900-01-01',3200.00,50.00),('1HWU',14371264,'05/08/2021',587.00,'',0.00,'2021-08-05','1900-01-01',500.00,75.00),('1HWU',14371264,'19/07/2021',587.00,'',0.00,'2021-07-19','1900-01-01',500.00,75.00),('1HWU',14371439,'02/11/2021',1787.00,'',0.00,'2021-11-02','1900-01-01',1700.00,75.00),('1HWU',14371686,'15/11/2021',2487.00,'',0.00,'2021-11-15','1900-01-01',2400.00,75.00),('0YJV',14371686,'04/02/2021',1058.00,'',0.00,'2021-02-04','1900-01-01',1000.00,50.00),('1HWX',14371736,'22/07/2021',3087.00,'',0.00,'2021-07-22','1900-01-01',3000.00,75.00),('6411',14374011,'19/07/2021',787.00,'',0.00,'2021-07-19','1900-01-01',700.00,75.00),('7860',14375216,'30/01/2021',958.00,'',0.00,'2021-01-30','1900-01-01',900.00,50.00),('0WI4',14376248,'17/04/2021',958.00,'',0.00,'2021-04-17','1900-01-01',900.00,50.00),('7063',14380661,'04/09/2021',1687.00,'',0.00,'2021-09-04','1900-01-01',1600.00,75.00),('5460',14381024,'15/01/2021',1858.00,'',0.00,'2021-01-15','1900-01-01',1800.00,50.00),('0T6X',14383277,'09/12/2021',4587.00,'',0.00,'2021-12-09','1900-01-01',4500.00,75.00),('0T8S',14383335,'13/02/2021',758.00,'',0.00,'2021-02-13','1900-01-01',700.00,50.00),('9305',14384168,'05/01/2021',858.00,'',0.00,'2021-01-05','1900-01-01',800.00,50.00),('0T2V',14384929,'25/02/2021',558.00,'',0.00,'2021-02-25','1900-01-01',500.00,50.00),('7302',14385066,'15/01/2021',1058.00,'',0.00,'2021-01-15','1900-01-01',1000.00,50.00),('0SX0',14399851,'19/08/2021',587.00,'',0.00,'2021-08-19','1900-01-01',500.00,75.00),('0SX0',14400006,'17/09/2021',1087.00,'',0.00,'2021-09-17','1900-01-01',1000.00,75.00),('0ODE',14400576,'17/11/2021',887.00,'',0.00,'2021-11-17','1900-01-01',800.00,75.00),('0ODE',14400576,'30/01/2021',1058.00,'',0.00,'2021-01-30','1900-01-01',1000.00,50.00),('4774',14402002,'18/01/2021',1058.00,'',0.00,'2021-01-18','1900-01-01',1000.00,50.00),('0108',14406086,'18/02/2021',4058.00,'',0.00,'2021-02-18','1900-01-01',4000.00,50.00),('0108',14406086,'02/02/2021',4058.00,'',0.00,'2021-02-02','1900-01-01',4000.00,50.00),('0T4L',14406557,'15/04/2021',2458.00,'',0.00,'2021-04-15','1900-01-01',2400.00,50.00),('0T4L',14406623,'26/03/2021',2458.00,'',0.00,'2021-03-26','1900-01-01',2400.00,50.00),('0SX0',14407183,'01/09/2021',587.00,'',0.00,'2021-09-01','1900-01-01',500.00,75.00),('0SX0',14407183,'03/07/2021',1087.00,'',0.00,'2021-07-03','1900-01-01',1000.00,75.00),('0SX0',14407332,'11/06/2021',1087.00,'',0.00,'2021-06-11','1900-01-01',1000.00,75.00),('0SX0',14407589,'18/01/2021',858.00,'',0.00,'2021-01-18','1900-01-01',800.00,50.00),('1GTF',14408934,'03/11/2021',1387.00,'',0.00,'2021-11-03','1900-01-01',1300.00,75.00),('0SX0',14410476,'02/01/2021',858.00,'',0.00,'2021-01-02','1900-01-01',800.00,50.00),('0SX0',14410484,'15/12/2021',1487.00,'',0.00,'2021-12-15','1900-01-01',1400.00,75.00),('0452',14414486,'14/10/2021',1087.00,'',0.00,'2021-10-14','1900-01-01',1000.00,75.00),('3638',14415053,'18/07/2021',2987.00,'',0.00,'2021-07-18','1900-01-01',2900.00,75.00),('0QDL',14417778,'19/12/2021',787.00,'',0.00,'2021-12-19','1900-01-01',700.00,75.00),('0T6C',14423313,'01/12/2021',587.00,'',0.00,'2021-12-01','1900-01-01',500.00,75.00),('0T6C',14423313,'15/09/2021',587.00,'',0.00,'2021-09-15','1900-01-01',500.00,75.00),('0NSX',14424360,'11/02/2021',3358.00,'',0.00,'2021-02-11','1900-01-01',3300.00,50.00),('0RTZ',14434815,'06/12/2021',1087.00,'',0.00,'2021-12-06','1900-01-01',1000.00,75.00),('0RTZ',14434815,'23/06/2021',1087.00,'',0.00,'2021-06-23','1900-01-01',1000.00,75.00),('0YAT',14438816,'07/11/2021',1187.00,'',0.00,'2021-11-07','1900-01-01',1100.00,75.00),('0YAT',14438816,'30/10/2021',1187.00,'',0.00,'2021-10-30','1900-01-01',1100.00,75.00),('0YAT',14439392,'27/12/2021',1087.00,'',0.00,'2021-12-27','1900-01-01',1000.00,75.00),('0YAT',14439483,'09/01/2021',1058.00,'',0.00,'2021-01-09','1900-01-01',1000.00,50.00),('0YAT',14439525,'24/10/2021',1087.00,'',0.00,'2021-10-24','1900-01-01',1000.00,75.00),('14QO',14450852,'29/01/2021',1458.00,'',0.00,'2021-01-29','1900-01-01',1400.00,50.00),('0SDT',14451298,'30/10/2021',1087.00,'',0.00,'2021-10-30','1900-01-01',1000.00,75.00),('0SJM',14455620,'06/01/2021',1358.00,'',0.00,'2021-01-06','1900-01-01',1300.00,50.00),('0T6C',14459077,'16/09/2021',787.00,'',0.00,'2021-09-16','1900-01-01',700.00,75.00),('0T9G',14459663,'06/03/2021',558.00,'',0.00,'2021-03-06','1900-01-01',500.00,50.00),('0T9G',14459663,'08/01/2021',558.00,'',0.00,'2021-01-08','1900-01-01',500.00,50.00),('8357',14462360,'14/01/2021',858.00,'',0.00,'2021-01-14','1900-01-01',800.00,50.00),('0108',14462667,'03/01/2021',1558.00,'',0.00,'2021-01-03','1900-01-01',1500.00,50.00),('0SF3',14464754,'16/12/2021',687.00,'',0.00,'2021-12-16','1900-01-01',600.00,75.00),('6502',14467427,'30/01/2021',2058.00,'',0.00,'2021-01-30','1900-01-01',2000.00,50.00),('0NYC',14475800,'12/06/2021',1587.00,'',0.00,'2021-06-12','1900-01-01',1500.00,75.00),('0T3M',14487805,'30/10/2021',1087.00,'',0.00,'2021-10-30','1900-01-01',1000.00,75.00),('1H86',14491245,'20/12/2021',587.00,'',0.00,'2021-12-20','1900-01-01',500.00,75.00),('0TCP',14492268,'18/09/2021',587.00,'',0.00,'2021-09-18','1900-01-01',500.00,75.00),('14QO',14504039,'15/01/2021',3458.00,'',0.00,'2021-01-15','1900-01-01',3400.00,50.00),('3044',14505465,'08/01/2021',1058.00,'',0.00,'2021-01-08','1900-01-01',1000.00,50.00),('0P1Z',14509046,'13/12/2021',887.00,'',0.00,'2021-12-13','1900-01-01',800.00,75.00),('0P1Z',14509129,'08/06/2021',1087.00,'',0.00,'2021-06-08','1900-01-01',1000.00,75.00),('0WVW',14510978,'02/07/2021',3087.00,'',0.00,'2021-07-02','1900-01-01',3000.00,75.00),('0WVW',14511042,'11/02/2021',1258.00,'',0.00,'2021-02-11','1900-01-01',1200.00,50.00),('0WVW',14511240,'03/02/2021',1258.00,'',0.00,'2021-02-03','1900-01-01',1200.00,50.00),('0WVW',14511349,'21/07/2021',5087.00,'',0.00,'2021-07-21','1900-01-01',5000.00,75.00),('0WVW',14511455,'03/04/2021',1358.00,'',0.00,'2021-04-03','1900-01-01',1300.00,50.00),('0WVW',14511919,'13/02/2021',1258.00,'',0.00,'2021-02-13','1900-01-01',1200.00,50.00),('0XM1',14526099,'16/05/2021',858.00,'16/07/2021',858.00,'2021-05-16','2021-07-16',771.00,75.00),('0TUT',14530224,'30/01/2021',1058.00,'',0.00,'2021-01-30','1900-01-01',1000.00,50.00),('0T7E',14545735,'08/07/2021',1887.00,'',0.00,'2021-07-08','1900-01-01',1800.00,75.00),('0T7E',14545735,'06/02/2021',1058.00,'',0.00,'2021-02-06','1900-01-01',1000.00,50.00),('0PW4',14548911,'19/02/2021',658.00,'',0.00,'2021-02-19','1900-01-01',600.00,50.00),('0NIS',14549729,'09/01/2021',1358.00,'',0.00,'2021-01-09','1900-01-01',1300.00,50.00),('9377',14562128,'28/01/2021',2558.00,'',0.00,'2021-01-28','1900-01-01',2500.00,50.00),('9377',14562144,'05/12/2021',3487.00,'',0.00,'2021-12-05','1900-01-01',3400.00,75.00),('0PGH',14566814,'18/11/2021',787.00,'',0.00,'2021-11-18','1900-01-01',700.00,75.00),('1IMX',14575609,'23/11/2021',687.00,'',0.00,'2021-11-23','1900-01-01',600.00,75.00),('10OP',14575930,'11/01/2021',758.00,'',0.00,'2021-01-11','1900-01-01',700.00,50.00),('1IMX',14576896,'17/08/2021',1687.00,'',0.00,'2021-08-17','1900-01-01',1600.00,75.00),('1IMX',14577670,'19/12/2021',787.00,'',0.00,'2021-12-19','1900-01-01',700.00,75.00),('1IMX',14577670,'14/08/2021',887.00,'',0.00,'2021-08-14','1900-01-01',800.00,75.00),('4894',14577845,'04/03/2021',558.00,'',0.00,'2021-03-04','1900-01-01',500.00,50.00),('8140',14578355,'18/01/2021',4058.00,'',0.00,'2021-01-18','1900-01-01',4000.00,50.00),('0RSF',14584445,'12/05/2021',558.00,'',0.00,'2021-05-12','1900-01-01',500.00,50.00),('0SHK',14586564,'17/05/2021',758.00,'',0.00,'2021-05-17','1900-01-01',671.00,75.00),('0SHK',14586564,'16/04/2021',758.00,'',0.00,'2021-04-16','1900-01-01',700.00,50.00),('0TCI',14589626,'17/12/2021',3187.00,'',0.00,'2021-12-17','1900-01-01',3100.00,75.00),('0TCI',14589683,'18/12/2021',2987.00,'',0.00,'2021-12-18','1900-01-01',2900.00,75.00),('0TCI',14589683,'18/01/2021',2358.00,'',0.00,'2021-01-18','1900-01-01',2300.00,50.00),('0TCI',14589840,'04/12/2021',2487.00,'',0.00,'2021-12-04','1900-01-01',2400.00,75.00),('0TCI',14589923,'15/01/2021',1858.00,'',0.00,'2021-01-15','1900-01-01',1800.00,50.00),('0TCI',14589931,'02/12/2021',2987.00,'',0.00,'2021-12-02','1900-01-01',2900.00,75.00),('0TCI',14590210,'02/12/2021',2587.00,'',0.00,'2021-12-02','1900-01-01',2500.00,75.00),('0TCI',14590301,'15/01/2021',1958.00,'',0.00,'2021-01-15','1900-01-01',1900.00,50.00),('0TCI',14590418,'03/02/2021',1858.00,'',0.00,'2021-02-03','1900-01-01',1800.00,50.00),('0TCI',14590541,'08/09/2021',1087.00,'',0.00,'2021-09-08','1900-01-01',1000.00,75.00),('0TCI',14590541,'27/08/2021',2087.00,'',0.00,'2021-08-27','1900-01-01',2000.00,75.00),('0TCI',14590632,'31/01/2021',1958.00,'',0.00,'2021-01-31','1900-01-01',1900.00,50.00),('8140',14590905,'15/01/2021',3658.00,'',0.00,'2021-01-15','1900-01-01',3600.00,50.00),('8140',14590939,'23/12/2021',1987.00,'',0.00,'2021-12-23','1900-01-01',1900.00,75.00),('0WVW',14599583,'18/02/2021',858.00,'',0.00,'2021-02-18','1900-01-01',800.00,50.00),('0TFP',14600670,'20/02/2021',1058.00,'',0.00,'2021-02-20','1900-01-01',1000.00,50.00),('0TFP',14600779,'21/08/2021',1487.00,'',0.00,'2021-08-21','1900-01-01',1400.00,75.00),('0TFP',14600910,'10/04/2021',1758.00,'',0.00,'2021-04-10','1900-01-01',1700.00,50.00),('1H86',14607980,'27/12/2021',1087.00,'',0.00,'2021-12-27','1900-01-01',1000.00,75.00),('1H86',14607980,'21/12/2021',1087.00,'',0.00,'2021-12-21','1900-01-01',1000.00,75.00),('1HK5',14608426,'22/12/2021',1887.00,'',0.00,'2021-12-22','1900-01-01',1800.00,75.00),('0THU',14608871,'20/11/2021',1287.00,'',0.00,'2021-11-20','1900-01-01',1200.00,75.00),('0O4U',14610927,'11/09/2021',1787.00,'',0.00,'2021-09-11','1900-01-01',1700.00,75.00),('9024',14618847,'07/02/2021',1058.00,'',0.00,'2021-02-07','1900-01-01',1000.00,50.00),('9024',14618847,'08/01/2021',2558.00,'',0.00,'2021-01-08','1900-01-01',2500.00,50.00),('0108',14640932,'10/02/2021',4058.00,'',0.00,'2021-02-10','1900-01-01',4000.00,50.00),('2117',14644983,'30/11/2021',4087.00,'',0.00,'2021-11-30','1900-01-01',4000.00,75.00),('0289',14657514,'08/12/2021',1587.00,'',0.00,'2021-12-08','1900-01-01',1500.00,75.00),('0289',14657563,'30/06/2021',1587.00,'',0.00,'2021-06-30','1900-01-01',1500.00,75.00),('4687',14659296,'27/11/2021',4087.00,'',0.00,'2021-11-27','1900-01-01',4000.00,75.00),('4687',14659296,'25/08/2021',4187.00,'',0.00,'2021-08-25','1900-01-01',4100.00,75.00),('0TJ8',14669998,'06/06/2021',587.00,'',0.00,'2021-06-06','1900-01-01',500.00,75.00),('0SWW',14671119,'16/10/2021',1287.00,'',0.00,'2021-10-16','1900-01-01',1200.00,75.00),('0SWW',14671150,'21/06/2021',1387.00,'',0.00,'2021-06-21','1900-01-01',1300.00,75.00),('6617',14685739,'15/01/2021',1358.00,'04/03/2021',1344.92,'2021-01-15','2021-03-04',1300.00,50.00),('8140',14686299,'30/01/2021',2158.00,'',0.00,'2021-01-30','1900-01-01',2100.00,50.00),('8140',14686315,'24/10/2021',2087.00,'',0.00,'2021-10-24','1900-01-01',2000.00,75.00),('0YAT',14688287,'05/12/2021',1087.00,'',0.00,'2021-12-05','1900-01-01',1000.00,75.00),('0YAT',14689038,'19/12/2021',687.00,'',0.00,'2021-12-19','1900-01-01',600.00,75.00),('0YAT',14689053,'16/08/2021',687.00,'',0.00,'2021-08-16','1900-01-01',600.00,75.00),('0YAT',14689210,'19/03/2021',558.00,'',0.00,'2021-03-19','1900-01-01',500.00,50.00),('0YAT',14689210,'14/03/2021',558.00,'',0.00,'2021-03-14','1900-01-01',500.00,50.00),('1CER',14690010,'09/01/2021',1458.00,'',0.00,'2021-01-09','1900-01-01',1400.00,50.00),('0YAT',14690259,'09/01/2021',1058.00,'',0.00,'2021-01-09','1900-01-01',1000.00,50.00),('0YAT',14690374,'11/01/2021',1058.00,'',0.00,'2021-01-11','1900-01-01',1000.00,50.00),('0YAT',14690374,'04/01/2021',1058.00,'',0.00,'2021-01-04','1900-01-01',1000.00,50.00),('0YAT',14690549,'30/01/2021',1058.00,'',0.00,'2021-01-30','1900-01-01',1000.00,50.00),('0YAT',14690549,'16/01/2021',1058.00,'',0.00,'2021-01-16','1900-01-01',1000.00,50.00),('0YAT',14690820,'15/12/2021',1287.00,'',0.00,'2021-12-15','1900-01-01',1200.00,75.00),('0YAT',14691471,'14/06/2021',587.00,'',0.00,'2021-06-14','1900-01-01',500.00,75.00),('1G9D',14691828,'04/06/2021',1087.00,'',0.00,'2021-06-04','1900-01-01',1000.00,75.00),('0YAT',14691984,'11/01/2021',1058.00,'',0.00,'2021-01-11','1900-01-01',1000.00,50.00),('0YAT',14692081,'05/12/2021',1287.00,'',0.00,'2021-12-05','1900-01-01',1200.00,75.00),('0YAT',14692081,'30/03/2021',1058.00,'',0.00,'2021-03-30','1900-01-01',1000.00,50.00),('0YAT',14692081,'21/03/2021',1058.00,'',0.00,'2021-03-21','1900-01-01',1000.00,50.00),('0YAT',14692222,'08/01/2021',1058.00,'',0.00,'2021-01-08','1900-01-01',1000.00,50.00),('0YAT',14692941,'31/07/2021',787.00,'',0.00,'2021-07-31','1900-01-01',700.00,75.00),('0YAT',14693154,'27/01/2021',558.00,'',0.00,'2021-01-27','1900-01-01',500.00,50.00),('0YAT',14693352,'02/01/2021',858.00,'',0.00,'2021-01-02','1900-01-01',800.00,50.00),('15FT',14694194,'13/12/2021',787.00,'',0.00,'2021-12-13','1900-01-01',700.00,75.00),('0YAT',14694830,'14/04/2021',758.00,'26/05/2021',742.35,'2021-04-14','2021-05-26',700.00,50.00),('0YAT',14695860,'09/01/2021',1058.00,'',0.00,'2021-01-09','1900-01-01',1000.00,50.00),('0YAT',14695985,'19/12/2021',1087.00,'',0.00,'2021-12-19','1900-01-01',1000.00,75.00),('0YAT',14696074,'01/01/2021',858.00,'',0.00,'2021-01-01','1900-01-01',800.00,50.00),('1G9D',14696561,'28/09/2021',1087.00,'',0.00,'2021-09-28','1900-01-01',1000.00,75.00),('0YAT',14696686,'07/01/2021',658.00,'',0.00,'2021-01-07','1900-01-01',600.00,50.00),('0YAT',14698195,'04/10/2021',787.00,'',0.00,'2021-10-04','1900-01-01',700.00,75.00),('0YAT',14698195,'11/01/2021',958.00,'',0.00,'2021-01-11','1900-01-01',900.00,50.00),('0YAT',14698369,'24/08/2021',587.00,'',0.00,'2021-08-24','1900-01-01',500.00,75.00),('0YAT',14698799,'17/01/2021',858.00,'',0.00,'2021-01-17','1900-01-01',800.00,50.00),('3690',14705651,'04/01/2021',658.00,'',0.00,'2021-01-04','1900-01-01',600.00,50.00),('0SEX',14706741,'02/07/2021',587.00,'',0.00,'2021-07-02','1900-01-01',500.00,75.00),('0SEX',14706741,'13/01/2021',558.00,'',0.00,'2021-01-13','1900-01-01',500.00,50.00),('0QY8',14710123,'06/12/2021',787.00,'',0.00,'2021-12-06','1900-01-01',700.00,75.00),('0T3M',14742035,'11/12/2021',787.00,'',0.00,'2021-12-11','1900-01-01',700.00,75.00),('0T3M',14742035,'09/10/2021',787.00,'',0.00,'2021-10-09','1900-01-01',700.00,75.00),('1C23',14742043,'17/01/2021',2058.00,'',0.00,'2021-01-17','1900-01-01',2000.00,50.00),('1HT4',14746572,'25/12/2021',887.00,'',0.00,'2021-12-25','1900-01-01',800.00,75.00),('0WVW',14760300,'05/03/2021',1258.00,'',0.00,'2021-03-05','1900-01-01',1200.00,50.00),('0WVW',14760383,'17/06/2021',3087.00,'',0.00,'2021-06-17','1900-01-01',3000.00,75.00),('0WVW',14760904,'17/06/2021',2587.00,'',0.00,'2021-06-17','1900-01-01',2500.00,75.00),('0WVW',14761233,'25/05/2021',1787.00,'',0.00,'2021-05-25','1900-01-01',1700.00,75.00),('07WM',14761308,'22/01/2021',3234.00,'',0.00,'2021-01-22','1900-01-01',3176.00,50.00),('1019',14761951,'15/07/2021',2087.00,'',0.00,'2021-07-15','1900-01-01',2000.00,75.00),('0S8D',14761985,'27/06/2021',1587.00,'',0.00,'2021-06-27','1900-01-01',1500.00,75.00),('0S8D',14762017,'19/11/2021',2087.00,'',0.00,'2021-11-19','1900-01-01',2000.00,75.00),('1019',14762041,'16/01/2021',1958.00,'',0.00,'2021-01-16','1900-01-01',1900.00,50.00),('0S8D',14762058,'15/01/2021',1658.00,'',0.00,'2021-01-15','1900-01-01',1600.00,50.00),('0S8D',14762074,'18/12/2021',1887.00,'',0.00,'2021-12-18','1900-01-01',1800.00,75.00),('0S8D',14762330,'23/07/2021',1087.00,'',0.00,'2021-07-23','1900-01-01',1000.00,75.00),('1019',14762439,'16/12/2021',1487.00,'',0.00,'2021-12-16','1900-01-01',1400.00,75.00),('0S8D',14762504,'26/02/2021',1058.00,'',0.00,'2021-02-26','1900-01-01',1000.00,50.00),('0TMX',14763056,'16/03/2021',858.00,'',0.00,'2021-03-16','1900-01-01',800.00,50.00),('0S8D',14771646,'17/02/2021',1258.00,'',0.00,'2021-02-17','1900-01-01',1200.00,50.00),('0S8D',14771695,'16/01/2021',1058.00,'',0.00,'2021-01-16','1900-01-01',1000.00,50.00),('9377',14772933,'08/02/2021',3058.00,'',0.00,'2021-02-08','1900-01-01',3000.00,50.00),('0POQ',14776678,'11/02/2021',1858.00,'',0.00,'2021-02-11','1900-01-01',1800.00,50.00),('1251',14778690,'12/12/2021',587.00,'',0.00,'2021-12-12','1900-01-01',500.00,75.00),('7248',14781827,'02/06/2021',4187.00,'',0.00,'2021-06-02','1900-01-01',4100.00,75.00),('15O7',14799571,'15/01/2021',1058.00,'',0.00,'2021-01-15','1900-01-01',1000.00,50.00),('6617',14800833,'16/01/2021',2058.00,'05/03/2021',2031.29,'2021-01-16','2021-03-05',2000.00,50.00),('6617',14800866,'18/01/2021',1058.00,'05/03/2021',1016.80,'2021-01-18','2021-03-05',1000.00,50.00),('6617',14801120,'02/01/2021',2058.00,'',0.00,'2021-01-02','1900-01-01',2000.00,50.00),('10OP',14802540,'05/01/2021',558.00,'',0.00,'2021-01-05','1900-01-01',500.00,50.00),('0289',14806517,'22/08/2021',1687.00,'',0.00,'2021-08-22','1900-01-01',1600.00,75.00),('0289',14806517,'06/02/2021',1758.00,'',0.00,'2021-02-06','1900-01-01',1700.00,50.00),('0289',14806533,'27/07/2021',587.00,'',0.00,'2021-07-27','1900-01-01',500.00,75.00),('0289',14806681,'05/03/2021',2158.00,'',0.00,'2021-03-05','1900-01-01',2100.00,50.00),('9572',14815047,'19/12/2021',687.00,'',0.00,'2021-12-19','1900-01-01',600.00,75.00),('0TQF',14819908,'20/01/2021',558.00,'',0.00,'2021-01-20','1900-01-01',500.00,50.00),('0TQF',14820104,'19/11/2021',1487.00,'',0.00,'2021-11-19','1900-01-01',1400.00,75.00),('0TQF',14820989,'20/12/2021',887.00,'',0.00,'2021-12-20','1900-01-01',800.00,75.00),('0P1Z',14821300,'25/12/2021',6587.00,'',0.00,'2021-12-25','1900-01-01',6500.00,75.00),('0P1Z',14821441,'24/12/2021',6587.00,'',0.00,'2021-12-24','1900-01-01',6500.00,75.00),('0P1Z',14821441,'13/08/2021',6587.00,'',0.00,'2021-08-13','1900-01-01',6500.00,75.00),('0P1Z',14821466,'06/08/2021',3587.00,'',0.00,'2021-08-06','1900-01-01',3500.00,75.00),('8140',14822811,'15/02/2021',1158.00,'',0.00,'2021-02-15','1900-01-01',1100.00,50.00),('8140',14822829,'23/11/2021',1887.00,'',0.00,'2021-11-23','1900-01-01',1800.00,75.00),('8140',14822829,'19/01/2021',1558.00,'',0.00,'2021-01-19','1900-01-01',1500.00,50.00),('8140',14822829,'02/01/2021',1458.00,'',0.00,'2021-01-02','1900-01-01',1400.00,50.00),('0PSU',14824585,'08/11/2021',4887.00,'',0.00,'2021-11-08','1900-01-01',4800.00,75.00),('0NSX',14825236,'03/09/2021',2787.00,'',0.00,'2021-09-03','1900-01-01',2700.00,75.00),('0TQF',14827539,'11/01/2021',1258.00,'',0.00,'2021-01-11','1900-01-01',1200.00,50.00),('0TQF',14828057,'04/12/2021',2487.00,'',0.00,'2021-12-04','1900-01-01',2400.00,75.00),('0S8D',14833412,'20/08/2021',587.00,'',0.00,'2021-08-20','1900-01-01',500.00,75.00),('0289',14836266,'09/09/2021',3087.00,'',0.00,'2021-09-09','1900-01-01',3000.00,75.00),('0R3D',14837967,'12/02/2021',1758.00,'',0.00,'2021-02-12','1900-01-01',1700.00,50.00),('17DY',14841001,'15/11/2021',987.00,'',0.00,'2021-11-15','1900-01-01',900.00,75.00),('0RB7',14841183,'16/02/2021',3558.00,'',0.00,'2021-02-16','1900-01-01',3500.00,50.00),('0QZ1',14844039,'03/03/2021',558.00,'',0.00,'2021-03-03','1900-01-01',500.00,50.00),('0QZ1',14844393,'08/10/2021',1287.00,'',0.00,'2021-10-08','1900-01-01',1200.00,75.00),('0QZ1',14844666,'10/12/2021',687.00,'',0.00,'2021-12-10','1900-01-01',600.00,75.00),('1C0O',14844989,'28/08/2021',837.00,'',0.00,'2021-08-28','1900-01-01',750.00,75.00),('0PHI',14849863,'30/11/2021',587.00,'',0.00,'2021-11-30','1900-01-01',500.00,75.00),('0RDM',14851745,'04/12/2021',1387.00,'',0.00,'2021-12-04','1900-01-01',1300.00,75.00),('6410',14854988,'12/01/2021',658.00,'',0.00,'2021-01-12','1900-01-01',600.00,50.00),('0RAW',14858591,'06/12/2021',1787.00,'',0.00,'2021-12-06','1900-01-01',1700.00,75.00),('0SMQ',14862577,'23/12/2021',2587.00,'',0.00,'2021-12-23','1900-01-01',2500.00,75.00),('1G9D',14883011,'23/10/2021',1087.00,'',0.00,'2021-10-23','1900-01-01',1000.00,75.00),('1G9D',14883011,'13/10/2021',1087.00,'',0.00,'2021-10-13','1900-01-01',1000.00,75.00),('0YAT',14884506,'03/01/2021',858.00,'',0.00,'2021-01-03','1900-01-01',800.00,50.00),('5979',14891436,'11/03/2021',1458.00,'',0.00,'2021-03-11','1900-01-01',1400.00,50.00),('0TSV',14892079,'21/06/2021',787.00,'',0.00,'2021-06-21','1900-01-01',700.00,75.00),('0TSV',14892111,'07/09/2021',5087.00,'',0.00,'2021-09-07','1900-01-01',5000.00,75.00),('0TTK',14893432,'05/02/2021',758.00,'',0.00,'2021-02-05','1900-01-01',700.00,50.00),('0254',14902449,'17/02/2021',1058.00,'',0.00,'2021-02-17','1900-01-01',1000.00,50.00),('8140',14909584,'30/01/2021',2558.00,'',0.00,'2021-01-30','1900-01-01',2500.00,50.00),('8140',14909840,'02/12/2021',3387.00,'',0.00,'2021-12-02','1900-01-01',3300.00,75.00),('0SOU',14914659,'19/12/2021',687.00,'',0.00,'2021-12-19','1900-01-01',600.00,75.00),('0SOU',14914659,'17/09/2021',787.00,'',0.00,'2021-09-17','1900-01-01',700.00,75.00),('0SOU',14915805,'09/12/2021',787.00,'',0.00,'2021-12-09','1900-01-01',700.00,75.00),('0P1Z',14916068,'18/10/2021',1087.00,'',0.00,'2021-10-18','1900-01-01',1000.00,75.00),('1BDT',14920599,'16/12/2021',3387.00,'',0.00,'2021-12-16','1900-01-01',3300.00,75.00),('0VI4',14933493,'19/01/2021',3658.00,'',0.00,'2021-01-19','1900-01-01',3600.00,50.00),('0VI4',14933535,'13/08/2021',1887.00,'',0.00,'2021-08-13','1900-01-01',1800.00,75.00),('0VI4',14933816,'14/02/2021',2158.00,'',0.00,'2021-02-14','1900-01-01',2100.00,50.00),('0VI4',14934103,'12/12/2021',1787.00,'',0.00,'2021-12-12','1900-01-01',1700.00,75.00),('0URR',14934848,'21/05/2021',1058.00,'',0.00,'2021-05-21','1900-01-01',971.00,75.00),('0URR',14934848,'14/05/2021',1058.00,'',0.00,'2021-05-14','1900-01-01',1000.00,50.00),('0S77',14941967,'09/01/2021',1058.00,'',0.00,'2021-01-09','1900-01-01',1000.00,50.00),('0S77',14942031,'12/02/2021',2058.00,'',0.00,'2021-02-12','1900-01-01',2000.00,50.00),('0S77',14942296,'14/02/2021',1558.00,'',0.00,'2021-02-14','1900-01-01',1500.00,50.00),('1CDZ',14942569,'21/12/2021',1087.00,'',0.00,'2021-12-21','1900-01-01',1000.00,75.00),('1CDZ',14942866,'13/03/2021',1058.00,'',0.00,'2021-03-13','1900-01-01',1000.00,50.00),('1HJG',14942932,'23/10/2021',2187.00,'',0.00,'2021-10-23','1900-01-01',2100.00,75.00),('6617',14943385,'20/01/2021',1958.00,'10/03/2021',1939.07,'2021-01-20','2021-03-10',1900.00,50.00),('6617',14943435,'20/01/2021',1158.00,'10/03/2021',1143.33,'2021-01-20','2021-03-10',1100.00,50.00),('6617',14943492,'15/01/2021',1858.00,'04/03/2021',1853.66,'2021-01-15','2021-03-04',1800.00,50.00),('0SWW',14947873,'19/10/2021',687.00,'',0.00,'2021-10-19','1900-01-01',600.00,75.00),('0QPF',14950125,'23/01/2021',1058.00,'',0.00,'2021-01-23','1900-01-01',1000.00,50.00),('0S77',14950307,'15/02/2021',2458.00,'',0.00,'2021-02-15','1900-01-01',2400.00,50.00),('1874',14972277,'03/02/2021',858.00,'',0.00,'2021-02-03','1900-01-01',800.00,50.00),('0YAT',14977862,'11/01/2021',758.00,'',0.00,'2021-01-11','1900-01-01',700.00,50.00),('5588',14977953,'06/02/2021',1058.00,'',0.00,'2021-02-06','1900-01-01',1000.00,50.00),('5588',14977953,'02/01/2021',1058.00,'',0.00,'2021-01-02','1900-01-01',1000.00,50.00),('0YAT',14978092,'23/05/2021',887.00,'',0.00,'2021-05-23','1900-01-01',800.00,75.00),('17GI',14979058,'12/09/2021',787.00,'',0.00,'2021-09-12','1900-01-01',700.00,75.00),('0WVW',14981765,'10/06/2021',3087.00,'',0.00,'2021-06-10','1900-01-01',3000.00,75.00),('0WVW',14981781,'23/04/2021',1258.00,'',0.00,'2021-04-23','1900-01-01',1200.00,50.00),('0WVW',14981971,'18/01/2021',1758.00,'',0.00,'2021-01-18','1900-01-01',1700.00,50.00),('0WVW',14981997,'25/06/2021',3087.00,'',0.00,'2021-06-25','1900-01-01',3000.00,75.00),('0QR3',14987416,'17/02/2021',758.00,'',0.00,'2021-02-17','1900-01-01',700.00,50.00),('2305',14997167,'30/12/2021',2087.00,'',0.00,'2021-12-30','1900-01-01',2000.00,75.00),('2305',14997167,'03/12/2021',2087.00,'',0.00,'2021-12-03','1900-01-01',2000.00,75.00),('5588',14998520,'03/01/2021',558.00,'',0.00,'2021-01-03','1900-01-01',500.00,50.00),('0SX0',15000326,'23/01/2021',558.00,'',0.00,'2021-01-23','1900-01-01',500.00,50.00),('6286',15000797,'26/02/2021',2158.00,'',0.00,'2021-02-26','1900-01-01',2100.00,50.00),('6286',15000797,'19/02/2021',2158.00,'',0.00,'2021-02-19','1900-01-01',2100.00,50.00),('175Z',15008113,'10/05/2021',1058.00,'',0.00,'2021-05-10','1900-01-01',1000.00,50.00),('2340',15017734,'09/04/2021',3058.00,'',0.00,'2021-04-09','1900-01-01',3000.00,50.00),('0QRX',15020126,'31/01/2021',658.00,'',0.00,'2021-01-31','1900-01-01',600.00,50.00),('0289',15021363,'18/11/2021',1687.00,'',0.00,'2021-11-18','1900-01-01',1600.00,75.00),('0289',15021389,'03/10/2021',1087.00,'',0.00,'2021-10-03','1900-01-01',1000.00,75.00),('0289',15021397,'11/02/2021',1358.00,'',0.00,'2021-02-11','1900-01-01',1300.00,50.00),('6782',15026933,'23/01/2021',4058.00,'',0.00,'2021-01-23','1900-01-01',4000.00,50.00),('7861',15029994,'30/04/2021',958.00,'',0.00,'2021-04-30','1900-01-01',900.00,50.00),('0254',15037237,'23/01/2021',2558.00,'',0.00,'2021-01-23','1900-01-01',2500.00,50.00),('2117',15041882,'29/06/2021',1587.00,'',0.00,'2021-06-29','1900-01-01',1500.00,75.00),('0O4U',15049042,'11/10/2021',787.00,'',0.00,'2021-10-11','1900-01-01',700.00,75.00),('0155',15050867,'05/03/2021',1058.00,'',0.00,'2021-03-05','1900-01-01',1000.00,50.00),('0TZK',15055619,'02/12/2021',6587.00,'',0.00,'2021-12-02','1900-01-01',6500.00,75.00),('0TXK',15060924,'27/04/2021',558.00,'',0.00,'2021-04-27','1900-01-01',500.00,50.00),('0TXK',15060999,'15/01/2021',1158.00,'',0.00,'2021-01-15','1900-01-01',1100.00,50.00),('0TXK',15061526,'21/12/2021',887.00,'',0.00,'2021-12-21','1900-01-01',800.00,75.00),('0TXK',15061583,'02/12/2021',587.00,'',0.00,'2021-12-02','1900-01-01',500.00,75.00),('2305',15064249,'05/12/2021',1987.00,'',0.00,'2021-12-05','1900-01-01',1900.00,75.00),('15QS',15065089,'08/08/2021',1087.00,'',0.00,'2021-08-08','1900-01-01',1000.00,75.00),('15QS',15065089,'09/07/2021',1087.00,'',0.00,'2021-07-09','1900-01-01',1000.00,75.00),('1GYK',15069131,'20/12/2021',1587.00,'',0.00,'2021-12-20','1900-01-01',1500.00,75.00),('0O4U',15072838,'30/04/2021',858.00,'',0.00,'2021-04-30','1900-01-01',800.00,50.00),('8140',15081086,'02/02/2021',1058.00,'',0.00,'2021-02-02','1900-01-01',1000.00,50.00),('8140',15081094,'17/12/2021',3287.00,'',0.00,'2021-12-17','1900-01-01',3200.00,75.00),('8140',15081094,'29/01/2021',2658.00,'',0.00,'2021-01-29','1900-01-01',2600.00,50.00),('18WH',15081334,'16/12/2021',2687.00,'',0.00,'2021-12-16','1900-01-01',2600.00,75.00),('6916',15082936,'03/09/2021',587.00,'',0.00,'2021-09-03','1900-01-01',500.00,75.00),('9255',15085616,'15/02/2021',2058.00,'',0.00,'2021-02-15','1900-01-01',2000.00,50.00),('9255',15085616,'19/01/2021',1058.00,'',0.00,'2021-01-19','1900-01-01',1000.00,50.00),('2305',15086978,'02/11/2021',1087.00,'',0.00,'2021-11-02','1900-01-01',1000.00,75.00),('07TX',15088347,'21/10/2021',987.00,'',0.00,'2021-10-21','1900-01-01',900.00,75.00),('14RC',15089212,'11/01/2021',1858.00,'',0.00,'2021-01-11','1900-01-01',1800.00,50.00),('3005',15092125,'05/02/2021',1158.00,'',0.00,'2021-02-05','1900-01-01',1100.00,50.00),('0NO4',15093511,'20/03/2021',1158.00,'',0.00,'2021-03-20','1900-01-01',1100.00,50.00),('1870',15099062,'27/02/2021',558.00,'',0.00,'2021-02-27','1900-01-01',500.00,50.00),('0TXT',15103708,'31/12/2021',987.00,'',0.00,'2021-12-31','1900-01-01',900.00,75.00),('0TXT',15103724,'02/03/2021',1558.00,'',0.00,'2021-03-02','1900-01-01',1500.00,50.00),('1274',15104391,'06/09/2021',687.00,'',0.00,'2021-09-06','1900-01-01',600.00,75.00),('2305',15111099,'19/07/2021',5087.00,'',0.00,'2021-07-19','1900-01-01',5000.00,75.00),('0R0K',15127590,'05/11/2021',587.00,'',0.00,'2021-11-05','1900-01-01',500.00,75.00),('2340',15134703,'05/09/2021',4587.00,'',0.00,'2021-09-05','1900-01-01',4500.00,75.00),('0YAT',15140072,'19/03/2021',858.00,'',0.00,'2021-03-19','1900-01-01',800.00,50.00),('0815',15141500,'15/01/2021',2358.00,'',0.00,'2021-01-15','1900-01-01',2300.00,50.00),('0WVW',15141716,'10/06/2021',1087.00,'',0.00,'2021-06-10','1900-01-01',1000.00,75.00),('0U2L',15143662,'01/10/2021',587.00,'',0.00,'2021-10-01','1900-01-01',500.00,75.00),('0RB7',15149065,'04/12/2021',4987.00,'',0.00,'2021-12-04','1900-01-01',4900.00,75.00),('2306',15149719,'31/01/2021',1858.00,'',0.00,'2021-01-31','1900-01-01',1800.00,50.00),('0OBT',15151996,'25/10/2021',2087.00,'',0.00,'2021-10-25','1900-01-01',2000.00,75.00),('0OBT',15151996,'11/10/2021',2087.00,'',0.00,'2021-10-11','1900-01-01',2000.00,75.00),('0U1V',15152226,'18/12/2021',987.00,'',0.00,'2021-12-18','1900-01-01',900.00,75.00),('0U5B',15153752,'21/12/2021',3087.00,'',0.00,'2021-12-21','1900-01-01',3000.00,75.00),('0U5B',15153885,'17/01/2021',1758.00,'',0.00,'2021-01-17','1900-01-01',1700.00,50.00),('14QO',15156292,'15/01/2021',1758.00,'',0.00,'2021-01-15','1900-01-01',1700.00,50.00),('2150',15157571,'06/05/2021',3558.00,'',0.00,'2021-05-06','1900-01-01',3500.00,50.00),('6617',15164536,'02/01/2021',1858.00,'',0.00,'2021-01-02','1900-01-01',1800.00,50.00),('6617',15164759,'15/01/2021',1658.00,'04/03/2021',1636.58,'2021-01-15','2021-03-04',1600.00,50.00),('0TKY',15172604,'07/01/2021',658.00,'',0.00,'2021-01-07','1900-01-01',600.00,50.00),('0SSN',15173735,'11/09/2021',1087.00,'',0.00,'2021-09-11','1900-01-01',1000.00,75.00),('0Q7U',15174741,'28/01/2021',4058.00,'',0.00,'2021-01-28','1900-01-01',4000.00,50.00),('2552',15177496,'20/01/2021',958.00,'',0.00,'2021-01-20','1900-01-01',900.00,50.00),('0TYL',15177744,'19/12/2021',987.00,'',0.00,'2021-12-19','1900-01-01',900.00,75.00),('7861',15179534,'30/03/2021',858.00,'',0.00,'2021-03-30','1900-01-01',800.00,50.00),('2163',15179930,'05/07/2021',1087.00,'',0.00,'2021-07-05','1900-01-01',1000.00,75.00),('5545',15181050,'03/12/2021',787.00,'',0.00,'2021-12-03','1900-01-01',700.00,75.00),('0WC0',15184328,'09/10/2021',887.00,'',0.00,'2021-10-09','1900-01-01',800.00,75.00),('0T58',15184807,'01/10/2021',587.00,'',0.00,'2021-10-01','1900-01-01',500.00,75.00),('0TYI',15189897,'27/01/2021',558.00,'',0.00,'2021-01-27','1900-01-01',500.00,50.00),('0O4U',15191158,'16/01/2021',958.00,'',0.00,'2021-01-16','1900-01-01',900.00,50.00),('0T5F',15198773,'07/10/2021',1087.00,'',0.00,'2021-10-07','1900-01-01',1000.00,75.00),('0T5F',15198773,'19/08/2021',587.00,'',0.00,'2021-08-19','1900-01-01',500.00,75.00),('0U80',15199151,'26/12/2021',787.00,'',0.00,'2021-12-26','1900-01-01',700.00,75.00),('0S77',15207301,'14/02/2021',1058.00,'',0.00,'2021-02-14','1900-01-01',1000.00,50.00),('1C0O',15220072,'28/07/2021',1287.00,'',0.00,'2021-07-28','1900-01-01',1200.00,75.00),('3902',15237027,'04/11/2021',987.00,'',0.00,'2021-11-04','1900-01-01',900.00,75.00),('0R3D',15237803,'01/03/2021',1958.00,'',0.00,'2021-03-01','1900-01-01',1900.00,50.00),('0UA9',15238363,'14/02/2021',858.00,'',0.00,'2021-02-14','1900-01-01',800.00,50.00),('0U6N',15238553,'05/07/2021',1287.00,'',0.00,'2021-07-05','1900-01-01',1200.00,75.00),('0YAT',15240856,'27/09/2021',1287.00,'',0.00,'2021-09-27','1900-01-01',1200.00,75.00),('0YAT',15240856,'02/01/2021',1058.00,'',0.00,'2021-01-02','1900-01-01',1000.00,50.00),('0R87',15252208,'01/08/2021',887.00,'',0.00,'2021-08-01','1900-01-01',800.00,75.00),('7302',15255235,'17/01/2021',958.00,'',0.00,'2021-01-17','1900-01-01',900.00,50.00),('1870',15255805,'31/12/2021',887.00,'',0.00,'2021-12-31','1900-01-01',800.00,75.00),('1DBT',15265895,'02/12/2021',2287.00,'',0.00,'2021-12-02','1900-01-01',2200.00,75.00),('2305',15265937,'16/12/2021',3887.00,'',0.00,'2021-12-16','1900-01-01',3800.00,75.00),('2305',15265937,'22/11/2021',3887.00,'',0.00,'2021-11-22','1900-01-01',3800.00,75.00),('0RUZ',15270176,'02/12/2021',1987.00,'',0.00,'2021-12-02','1900-01-01',1900.00,75.00),('0UBE',15275647,'09/01/2021',558.00,'',0.00,'2021-01-09','1900-01-01',500.00,50.00),('1B7K',15276678,'06/12/2021',587.00,'',0.00,'2021-12-06','1900-01-01',500.00,75.00),('1B7K',15276827,'07/03/2021',858.00,'',0.00,'2021-03-07','1900-01-01',800.00,50.00),('0S77',15285257,'27/01/2021',1058.00,'',0.00,'2021-01-27','1900-01-01',1000.00,50.00),('9554',15286156,'31/10/2021',587.00,'',0.00,'2021-10-31','1900-01-01',500.00,75.00),('1H5X',15286180,'29/11/2021',687.00,'',0.00,'2021-11-29','1900-01-01',600.00,75.00),('0UA2',15290745,'04/02/2021',858.00,'',0.00,'2021-02-04','1900-01-01',800.00,50.00),('0T9X',15293038,'15/02/2021',3858.00,'31/03/2021',1803.84,'2021-02-15','2021-03-31',3800.00,50.00),('0359',15293327,'27/10/2021',1087.00,'',0.00,'2021-10-27','1900-01-01',1000.00,75.00),('0U8U',15299381,'19/12/2021',4487.00,'',0.00,'2021-12-19','1900-01-01',4400.00,75.00),('2305',15301351,'30/07/2021',987.00,'',0.00,'2021-07-30','1900-01-01',900.00,75.00),('5979',15305774,'19/03/2021',2058.00,'',0.00,'2021-03-19','1900-01-01',2000.00,50.00),('17GE',15306251,'05/01/2021',2358.00,'',0.00,'2021-01-05','1900-01-01',2300.00,50.00),('0RAQ',15307895,'16/11/2021',587.00,'',0.00,'2021-11-16','1900-01-01',500.00,75.00),('0UBG',15316722,'13/09/2021',3187.00,'',0.00,'2021-09-13','1900-01-01',3100.00,75.00),('0UBG',15316722,'02/04/2021',1758.00,'',0.00,'2021-04-02','1900-01-01',1700.00,50.00),('0PSU',15318637,'30/12/2021',2087.00,'',0.00,'2021-12-30','1900-01-01',2000.00,75.00),('0REE',15327364,'09/09/2021',887.00,'',0.00,'2021-09-09','1900-01-01',800.00,75.00),('0WOM',15330053,'05/12/2021',1687.00,'',0.00,'2021-12-05','1900-01-01',1600.00,75.00),('0QTX',15332356,'14/09/2021',887.00,'',0.00,'2021-09-14','1900-01-01',800.00,75.00),('0289',15333420,'01/04/2021',1058.00,'',0.00,'2021-04-01','1900-01-01',1000.00,50.00),('0289',15333487,'23/12/2021',1287.00,'',0.00,'2021-12-23','1900-01-01',1200.00,75.00),('0SN8',15342199,'02/03/2021',558.00,'',0.00,'2021-03-02','1900-01-01',500.00,50.00),('164C',15342546,'23/05/2021',1087.00,'02/07/2021',130.86,'2021-05-23','2021-07-02',1000.00,75.00),('0108',15348063,'17/12/2021',6587.00,'',0.00,'2021-12-17','1900-01-01',6500.00,75.00),('0SZG',15352180,'13/09/2021',687.00,'',0.00,'2021-09-13','1900-01-01',600.00,75.00),('0UGE',15356025,'06/01/2021',4058.00,'',0.00,'2021-01-06','1900-01-01',4000.00,50.00),('5528',15358450,'15/01/2021',2958.00,'',0.00,'2021-01-15','1900-01-01',2900.00,50.00),('0NAG',15361033,'23/12/2021',687.00,'',0.00,'2021-12-23','1900-01-01',600.00,75.00),('6617',15364227,'04/01/2021',1058.00,'',0.00,'2021-01-04','1900-01-01',1000.00,50.00),('6617',15364235,'15/01/2021',1258.00,'04/03/2021',1255.53,'2021-01-15','2021-03-04',1200.00,50.00),('0WVW',15374770,'14/06/2021',2087.00,'',0.00,'2021-06-14','1900-01-01',2000.00,75.00),('0WVW',15374770,'08/02/2021',1358.00,'',0.00,'2021-02-08','1900-01-01',1300.00,50.00),('0WVW',15374911,'27/06/2021',3087.00,'',0.00,'2021-06-27','1900-01-01',3000.00,75.00),('0NO4',15377013,'08/02/2021',1058.00,'',0.00,'2021-02-08','1900-01-01',1000.00,50.00),('3497',15383789,'06/02/2021',1058.00,'',0.00,'2021-02-06','1900-01-01',1000.00,50.00),('7728',15392434,'17/12/2021',1687.00,'',0.00,'2021-12-17','1900-01-01',1600.00,75.00),('8082',15394950,'14/03/2021',1158.00,'',0.00,'2021-03-14','1900-01-01',1100.00,50.00),('8082',15394950,'05/03/2021',1158.00,'',0.00,'2021-03-05','1900-01-01',1100.00,50.00),('8082',15394950,'31/01/2021',1058.00,'',0.00,'2021-01-31','1900-01-01',1000.00,50.00),('8082',15394950,'18/01/2021',1058.00,'',0.00,'2021-01-18','1900-01-01',1000.00,50.00),('0T8F',15399942,'20/05/2021',758.00,'',0.00,'2021-05-20','1900-01-01',671.00,75.00),('0P4F',15406325,'02/04/2021',558.00,'',0.00,'2021-04-02','1900-01-01',500.00,50.00),('4442',15414659,'16/01/2021',958.00,'',0.00,'2021-01-16','1900-01-01',900.00,50.00),('0UBX',15415979,'02/12/2021',1387.00,'',0.00,'2021-12-02','1900-01-01',1300.00,75.00),('15KL',15418965,'17/02/2021',4058.00,'',0.00,'2021-02-17','1900-01-01',4000.00,50.00),('5916',15422322,'12/01/2021',1258.00,'',0.00,'2021-01-12','1900-01-01',1200.00,50.00),('0NO4',15426000,'23/07/2021',987.00,'',0.00,'2021-07-23','1900-01-01',900.00,75.00),('17DY',15442122,'27/11/2021',987.00,'',0.00,'2021-11-27','1900-01-01',900.00,75.00),('17DY',15442122,'09/07/2021',1887.00,'',0.00,'2021-07-09','1900-01-01',1800.00,75.00),('17DY',15442148,'12/11/2021',1587.00,'',0.00,'2021-11-12','1900-01-01',1500.00,75.00),('16UH',15444474,'22/08/2021',787.00,'',0.00,'2021-08-22','1900-01-01',700.00,75.00),('1FNL',15445026,'17/08/2021',587.00,'',0.00,'2021-08-17','1900-01-01',500.00,75.00),('1FNL',15445026,'08/03/2021',1158.00,'',0.00,'2021-03-08','1900-01-01',1100.00,50.00),('18PV',15445026,'22/01/2021',558.00,'',0.00,'2021-01-22','1900-01-01',500.00,50.00),('0289',15446370,'06/12/2021',2887.00,'',0.00,'2021-12-06','1900-01-01',2800.00,75.00),('0289',15446370,'12/11/2021',2887.00,'',0.00,'2021-11-12','1900-01-01',2800.00,75.00),('0289',15446412,'14/01/2021',1158.00,'',0.00,'2021-01-14','1900-01-01',1100.00,50.00),('0YAT',15452444,'16/01/2021',858.00,'',0.00,'2021-01-16','1900-01-01',800.00,50.00),('1HWX',15454499,'13/12/2021',987.00,'',0.00,'2021-12-13','1900-01-01',900.00,75.00),('1HWX',15454531,'15/11/2021',2487.00,'',0.00,'2021-11-15','1900-01-01',2400.00,75.00),('1HWX',15454754,'21/08/2021',2087.00,'',0.00,'2021-08-21','1900-01-01',2000.00,75.00),('1HWS',15455033,'31/12/2021',2787.00,'',0.00,'2021-12-31','1900-01-01',2700.00,75.00),('1HWS',15455033,'02/12/2021',2787.00,'',0.00,'2021-12-02','1900-01-01',2700.00,75.00),('1HWS',15455033,'02/08/2021',1087.00,'',0.00,'2021-08-02','1900-01-01',1000.00,75.00),('1HWX',15455330,'28/12/2021',587.00,'',0.00,'2021-12-28','1900-01-01',500.00,75.00),('1DV6',15455926,'23/01/2021',558.00,'',0.00,'2021-01-23','1900-01-01',500.00,50.00),('1DV6',15455926,'16/01/2021',558.00,'',0.00,'2021-01-16','1900-01-01',500.00,50.00),('0WVW',15465032,'25/02/2021',558.00,'',0.00,'2021-02-25','1900-01-01',500.00,50.00),('9377',15467079,'01/08/2021',1787.00,'',0.00,'2021-08-01','1900-01-01',1700.00,75.00),('1DQ0',15471238,'03/12/2021',2087.00,'',0.00,'2021-12-03','1900-01-01',2000.00,75.00),('0QUW',15474570,'08/12/2021',1087.00,'',0.00,'2021-12-08','1900-01-01',1000.00,75.00),('0QUW',15474570,'10/07/2021',1087.00,'',0.00,'2021-07-10','1900-01-01',1000.00,75.00),('7126',15475981,'04/12/2021',587.00,'',0.00,'2021-12-04','1900-01-01',500.00,75.00),('1CRV',15479157,'12/02/2021',758.00,'',0.00,'2021-02-12','1900-01-01',700.00,50.00),('8819',15485543,'27/03/2021',1158.00,'14/05/2021',1156.70,'2021-03-27','2021-05-14',1100.00,50.00),('0289',15490469,'22/06/2021',1887.00,'',0.00,'2021-06-22','1900-01-01',1800.00,75.00),('8140',15493380,'10/04/2021',4058.00,'',0.00,'2021-04-10','1900-01-01',4000.00,50.00),('8140',15493380,'01/02/2021',4058.00,'',0.00,'2021-02-01','1900-01-01',4000.00,50.00),('1CSG',15499080,'20/12/2021',1487.00,'',0.00,'2021-12-20','1900-01-01',1400.00,75.00),('17A6',15502867,'25/02/2021',558.00,'',0.00,'2021-02-25','1900-01-01',500.00,50.00),('0UGI',15512650,'03/02/2021',2158.00,'',0.00,'2021-02-03','1900-01-01',2100.00,50.00),('0UGI',15512882,'21/08/2021',987.00,'',0.00,'2021-08-21','1900-01-01',900.00,75.00),('0UGI',15512882,'08/07/2021',1587.00,'',0.00,'2021-07-08','1900-01-01',1500.00,75.00),('0UGI',15512981,'16/09/2021',1187.00,'',0.00,'2021-09-16','1900-01-01',1100.00,75.00),('0UGI',15513021,'05/02/2021',1158.00,'',0.00,'2021-02-05','1900-01-01',1100.00,50.00),('0UGI',15513021,'18/01/2021',1158.00,'',0.00,'2021-01-18','1900-01-01',1100.00,50.00),('1BVJ',15515992,'15/10/2021',4887.00,'',0.00,'2021-10-15','1900-01-01',4800.00,75.00),('1I3R',15515992,'05/10/2021',6387.00,'',0.00,'2021-10-05','1900-01-01',6300.00,75.00),('0PHI',15521008,'19/12/2021',1187.00,'',0.00,'2021-12-19','1900-01-01',1100.00,75.00),('0PHI',15521008,'27/07/2021',1187.00,'',0.00,'2021-07-27','1900-01-01',1100.00,75.00),('8282',15524150,'29/01/2021',1358.00,'',0.00,'2021-01-29','1900-01-01',1300.00,50.00),('0WVW',15524218,'11/08/2021',2487.00,'',0.00,'2021-08-11','1900-01-01',2400.00,75.00),('9377',15527104,'29/11/2021',587.00,'',0.00,'2021-11-29','1900-01-01',500.00,75.00),('9377',15527104,'14/09/2021',1587.00,'',0.00,'2021-09-14','1900-01-01',1500.00,75.00),('9377',15527104,'06/09/2021',2087.00,'',0.00,'2021-09-06','1900-01-01',2000.00,75.00),('15FT',15530421,'14/12/2021',587.00,'',0.00,'2021-12-14','1900-01-01',500.00,75.00),('1IK4',15532955,'11/09/2021',687.00,'',0.00,'2021-09-11','1900-01-01',600.00,75.00),('0W05',15533839,'09/12/2021',587.00,'',0.00,'2021-12-09','1900-01-01',500.00,75.00),('19JM',15540172,'20/02/2021',1958.00,'',0.00,'2021-02-20','1900-01-01',1900.00,50.00),('0UOK',15543721,'08/01/2021',758.00,'',0.00,'2021-01-08','1900-01-01',700.00,50.00),('0UOK',15543721,'04/01/2021',658.00,'',0.00,'2021-01-04','1900-01-01',600.00,50.00),('0WVW',15544943,'17/06/2021',2087.00,'',0.00,'2021-06-17','1900-01-01',2000.00,75.00),('1GYK',15549132,'15/08/2021',687.00,'',0.00,'2021-08-15','1900-01-01',600.00,75.00),('0108',15549264,'01/12/2021',4487.00,'',0.00,'2021-12-01','1900-01-01',4400.00,75.00),('0UHK',15552904,'18/01/2021',1058.00,'05/03/2021',1058.00,'2021-01-18','2021-03-05',1000.00,50.00),('0UHK',15552953,'16/01/2021',3058.00,'',0.00,'2021-01-16','1900-01-01',3000.00,50.00),('0UHK',15553118,'10/02/2021',1058.00,'',0.00,'2021-02-10','1900-01-01',1000.00,50.00),('0XN8',15555212,'15/12/2021',1087.00,'',0.00,'2021-12-15','1900-01-01',1000.00,75.00),('2305',15556806,'20/11/2021',2687.00,'',0.00,'2021-11-20','1900-01-01',2600.00,75.00),('0UPA',15558299,'15/05/2021',858.00,'',0.00,'2021-05-15','1900-01-01',771.00,75.00),('0UPA',15558471,'29/09/2021',587.00,'',0.00,'2021-09-29','1900-01-01',500.00,75.00),('0UPA',15559503,'21/06/2021',987.00,'',0.00,'2021-06-21','1900-01-01',900.00,75.00),('0UPA',15561012,'11/11/2021',587.00,'',0.00,'2021-11-11','1900-01-01',500.00,75.00),('0UPA',15561012,'02/02/2021',558.00,'',0.00,'2021-02-02','1900-01-01',500.00,50.00),('0108',15561434,'01/01/2021',4058.00,'',0.00,'2021-01-01','1900-01-01',4000.00,50.00),('0UPA',15561590,'29/01/2021',1058.00,'',0.00,'2021-01-29','1900-01-01',1000.00,50.00),('0UPA',15561673,'07/01/2021',758.00,'',0.00,'2021-01-07','1900-01-01',700.00,50.00),('0UPA',15561871,'26/02/2021',1058.00,'',0.00,'2021-02-26','1900-01-01',1000.00,50.00),('0UPA',15562218,'28/11/2021',1287.00,'',0.00,'2021-11-28','1900-01-01',1200.00,75.00),('0UPA',15562218,'07/02/2021',958.00,'',0.00,'2021-02-07','1900-01-01',900.00,50.00),('2305',15567027,'08/02/2021',2958.00,'',0.00,'2021-02-08','1900-01-01',2900.00,50.00),('2305',15567035,'01/01/2021',958.00,'',0.00,'2021-01-01','1900-01-01',900.00,50.00),('159T',15584022,'02/04/2021',658.00,'',0.00,'2021-04-02','1900-01-01',600.00,50.00),('0ULQ',15596604,'28/12/2021',1187.00,'',0.00,'2021-12-28','1900-01-01',1100.00,75.00),('6795',15597941,'31/01/2021',1658.00,'',0.00,'2021-01-31','1900-01-01',1600.00,50.00),('0WVW',15599038,'10/06/2021',6587.00,'',0.00,'2021-06-10','1900-01-01',6500.00,75.00),('0WVW',15599129,'18/02/2021',4058.00,'',0.00,'2021-02-18','1900-01-01',4000.00,50.00),('0WVW',15599152,'01/02/2021',4058.00,'',0.00,'2021-02-01','1900-01-01',4000.00,50.00),('0WVW',15599293,'25/07/2021',5087.00,'',0.00,'2021-07-25','1900-01-01',5000.00,75.00),('0WVW',15599301,'23/01/2021',4058.00,'',0.00,'2021-01-23','1900-01-01',4000.00,50.00),('0WVW',15599350,'22/07/2021',1587.00,'',0.00,'2021-07-22','1900-01-01',1500.00,75.00),('0WVW',15599723,'23/06/2021',3087.00,'',0.00,'2021-06-23','1900-01-01',3000.00,75.00),('0WVW',15599749,'21/07/2021',6587.00,'',0.00,'2021-07-21','1900-01-01',6500.00,75.00),('0WVW',15599897,'06/04/2021',2058.00,'',0.00,'2021-04-06','1900-01-01',2000.00,50.00),('0WVW',15599970,'10/07/2021',6587.00,'',0.00,'2021-07-10','1900-01-01',6500.00,75.00),('0UOI',15602709,'01/10/2021',987.00,'',0.00,'2021-10-01','1900-01-01',900.00,75.00),('1FWF',15603558,'11/08/2021',587.00,'',0.00,'2021-08-11','1900-01-01',500.00,75.00),('1FWF',15605314,'07/09/2021',3087.00,'',0.00,'2021-09-07','1900-01-01',3000.00,75.00),('1FWF',15605314,'01/07/2021',1087.00,'',0.00,'2021-07-01','1900-01-01',1000.00,75.00),('15Y7',15607583,'21/12/2021',787.00,'',0.00,'2021-12-21','1900-01-01',700.00,75.00),('0QEG',15616212,'31/12/2021',1987.00,'',0.00,'2021-12-31','1900-01-01',1900.00,75.00),('0S5X',15622202,'18/01/2021',1858.00,'',0.00,'2021-01-18','1900-01-01',1800.00,50.00),('1DDT',15624240,'10/11/2021',587.00,'',0.00,'2021-11-10','1900-01-01',500.00,75.00),('0UPD',15627961,'05/12/2021',687.00,'',0.00,'2021-12-05','1900-01-01',600.00,75.00),('0UPD',15628795,'30/06/2021',687.00,'',0.00,'2021-06-30','1900-01-01',600.00,75.00),('8140',15629678,'14/11/2021',1987.00,'',0.00,'2021-11-14','1900-01-01',1900.00,75.00),('0OBT',15631005,'18/12/2021',2687.00,'',0.00,'2021-12-18','1900-01-01',2600.00,75.00),('0OBT',15631005,'01/01/2021',1658.00,'',0.00,'2021-01-01','1900-01-01',1600.00,50.00),('2305',15633571,'18/12/2021',3087.00,'',0.00,'2021-12-18','1900-01-01',3000.00,75.00),('5460',15647076,'28/01/2021',2158.00,'',0.00,'2021-01-28','1900-01-01',2100.00,50.00),('0Z6U',15647373,'29/12/2021',587.00,'',0.00,'2021-12-29','1900-01-01',500.00,75.00),('1HT4',15647969,'21/12/2021',587.00,'',0.00,'2021-12-21','1900-01-01',500.00,75.00),('1HT4',15647969,'24/07/2021',787.00,'',0.00,'2021-07-24','1900-01-01',700.00,75.00),('0NSX',15650336,'17/08/2021',1087.00,'',0.00,'2021-08-17','1900-01-01',1000.00,75.00),('0SQT',15654999,'12/12/2021',4087.00,'',0.00,'2021-12-12','1900-01-01',4000.00,75.00),('0UJK',15655814,'04/12/2021',787.00,'',0.00,'2021-12-04','1900-01-01',700.00,75.00),('0UJK',15656028,'30/10/2021',1787.00,'',0.00,'2021-10-30','1900-01-01',1700.00,75.00),('0UJK',15656044,'09/12/2021',687.00,'',0.00,'2021-12-09','1900-01-01',600.00,75.00),('0UJK',15656044,'23/09/2021',687.00,'',0.00,'2021-09-23','1900-01-01',600.00,75.00),('0UJK',15656689,'04/12/2021',887.00,'',0.00,'2021-12-04','1900-01-01',800.00,75.00),('0UCI',15661465,'01/05/2021',758.00,'',0.00,'2021-05-01','1900-01-01',700.00,50.00),('0RPU',15668395,'27/04/2021',1058.00,'',0.00,'2021-04-27','1900-01-01',1000.00,50.00),('0322',15669146,'14/03/2021',3158.00,'',0.00,'2021-03-14','1900-01-01',3100.00,50.00),('0Z37',15670003,'18/09/2021',1087.00,'',0.00,'2021-09-18','1900-01-01',1000.00,75.00),('13BZ',15670201,'03/02/2021',1858.00,'',0.00,'2021-02-03','1900-01-01',1800.00,50.00),('0WVW',15674633,'04/07/2021',2087.00,'',0.00,'2021-07-04','1900-01-01',2000.00,75.00),('0WVW',15674666,'08/06/2021',1087.00,'',0.00,'2021-06-08','1900-01-01',1000.00,75.00),('8350',15679855,'12/12/2021',2087.00,'',0.00,'2021-12-12','1900-01-01',2000.00,75.00),('2749',15693278,'28/11/2021',1987.00,'',0.00,'2021-11-28','1900-01-01',1900.00,75.00),('0NO4',15693542,'21/06/2021',2687.00,'',0.00,'2021-06-21','1900-01-01',2600.00,75.00),('0NR9',15704786,'17/05/2021',558.00,'',0.00,'2021-05-17','1900-01-01',471.00,75.00),('0OBT',15713845,'28/01/2021',3938.00,'',0.00,'2021-01-28','1900-01-01',3880.00,50.00),('0N5Z',15720691,'12/02/2021',558.00,'',0.00,'2021-02-12','1900-01-01',500.00,50.00),('9292',15720758,'12/04/2021',558.00,'',0.00,'2021-04-12','1900-01-01',500.00,50.00),('8140',15725047,'22/12/2021',5787.00,'',0.00,'2021-12-22','1900-01-01',5700.00,75.00),('8140',15725047,'02/12/2021',3287.00,'',0.00,'2021-12-02','1900-01-01',3200.00,75.00),('8140',15725112,'26/12/2021',1987.00,'',0.00,'2021-12-26','1900-01-01',1900.00,75.00),('0WC0',15732431,'13/11/2021',587.00,'',0.00,'2021-11-13','1900-01-01',500.00,75.00),('0WVW',15736895,'21/06/2021',3087.00,'',0.00,'2021-06-21','1900-01-01',3000.00,75.00),('5545',15741762,'03/03/2021',558.00,'',0.00,'2021-03-03','1900-01-01',500.00,50.00),('0QMC',15750136,'21/08/2021',787.00,'',0.00,'2021-08-21','1900-01-01',700.00,75.00),('1C23',15750474,'12/02/2021',2258.00,'',0.00,'2021-02-12','1900-01-01',2200.00,50.00),('0UDM',15758717,'15/01/2021',1458.00,'',0.00,'2021-01-15','1900-01-01',1400.00,50.00),('0TKP',15764780,'31/08/2021',1387.00,'',0.00,'2021-08-31','1900-01-01',1300.00,75.00),('0USP',15765597,'27/02/2021',1458.00,'',0.00,'2021-02-27','1900-01-01',1400.00,50.00),('0USP',15765597,'01/01/2021',1258.00,'',0.00,'2021-01-01','1900-01-01',1200.00,50.00),('0NT0',15772502,'17/02/2021',1358.00,'',0.00,'2021-02-17','1900-01-01',1300.00,50.00),('4337',15775430,'19/02/2021',858.00,'',0.00,'2021-02-19','1900-01-01',800.00,50.00),('0PNO',15782170,'04/01/2021',958.00,'',0.00,'2021-01-04','1900-01-01',900.00,50.00),('175Z',15783103,'13/12/2021',787.00,'',0.00,'2021-12-13','1900-01-01',700.00,75.00),('3218',15790173,'03/12/2021',1587.00,'',0.00,'2021-12-03','1900-01-01',1500.00,75.00),('11QA',15793250,'08/06/2021',887.00,'',0.00,'2021-06-08','1900-01-01',800.00,75.00),('1C0O',15794563,'24/04/2021',858.00,'',0.00,'2021-04-24','1900-01-01',800.00,50.00),('1265',15807365,'24/12/2021',2087.00,'',0.00,'2021-12-24','1900-01-01',2000.00,75.00),('2305',15814791,'26/03/2021',758.00,'',0.00,'2021-03-26','1900-01-01',700.00,50.00),('1CT8',15816143,'01/12/2021',787.00,'',0.00,'2021-12-01','1900-01-01',700.00,75.00),('1FNL',15816374,'02/03/2021',1358.00,'',0.00,'2021-03-02','1900-01-01',1300.00,50.00),('9053',15818925,'10/09/2021',2787.00,'',0.00,'2021-09-10','1900-01-01',2700.00,75.00),('0Z67',15821366,'17/01/2021',2058.00,'',0.00,'2021-01-17','1900-01-01',2000.00,50.00),('0YAT',15823305,'26/07/2021',1087.00,'',0.00,'2021-07-26','1900-01-01',1000.00,75.00),('0YAT',15823362,'09/01/2021',558.00,'',0.00,'2021-01-09','1900-01-01',500.00,50.00),('0ZOG',15824782,'06/02/2021',1058.00,'',0.00,'2021-02-06','1900-01-01',1000.00,50.00),('0ZOG',15824808,'14/05/2021',658.00,'',0.00,'2021-05-14','1900-01-01',600.00,50.00),('0ZOG',15824873,'03/01/2021',558.00,'',0.00,'2021-01-03','1900-01-01',500.00,50.00),('0ZOG',15824923,'06/11/2021',887.00,'',0.00,'2021-11-06','1900-01-01',800.00,75.00),('0SIA',15825599,'21/08/2021',987.00,'',0.00,'2021-08-21','1900-01-01',900.00,75.00),('0QK3',15826084,'16/06/2021',1387.00,'',0.00,'2021-06-16','1900-01-01',1300.00,75.00),('0645',15832926,'18/12/2021',1287.00,'',0.00,'2021-12-18','1900-01-01',1200.00,75.00),('1DAF',15839723,'25/02/2021',2358.00,'',0.00,'2021-02-25','1900-01-01',2300.00,50.00),('0QZX',15846991,'05/02/2021',4058.00,'',0.00,'2021-02-05','1900-01-01',4000.00,50.00),('0QZX',15846991,'25/01/2021',4058.00,'',0.00,'2021-01-25','1900-01-01',4000.00,50.00),('5383',15851835,'16/12/2021',887.00,'',0.00,'2021-12-16','1900-01-01',800.00,75.00),('5383',15851835,'02/08/2021',687.00,'',0.00,'2021-08-02','1900-01-01',600.00,75.00),('0T3M',15854904,'24/12/2021',887.00,'',0.00,'2021-12-24','1900-01-01',800.00,75.00),('0T3M',15854904,'08/12/2021',687.00,'',0.00,'2021-12-08','1900-01-01',600.00,75.00),('0V0R',15858012,'28/09/2021',687.00,'',0.00,'2021-09-28','1900-01-01',600.00,75.00),('1CT8',15867286,'22/09/2021',787.00,'',0.00,'2021-09-22','1900-01-01',700.00,75.00),('0UYX',15867740,'26/03/2021',2958.00,'',0.00,'2021-03-26','1900-01-01',2900.00,50.00),('0UYX',15867740,'11/01/2021',2458.00,'',0.00,'2021-01-11','1900-01-01',2400.00,50.00),('0108',15869464,'14/01/2021',1558.00,'',0.00,'2021-01-14','1900-01-01',1500.00,50.00),('17IW',15869597,'02/11/2021',1287.00,'',0.00,'2021-11-02','1900-01-01',1200.00,75.00),('0UZJ',15875685,'23/12/2021',887.00,'',0.00,'2021-12-23','1900-01-01',800.00,75.00),('0254',15876972,'21/01/2021',4000.00,'',0.00,'2021-01-21','1900-01-01',3942.00,50.00),('10WT',15894330,'20/11/2021',1087.00,'',0.00,'2021-11-20','1900-01-01',1000.00,75.00),('10WT',15894330,'16/01/2021',1358.00,'',0.00,'2021-01-16','1900-01-01',1300.00,50.00),('0289',15896905,'24/03/2021',558.00,'',0.00,'2021-03-24','1900-01-01',500.00,50.00),('0419',15900236,'08/07/2021',587.00,'',0.00,'2021-07-08','1900-01-01',500.00,75.00),('10WT',15905201,'10/01/2021',1058.00,'',0.00,'2021-01-10','1900-01-01',1000.00,50.00),('0QMC',15905821,'25/01/2021',1058.00,'',0.00,'2021-01-25','1900-01-01',1000.00,50.00),('0248',15906191,'30/08/2021',1987.00,'',0.00,'2021-08-30','1900-01-01',1900.00,75.00),('0V0F',15917503,'02/11/2021',1687.00,'',0.00,'2021-11-02','1900-01-01',1600.00,75.00),('0V0F',15917628,'04/10/2021',1087.00,'',0.00,'2021-10-04','1900-01-01',1000.00,75.00),('0V1S',15925175,'15/01/2021',2158.00,'',0.00,'2021-01-15','1900-01-01',2100.00,50.00),('0V1S',15925316,'12/01/2021',2558.00,'',0.00,'2021-01-12','1900-01-01',2500.00,50.00),('0RB7',15926165,'16/10/2021',2087.00,'',0.00,'2021-10-16','1900-01-01',2000.00,75.00),('0RB7',15926173,'06/07/2021',3887.00,'',0.00,'2021-07-06','1900-01-01',3800.00,75.00),('0RB7',15926173,'05/01/2021',3258.00,'',0.00,'2021-01-05','1900-01-01',3200.00,50.00),('6617',15931462,'15/01/2021',2558.00,'04/03/2021',2549.96,'2021-01-15','2021-03-04',2500.00,50.00),('0021',15937782,'08/01/2021',558.00,'',0.00,'2021-01-08','1900-01-01',500.00,50.00),('0P4F',15940729,'30/01/2021',1158.00,'',0.00,'2021-01-30','1900-01-01',1100.00,50.00),('0PJ4',15941271,'15/01/2021',558.00,'',0.00,'2021-01-15','1900-01-01',500.00,50.00),('1249',15945355,'18/01/2021',558.00,'',0.00,'2021-01-18','1900-01-01',500.00,50.00),('0V4S',15948086,'02/03/2021',858.00,'',0.00,'2021-03-02','1900-01-01',800.00,50.00),('0Z67',15948680,'08/05/2021',858.00,'',0.00,'2021-05-08','1900-01-01',800.00,50.00),('0Z67',15948680,'11/02/2021',858.00,'',0.00,'2021-02-11','1900-01-01',800.00,50.00),('0289',15971567,'12/12/2021',4887.00,'',0.00,'2021-12-12','1900-01-01',4800.00,75.00),('8140',15978091,'21/08/2021',1487.00,'',0.00,'2021-08-21','1900-01-01',1400.00,75.00),('0TSV',15979792,'21/09/2021',587.00,'',0.00,'2021-09-21','1900-01-01',500.00,75.00),('3776',15995038,'12/02/2021',758.00,'',0.00,'2021-02-12','1900-01-01',700.00,50.00),('0PFT',15996994,'15/01/2021',858.00,'',0.00,'2021-01-15','1900-01-01',800.00,50.00),('0Z67',15998404,'01/02/2021',1658.00,'',0.00,'2021-02-01','1900-01-01',1600.00,50.00),('133V',16002040,'07/02/2021',758.00,'',0.00,'2021-02-07','1900-01-01',700.00,50.00),('160E',16003022,'10/01/2021',2058.00,'',0.00,'2021-01-10','1900-01-01',2000.00,50.00),('0419',16003477,'16/11/2021',587.00,'',0.00,'2021-11-16','1900-01-01',500.00,75.00),('1HZK',16007247,'12/11/2021',5287.00,'',0.00,'2021-11-12','1900-01-01',5200.00,75.00),('0YP9',16007262,'31/01/2021',858.00,'',0.00,'2021-01-31','1900-01-01',800.00,50.00),('1HT4',16016305,'02/11/2021',787.00,'',0.00,'2021-11-02','1900-01-01',700.00,75.00),('0V0F',16017584,'15/08/2021',587.00,'',0.00,'2021-08-15','1900-01-01',500.00,75.00),('0289',16042525,'07/12/2021',1687.00,'',0.00,'2021-12-07','1900-01-01',1600.00,75.00),('0289',16042525,'11/02/2021',1658.00,'',0.00,'2021-02-11','1900-01-01',1600.00,50.00),('0SDT',16046120,'20/12/2021',1087.00,'',0.00,'2021-12-20','1900-01-01',1000.00,75.00),('0S5X',16049074,'31/07/2021',3387.00,'',0.00,'2021-07-31','1900-01-01',3300.00,75.00),('5383',16051476,'03/12/2021',687.00,'',0.00,'2021-12-03','1900-01-01',600.00,75.00),('5383',16051476,'01/09/2021',587.00,'',0.00,'2021-09-01','1900-01-01',500.00,75.00),('8300',16061194,'12/02/2021',558.00,'',0.00,'2021-02-12','1900-01-01',500.00,50.00),('1EUY',16061376,'01/09/2021',6187.00,'',0.00,'2021-09-01','1900-01-01',6100.00,75.00),('0YAT',16066219,'17/01/2021',1058.00,'',0.00,'2021-01-17','1900-01-01',1000.00,50.00),('0YAT',16066409,'11/09/2021',1287.00,'',0.00,'2021-09-11','1900-01-01',1200.00,75.00),('0YAT',16066409,'17/01/2021',1058.00,'',0.00,'2021-01-17','1900-01-01',1000.00,50.00),('0079',16069072,'20/01/2021',1958.00,'',0.00,'2021-01-20','1900-01-01',1900.00,50.00),('1BC8',16070856,'05/10/2021',787.00,'16/11/2021',779.73,'2021-10-05','2021-11-16',700.00,75.00),('1BC8',16070856,'08/05/2021',558.00,'',0.00,'2021-05-08','1900-01-01',500.00,50.00),('1EUY',16074387,'24/08/2021',1587.00,'',0.00,'2021-08-24','1900-01-01',1500.00,75.00),('0SOU',16081408,'05/12/2021',1487.00,'',0.00,'2021-12-05','1900-01-01',1400.00,75.00),('3497',16081937,'29/01/2021',1958.00,'',0.00,'2021-01-29','1900-01-01',1900.00,50.00),('6411',16082430,'27/08/2021',787.00,'',0.00,'2021-08-27','1900-01-01',700.00,75.00),('6411',16082430,'13/08/2021',787.00,'',0.00,'2021-08-13','1900-01-01',700.00,75.00),('0Q7A',16083073,'27/01/2021',558.00,'',0.00,'2021-01-27','1900-01-01',500.00,50.00),('1BDA',16083909,'14/08/2021',887.00,'',0.00,'2021-08-14','1900-01-01',800.00,75.00),('1BDA',16084543,'01/08/2021',1087.00,'',0.00,'2021-08-01','1900-01-01',1000.00,75.00),('1BC8',16084543,'24/03/2021',1058.00,'',0.00,'2021-03-24','1900-01-01',1000.00,50.00),('0QXL',16085771,'25/02/2021',1058.00,'',0.00,'2021-02-25','1900-01-01',1000.00,50.00),('5629',16092033,'16/03/2021',2358.00,'',0.00,'2021-03-16','1900-01-01',2300.00,50.00),('5629',16092041,'06/09/2021',587.00,'',0.00,'2021-09-06','1900-01-01',500.00,75.00),('5629',16092041,'11/08/2021',587.00,'',0.00,'2021-08-11','1900-01-01',500.00,75.00),('0V0F',16094294,'11/01/2021',1658.00,'',0.00,'2021-01-11','1900-01-01',1600.00,50.00),('0V81',16094997,'30/03/2021',1058.00,'',0.00,'2021-03-30','1900-01-01',1000.00,50.00),('14OH',16105355,'20/02/2021',2258.00,'',0.00,'2021-02-20','1900-01-01',2200.00,50.00),('8140',16106924,'26/02/2021',1458.00,'',0.00,'2021-02-26','1900-01-01',1400.00,50.00),('8140',16107021,'02/11/2021',1187.00,'',0.00,'2021-11-02','1900-01-01',1100.00,75.00),('0108',16109175,'15/01/2021',3458.00,'',0.00,'2021-01-15','1900-01-01',3400.00,50.00),('1EUY',16110371,'17/12/2021',3287.00,'',0.00,'2021-12-17','1900-01-01',3200.00,75.00),('1EUY',16119588,'19/03/2021',1258.00,'',0.00,'2021-03-19','1900-01-01',1200.00,50.00),('0NIA',16130346,'11/01/2021',958.00,'',0.00,'2021-01-11','1900-01-01',900.00,50.00),('175Z',16139180,'02/12/2021',2787.00,'',0.00,'2021-12-02','1900-01-01',2700.00,75.00),('2305',16141004,'13/01/2021',1058.00,'',0.00,'2021-01-13','1900-01-01',1000.00,50.00),('5034',16141137,'01/12/2021',1087.00,'',0.00,'2021-12-01','1900-01-01',1000.00,75.00),('5034',16141145,'30/12/2021',1987.00,'',0.00,'2021-12-30','1900-01-01',1900.00,75.00),('4851',16150062,'26/08/2021',587.00,'',0.00,'2021-08-26','1900-01-01',500.00,75.00),('17DY',16152522,'30/01/2021',1458.00,'',0.00,'2021-01-30','1900-01-01',1400.00,50.00),('1EUY',16156648,'07/05/2021',2558.00,'',0.00,'2021-05-07','1900-01-01',2500.00,50.00),('3610',16157109,'23/07/2021',1987.00,'',0.00,'2021-07-23','1900-01-01',1900.00,75.00),('0TJT',16161135,'10/01/2021',2858.00,'26/02/2021',2839.84,'2021-01-10','2021-02-26',2800.00,50.00),('0NVR',16178626,'26/11/2021',4087.00,'',0.00,'2021-11-26','1900-01-01',4000.00,75.00),('0O5J',16187700,'15/01/2021',958.00,'',0.00,'2021-01-15','1900-01-01',900.00,50.00),('0NA5',16188195,'27/11/2021',687.00,'',0.00,'2021-11-27','1900-01-01',600.00,75.00),('0NA5',16188195,'12/10/2021',587.00,'',0.00,'2021-10-12','1900-01-01',500.00,75.00),('0616',16189730,'22/09/2021',687.00,'',0.00,'2021-09-22','1900-01-01',600.00,75.00),('6617',16194391,'18/01/2021',3958.00,'05/03/2021',3890.00,'2021-01-18','2021-03-05',3900.00,50.00),('6617',16194524,'15/01/2021',858.00,'04/03/2021',853.82,'2021-01-15','2021-03-04',800.00,50.00),('0NSX',16198327,'25/09/2021',1087.00,'',0.00,'2021-09-25','1900-01-01',1000.00,75.00),('0VD2',16199101,'13/01/2021',958.00,'',0.00,'2021-01-13','1900-01-01',900.00,50.00),('9808',16202228,'18/09/2021',4987.00,'',0.00,'2021-09-18','1900-01-01',4900.00,75.00),('0YAT',16203465,'01/04/2021',858.00,'12/05/2021',842.32,'2021-04-01','2021-05-12',800.00,50.00),('0V3H',16209363,'29/12/2021',787.00,'',0.00,'2021-12-29','1900-01-01',700.00,75.00),('0V0F',16227134,'17/12/2021',1487.00,'',0.00,'2021-12-17','1900-01-01',1400.00,75.00),('0404',16228249,'31/01/2021',3058.00,'',0.00,'2021-01-31','1900-01-01',3000.00,50.00),('0VGL',16240848,'27/08/2021',687.00,'',0.00,'2021-08-27','1900-01-01',600.00,75.00),('2980',16243081,'02/12/2021',1287.00,'',0.00,'2021-12-02','1900-01-01',1200.00,75.00),('4505',16245631,'18/12/2021',1587.00,'',0.00,'2021-12-18','1900-01-01',1500.00,75.00),('0NO4',16246415,'25/04/2021',1158.00,'',0.00,'2021-04-25','1900-01-01',1100.00,50.00),('6502',16251266,'08/08/2021',2387.00,'',0.00,'2021-08-08','1900-01-01',2300.00,75.00),('8140',16253437,'04/01/2021',1458.00,'',0.00,'2021-01-04','1900-01-01',1400.00,50.00),('8140',16253577,'09/03/2021',558.00,'',0.00,'2021-03-09','1900-01-01',500.00,50.00),('0QYK',16259103,'07/12/2021',2087.00,'',0.00,'2021-12-07','1900-01-01',2000.00,75.00),('13IV',16263006,'23/11/2021',1887.00,'',0.00,'2021-11-23','1900-01-01',1800.00,75.00),('2305',16275299,'01/02/2021',1058.00,'',0.00,'2021-02-01','1900-01-01',1000.00,50.00),('5974',16276446,'26/06/2021',987.00,'',0.00,'2021-06-26','1900-01-01',900.00,75.00),('1C0O',16282782,'26/12/2021',1487.00,'',0.00,'2021-12-26','1900-01-01',1400.00,75.00),('1C0O',16282782,'27/11/2021',1187.00,'',0.00,'2021-11-27','1900-01-01',1100.00,75.00),('0YAT',16294852,'23/01/2021',1058.00,'04/03/2021',1009.78,'2021-01-23','2021-03-04',1000.00,50.00),('0QIS',16295594,'17/10/2021',6587.00,'',0.00,'2021-10-17','1900-01-01',6500.00,75.00),('0VJ1',16296428,'22/04/2021',958.00,'',0.00,'2021-04-22','1900-01-01',900.00,50.00),('0VJ1',16296436,'23/06/2021',2587.00,'',0.00,'2021-06-23','1900-01-01',2500.00,75.00),('0Z6U',16299950,'25/01/2021',3558.00,'',0.00,'2021-01-25','1900-01-01',3500.00,50.00),('0WOM',16304107,'23/10/2021',1087.00,'',0.00,'2021-10-23','1900-01-01',1000.00,75.00),('0NO4',16304107,'06/07/2021',1087.00,'',0.00,'2021-07-06','1900-01-01',1000.00,75.00),('0NO4',16304131,'08/01/2021',558.00,'',0.00,'2021-01-08','1900-01-01',500.00,50.00),('7402',16321515,'12/02/2021',1158.00,'',0.00,'2021-02-12','1900-01-01',1100.00,50.00),('0405',16323396,'20/11/2021',1387.00,'',0.00,'2021-11-20','1900-01-01',1300.00,75.00),('0VHM',16327983,'27/06/2021',587.00,'',0.00,'2021-06-27','1900-01-01',500.00,75.00),('7302',16334781,'17/12/2021',2087.00,'',0.00,'2021-12-17','1900-01-01',2000.00,75.00),('0NB2',16337404,'12/11/2021',587.00,'',0.00,'2021-11-12','1900-01-01',500.00,75.00),('0TQF',16342040,'17/09/2021',1087.00,'',0.00,'2021-09-17','1900-01-01',1000.00,75.00),('0TQF',16345613,'18/11/2021',687.00,'',0.00,'2021-11-18','1900-01-01',600.00,75.00),('8282',16345720,'06/02/2021',958.00,'',0.00,'2021-02-06','1900-01-01',900.00,50.00),('8282',16345720,'25/01/2021',958.00,'',0.00,'2021-01-25','1900-01-01',900.00,50.00),('0T8F',16355455,'04/05/2021',858.00,'',0.00,'2021-05-04','1900-01-01',800.00,50.00),('0419',16356966,'04/01/2021',1458.00,'',0.00,'2021-01-04','1900-01-01',1400.00,50.00),('8140',16368847,'15/01/2021',1458.00,'',0.00,'2021-01-15','1900-01-01',1400.00,50.00),('8140',16369027,'22/03/2021',1058.00,'',0.00,'2021-03-22','1900-01-01',1000.00,50.00),('1DL2',16373722,'02/02/2021',858.00,'',0.00,'2021-02-02','1900-01-01',800.00,50.00),('1DL2',16373722,'17/01/2021',858.00,'',0.00,'2021-01-17','1900-01-01',800.00,50.00),('0YL6',16374969,'01/06/2021',1587.00,'',0.00,'2021-06-01','1900-01-01',1500.00,75.00),('0YL6',16374969,'29/03/2021',658.00,'',0.00,'2021-03-29','1900-01-01',600.00,50.00),('0RSF',16385999,'01/11/2021',787.00,'',0.00,'2021-11-01','1900-01-01',700.00,75.00),('0136',16392979,'11/08/2021',587.00,'',0.00,'2021-08-11','1900-01-01',500.00,75.00),('0419',16408940,'06/12/2021',1587.00,'',0.00,'2021-12-06','1900-01-01',1500.00,75.00),('0419',16408940,'23/11/2021',687.00,'',0.00,'2021-11-23','1900-01-01',600.00,75.00),('0PHL',16409245,'06/12/2021',1087.00,'',0.00,'2021-12-06','1900-01-01',1000.00,75.00),('0RFB',16414278,'20/02/2021',558.00,'',0.00,'2021-02-20','1900-01-01',500.00,50.00),('2305',16414450,'10/04/2021',1558.00,'',0.00,'2021-04-10','1900-01-01',1500.00,50.00),('0NXP',16418808,'26/07/2021',587.00,'',0.00,'2021-07-26','1900-01-01',500.00,75.00),('134N',16419798,'20/02/2021',558.00,'',0.00,'2021-02-20','1900-01-01',500.00,50.00),('134N',16419947,'18/06/2021',587.00,'',0.00,'2021-06-18','1900-01-01',500.00,75.00),('1CM7',16421257,'24/08/2021',787.00,'',0.00,'2021-08-24','1900-01-01',700.00,75.00),('1CM7',16421349,'29/12/2021',687.00,'',0.00,'2021-12-29','1900-01-01',600.00,75.00),('1CM7',16421349,'24/10/2021',687.00,'',0.00,'2021-10-24','1900-01-01',600.00,75.00),('1CM7',16421687,'29/11/2021',787.00,'',0.00,'2021-11-29','1900-01-01',700.00,75.00),('0254',16422982,'04/12/2021',3087.00,'',0.00,'2021-12-04','1900-01-01',3000.00,75.00),('0254',16422982,'11/01/2021',3058.00,'',0.00,'2021-01-11','1900-01-01',3000.00,50.00),('122S',16429433,'22/01/2021',1158.00,'',0.00,'2021-01-22','1900-01-01',1100.00,50.00),('0QMC',16436875,'09/01/2021',558.00,'',0.00,'2021-01-09','1900-01-01',500.00,50.00),('0419',16437907,'14/01/2021',1558.00,'',0.00,'2021-01-14','1900-01-01',1500.00,50.00),('0UPA',16439242,'30/11/2021',1587.00,'',0.00,'2021-11-30','1900-01-01',1500.00,75.00),('0UPA',16439242,'30/04/2021',1158.00,'',0.00,'2021-04-30','1900-01-01',1100.00,50.00),('0USP',16442303,'16/11/2021',1587.00,'',0.00,'2021-11-16','1900-01-01',1500.00,75.00),('1019',16444036,'10/01/2021',1558.00,'',0.00,'2021-01-10','1900-01-01',1500.00,50.00),('0QZ1',16444242,'16/12/2021',2287.00,'',0.00,'2021-12-16','1900-01-01',2200.00,75.00),('0S0R',16447328,'02/03/2021',1058.00,'',0.00,'2021-03-02','1900-01-01',1000.00,50.00),('8140',16468720,'15/01/2021',1458.00,'',0.00,'2021-01-15','1900-01-01',1400.00,50.00),('8140',16469165,'15/11/2021',1587.00,'',0.00,'2021-11-15','1900-01-01',1500.00,75.00),('0WVW',16479081,'21/07/2021',2487.00,'',0.00,'2021-07-21','1900-01-01',2400.00,75.00),('0WVW',16479537,'12/02/2021',1258.00,'',0.00,'2021-02-12','1900-01-01',1200.00,50.00),('0WVW',16479610,'07/03/2021',1258.00,'',0.00,'2021-03-07','1900-01-01',1200.00,50.00),('0VPX',16487613,'31/01/2021',958.00,'',0.00,'2021-01-31','1900-01-01',900.00,50.00),('0VPX',16487829,'04/01/2021',1858.00,'',0.00,'2021-01-04','1900-01-01',1800.00,50.00),('0VPX',16487886,'15/01/2021',1258.00,'',0.00,'2021-01-15','1900-01-01',1200.00,50.00),('0T9X',16499998,'15/04/2021',1758.00,'',0.00,'2021-04-15','1900-01-01',1700.00,50.00),('19U0',16504748,'16/01/2021',1858.00,'',0.00,'2021-01-16','1900-01-01',1800.00,50.00),('175Z',16506370,'13/02/2021',1958.00,'',0.00,'2021-02-13','1900-01-01',1900.00,50.00),('2305',16511388,'24/01/2021',858.00,'',0.00,'2021-01-24','1900-01-01',800.00,50.00),('0V0F',16517476,'05/02/2021',1358.00,'',0.00,'2021-02-05','1900-01-01',1300.00,50.00),('0V0F',16517609,'01/09/2021',2887.00,'',0.00,'2021-09-01','1900-01-01',2800.00,75.00),('0V0F',16518144,'19/05/2021',2358.00,'',0.00,'2021-05-19','1900-01-01',2271.00,75.00),('0V0F',16518201,'23/01/2021',1158.00,'',0.00,'2021-01-23','1900-01-01',1100.00,50.00),('0VS7',16526766,'25/01/2021',1158.00,'',0.00,'2021-01-25','1900-01-01',1100.00,50.00),('5490',16530800,'16/12/2021',4587.00,'',0.00,'2021-12-16','1900-01-01',4500.00,75.00),('5490',16530800,'15/01/2021',4058.00,'',0.00,'2021-01-15','1900-01-01',4000.00,50.00),('0VS5',16532129,'24/06/2021',2087.00,'',0.00,'2021-06-24','1900-01-01',2000.00,75.00),('0VS5',16532129,'11/02/2021',2858.00,'',0.00,'2021-02-11','1900-01-01',2800.00,50.00),('0VS5',16532228,'23/01/2021',1458.00,'',0.00,'2021-01-23','1900-01-01',1400.00,50.00),('0VS5',16532335,'15/07/2021',2287.00,'',0.00,'2021-07-15','1900-01-01',2200.00,75.00),('0108',16533226,'14/01/2021',4058.00,'',0.00,'2021-01-14','1900-01-01',4000.00,50.00),('9220',16533663,'05/01/2021',2458.00,'',0.00,'2021-01-05','1900-01-01',2400.00,50.00),('4505',16536534,'14/08/2021',687.00,'',0.00,'2021-08-14','1900-01-01',600.00,75.00),('5297',16543084,'17/12/2021',2887.00,'',0.00,'2021-12-17','1900-01-01',2800.00,75.00),('1BDA',16545709,'21/09/2021',1187.00,'',0.00,'2021-09-21','1900-01-01',1100.00,75.00),('1BC8',16545709,'02/09/2021',1187.00,'',0.00,'2021-09-02','1900-01-01',1100.00,75.00),('0289',16546475,'14/01/2021',2058.00,'',0.00,'2021-01-14','1900-01-01',2000.00,50.00),('1HX3',16551822,'25/11/2021',3087.00,'',0.00,'2021-11-25','1900-01-01',3000.00,75.00),('0TQH',16555526,'06/06/2021',1287.00,'',0.00,'2021-06-06','1900-01-01',1200.00,75.00),('6410',16555633,'14/02/2021',558.00,'',0.00,'2021-02-14','1900-01-01',500.00,50.00),('0WVW',16565822,'09/04/2021',2258.00,'',0.00,'2021-04-09','1900-01-01',2200.00,50.00),('0NQP',16566374,'04/07/2021',1787.00,'',0.00,'2021-07-04','1900-01-01',1700.00,75.00),('0VT0',16566820,'25/12/2021',987.00,'',0.00,'2021-12-25','1900-01-01',900.00,75.00),('0VT0',16566820,'10/10/2021',1187.00,'',0.00,'2021-10-10','1900-01-01',1100.00,75.00),('0NIA',16570806,'03/02/2021',858.00,'',0.00,'2021-02-03','1900-01-01',800.00,50.00),('0YA1',16572158,'16/01/2021',1958.00,'',0.00,'2021-01-16','1900-01-01',1900.00,50.00),('0VTM',16573628,'21/11/2021',587.00,'',0.00,'2021-11-21','1900-01-01',500.00,75.00),('0X6F',16587321,'09/01/2021',658.00,'',0.00,'2021-01-09','1900-01-01',600.00,50.00),('1GYK',16593493,'25/09/2021',1087.00,'',0.00,'2021-09-25','1900-01-01',1000.00,75.00),('2305',16596553,'24/01/2021',1758.00,'',0.00,'2021-01-24','1900-01-01',1700.00,50.00),('0O8P',16598088,'08/01/2021',658.00,'',0.00,'2021-01-08','1900-01-01',600.00,50.00),('5063',16598880,'16/11/2021',1887.00,'',0.00,'2021-11-16','1900-01-01',1800.00,75.00),('6617',16598989,'04/01/2021',2058.00,'',0.00,'2021-01-04','1900-01-01',2000.00,50.00),('6617',16599045,'15/01/2021',2258.00,'04/03/2021',2242.81,'2021-01-15','2021-03-04',2200.00,50.00),('9135',16603201,'19/06/2021',2087.00,'',0.00,'2021-06-19','1900-01-01',2000.00,75.00),('6711',16605206,'01/12/2021',1987.00,'19/01/2022',1942.20,'2021-12-01','2022-01-19',1900.00,75.00),('0OSB',16605255,'17/01/2021',1258.00,'',0.00,'2021-01-17','1900-01-01',1200.00,50.00),('2448',16607723,'22/07/2021',1287.00,'',0.00,'2021-07-22','1900-01-01',1200.00,75.00),('2448',16607723,'13/02/2021',1258.00,'',0.00,'2021-02-13','1900-01-01',1200.00,50.00),('9377',16613101,'19/12/2021',5487.00,'',0.00,'2021-12-19','1900-01-01',5400.00,75.00),('0VUF',16614497,'27/07/2021',1587.00,'',0.00,'2021-07-27','1900-01-01',1500.00,75.00),('15HX',16619306,'12/03/2021',1058.00,'',0.00,'2021-03-12','1900-01-01',1000.00,50.00),('0VU0',16621179,'05/04/2021',658.00,'',0.00,'2021-04-05','1900-01-01',600.00,50.00),('0Q1B',16623118,'31/07/2021',3087.00,'',0.00,'2021-07-31','1900-01-01',3000.00,75.00),('17DY',16625444,'04/01/2021',1558.00,'',0.00,'2021-01-04','1900-01-01',1500.00,50.00),('0405',16625857,'26/12/2021',5887.00,'',0.00,'2021-12-26','1900-01-01',5800.00,75.00),('2117',16642548,'12/02/2021',2358.00,'',0.00,'2021-02-12','1900-01-01',2300.00,50.00),('0419',16645624,'11/06/2021',1587.00,'',0.00,'2021-06-11','1900-01-01',1500.00,75.00),('0RBZ',16647125,'12/09/2021',587.00,'22/10/2021',552.25,'2021-09-12','2021-10-22',500.00,75.00),('0419',16650095,'08/01/2021',1058.00,'',0.00,'2021-01-08','1900-01-01',1000.00,50.00),('0419',16654089,'06/01/2021',1258.00,'',0.00,'2021-01-06','1900-01-01',1200.00,50.00),('1B7K',16658999,'12/11/2021',687.00,'',0.00,'2021-11-12','1900-01-01',600.00,75.00),('1B7K',16659187,'14/06/2021',1087.00,'',0.00,'2021-06-14','1900-01-01',1000.00,75.00),('5233',16661829,'15/01/2021',1558.00,'',0.00,'2021-01-15','1900-01-01',1500.00,50.00),('2305',16667230,'14/01/2021',3758.00,'',0.00,'2021-01-14','1900-01-01',3700.00,50.00),('3159',16670309,'24/01/2021',558.00,'',0.00,'2021-01-24','1900-01-01',500.00,50.00),('0VXT',16675357,'26/07/2021',1587.00,'',0.00,'2021-07-26','1900-01-01',1500.00,75.00),('17DY',16677866,'29/12/2021',587.00,'',0.00,'2021-12-29','1900-01-01',500.00,75.00),('17DY',16677866,'07/01/2021',558.00,'',0.00,'2021-01-07','1900-01-01',500.00,50.00),('2011',16678708,'07/08/2021',1887.00,'',0.00,'2021-08-07','1900-01-01',1800.00,75.00),('2034',16680548,'09/12/2021',2087.00,'',0.00,'2021-12-09','1900-01-01',2000.00,75.00),('1DV6',16684581,'27/11/2021',687.00,'',0.00,'2021-11-27','1900-01-01',600.00,75.00),('9711',16684656,'09/03/2021',558.00,'',0.00,'2021-03-09','1900-01-01',500.00,50.00),('2117',16689416,'11/02/2021',1558.00,'',0.00,'2021-02-11','1900-01-01',1500.00,50.00),('134N',16692824,'10/09/2021',1087.00,'',0.00,'2021-09-10','1900-01-01',1000.00,75.00),('0W6U',16694200,'23/01/2021',558.00,'',0.00,'2021-01-23','1900-01-01',500.00,50.00),('0VU7',16697005,'07/02/2021',558.00,'',0.00,'2021-02-07','1900-01-01',500.00,50.00),('0VU7',16697021,'12/02/2021',1458.00,'',0.00,'2021-02-12','1900-01-01',1400.00,50.00),('16PU',16697138,'02/12/2021',6587.00,'',0.00,'2021-12-02','1900-01-01',6500.00,75.00),('1HZP',16697245,'05/08/2021',1387.00,'',0.00,'2021-08-05','1900-01-01',1300.00,75.00),('0VU7',16697567,'08/02/2021',758.00,'',0.00,'2021-02-08','1900-01-01',700.00,50.00),('1265',16697849,'13/02/2021',658.00,'',0.00,'2021-02-13','1900-01-01',600.00,50.00),('4442',16697864,'30/08/2021',987.00,'',0.00,'2021-08-30','1900-01-01',900.00,75.00),('156E',16698979,'29/01/2021',1758.00,'',0.00,'2021-01-29','1900-01-01',1700.00,50.00),('0221',16701831,'08/02/2021',1558.00,'',0.00,'2021-02-08','1900-01-01',1500.00,50.00),('9240',16701963,'29/01/2021',3058.00,'',0.00,'2021-01-29','1900-01-01',3000.00,50.00),('9240',16701997,'30/01/2021',658.00,'',0.00,'2021-01-30','1900-01-01',600.00,50.00),('9240',16702003,'24/02/2021',2758.00,'',0.00,'2021-02-24','1900-01-01',2700.00,50.00),('1132',16711434,'31/12/2021',1587.00,'',0.00,'2021-12-31','1900-01-01',1500.00,75.00),('0VYE',16712150,'13/01/2021',3658.00,'',0.00,'2021-01-13','1900-01-01',3600.00,50.00),('8576',16715591,'15/01/2021',3558.00,'',0.00,'2021-01-15','1900-01-01',3500.00,50.00),('1BI5',16734576,'10/04/2021',1258.00,'',0.00,'2021-04-10','1900-01-01',1200.00,50.00),('1BI5',16734576,'02/02/2021',2558.00,'',0.00,'2021-02-02','1900-01-01',2500.00,50.00),('1BO7',16735482,'11/10/2021',887.00,'',0.00,'2021-10-11','1900-01-01',800.00,75.00),('8140',16737983,'25/12/2021',2087.00,'',0.00,'2021-12-25','1900-01-01',2000.00,75.00),('8140',16738098,'19/01/2021',1058.00,'',0.00,'2021-01-19','1900-01-01',1000.00,50.00),('8140',16738205,'03/12/2021',1987.00,'',0.00,'2021-12-03','1900-01-01',1900.00,75.00),('0286',16740607,'13/08/2021',1487.00,'30/09/2021',1485.99,'2021-08-13','2021-09-30',1400.00,75.00),('3468',16747008,'31/01/2021',1258.00,'',0.00,'2021-01-31','1900-01-01',1200.00,50.00),('4687',16751778,'02/10/2021',1487.00,'',0.00,'2021-10-02','1900-01-01',1400.00,75.00),('1AJZ',16754145,'05/02/2021',1358.00,'',0.00,'2021-02-05','1900-01-01',1300.00,50.00),('0254',16756462,'22/01/2021',2258.00,'',0.00,'2021-01-22','1900-01-01',2200.00,50.00),('0W0W',16763856,'12/01/2021',3358.00,'',0.00,'2021-01-12','1900-01-01',3300.00,50.00),('0289',16777419,'02/12/2021',1087.00,'',0.00,'2021-12-02','1900-01-01',1000.00,75.00),('0VX5',16778052,'29/10/2021',787.00,'',0.00,'2021-10-29','1900-01-01',700.00,75.00),('18DX',16779795,'01/09/2021',4187.00,'20/10/2021',4187.00,'2021-09-01','2021-10-20',4100.00,75.00),('18DX',16779795,'22/01/2021',2058.00,'',0.00,'2021-01-22','1900-01-01',2000.00,50.00),('1CE3',16782955,'27/01/2021',558.00,'',0.00,'2021-01-27','1900-01-01',500.00,50.00),('5074',16788879,'07/12/2021',6087.00,'',0.00,'2021-12-07','1900-01-01',6000.00,75.00),('5074',16788879,'18/02/2021',4058.00,'',0.00,'2021-02-18','1900-01-01',4000.00,50.00),('0V0A',16791964,'02/08/2021',1587.00,'',0.00,'2021-08-02','1900-01-01',1500.00,75.00),('0WVW',16793788,'16/01/2021',3758.00,'',0.00,'2021-01-16','1900-01-01',3700.00,50.00),('0W1Z',16794968,'21/08/2021',1987.00,'',0.00,'2021-08-21','1900-01-01',1900.00,75.00),('0W1Z',16794968,'03/03/2021',558.00,'',0.00,'2021-03-03','1900-01-01',500.00,50.00),('0W1Z',16795320,'04/12/2021',887.00,'13/01/2022',887.00,'2021-12-04','2022-01-13',800.00,75.00),('0W1Z',16795353,'31/12/2021',587.00,'',0.00,'2021-12-31','1900-01-01',500.00,75.00),('0W1Z',16795361,'24/12/2021',587.00,'',0.00,'2021-12-24','1900-01-01',500.00,75.00),('0W23',16795593,'26/12/2021',1187.00,'',0.00,'2021-12-26','1900-01-01',1100.00,75.00),('0W23',16795619,'26/12/2021',1287.00,'',0.00,'2021-12-26','1900-01-01',1200.00,75.00),('0W23',16795619,'19/12/2021',587.00,'',0.00,'2021-12-19','1900-01-01',500.00,75.00),('0W23',16795718,'27/12/2021',587.00,'',0.00,'2021-12-27','1900-01-01',500.00,75.00),('0W23',16795759,'13/02/2021',1058.00,'',0.00,'2021-02-13','1900-01-01',1000.00,50.00),('0211',16797409,'17/01/2021',558.00,'',0.00,'2021-01-17','1900-01-01',500.00,50.00),('0ZJX',16804338,'31/10/2021',787.00,'',0.00,'2021-10-31','1900-01-01',700.00,75.00),('0405',16806788,'12/11/2021',887.00,'',0.00,'2021-11-12','1900-01-01',800.00,75.00),('0S29',16810012,'27/05/2021',587.00,'',0.00,'2021-05-27','1900-01-01',500.00,75.00),('0517',16811739,'07/08/2021',787.00,'',0.00,'2021-08-07','1900-01-01',700.00,75.00),('0W0Z',16812083,'26/08/2021',3087.00,'',0.00,'2021-08-26','1900-01-01',3000.00,75.00),('0W0Z',16812109,'13/05/2021',3058.00,'',0.00,'2021-05-13','1900-01-01',3000.00,50.00),('0W0Z',16812141,'31/12/2021',2987.00,'',0.00,'2021-12-31','1900-01-01',2900.00,75.00),('0W0Z',16812141,'18/12/2021',2987.00,'',0.00,'2021-12-18','1900-01-01',2900.00,75.00),('0PNO',16817009,'25/02/2021',758.00,'',0.00,'2021-02-25','1900-01-01',700.00,50.00),('0W42',16820987,'27/01/2021',1858.00,'',0.00,'2021-01-27','1900-01-01',1800.00,50.00),('0SJM',16843021,'11/06/2021',1687.00,'',0.00,'2021-06-11','1900-01-01',1600.00,75.00),('0SJM',16843021,'25/01/2021',1458.00,'',0.00,'2021-01-25','1900-01-01',1400.00,50.00),('0SJM',16843070,'03/01/2021',1258.00,'',0.00,'2021-01-03','1900-01-01',1200.00,50.00),('18X9',16854820,'03/03/2021',1558.00,'',0.00,'2021-03-03','1900-01-01',1500.00,50.00),('0RB7',16856882,'05/01/2021',2258.00,'',0.00,'2021-01-05','1900-01-01',2200.00,50.00),('7861',16861528,'02/09/2021',3287.00,'',0.00,'2021-09-02','1900-01-01',3200.00,75.00),('7861',16861528,'12/06/2021',3187.00,'',0.00,'2021-06-12','1900-01-01',3100.00,75.00),('0WVW',16862807,'18/01/2021',1258.00,'',0.00,'2021-01-18','1900-01-01',1200.00,50.00),('0WVW',16863011,'18/06/2021',2087.00,'',0.00,'2021-06-18','1900-01-01',2000.00,75.00),('0WVW',16863060,'19/03/2021',1258.00,'',0.00,'2021-03-19','1900-01-01',1200.00,50.00),('0WVW',16863094,'27/06/2021',1287.00,'',0.00,'2021-06-27','1900-01-01',1200.00,75.00),('0WVW',16863102,'16/02/2021',1258.00,'',0.00,'2021-02-16','1900-01-01',1200.00,50.00),('0WVW',16863177,'20/07/2021',2087.00,'',0.00,'2021-07-20','1900-01-01',2000.00,75.00),('0WVW',16863425,'17/02/2021',1258.00,'',0.00,'2021-02-17','1900-01-01',1200.00,50.00),('0WVW',16863656,'25/07/2021',1587.00,'',0.00,'2021-07-25','1900-01-01',1500.00,75.00),('0WVW',16864126,'02/01/2021',1258.00,'',0.00,'2021-01-02','1900-01-01',1200.00,50.00),('0WVW',16864381,'04/02/2021',1258.00,'',0.00,'2021-02-04','1900-01-01',1200.00,50.00),('0WVW',16864712,'01/02/2021',1258.00,'',0.00,'2021-02-01','1900-01-01',1200.00,50.00),('0WVW',16864845,'13/02/2021',1258.00,'',0.00,'2021-02-13','1900-01-01',1200.00,50.00),('0WVW',16864860,'18/06/2021',1587.00,'18/08/2021',1550.72,'2021-06-18','2021-08-18',1500.00,75.00),('0WVW',16865008,'18/06/2021',3087.00,'',0.00,'2021-06-18','1900-01-01',3000.00,75.00),('0WVW',16865024,'18/06/2021',1587.00,'',0.00,'2021-06-18','1900-01-01',1500.00,75.00),('0WVW',16865115,'22/05/2021',1287.00,'',0.00,'2021-05-22','1900-01-01',1200.00,75.00),('0WVW',16865248,'17/02/2021',1258.00,'',0.00,'2021-02-17','1900-01-01',1200.00,50.00),('0WVW',16865347,'20/07/2021',3087.00,'17/09/2021',3055.02,'2021-07-20','2021-09-17',3000.00,75.00),('0WVW',16865396,'03/06/2021',3087.00,'',0.00,'2021-06-03','1900-01-01',3000.00,75.00),('0WVW',16865594,'03/04/2021',1258.00,'',0.00,'2021-04-03','1900-01-01',1200.00,50.00),('0WVW',16865701,'12/07/2021',1587.00,'',0.00,'2021-07-12','1900-01-01',1500.00,75.00),('0WVW',16865792,'27/06/2021',3087.00,'',0.00,'2021-06-27','1900-01-01',3000.00,75.00),('0WVW',16866048,'08/02/2021',1258.00,'',0.00,'2021-02-08','1900-01-01',1200.00,50.00),('0WVW',16866121,'06/04/2021',1258.00,'',0.00,'2021-04-06','1900-01-01',1200.00,50.00),('0WVW',16866204,'21/07/2021',3087.00,'22/09/2021',3081.30,'2021-07-21','2021-09-22',3000.00,75.00),('0WVW',16866303,'11/03/2021',1258.00,'',0.00,'2021-03-11','1900-01-01',1200.00,50.00),('0WVW',16866576,'18/02/2021',558.00,'',0.00,'2021-02-18','1900-01-01',500.00,50.00),('1BC8',16867624,'06/09/2021',687.00,'',0.00,'2021-09-06','1900-01-01',600.00,75.00),('0S8D',16871584,'05/06/2021',1087.00,'',0.00,'2021-06-05','1900-01-01',1000.00,75.00),('2305',16877003,'07/01/2021',2658.00,'',0.00,'2021-01-07','1900-01-01',2600.00,50.00),('0NO4',16877524,'03/01/2021',1158.00,'',0.00,'2021-01-03','1900-01-01',1100.00,50.00),('134N',16881104,'22/05/2021',687.00,'',0.00,'2021-05-22','1900-01-01',600.00,75.00),('0V0F',16882144,'15/01/2021',858.00,'',0.00,'2021-01-15','1900-01-01',800.00,50.00),('8140',16885527,'09/02/2021',2558.00,'',0.00,'2021-02-09','1900-01-01',2500.00,50.00),('1GYK',16887697,'09/10/2021',1187.00,'',0.00,'2021-10-09','1900-01-01',1100.00,75.00),('0VUR',16894396,'28/08/2021',1487.00,'',0.00,'2021-08-28','1900-01-01',1400.00,75.00),('5383',16901431,'01/09/2021',587.00,'',0.00,'2021-09-01','1900-01-01',500.00,75.00),('18GU',16901589,'26/08/2021',587.00,'',0.00,'2021-08-26','1900-01-01',500.00,75.00),('18GU',16901589,'03/07/2021',987.00,'',0.00,'2021-07-03','1900-01-01',900.00,75.00),('1HV3',16903676,'30/12/2021',3187.00,'',0.00,'2021-12-30','1900-01-01',3100.00,75.00),('0Z67',16903676,'30/01/2021',2458.00,'',0.00,'2021-01-30','1900-01-01',2400.00,50.00),('5036',16904211,'01/07/2021',1087.00,'',0.00,'2021-07-01','1900-01-01',1000.00,75.00),('0O4U',16909905,'21/11/2021',1587.00,'',0.00,'2021-11-21','1900-01-01',1500.00,75.00),('0289',16910440,'23/12/2021',1287.00,'',0.00,'2021-12-23','1900-01-01',1200.00,75.00),('121S',16910713,'14/10/2021',687.00,'',0.00,'2021-10-14','1900-01-01',600.00,75.00),('6416',16913923,'18/10/2021',1287.00,'',0.00,'2021-10-18','1900-01-01',1200.00,75.00),('0NLJ',16916280,'05/12/2021',3687.00,'',0.00,'2021-12-05','1900-01-01',3600.00,75.00),('2305',16917445,'12/12/2021',987.00,'',0.00,'2021-12-12','1900-01-01',900.00,75.00),('175Z',16917700,'13/12/2021',787.00,'',0.00,'2021-12-13','1900-01-01',700.00,75.00),('0VJ1',16917981,'17/12/2021',1887.00,'',0.00,'2021-12-17','1900-01-01',1800.00,75.00),('0VJ1',16917981,'30/01/2021',1758.00,'',0.00,'2021-01-30','1900-01-01',1700.00,50.00),('4760',16918690,'08/01/2021',958.00,'',0.00,'2021-01-08','1900-01-01',900.00,50.00),('1F7H',16937583,'29/01/2021',3158.00,'',0.00,'2021-01-29','1900-01-01',3100.00,50.00),('0RRD',16938987,'06/12/2021',1087.00,'',0.00,'2021-12-06','1900-01-01',1000.00,75.00),('0108',16946162,'03/01/2021',3358.00,'',0.00,'2021-01-03','1900-01-01',3300.00,50.00),('0VI4',16947202,'15/11/2021',3787.00,'',0.00,'2021-11-15','1900-01-01',3700.00,75.00),('1494',16957086,'09/01/2021',758.00,'',0.00,'2021-01-09','1900-01-01',700.00,50.00),('0470',16962367,'17/12/2021',1887.00,'',0.00,'2021-12-17','1900-01-01',1800.00,75.00),('0TVM',16963076,'18/07/2021',1787.00,'',0.00,'2021-07-18','1900-01-01',1700.00,75.00),('18T8',16969099,'20/12/2021',687.00,'',0.00,'2021-12-20','1900-01-01',600.00,75.00),('18T8',16969099,'26/11/2021',587.00,'',0.00,'2021-11-26','1900-01-01',500.00,75.00),('11HJ',16978439,'02/12/2021',2687.00,'',0.00,'2021-12-02','1900-01-01',2600.00,75.00),('11HJ',16978439,'18/11/2021',2687.00,'',0.00,'2021-11-18','1900-01-01',2600.00,75.00),('101M',16978454,'31/12/2021',1087.00,'',0.00,'2021-12-31','1900-01-01',1000.00,75.00),('0VM5',16987299,'11/02/2021',2958.00,'',0.00,'2021-02-11','1900-01-01',2900.00,50.00),('0YZ3',16987455,'03/01/2021',558.00,'',0.00,'2021-01-03','1900-01-01',500.00,50.00),('0121',16989220,'01/07/2021',2287.00,'',0.00,'2021-07-01','1900-01-01',2200.00,75.00),('0W7R',16990749,'04/10/2021',587.00,'',0.00,'2021-10-04','1900-01-01',500.00,75.00),('178J',16993180,'01/02/2021',758.00,'',0.00,'2021-02-01','1900-01-01',700.00,50.00),('0005',17005661,'26/01/2021',1258.00,'',0.00,'2021-01-26','1900-01-01',1200.00,50.00),('0NLJ',17007253,'17/12/2021',4087.00,'',0.00,'2021-12-17','1900-01-01',4000.00,75.00),('0NLJ',17007253,'11/12/2021',4087.00,'',0.00,'2021-12-11','1900-01-01',4000.00,75.00),('156E',17007386,'07/02/2021',1158.00,'',0.00,'2021-02-07','1900-01-01',1100.00,50.00),('0SSN',17009416,'17/12/2021',1587.00,'',0.00,'2021-12-17','1900-01-01',1500.00,75.00),('0SSN',17009416,'14/02/2021',1758.00,'',0.00,'2021-02-14','1900-01-01',1700.00,50.00),('0SDT',17011453,'08/01/2021',658.00,'',0.00,'2021-01-08','1900-01-01',600.00,50.00),('0WVW',17013384,'26/04/2021',1258.00,'',0.00,'2021-04-26','1900-01-01',1200.00,50.00),('8140',17015934,'17/01/2021',1458.00,'',0.00,'2021-01-17','1900-01-01',1400.00,50.00),('8140',17015959,'28/09/2021',1087.00,'',0.00,'2021-09-28','1900-01-01',1000.00,75.00),('8140',17015991,'30/01/2021',3058.00,'',0.00,'2021-01-30','1900-01-01',3000.00,50.00),('8140',17016213,'05/01/2021',2358.00,'',0.00,'2021-01-05','1900-01-01',2300.00,50.00),('5250',17019266,'17/01/2021',1058.00,'',0.00,'2021-01-17','1900-01-01',1000.00,50.00),('0289',17031022,'11/12/2021',1687.00,'',0.00,'2021-12-11','1900-01-01',1600.00,75.00),('0289',17031022,'26/02/2021',1358.00,'',0.00,'2021-02-26','1900-01-01',1300.00,50.00),('0289',17031030,'22/11/2021',1487.00,'',0.00,'2021-11-22','1900-01-01',1400.00,75.00),('0TZK',17037409,'12/01/2021',1658.00,'',0.00,'2021-01-12','1900-01-01',1600.00,50.00),('9240',17044983,'20/11/2021',2587.00,'',0.00,'2021-11-20','1900-01-01',2500.00,75.00),('0VHM',17047242,'30/12/2021',787.00,'',0.00,'2021-12-30','1900-01-01',700.00,75.00),('0SR1',17050691,'19/02/2021',858.00,'',0.00,'2021-02-19','1900-01-01',800.00,50.00),('1609',17052614,'06/08/2021',987.00,'',0.00,'2021-08-06','1900-01-01',900.00,75.00),('0QMC',17053018,'20/03/2021',1058.00,'',0.00,'2021-03-20','1900-01-01',1000.00,50.00),('7085',17053075,'30/01/2021',558.00,'',0.00,'2021-01-30','1900-01-01',500.00,50.00),('122S',17054164,'25/05/2021',1587.00,'',0.00,'2021-05-25','1900-01-01',1500.00,75.00),('0SHK',17056318,'22/01/2021',958.00,'',0.00,'2021-01-22','1900-01-01',900.00,50.00),('0VSY',17058983,'03/12/2021',1587.00,'',0.00,'2021-12-03','1900-01-01',1500.00,75.00),('0V0F',17060021,'30/01/2021',2058.00,'',0.00,'2021-01-30','1900-01-01',2000.00,50.00),('0WBC',17060625,'24/01/2021',1058.00,'',0.00,'2021-01-24','1900-01-01',1000.00,50.00),('0109',17062811,'19/12/2021',2087.00,'',0.00,'2021-12-19','1900-01-01',2000.00,75.00),('0109',17062811,'15/01/2021',1558.00,'',0.00,'2021-01-15','1900-01-01',1500.00,50.00),('0108',17064593,'03/01/2021',1758.00,'',0.00,'2021-01-03','1900-01-01',1700.00,50.00),('0NO4',17072380,'21/05/2021',1058.00,'',0.00,'2021-05-21','1900-01-01',971.00,75.00),('0NO4',17072380,'05/04/2021',758.00,'',0.00,'2021-04-05','1900-01-01',700.00,50.00),('0VNR',17079047,'05/12/2021',587.00,'',0.00,'2021-12-05','1900-01-01',500.00,75.00),('0WOM',17080730,'02/12/2021',787.00,'',0.00,'2021-12-02','1900-01-01',700.00,75.00),('0517',17086042,'21/08/2021',687.00,'',0.00,'2021-08-21','1900-01-01',600.00,75.00),('0SX0',17088261,'21/09/2021',1287.00,'',0.00,'2021-09-21','1900-01-01',1200.00,75.00),('6782',17088477,'18/11/2021',2787.00,'',0.00,'2021-11-18','1900-01-01',2700.00,75.00),('0TCF',17089434,'21/12/2021',4987.00,'',0.00,'2021-12-21','1900-01-01',4900.00,75.00),('0TCF',17089434,'07/07/2021',3487.00,'',0.00,'2021-07-07','1900-01-01',3400.00,75.00),('8230',17099037,'18/10/2021',787.00,'',0.00,'2021-10-18','1900-01-01',700.00,75.00),('8230',17099037,'17/01/2021',658.00,'',0.00,'2021-01-17','1900-01-01',600.00,50.00),('0X45',17099193,'21/11/2021',2087.00,'',0.00,'2021-11-21','1900-01-01',2000.00,75.00),('6502',17104985,'31/12/2021',2387.00,'',0.00,'2021-12-31','1900-01-01',2300.00,75.00),('6502',17104985,'21/12/2021',2487.00,'',0.00,'2021-12-21','1900-01-01',2400.00,75.00),('0UGI',17106196,'25/01/2021',1158.00,'',0.00,'2021-01-25','1900-01-01',1100.00,50.00),('15AI',17114802,'26/12/2021',4287.00,'',0.00,'2021-12-26','1900-01-01',4200.00,75.00),('15AI',17114802,'01/01/2021',3358.00,'',0.00,'2021-01-01','1900-01-01',3300.00,50.00),('15AI',17115148,'25/03/2021',2658.00,'',0.00,'2021-03-25','1900-01-01',2600.00,50.00),('1EUY',17125170,'03/12/2021',2587.00,'',0.00,'2021-12-03','1900-01-01',2500.00,75.00),('07R0',17125980,'15/01/2021',2058.00,'',0.00,'2021-01-15','1900-01-01',2000.00,50.00),('0WC0',17126780,'29/11/2021',587.00,'',0.00,'2021-11-29','1900-01-01',500.00,75.00),('0UJE',17129776,'17/12/2021',1087.00,'',0.00,'2021-12-17','1900-01-01',1000.00,75.00),('0UJE',17129776,'27/02/2021',3458.00,'',0.00,'2021-02-27','1900-01-01',3400.00,50.00),('0SSN',17133596,'17/01/2021',4058.00,'',0.00,'2021-01-17','1900-01-01',4000.00,50.00),('1291',17137126,'12/12/2021',2187.00,'',0.00,'2021-12-12','1900-01-01',2100.00,75.00),('0452',17142258,'04/05/2021',1158.00,'',0.00,'2021-05-04','1900-01-01',1100.00,50.00),('8140',17144437,'12/11/2021',4387.00,'',0.00,'2021-11-12','1900-01-01',4300.00,75.00),('8140',17144569,'16/01/2021',2058.00,'',0.00,'2021-01-16','1900-01-01',2000.00,50.00),('0PJA',17146002,'24/01/2021',558.00,'',0.00,'2021-01-24','1900-01-01',500.00,50.00),('2305',17153511,'21/11/2021',3187.00,'',0.00,'2021-11-21','1900-01-01',3100.00,75.00),('0S29',17164443,'13/12/2021',987.00,'',0.00,'2021-12-13','1900-01-01',900.00,75.00),('0WGU',17168790,'19/02/2021',1358.00,'',0.00,'2021-02-19','1900-01-01',1300.00,50.00),('0S77',17169384,'05/02/2021',1958.00,'',0.00,'2021-02-05','1900-01-01',1900.00,50.00),('7860',17179839,'12/12/2021',1087.00,'',0.00,'2021-12-12','1900-01-01',1000.00,75.00),('7860',17179839,'20/03/2021',958.00,'',0.00,'2021-03-20','1900-01-01',900.00,50.00),('0VGL',17187790,'01/10/2021',1087.00,'',0.00,'2021-10-01','1900-01-01',1000.00,75.00),('0S29',17190471,'29/12/2021',1087.00,'',0.00,'2021-12-29','1900-01-01',1000.00,75.00),('0QDL',17195090,'04/12/2021',1387.00,'',0.00,'2021-12-04','1900-01-01',1300.00,75.00),('0QDL',17195090,'06/02/2021',1058.00,'',0.00,'2021-02-06','1900-01-01',1000.00,50.00),('17IW',17198821,'11/12/2021',1087.00,'',0.00,'2021-12-11','1900-01-01',1000.00,75.00),('0254',17216128,'29/01/2021',2858.00,'',0.00,'2021-01-29','1900-01-01',2800.00,50.00),('0S8D',17219585,'28/12/2021',1087.00,'',0.00,'2021-12-28','1900-01-01',1000.00,75.00),('0452',17226911,'04/12/2021',1587.00,'',0.00,'2021-12-04','1900-01-01',1500.00,75.00),('0US9',17227349,'06/03/2021',2258.00,'',0.00,'2021-03-06','1900-01-01',2200.00,50.00),('0US9',17227620,'21/08/2021',787.00,'',0.00,'2021-08-21','1900-01-01',700.00,75.00),('6617',17228149,'15/01/2021',858.00,'04/03/2021',854.34,'2021-01-15','2021-03-04',800.00,50.00),('5979',17228503,'24/12/2021',2687.00,'',0.00,'2021-12-24','1900-01-01',2600.00,75.00),('0UA2',17229535,'02/12/2021',1087.00,'',0.00,'2021-12-02','1900-01-01',1000.00,75.00),('189R',17233107,'11/01/2021',1058.00,'',0.00,'2021-01-11','1900-01-01',1000.00,50.00),('2054',17233321,'29/01/2021',2358.00,'',0.00,'2021-01-29','1900-01-01',2300.00,50.00),('0WVW',17239153,'08/08/2021',3087.00,'',0.00,'2021-08-08','1900-01-01',3000.00,75.00),('0WVW',17239161,'13/04/2021',1558.00,'',0.00,'2021-04-13','1900-01-01',1500.00,50.00),('0WVW',17245317,'04/05/2021',1258.00,'',0.00,'2021-05-04','1900-01-01',1200.00,50.00),('0QEX',17255340,'11/12/2021',787.00,'',0.00,'2021-12-11','1900-01-01',700.00,75.00),('8140',17257635,'27/01/2021',1058.00,'',0.00,'2021-01-27','1900-01-01',1000.00,50.00),('0289',17258047,'25/09/2021',1587.00,'12/11/2021',1410.12,'2021-09-25','2021-11-12',1500.00,75.00),('2305',17259441,'01/09/2021',1587.00,'',0.00,'2021-09-01','1900-01-01',1500.00,75.00),('07TX',17261256,'06/12/2021',1087.00,'',0.00,'2021-12-06','1900-01-01',1000.00,75.00),('0WI4',17261280,'17/05/2021',1158.00,'',0.00,'2021-05-17','1900-01-01',1071.00,75.00),('0WI4',17261587,'15/03/2021',558.00,'',0.00,'2021-03-15','1900-01-01',500.00,50.00),('0NDH',17268319,'08/01/2021',1058.00,'',0.00,'2021-01-08','1900-01-01',1000.00,50.00),('0YKP',17271420,'24/09/2021',587.00,'',0.00,'2021-09-24','1900-01-01',500.00,75.00),('2054',17272295,'01/12/2021',4287.00,'',0.00,'2021-12-01','1900-01-01',4200.00,75.00),('2054',17272295,'30/01/2021',3458.00,'',0.00,'2021-01-30','1900-01-01',3400.00,50.00),('1CLL',17272741,'17/12/2021',1387.00,'',0.00,'2021-12-17','1900-01-01',1300.00,75.00),('1BC8',17277690,'15/01/2021',1058.00,'',0.00,'2021-01-15','1900-01-01',1000.00,50.00),('5460',17278581,'23/01/2021',1958.00,'',0.00,'2021-01-23','1900-01-01',1900.00,50.00),('0108',17285693,'29/01/2021',3058.00,'',0.00,'2021-01-29','1900-01-01',3000.00,50.00),('9757',17288325,'13/06/2021',587.00,'',0.00,'2021-06-13','1900-01-01',500.00,75.00),('0O9Z',17294489,'08/12/2021',587.00,'',0.00,'2021-12-08','1900-01-01',500.00,75.00),('0PJA',17300930,'26/01/2021',558.00,'',0.00,'2021-01-26','1900-01-01',500.00,50.00),('0WVW',17307364,'10/05/2021',558.00,'',0.00,'2021-05-10','1900-01-01',500.00,50.00),('1AJZ',17314725,'06/12/2021',887.00,'',0.00,'2021-12-06','1900-01-01',800.00,75.00),('1AJZ',17314725,'22/11/2021',887.00,'',0.00,'2021-11-22','1900-01-01',800.00,75.00),('0108',17324005,'29/01/2021',2458.00,'',0.00,'2021-01-29','1900-01-01',2400.00,50.00),('0UNL',17327016,'09/02/2021',1058.00,'31/03/2021',1038.84,'2021-02-09','2021-03-31',1000.00,50.00),('11LN',17327677,'08/01/2021',2058.00,'',0.00,'2021-01-08','1900-01-01',2000.00,50.00),('0VI4',17337072,'16/11/2021',587.00,'',0.00,'2021-11-16','1900-01-01',500.00,75.00),('9377',17344573,'04/12/2021',2487.00,'',0.00,'2021-12-04','1900-01-01',2400.00,75.00),('0UNL',17344656,'23/01/2021',4058.00,'',0.00,'2021-01-23','1900-01-01',4000.00,50.00),('0108',17345323,'16/01/2021',2558.00,'',0.00,'2021-01-16','1900-01-01',2500.00,50.00),('0UA2',17373671,'03/02/2021',558.00,'',0.00,'2021-02-03','1900-01-01',500.00,50.00),('0WVW',17377235,'14/03/2021',1258.00,'',0.00,'2021-03-14','1900-01-01',1200.00,50.00),('0WVW',17377326,'15/08/2021',1087.00,'',0.00,'2021-08-15','1900-01-01',1000.00,75.00),('0WVW',17377540,'18/06/2021',3087.00,'',0.00,'2021-06-18','1900-01-01',3000.00,75.00),('5341',17388612,'10/04/2021',1258.00,'',0.00,'2021-04-10','1900-01-01',1200.00,50.00),('0VX5',17390121,'29/10/2021',987.00,'',0.00,'2021-10-29','1900-01-01',900.00,75.00),('0TSB',17392747,'08/06/2021',2287.00,'',0.00,'2021-06-08','1900-01-01',2200.00,75.00),('0TBW',17397936,'31/07/2021',987.00,'',0.00,'2021-07-31','1900-01-01',900.00,75.00),('5873',17408980,'14/08/2021',787.00,'',0.00,'2021-08-14','1900-01-01',700.00,75.00),('0WVW',17410416,'20/07/2021',4287.00,'',0.00,'2021-07-20','1900-01-01',4200.00,75.00),('12QM',17420506,'07/08/2021',787.00,'',0.00,'2021-08-07','1900-01-01',700.00,75.00),('0234',17425752,'04/05/2021',1558.00,'',0.00,'2021-05-04','1900-01-01',1500.00,50.00),('0234',17425752,'16/03/2021',1558.00,'',0.00,'2021-03-16','1900-01-01',1500.00,50.00),('3010',17428046,'24/06/2021',887.00,'',0.00,'2021-06-24','1900-01-01',800.00,75.00),('0V0F',17430976,'18/01/2021',1458.00,'',0.00,'2021-01-18','1900-01-01',1400.00,50.00),('0V0F',17431156,'30/05/2021',587.00,'',0.00,'2021-05-30','1900-01-01',500.00,75.00),('0V0F',17431156,'06/04/2021',1058.00,'',0.00,'2021-04-06','1900-01-01',1000.00,50.00),('0289',17439340,'21/11/2021',3387.00,'',0.00,'2021-11-21','1900-01-01',3300.00,75.00),('0WT7',17442534,'19/03/2021',1058.00,'',0.00,'2021-03-19','1900-01-01',1000.00,50.00),('0NQP',17450032,'31/01/2021',2058.00,'',0.00,'2021-01-31','1900-01-01',2000.00,50.00),('6617',17459280,'05/01/2021',1558.00,'',0.00,'2021-01-05','1900-01-01',1500.00,50.00),('0VYE',17461773,'23/01/2021',4058.00,'',0.00,'2021-01-23','1900-01-01',4000.00,50.00),('0VYE',17461773,'11/01/2021',4058.00,'',0.00,'2021-01-11','1900-01-01',4000.00,50.00),('0T8P',17467911,'25/08/2021',2787.00,'',0.00,'2021-08-25','1900-01-01',2700.00,75.00),('2305',17488404,'27/03/2021',858.00,'',0.00,'2021-03-27','1900-01-01',800.00,50.00),('8140',17490632,'23/12/2021',1987.00,'',0.00,'2021-12-23','1900-01-01',1900.00,75.00),('8140',17490723,'13/02/2021',3058.00,'',0.00,'2021-02-13','1900-01-01',3000.00,50.00),('8140',17490749,'01/11/2021',587.00,'',0.00,'2021-11-01','1900-01-01',500.00,75.00),('8140',17490756,'01/12/2021',2887.00,'',0.00,'2021-12-01','1900-01-01',2800.00,75.00),('8140',17490806,'26/02/2021',1458.00,'',0.00,'2021-02-26','1900-01-01',1400.00,50.00),('9668',17493222,'01/01/2021',1558.00,'',0.00,'2021-01-01','1900-01-01',1500.00,50.00),('0R5B',17497025,'04/12/2021',1587.00,'',0.00,'2021-12-04','1900-01-01',1500.00,75.00),('17N0',17502329,'08/08/2021',3587.00,'',0.00,'2021-08-08','1900-01-01',3500.00,75.00),('0UJK',17502931,'13/08/2021',987.00,'',0.00,'2021-08-13','1900-01-01',900.00,75.00),('9218',17504531,'05/03/2021',1058.00,'22/04/2021',1053.40,'2021-03-05','2021-04-22',1000.00,50.00),('3437',17507187,'22/09/2021',2587.00,'',0.00,'2021-09-22','1900-01-01',2500.00,75.00),('0RAW',17510058,'17/12/2021',1387.00,'',0.00,'2021-12-17','1900-01-01',1300.00,75.00),('0WVW',17511627,'09/08/2021',1587.00,'',0.00,'2021-08-09','1900-01-01',1500.00,75.00),('1C0O',17512310,'27/12/2021',3087.00,'',0.00,'2021-12-27','1900-01-01',3000.00,75.00),('0V0F',17516071,'03/07/2021',3387.00,'',0.00,'2021-07-03','1900-01-01',3300.00,75.00),('0V9Q',17516378,'18/01/2021',2058.00,'',0.00,'2021-01-18','1900-01-01',2000.00,50.00),('0WVS',17519976,'20/06/2021',1587.00,'',0.00,'2021-06-20','1900-01-01',1500.00,75.00),('0WVS',17520446,'14/06/2021',3287.00,'',0.00,'2021-06-14','1900-01-01',3200.00,75.00),('0WVS',17520479,'31/08/2021',2087.00,'',0.00,'2021-08-31','1900-01-01',2000.00,75.00),('0WVS',17520941,'07/08/2021',887.00,'',0.00,'2021-08-07','1900-01-01',800.00,75.00),('0WVS',17520966,'16/07/2021',1987.00,'',0.00,'2021-07-16','1900-01-01',1900.00,75.00),('0WWH',17532318,'13/08/2021',1387.00,'',0.00,'2021-08-13','1900-01-01',1300.00,75.00),('0YAT',17545344,'08/01/2021',658.00,'',0.00,'2021-01-08','1900-01-01',600.00,50.00),('1I3R',17548421,'03/09/2021',1687.00,'',0.00,'2021-09-03','1900-01-01',1600.00,75.00),('2163',17562075,'30/03/2021',1058.00,'',0.00,'2021-03-30','1900-01-01',1000.00,50.00),('2163',17562091,'05/01/2021',1058.00,'',0.00,'2021-01-05','1900-01-01',1000.00,50.00),('17GE',17564055,'29/01/2021',2158.00,'',0.00,'2021-01-29','1900-01-01',2100.00,50.00),('0YZQ',17568312,'22/01/2021',2058.00,'',0.00,'2021-01-22','1900-01-01',2000.00,50.00),('0RB7',17573742,'15/12/2021',3687.00,'',0.00,'2021-12-15','1900-01-01',3600.00,75.00),('15AI',17575044,'01/02/2021',2058.00,'',0.00,'2021-02-01','1900-01-01',2000.00,50.00),('1BI5',17576901,'27/11/2021',2087.00,'',0.00,'2021-11-27','1900-01-01',2000.00,75.00),('0WOM',17581976,'18/11/2021',687.00,'',0.00,'2021-11-18','1900-01-01',600.00,75.00),('0QOU',17586405,'19/06/2021',587.00,'',0.00,'2021-06-19','1900-01-01',500.00,75.00),('122S',17587247,'31/12/2021',2087.00,'',0.00,'2021-12-31','1900-01-01',2000.00,75.00),('0RAW',17587726,'17/12/2021',6587.00,'',0.00,'2021-12-17','1900-01-01',6500.00,75.00),('0RAW',17587726,'02/01/2021',4058.00,'',0.00,'2021-01-02','1900-01-01',4000.00,50.00),('1EUY',17589672,'30/10/2021',4087.00,'',0.00,'2021-10-30','1900-01-01',4000.00,75.00),('0NFB',17593401,'06/10/2021',787.00,'',0.00,'2021-10-06','1900-01-01',700.00,75.00),('15PG',17609777,'16/12/2021',3587.00,'',0.00,'2021-12-16','1900-01-01',3500.00,75.00),('15PG',17609777,'22/01/2021',3458.00,'',0.00,'2021-01-22','1900-01-01',3400.00,50.00),('0U8U',17609843,'01/01/2021',1658.00,'',0.00,'2021-01-01','1900-01-01',1600.00,50.00),('9377',17611054,'28/11/2021',2587.00,'',0.00,'2021-11-28','1900-01-01',2500.00,75.00),('0WC0',17611492,'13/08/2021',1087.00,'',0.00,'2021-08-13','1900-01-01',1000.00,75.00),('0254',17619800,'16/07/2021',1387.00,'',0.00,'2021-07-16','1900-01-01',1300.00,75.00),('0WVW',17631797,'22/01/2021',4058.00,'',0.00,'2021-01-22','1900-01-01',4000.00,50.00),('0WVW',17631870,'17/06/2021',3087.00,'',0.00,'2021-06-17','1900-01-01',3000.00,75.00),('0WVW',17632027,'22/06/2021',2087.00,'',0.00,'2021-06-22','1900-01-01',2000.00,75.00),('0WVW',17632373,'22/07/2021',2087.00,'',0.00,'2021-07-22','1900-01-01',2000.00,75.00),('0WVW',17632373,'17/03/2021',858.00,'',0.00,'2021-03-17','1900-01-01',800.00,50.00),('0RSF',17660564,'02/10/2021',787.00,'',0.00,'2021-10-02','1900-01-01',700.00,75.00),('0WGU',17663964,'11/02/2021',958.00,'',0.00,'2021-02-11','1900-01-01',900.00,50.00),('9808',17668427,'11/05/2021',1558.00,'',0.00,'2021-05-11','1900-01-01',1500.00,50.00),('9808',17668427,'10/04/2021',558.00,'',0.00,'2021-04-10','1900-01-01',500.00,50.00),('0YAT',17672973,'24/05/2021',1087.00,'',0.00,'2021-05-24','1900-01-01',1000.00,75.00),('5383',17674185,'13/11/2021',987.00,'',0.00,'2021-11-13','1900-01-01',900.00,75.00),('0SWP',17679242,'27/08/2021',787.00,'',0.00,'2021-08-27','1900-01-01',700.00,75.00),('1HZJ',17681610,'12/11/2021',1587.00,'',0.00,'2021-11-12','1900-01-01',1500.00,75.00),('0108',17701079,'14/09/2021',2987.00,'',0.00,'2021-09-14','1900-01-01',2900.00,75.00),('0WNJ',17721630,'25/10/2021',1887.00,'',0.00,'2021-10-25','1900-01-01',1800.00,75.00),('0O4U',17725342,'02/10/2021',1087.00,'',0.00,'2021-10-02','1900-01-01',1000.00,75.00),('0V0F',17728825,'29/09/2021',587.00,'',0.00,'2021-09-29','1900-01-01',500.00,75.00),('0V0F',17728833,'22/01/2021',1058.00,'',0.00,'2021-01-22','1900-01-01',1000.00,50.00),('0X59',17738204,'04/12/2021',4787.00,'',0.00,'2021-12-04','1900-01-01',4700.00,75.00),('0X62',17746736,'14/10/2021',1987.00,'',0.00,'2021-10-14','1900-01-01',1900.00,75.00),('0X62',17746769,'05/12/2021',2687.00,'',0.00,'2021-12-05','1900-01-01',2600.00,75.00),('0X62',17746769,'28/11/2021',2687.00,'',0.00,'2021-11-28','1900-01-01',2600.00,75.00),('3380',17755349,'21/06/2021',1087.00,'',0.00,'2021-06-21','1900-01-01',1000.00,75.00),('0O4U',17756883,'20/05/2021',3658.00,'',0.00,'2021-05-20','1900-01-01',3571.00,75.00),('0O4U',17757089,'03/07/2021',1587.00,'',0.00,'2021-07-03','1900-01-01',1500.00,75.00),('0O4U',17757089,'30/05/2021',1537.00,'',0.00,'2021-05-30','1900-01-01',1450.00,75.00),('0OFY',17757121,'06/09/2021',2087.00,'',0.00,'2021-09-06','1900-01-01',2000.00,75.00),('0T8F',17757451,'22/12/2021',1787.00,'',0.00,'2021-12-22','1900-01-01',1700.00,75.00),('0T8F',17757451,'17/12/2021',1787.00,'',0.00,'2021-12-17','1900-01-01',1700.00,75.00),('8140',17770124,'14/05/2021',1658.00,'01/07/2021',1621.60,'2021-05-14','2021-07-01',1600.00,50.00),('8140',17770124,'01/05/2021',1658.00,'',0.00,'2021-05-01','1900-01-01',1600.00,50.00),('0X0H',17773631,'16/10/2021',1787.00,'',0.00,'2021-10-16','1900-01-01',1700.00,75.00),('0NO4',17779760,'19/05/2021',958.00,'',0.00,'2021-05-19','1900-01-01',871.00,75.00),('0X4K',17783762,'13/11/2021',687.00,'',0.00,'2021-11-13','1900-01-01',600.00,75.00),('0874',17791054,'20/11/2021',987.00,'',0.00,'2021-11-20','1900-01-01',900.00,75.00),('0SYI',17791351,'05/01/2021',1258.00,'',0.00,'2021-01-05','1900-01-01',1200.00,50.00),('3690',17792508,'18/07/2021',1087.00,'',0.00,'2021-07-18','1900-01-01',1000.00,75.00),('0125',17796228,'03/07/2021',3287.00,'',0.00,'2021-07-03','1900-01-01',3200.00,75.00),('0125',17796228,'29/01/2021',1258.00,'',0.00,'2021-01-29','1900-01-01',1200.00,50.00),('0WVW',17796376,'03/02/2021',1758.00,'',0.00,'2021-02-03','1900-01-01',1700.00,50.00),('0WVW',17796400,'19/02/2021',1258.00,'',0.00,'2021-02-19','1900-01-01',1200.00,50.00),('0O0N',17796616,'15/07/2021',1087.00,'',0.00,'2021-07-15','1900-01-01',1000.00,75.00),('0O1S',17796632,'13/07/2021',1087.00,'',0.00,'2021-07-13','1900-01-01',1000.00,75.00),('0O0N',17796699,'29/01/2021',1158.00,'',0.00,'2021-01-29','1900-01-01',1100.00,50.00),('0PFR',17796889,'30/01/2021',858.00,'',0.00,'2021-01-30','1900-01-01',800.00,50.00),('0U1V',17800731,'15/01/2021',1258.00,'',0.00,'2021-01-15','1900-01-01',1200.00,50.00),('13NX',17803545,'27/10/2021',687.00,'',0.00,'2021-10-27','1900-01-01',600.00,75.00),('1C6T',17803552,'27/12/2021',587.00,'',0.00,'2021-12-27','1900-01-01',500.00,75.00),('0O1S',17808999,'23/12/2021',1987.00,'',0.00,'2021-12-23','1900-01-01',1900.00,75.00),('0O1S',17809328,'06/01/2021',2558.00,'',0.00,'2021-01-06','1900-01-01',2500.00,50.00),('0O1S',17809336,'16/08/2021',2087.00,'',0.00,'2021-08-16','1900-01-01',2000.00,75.00),('0O1S',17809419,'06/03/2021',2058.00,'',0.00,'2021-03-06','1900-01-01',2000.00,50.00),('0O1S',17809435,'02/12/2021',2087.00,'',0.00,'2021-12-02','1900-01-01',2000.00,75.00),('0O1S',17809435,'06/01/2021',1758.00,'',0.00,'2021-01-06','1900-01-01',1700.00,50.00),('0O1S',17809559,'05/02/2021',1058.00,'',0.00,'2021-02-05','1900-01-01',1000.00,50.00),('2741',17814336,'12/12/2021',987.00,'',0.00,'2021-12-12','1900-01-01',900.00,75.00),('2741',17814336,'16/10/2021',587.00,'',0.00,'2021-10-16','1900-01-01',500.00,75.00),('0VGL',17823451,'07/10/2021',687.00,'',0.00,'2021-10-07','1900-01-01',600.00,75.00),('5233',17824608,'31/03/2021',558.00,'',0.00,'2021-03-31','1900-01-01',500.00,50.00),('0VU7',17826934,'10/01/2021',558.00,'',0.00,'2021-01-10','1900-01-01',500.00,50.00),('0334',17834003,'18/08/2021',587.00,'',0.00,'2021-08-18','1900-01-01',500.00,75.00),('0QZL',17834029,'11/12/2021',1387.00,'',0.00,'2021-12-11','1900-01-01',1300.00,75.00),('6782',17835828,'27/01/2021',1008.00,'',0.00,'2021-01-27','1900-01-01',950.00,50.00),('0V8S',17848441,'26/12/2021',687.00,'',0.00,'2021-12-26','1900-01-01',600.00,75.00),('0O4U',17849860,'21/12/2021',1487.00,'',0.00,'2021-12-21','1900-01-01',1400.00,75.00),('0O4U',17849860,'02/12/2021',987.00,'',0.00,'2021-12-02','1900-01-01',900.00,75.00),('0254',17852948,'31/12/2021',1587.00,'',0.00,'2021-12-31','1900-01-01',1500.00,75.00),('0470',17856451,'03/02/2021',558.00,'',0.00,'2021-02-03','1900-01-01',500.00,50.00),('0WVW',17856501,'01/07/2021',2187.00,'',0.00,'2021-07-01','1900-01-01',2100.00,75.00),('1494',17858036,'29/11/2021',587.00,'',0.00,'2021-11-29','1900-01-01',500.00,75.00),('2163',17858408,'28/03/2021',1458.00,'',0.00,'2021-03-28','1900-01-01',1400.00,50.00),('2163',17858457,'05/03/2021',558.00,'',0.00,'2021-03-05','1900-01-01',500.00,50.00),('1518',17860834,'16/08/2021',2087.00,'',0.00,'2021-08-16','1900-01-01',2000.00,75.00),('0WOM',17861006,'16/11/2021',587.00,'',0.00,'2021-11-16','1900-01-01',500.00,75.00),('0WOM',17862087,'01/12/2021',787.00,'',0.00,'2021-12-01','1900-01-01',700.00,75.00),('3044',17864885,'21/12/2021',3087.00,'',0.00,'2021-12-21','1900-01-01',3000.00,75.00),('0U8P',17872490,'06/02/2021',3158.00,'',0.00,'2021-02-06','1900-01-01',3100.00,50.00),('179B',17878489,'26/10/2021',587.00,'',0.00,'2021-10-26','1900-01-01',500.00,75.00),('0RSF',17879495,'05/09/2021',1487.00,'',0.00,'2021-09-05','1900-01-01',1400.00,75.00),('0RXJ',17879529,'15/11/2021',2387.00,'',0.00,'2021-11-15','1900-01-01',2300.00,75.00),('9218',17882580,'22/11/2021',3287.00,'',0.00,'2021-11-22','1900-01-01',3200.00,75.00),('0O4U',17896150,'05/02/2021',1658.00,'',0.00,'2021-02-05','1900-01-01',1600.00,50.00),('1019',17897034,'09/07/2021',587.00,'',0.00,'2021-07-09','1900-01-01',500.00,75.00),('9757',17900341,'14/11/2021',587.00,'',0.00,'2021-11-14','1900-01-01',500.00,75.00),('0NO4',17901406,'13/03/2021',1858.00,'',0.00,'2021-03-13','1900-01-01',1800.00,50.00),('2333',17904848,'16/02/2021',1258.00,'',0.00,'2021-02-16','1900-01-01',1200.00,50.00),('0QPF',17910126,'02/05/2021',1858.00,'',0.00,'2021-05-02','1900-01-01',1800.00,50.00),('0XDK',17911199,'19/02/2021',1858.00,'',0.00,'2021-02-19','1900-01-01',1800.00,50.00),('0XDK',17911199,'12/02/2021',1858.00,'',0.00,'2021-02-12','1900-01-01',1800.00,50.00),('0XDK',17911199,'24/01/2021',958.00,'',0.00,'2021-01-24','1900-01-01',900.00,50.00),('4010',17913674,'31/01/2021',1858.00,'',0.00,'2021-01-31','1900-01-01',1800.00,50.00),('2305',17922550,'06/12/2021',2187.00,'',0.00,'2021-12-06','1900-01-01',2100.00,75.00),('12FJ',17925785,'06/12/2021',2687.00,'',0.00,'2021-12-06','1900-01-01',2600.00,75.00),('0XD7',17930132,'20/03/2021',658.00,'',0.00,'2021-03-20','1900-01-01',600.00,50.00),('0254',17930827,'28/07/2021',3687.00,'',0.00,'2021-07-28','1900-01-01',3600.00,75.00),('8357',17931189,'03/02/2021',758.00,'',0.00,'2021-02-03','1900-01-01',700.00,50.00),('0O1S',17940115,'30/10/2021',3087.00,'',0.00,'2021-10-30','1900-01-01',3000.00,75.00),('0QY6',17940693,'30/11/2021',2587.00,'',0.00,'2021-11-30','1900-01-01',2500.00,75.00),('0YAT',17954827,'14/03/2021',1058.00,'',0.00,'2021-03-14','1900-01-01',1000.00,50.00),('0VI4',17956327,'02/07/2021',3987.00,'',0.00,'2021-07-02','1900-01-01',3900.00,75.00),('14OJ',17957523,'08/08/2021',787.00,'',0.00,'2021-08-08','1900-01-01',700.00,75.00),('0XC8',17957895,'17/08/2021',687.00,'',0.00,'2021-08-17','1900-01-01',600.00,75.00),('0XF4',17958257,'20/06/2021',587.00,'',0.00,'2021-06-20','1900-01-01',500.00,75.00),('0XF4',17958257,'07/06/2021',687.00,'',0.00,'2021-06-07','1900-01-01',600.00,75.00),('8140',17958570,'31/01/2021',4058.00,'',0.00,'2021-01-31','1900-01-01',4000.00,50.00),('0108',17968322,'13/08/2021',1587.00,'',0.00,'2021-08-13','1900-01-01',1500.00,75.00),('0XGC',17978073,'02/12/2021',4687.00,'',0.00,'2021-12-02','1900-01-01',4600.00,75.00),('7194',17982612,'13/09/2021',987.00,'',0.00,'2021-09-13','1900-01-01',900.00,75.00),('7194',17982612,'20/02/2021',758.00,'',0.00,'2021-02-20','1900-01-01',700.00,50.00),('0RUZ',17983701,'26/12/2021',4087.00,'',0.00,'2021-12-26','1900-01-01',4000.00,75.00),('0XE2',17983792,'01/11/2021',1387.00,'',0.00,'2021-11-01','1900-01-01',1300.00,75.00),('0XE2',17984055,'26/07/2021',2087.00,'',0.00,'2021-07-26','1900-01-01',2000.00,75.00),('0XE2',17984246,'27/02/2021',1658.00,'',0.00,'2021-02-27','1900-01-01',1600.00,50.00),('0O4U',17987850,'20/01/2021',1058.00,'',0.00,'2021-01-20','1900-01-01',1000.00,50.00),('2741',17988627,'21/09/2021',687.00,'',0.00,'2021-09-21','1900-01-01',600.00,75.00),('0QIS',17991456,'05/09/2021',2487.00,'',0.00,'2021-09-05','1900-01-01',2400.00,75.00),('0RUZ',17991597,'08/12/2021',2087.00,'',0.00,'2021-12-08','1900-01-01',2000.00,75.00),('0RUZ',17992132,'15/01/2021',1358.00,'',0.00,'2021-01-15','1900-01-01',1300.00,50.00),('0RUZ',17992173,'18/07/2021',1087.00,'',0.00,'2021-07-18','1900-01-01',1000.00,75.00),('0XBP',17993072,'15/06/2021',687.00,'',0.00,'2021-06-15','1900-01-01',600.00,75.00),('0XFG',17993361,'13/02/2021',558.00,'',0.00,'2021-02-13','1900-01-01',500.00,50.00),('0404',17996133,'07/02/2021',4058.00,'',0.00,'2021-02-07','1900-01-01',4000.00,50.00),('1DDT',17997768,'20/04/2021',558.00,'',0.00,'2021-04-20','1900-01-01',500.00,50.00),('0419',18003830,'29/07/2021',2287.00,'15/09/2021',2286.98,'2021-07-29','2021-09-15',2200.00,75.00),('0419',18003830,'09/04/2021',1058.00,'',0.00,'2021-04-09','1900-01-01',1000.00,50.00),('0485',18005207,'17/07/2021',787.00,'',0.00,'2021-07-17','1900-01-01',700.00,75.00),('0XGC',18005215,'05/07/2021',2387.00,'',0.00,'2021-07-05','1900-01-01',2300.00,75.00),('0XC6',18006742,'12/10/2021',887.00,'',0.00,'2021-10-12','1900-01-01',800.00,75.00),('0XE2',18006882,'17/01/2021',1658.00,'',0.00,'2021-01-17','1900-01-01',1600.00,50.00),('0XE2',18006882,'03/01/2021',1658.00,'',0.00,'2021-01-03','1900-01-01',1600.00,50.00),('9121',18010256,'21/11/2021',1587.00,'',0.00,'2021-11-21','1900-01-01',1500.00,75.00),('0XEG',18016790,'06/05/2021',1258.00,'',0.00,'2021-05-06','1900-01-01',1200.00,50.00),('0VN4',18017673,'06/08/2021',687.00,'',0.00,'2021-08-06','1900-01-01',600.00,75.00),('0UA2',18018010,'02/01/2021',558.00,'',0.00,'2021-01-02','1900-01-01',500.00,50.00),('1CWX',18018630,'12/09/2021',2087.00,'',0.00,'2021-09-12','1900-01-01',2000.00,75.00),('8140',18022277,'29/01/2021',2958.00,'',0.00,'2021-01-29','1900-01-01',2900.00,50.00),('8140',18022442,'13/11/2021',2087.00,'',0.00,'2021-11-13','1900-01-01',2000.00,75.00),('8140',18022442,'16/01/2021',2058.00,'',0.00,'2021-01-16','1900-01-01',2000.00,50.00),('8140',18022582,'07/01/2021',4058.00,'',0.00,'2021-01-07','1900-01-01',4000.00,50.00),('8140',18022681,'30/01/2021',3058.00,'',0.00,'2021-01-30','1900-01-01',3000.00,50.00),('8140',18022731,'02/03/2021',2358.00,'21/04/2021',2356.27,'2021-03-02','2021-04-21',2300.00,50.00),('8140',18022731,'15/02/2021',3058.00,'',0.00,'2021-02-15','1900-01-01',3000.00,50.00),('0XFP',18025882,'13/10/2021',1087.00,'',0.00,'2021-10-13','1900-01-01',1000.00,75.00),('1354',18026013,'06/02/2021',1058.00,'',0.00,'2021-02-06','1900-01-01',1000.00,50.00),('0WSY',18028118,'12/08/2021',1087.00,'',0.00,'2021-08-12','1900-01-01',1000.00,75.00),('1CWX',18031385,'20/12/2021',1087.00,'',0.00,'2021-12-20','1900-01-01',1000.00,75.00),('4957',18032441,'09/01/2021',558.00,'',0.00,'2021-01-09','1900-01-01',500.00,50.00),('0NO4',18040105,'15/01/2021',1758.00,'',0.00,'2021-01-15','1900-01-01',1700.00,50.00),('0PR6',18041616,'21/02/2021',658.00,'',0.00,'2021-02-21','1900-01-01',600.00,50.00),('0PR6',18041616,'25/01/2021',658.00,'',0.00,'2021-01-25','1900-01-01',600.00,50.00),('0TKE',18043893,'17/01/2021',858.00,'',0.00,'2021-01-17','1900-01-01',800.00,50.00),('0890',18061812,'30/11/2021',787.00,'',0.00,'2021-11-30','1900-01-01',700.00,75.00),('0890',18061812,'15/02/2021',558.00,'',0.00,'2021-02-15','1900-01-01',500.00,50.00),('0WVW',18065243,'12/08/2021',1287.00,'',0.00,'2021-08-12','1900-01-01',1200.00,75.00),('0WVW',18065458,'24/07/2021',4287.00,'',0.00,'2021-07-24','1900-01-01',4200.00,75.00),('0WVW',18065607,'25/01/2021',1258.00,'',0.00,'2021-01-25','1900-01-01',1200.00,50.00),('0WVW',18065649,'24/07/2021',3087.00,'23/09/2021',3042.40,'2021-07-24','2021-09-23',3000.00,75.00),('0WVW',18065656,'07/02/2021',1758.00,'',0.00,'2021-02-07','1900-01-01',1700.00,50.00),('0WVW',18065672,'21/07/2021',3087.00,'',0.00,'2021-07-21','1900-01-01',3000.00,75.00),('9053',18067223,'26/12/2021',2087.00,'',0.00,'2021-12-26','1900-01-01',2000.00,75.00),('0YAT',18074781,'09/01/2021',958.00,'',0.00,'2021-01-09','1900-01-01',900.00,50.00),('1CWX',18076158,'20/12/2021',1687.00,'',0.00,'2021-12-20','1900-01-01',1600.00,75.00),('0UGE',18081927,'18/02/2021',1758.00,'',0.00,'2021-02-18','1900-01-01',1700.00,50.00),('3972',18083998,'24/12/2021',887.00,'',0.00,'2021-12-24','1900-01-01',800.00,75.00),('0234',18085001,'01/12/2021',1387.00,'',0.00,'2021-12-01','1900-01-01',1300.00,75.00),('0X37',18098541,'26/11/2021',987.00,'',0.00,'2021-11-26','1900-01-01',900.00,75.00),('0VS5',18100172,'13/08/2021',2787.00,'',0.00,'2021-08-13','1900-01-01',2700.00,75.00),('8140',18111179,'03/01/2021',4058.00,'',0.00,'2021-01-03','1900-01-01',4000.00,50.00),('8140',18111237,'01/02/2021',4058.00,'',0.00,'2021-02-01','1900-01-01',4000.00,50.00),('2305',18119859,'14/03/2021',4058.00,'',0.00,'2021-03-14','1900-01-01',4000.00,50.00),('2117',18127746,'24/02/2021',4058.00,'',0.00,'2021-02-24','1900-01-01',4000.00,50.00),('1B9D',18130864,'06/11/2021',1087.00,'',0.00,'2021-11-06','1900-01-01',1000.00,75.00),('07T8',18132076,'21/07/2021',887.00,'',0.00,'2021-07-21','1900-01-01',800.00,75.00),('5979',18135871,'29/08/2021',587.00,'',0.00,'2021-08-29','1900-01-01',500.00,75.00),('0WGU',18137158,'19/02/2021',1558.00,'',0.00,'2021-02-19','1900-01-01',1500.00,50.00),('8140',18139147,'02/12/2021',3587.00,'',0.00,'2021-12-02','1900-01-01',3500.00,75.00),('8140',18139147,'05/01/2021',3058.00,'',0.00,'2021-01-05','1900-01-01',3000.00,50.00),('8140',18139170,'02/12/2021',4687.00,'',0.00,'2021-12-02','1900-01-01',4600.00,75.00),('8140',18139204,'30/01/2021',2758.00,'',0.00,'2021-01-30','1900-01-01',2700.00,50.00),('8140',18139212,'17/12/2021',2387.00,'',0.00,'2021-12-17','1900-01-01',2300.00,75.00),('8140',18139220,'22/12/2021',1587.00,'',0.00,'2021-12-22','1900-01-01',1500.00,75.00),('8140',18139220,'06/03/2021',1058.00,'',0.00,'2021-03-06','1900-01-01',1000.00,50.00),('11ZW',18141960,'07/02/2021',658.00,'',0.00,'2021-02-07','1900-01-01',600.00,50.00),('2305',18153338,'28/05/2021',4087.00,'',0.00,'2021-05-28','1900-01-01',4000.00,75.00),('1CUC',18155432,'18/10/2021',787.00,'',0.00,'2021-10-18','1900-01-01',700.00,75.00),('0X37',18158527,'08/07/2021',687.00,'',0.00,'2021-07-08','1900-01-01',600.00,75.00),('3776',18159103,'08/01/2021',1158.00,'',0.00,'2021-01-08','1900-01-01',1100.00,50.00),('1CWX',18161521,'09/02/2021',858.00,'31/03/2021',858.00,'2021-02-09','2021-03-31',800.00,50.00),('0S77',18161711,'02/02/2021',2158.00,'',0.00,'2021-02-02','1900-01-01',2100.00,50.00),('0XQ0',18162610,'21/09/2021',587.00,'',0.00,'2021-09-21','1900-01-01',500.00,75.00),('17A6',18168674,'17/07/2021',1087.00,'26/08/2021',247.09,'2021-07-17','2021-08-26',1000.00,75.00),('8282',18171728,'06/02/2021',1358.00,'',0.00,'2021-02-06','1900-01-01',1300.00,50.00),('112F',18174482,'10/12/2021',687.00,'',0.00,'2021-12-10','1900-01-01',600.00,75.00),('7861',18175463,'28/01/2021',1258.00,'17/03/2021',1193.28,'2021-01-28','2021-03-17',1200.00,50.00),('0WVW',18183822,'25/03/2021',1058.00,'',0.00,'2021-03-25','1900-01-01',1000.00,50.00),('0WVW',18183848,'19/02/2021',1258.00,'',0.00,'2021-02-19','1900-01-01',1200.00,50.00),('0WVW',18183970,'29/06/2021',3087.00,'',0.00,'2021-06-29','1900-01-01',3000.00,75.00),('0WVW',18184010,'17/06/2021',3087.00,'',0.00,'2021-06-17','1900-01-01',3000.00,75.00),('0WVW',18184010,'09/04/2021',1258.00,'',0.00,'2021-04-09','1900-01-01',1200.00,50.00),('0WVW',18184077,'11/06/2021',3087.00,'',0.00,'2021-06-11','1900-01-01',3000.00,75.00),('0WVW',18184093,'26/07/2021',3087.00,'',0.00,'2021-07-26','1900-01-01',3000.00,75.00),('0WVW',18184143,'06/08/2021',1587.00,'',0.00,'2021-08-06','1900-01-01',1500.00,75.00),('0WVW',18184176,'28/04/2021',1258.00,'',0.00,'2021-04-28','1900-01-01',1200.00,50.00),('0WVW',18184200,'18/06/2021',3087.00,'',0.00,'2021-06-18','1900-01-01',3000.00,75.00),('0WVW',18184242,'15/02/2021',1258.00,'',0.00,'2021-02-15','1900-01-01',1200.00,50.00),('0WVW',18184341,'03/08/2021',3087.00,'',0.00,'2021-08-03','1900-01-01',3000.00,75.00),('0WVW',18184689,'14/05/2021',4058.00,'',0.00,'2021-05-14','1900-01-01',4000.00,50.00),('0WVW',18184689,'17/01/2021',4058.00,'',0.00,'2021-01-17','1900-01-01',4000.00,50.00),('0WVW',18184739,'17/06/2021',3087.00,'',0.00,'2021-06-17','1900-01-01',3000.00,75.00),('0WVW',18184754,'22/06/2021',3087.00,'',0.00,'2021-06-22','1900-01-01',3000.00,75.00),('0X4L',18186593,'16/02/2021',558.00,'',0.00,'2021-02-16','1900-01-01',500.00,50.00),('0108',18189423,'18/06/2021',587.00,'',0.00,'2021-06-18','1900-01-01',500.00,75.00),('17IW',18191189,'01/11/2021',1987.00,'',0.00,'2021-11-01','1900-01-01',1900.00,75.00),('0S29',18203364,'23/05/2021',587.00,'',0.00,'2021-05-23','1900-01-01',500.00,75.00),('0N94',18213108,'17/05/2021',658.00,'',0.00,'2021-05-17','1900-01-01',571.00,75.00),('0WVW',18217349,'03/07/2021',3087.00,'',0.00,'2021-07-03','1900-01-01',3000.00,75.00),('14KQ',18217836,'13/08/2021',787.00,'',0.00,'2021-08-13','1900-01-01',700.00,75.00),('10WT',18222596,'18/06/2021',787.00,'',0.00,'2021-06-18','1900-01-01',700.00,75.00),('4505',18222794,'10/06/2021',987.00,'',0.00,'2021-06-10','1900-01-01',900.00,75.00),('4505',18222877,'20/09/2021',887.00,'',0.00,'2021-09-20','1900-01-01',800.00,75.00),('0404',18227751,'01/02/2021',4058.00,'',0.00,'2021-02-01','1900-01-01',4000.00,50.00),('15QL',18232009,'04/02/2021',658.00,'',0.00,'2021-02-04','1900-01-01',600.00,50.00),('0452',18232827,'30/01/2021',2658.00,'',0.00,'2021-01-30','1900-01-01',2600.00,50.00),('0WAQ',18238923,'07/04/2021',1458.00,'',0.00,'2021-04-07','1900-01-01',1400.00,50.00),('0WVW',18247916,'25/01/2021',1258.00,'',0.00,'2021-01-25','1900-01-01',1200.00,50.00),('0WVW',18247924,'30/05/2021',587.00,'',0.00,'2021-05-30','1900-01-01',500.00,75.00),('0WVW',18248005,'11/02/2021',1258.00,'',0.00,'2021-02-11','1900-01-01',1200.00,50.00),('0WVW',18248013,'27/06/2021',2087.00,'',0.00,'2021-06-27','1900-01-01',2000.00,75.00),('0WVW',18248179,'20/07/2021',3087.00,'17/09/2021',2997.37,'2021-07-20','2021-09-17',3000.00,75.00),('0WVW',18248179,'15/02/2021',1258.00,'',0.00,'2021-02-15','1900-01-01',1200.00,50.00),('0WVW',18248245,'05/07/2021',4087.00,'',0.00,'2021-07-05','1900-01-01',4000.00,75.00),('0WVW',18248344,'27/04/2021',1058.00,'',0.00,'2021-04-27','1900-01-01',1000.00,50.00),('0WVW',18248625,'02/01/2021',1258.00,'',0.00,'2021-01-02','1900-01-01',1200.00,50.00),('18AD',18250357,'17/02/2021',1158.00,'',0.00,'2021-02-17','1900-01-01',1100.00,50.00),('0108',18253104,'04/04/2021',2058.00,'',0.00,'2021-04-04','1900-01-01',2000.00,50.00),('0NO4',18255455,'24/07/2021',587.00,'',0.00,'2021-07-24','1900-01-01',500.00,75.00),('0XV5',18259994,'22/11/2021',1587.00,'',0.00,'2021-11-22','1900-01-01',1500.00,75.00),('0RB7',18260521,'18/12/2021',2687.00,'',0.00,'2021-12-18','1900-01-01',2600.00,75.00),('18AD',18261032,'16/02/2021',858.00,'',0.00,'2021-02-16','1900-01-01',800.00,50.00),('18AD',18261883,'23/01/2021',558.00,'',0.00,'2021-01-23','1900-01-01',500.00,50.00),('0QCX',18265181,'20/04/2021',558.00,'',0.00,'2021-04-20','1900-01-01',500.00,50.00),('0QCX',18265181,'11/04/2021',558.00,'',0.00,'2021-04-11','1900-01-01',500.00,50.00),('1CLR',18266270,'09/07/2021',687.00,'',0.00,'2021-07-09','1900-01-01',600.00,75.00),('0PSC',18266320,'09/01/2021',558.00,'',0.00,'2021-01-09','1900-01-01',500.00,50.00),('0PMO',18267005,'06/12/2021',1687.00,'',0.00,'2021-12-06','1900-01-01',1600.00,75.00),('1HWV',18274563,'10/08/2021',587.00,'',0.00,'2021-08-10','1900-01-01',500.00,75.00),('1EBC',18275883,'15/01/2021',1858.00,'',0.00,'2021-01-15','1900-01-01',1800.00,50.00),('0WLA',18277517,'11/02/2021',1158.00,'',0.00,'2021-02-11','1900-01-01',1100.00,50.00),('0221',18283820,'15/02/2021',1558.00,'',0.00,'2021-02-15','1900-01-01',1500.00,50.00),('0XWC',18285510,'13/06/2021',1187.00,'',0.00,'2021-06-13','1900-01-01',1100.00,75.00),('0XWC',18285593,'14/03/2021',858.00,'',0.00,'2021-03-14','1900-01-01',800.00,50.00),('0XWC',18285957,'12/08/2021',587.00,'',0.00,'2021-08-12','1900-01-01',500.00,75.00),('0XWC',18285957,'15/06/2021',587.00,'',0.00,'2021-06-15','1900-01-01',500.00,75.00),('0XWC',18286120,'03/07/2021',1487.00,'',0.00,'2021-07-03','1900-01-01',1400.00,75.00),('0XWC',18286351,'19/02/2021',858.00,'',0.00,'2021-02-19','1900-01-01',800.00,50.00),('0XWC',18286443,'19/12/2021',1087.00,'',0.00,'2021-12-19','1900-01-01',1000.00,75.00),('0XWC',18286690,'06/05/2021',658.00,'',0.00,'2021-05-06','1900-01-01',600.00,50.00),('0XWC',18286757,'28/01/2021',558.00,'',0.00,'2021-01-28','1900-01-01',500.00,50.00),('0XWC',18286922,'08/01/2021',658.00,'',0.00,'2021-01-08','1900-01-01',600.00,50.00),('0XWC',18286963,'31/01/2021',1458.00,'',0.00,'2021-01-31','1900-01-01',1400.00,50.00),('0XWC',18287201,'21/04/2021',658.00,'',0.00,'2021-04-21','1900-01-01',600.00,50.00),('0XWC',18287219,'26/01/2021',558.00,'',0.00,'2021-01-26','1900-01-01',500.00,50.00),('0XWC',18287342,'24/09/2021',1087.00,'',0.00,'2021-09-24','1900-01-01',1000.00,75.00),('0XWC',18287425,'13/12/2021',987.00,'',0.00,'2021-12-13','1900-01-01',900.00,75.00),('0XWC',18287490,'16/11/2021',587.00,'',0.00,'2021-11-16','1900-01-01',500.00,75.00),('0XWC',18287599,'14/01/2021',658.00,'',0.00,'2021-01-14','1900-01-01',600.00,50.00),('0XWC',18287912,'28/04/2021',958.00,'',0.00,'2021-04-28','1900-01-01',900.00,50.00),('0XWC',18288142,'23/01/2021',558.00,'',0.00,'2021-01-23','1900-01-01',500.00,50.00),('0XWC',18288142,'10/01/2021',558.00,'',0.00,'2021-01-10','1900-01-01',500.00,50.00),('0XWC',18288381,'19/01/2021',558.00,'',0.00,'2021-01-19','1900-01-01',500.00,50.00),('0XWC',18288621,'21/01/2021',558.00,'',0.00,'2021-01-21','1900-01-01',500.00,50.00),('0XWC',18288639,'15/01/2021',558.00,'',0.00,'2021-01-15','1900-01-01',500.00,50.00),('0XWC',18288761,'06/01/2021',758.00,'',0.00,'2021-01-06','1900-01-01',700.00,50.00),('0XWC',18288852,'28/12/2021',887.00,'',0.00,'2021-12-28','1900-01-01',800.00,75.00),('0XWC',18289140,'30/05/2021',887.00,'',0.00,'2021-05-30','1900-01-01',800.00,75.00),('0XWC',18289157,'27/12/2021',1287.00,'',0.00,'2021-12-27','1900-01-01',1200.00,75.00),('0XWC',18289389,'24/12/2021',637.00,'',0.00,'2021-12-24','1900-01-01',550.00,75.00),('0XWC',18289405,'29/01/2021',1058.00,'',0.00,'2021-01-29','1900-01-01',1000.00,50.00),('0XWC',18289470,'15/01/2021',758.00,'',0.00,'2021-01-15','1900-01-01',700.00,50.00),('0XWC',18289512,'28/01/2021',658.00,'',0.00,'2021-01-28','1900-01-01',600.00,50.00),('0XWC',18289694,'18/09/2021',687.00,'',0.00,'2021-09-18','1900-01-01',600.00,75.00),('9449',18291807,'07/01/2021',758.00,'',0.00,'2021-01-07','1900-01-01',700.00,50.00),('10RZ',18294595,'10/01/2021',958.00,'',0.00,'2021-01-10','1900-01-01',900.00,50.00),('0NSZ',18296814,'24/09/2021',587.00,'',0.00,'2021-09-24','1900-01-01',500.00,75.00),('0WMN',18304261,'27/03/2021',1058.00,'',0.00,'2021-03-27','1900-01-01',1000.00,50.00),('0WVW',18304634,'25/06/2021',1587.00,'',0.00,'2021-06-25','1900-01-01',1500.00,75.00),('0WVW',18304634,'26/02/2021',1258.00,'',0.00,'2021-02-26','1900-01-01',1200.00,50.00),('0WVW',18304683,'17/06/2021',3087.00,'',0.00,'2021-06-17','1900-01-01',3000.00,75.00),('0289',18308619,'26/02/2021',758.00,'',0.00,'2021-02-26','1900-01-01',700.00,50.00),('0289',18308650,'20/11/2021',2587.00,'',0.00,'2021-11-20','1900-01-01',2500.00,75.00),('0NO4',18308908,'03/02/2021',558.00,'',0.00,'2021-02-03','1900-01-01',500.00,50.00),('0RIF',18309435,'17/11/2021',1387.00,'',0.00,'2021-11-17','1900-01-01',1300.00,75.00),('8131',18317131,'29/11/2021',787.00,'',0.00,'2021-11-29','1900-01-01',700.00,75.00),('0O1S',18317354,'22/05/2021',637.00,'',0.00,'2021-05-22','1900-01-01',550.00,75.00),('0O1S',18317362,'15/03/2021',958.00,'',0.00,'2021-03-15','1900-01-01',900.00,50.00),('7302',18324830,'27/12/2021',1587.00,'',0.00,'2021-12-27','1900-01-01',1500.00,75.00),('7302',18324830,'22/01/2021',1258.00,'',0.00,'2021-01-22','1900-01-01',1200.00,50.00),('5383',18332858,'23/12/2021',987.00,'',0.00,'2021-12-23','1900-01-01',900.00,75.00),('5383',18332858,'11/10/2021',1287.00,'',0.00,'2021-10-11','1900-01-01',1200.00,75.00),('0OSA',18335653,'13/02/2021',858.00,'',0.00,'2021-02-13','1900-01-01',800.00,50.00),('0SDT',18338095,'21/10/2021',887.00,'',0.00,'2021-10-21','1900-01-01',800.00,75.00),('6348',18344952,'06/02/2021',1658.00,'',0.00,'2021-02-06','1900-01-01',1600.00,50.00),('0P4F',18345439,'08/03/2021',658.00,'',0.00,'2021-03-08','1900-01-01',600.00,50.00),('0345',18349886,'19/03/2021',858.00,'',0.00,'2021-03-19','1900-01-01',800.00,50.00),('0WVW',18353227,'20/02/2021',1258.00,'',0.00,'2021-02-20','1900-01-01',1200.00,50.00),('2257',18375113,'21/08/2021',787.00,'',0.00,'2021-08-21','1900-01-01',700.00,75.00),('2305',18375899,'26/11/2021',1287.00,'',0.00,'2021-11-26','1900-01-01',1200.00,75.00),('0RUZ',18382697,'15/01/2021',2958.00,'',0.00,'2021-01-15','1900-01-01',2900.00,50.00),('0XVO',18397331,'21/04/2021',2258.00,'',0.00,'2021-04-21','1900-01-01',2200.00,50.00),('0XVO',18397349,'06/05/2021',1258.00,'',0.00,'2021-05-06','1900-01-01',1200.00,50.00),('6360',18410423,'25/12/2021',1487.00,'',0.00,'2021-12-25','1900-01-01',1400.00,75.00),('0079',18413476,'20/01/2021',1158.00,'',0.00,'2021-01-20','1900-01-01',1100.00,50.00),('8140',18419069,'29/01/2021',3258.00,'',0.00,'2021-01-29','1900-01-01',3200.00,50.00),('0108',18421552,'29/10/2021',3587.00,'',0.00,'2021-10-29','1900-01-01',3500.00,75.00),('0RSF',18423483,'25/12/2021',1487.00,'',0.00,'2021-12-25','1900-01-01',1400.00,75.00),('1AM8',18428953,'18/12/2021',1187.00,'',0.00,'2021-12-18','1900-01-01',1100.00,75.00),('0SYY',18431460,'23/11/2021',687.00,'',0.00,'2021-11-23','1900-01-01',600.00,75.00),('0SYY',18431460,'11/03/2021',558.00,'',0.00,'2021-03-11','1900-01-01',500.00,50.00),('3638',18445908,'01/12/2021',1787.00,'',0.00,'2021-12-01','1900-01-01',1700.00,75.00),('0R3D',18448670,'28/02/2021',1958.00,'',0.00,'2021-02-28','1900-01-01',1900.00,50.00),('0Y0D',18450890,'24/06/2021',687.00,'',0.00,'2021-06-24','1900-01-01',600.00,75.00),('5233',18460204,'16/08/2021',687.00,'',0.00,'2021-08-16','1900-01-01',600.00,75.00),('1I6P',18460337,'08/10/2021',1487.00,'',0.00,'2021-10-08','1900-01-01',1400.00,75.00),('6415',18460915,'07/10/2021',787.00,'',0.00,'2021-10-07','1900-01-01',700.00,75.00),('0RSF',18473298,'17/01/2021',2858.00,'',0.00,'2021-01-17','1900-01-01',2800.00,50.00),('0YAT',18473504,'31/03/2021',558.00,'12/05/2021',502.57,'2021-03-31','2021-05-12',500.00,50.00),('1D5M',18480137,'16/01/2021',858.00,'',0.00,'2021-01-16','1900-01-01',800.00,50.00),('0X62',18481762,'13/10/2021',2187.00,'',0.00,'2021-10-13','1900-01-01',2100.00,75.00),('0470',18487900,'19/11/2021',1987.00,'',0.00,'2021-11-19','1900-01-01',1900.00,75.00),('0470',18487900,'19/02/2021',1458.00,'',0.00,'2021-02-19','1900-01-01',1400.00,50.00),('3454',18492041,'22/11/2021',687.00,'',0.00,'2021-11-22','1900-01-01',600.00,75.00),('0NO4',18494351,'03/03/2021',1458.00,'15/04/2021',565.81,'2021-03-03','2021-04-15',1400.00,50.00),('2305',18504548,'05/03/2021',2058.00,'',0.00,'2021-03-05','1900-01-01',2000.00,50.00),('0VS5',18521799,'18/12/2021',4087.00,'',0.00,'2021-12-18','1900-01-01',4000.00,75.00),('0RSF',18524793,'21/12/2021',1387.00,'',0.00,'2021-12-21','1900-01-01',1300.00,75.00),('0RSF',18524793,'23/06/2021',1087.00,'',0.00,'2021-06-23','1900-01-01',1000.00,75.00),('0WVW',18526517,'17/06/2021',3087.00,'',0.00,'2021-06-17','1900-01-01',3000.00,75.00),('0Y4X',18531301,'12/12/2021',6087.00,'',0.00,'2021-12-12','1900-01-01',6000.00,75.00),('0O4O',18534594,'22/10/2021',987.00,'',0.00,'2021-10-22','1900-01-01',900.00,75.00),('0Y3X',18559054,'01/02/2021',1058.00,'',0.00,'2021-02-01','1900-01-01',1000.00,50.00),('0Y5K',18560391,'22/01/2021',608.00,'',0.00,'2021-01-22','1900-01-01',550.00,50.00),('0TF5',18561910,'03/02/2021',1558.00,'',0.00,'2021-02-03','1900-01-01',1500.00,50.00),('0254',18567719,'14/09/2021',2287.00,'',0.00,'2021-09-14','1900-01-01',2200.00,75.00),('0ZJX',18572123,'26/12/2021',887.00,'',0.00,'2021-12-26','1900-01-01',800.00,75.00),('1019',18575258,'23/06/2021',2587.00,'',0.00,'2021-06-23','1900-01-01',2500.00,75.00),('0YAT',18577437,'20/09/2021',587.00,'',0.00,'2021-09-20','1900-01-01',500.00,75.00),('0YAT',18577437,'31/08/2021',587.00,'',0.00,'2021-08-31','1900-01-01',500.00,75.00),('7203',18586719,'04/01/2021',1058.00,'',0.00,'2021-01-04','1900-01-01',1000.00,50.00),('9527',18593582,'18/06/2021',1887.00,'',0.00,'2021-06-18','1900-01-01',1800.00,75.00),('1494',18598524,'05/01/2021',1058.00,'',0.00,'2021-01-05','1900-01-01',1000.00,50.00),('0O4U',18615468,'09/05/2021',1058.00,'',0.00,'2021-05-09','1900-01-01',1000.00,50.00),('16IL',18616763,'16/12/2021',3087.00,'',0.00,'2021-12-16','1900-01-01',3000.00,75.00),('0WVW',18618801,'15/02/2021',1258.00,'',0.00,'2021-02-15','1900-01-01',1200.00,50.00),('1HZK',18619262,'23/12/2021',1287.00,'',0.00,'2021-12-23','1900-01-01',1200.00,75.00),('1HV3',18621920,'01/09/2021',2087.00,'',0.00,'2021-09-01','1900-01-01',2000.00,75.00),('1HX4',18624163,'01/12/2021',5087.00,'',0.00,'2021-12-01','1900-01-01',5000.00,75.00),('0SX0',18627760,'19/08/2021',1287.00,'',0.00,'2021-08-19','1900-01-01',1200.00,75.00),('0R3D',18628396,'14/02/2021',1958.00,'',0.00,'2021-02-14','1900-01-01',1900.00,50.00),('0Y8I',18630772,'20/01/2021',1658.00,'',0.00,'2021-01-20','1900-01-01',1600.00,50.00),('0Y8I',18630806,'16/02/2021',1458.00,'',0.00,'2021-02-16','1900-01-01',1400.00,50.00),('0Y8I',18630814,'16/02/2021',3558.00,'',0.00,'2021-02-16','1900-01-01',3500.00,50.00),('0V0A',18632133,'19/06/2021',1787.00,'',0.00,'2021-06-19','1900-01-01',1700.00,75.00),('1C0O',18633297,'15/05/2021',558.00,'',0.00,'2021-05-15','1900-01-01',471.00,75.00),('0Y8S',18634196,'17/06/2021',587.00,'',0.00,'2021-06-17','1900-01-01',500.00,75.00),('0Y8S',18634394,'27/12/2021',3187.00,'',0.00,'2021-12-27','1900-01-01',3100.00,75.00),('0Y8S',18634394,'27/04/2021',1058.00,'',0.00,'2021-04-27','1900-01-01',1000.00,50.00),('0Y8S',18634451,'10/10/2021',1287.00,'',0.00,'2021-10-10','1900-01-01',1200.00,75.00),('0Y8S',18634451,'12/09/2021',1287.00,'',0.00,'2021-09-12','1900-01-01',1200.00,75.00),('0U1N',18635342,'31/12/2021',887.00,'',0.00,'2021-12-31','1900-01-01',800.00,75.00),('0QEG',18642256,'26/02/2021',1258.00,'15/04/2021',1221.08,'2021-02-26','2021-04-15',1200.00,50.00),('0QEG',18642256,'12/02/2021',1258.00,'',0.00,'2021-02-12','1900-01-01',1200.00,50.00),('1HX2',18643197,'03/10/2021',1687.00,'',0.00,'2021-10-03','1900-01-01',1600.00,75.00),('0V6G',18644856,'18/01/2021',3758.00,'',0.00,'2021-01-18','1900-01-01',3700.00,50.00),('0Z70',18647370,'12/01/2021',858.00,'',0.00,'2021-01-12','1900-01-01',800.00,50.00),('0289',18648014,'28/02/2021',958.00,'',0.00,'2021-02-28','1900-01-01',900.00,50.00),('9218',18649426,'24/09/2021',1587.00,'',0.00,'2021-09-24','1900-01-01',1500.00,75.00),('1DCS',18651208,'28/11/2021',987.00,'',0.00,'2021-11-28','1900-01-01',900.00,75.00),('0WC0',18651323,'25/12/2021',1187.00,'',0.00,'2021-12-25','1900-01-01',1100.00,75.00),('0T2G',18657734,'15/01/2021',2658.00,'',0.00,'2021-01-15','1900-01-01',2600.00,50.00),('0W4A',18659102,'24/07/2021',787.00,'',0.00,'2021-07-24','1900-01-01',700.00,75.00),('0W4A',18659102,'19/07/2021',587.00,'',0.00,'2021-07-19','1900-01-01',500.00,75.00),('8140',18661397,'02/01/2021',2458.00,'',0.00,'2021-01-02','1900-01-01',2400.00,50.00),('8140',18661595,'31/10/2021',987.00,'',0.00,'2021-10-31','1900-01-01',900.00,75.00),('0V6G',18664706,'15/01/2021',1558.00,'',0.00,'2021-01-15','1900-01-01',1500.00,50.00),('0NAG',18667477,'19/01/2021',558.00,'',0.00,'2021-01-19','1900-01-01',500.00,50.00),('0Y5R',18671719,'27/09/2021',587.00,'',0.00,'2021-09-27','1900-01-01',500.00,75.00),('1D5M',18678102,'08/11/2021',787.00,'',0.00,'2021-11-08','1900-01-01',700.00,75.00),('12QM',18680355,'14/08/2021',587.00,'',0.00,'2021-08-14','1900-01-01',500.00,75.00),('0419',18682690,'13/12/2021',1287.00,'',0.00,'2021-12-13','1900-01-01',1200.00,75.00),('0419',18682690,'05/01/2021',1058.00,'',0.00,'2021-01-05','1900-01-01',1000.00,50.00),('1HX3',18683185,'06/12/2021',1987.00,'',0.00,'2021-12-06','1900-01-01',1900.00,75.00),('1IEP',18685990,'01/08/2021',687.00,'',0.00,'2021-08-01','1900-01-01',600.00,75.00),('1494',18690446,'14/09/2021',1187.00,'',0.00,'2021-09-14','1900-01-01',1100.00,75.00),('6153',18690727,'24/08/2021',587.00,'',0.00,'2021-08-24','1900-01-01',500.00,75.00),('0UG6',18696773,'05/09/2021',987.00,'',0.00,'2021-09-05','1900-01-01',900.00,75.00),('3776',18697482,'26/01/2021',858.00,'',0.00,'2021-01-26','1900-01-01',800.00,50.00),('9255',18701508,'18/01/2021',858.00,'',0.00,'2021-01-18','1900-01-01',800.00,50.00),('0XFG',18713602,'09/10/2021',887.00,'',0.00,'2021-10-09','1900-01-01',800.00,75.00),('9218',18714105,'17/09/2021',2487.00,'',0.00,'2021-09-17','1900-01-01',2400.00,75.00),('1JSY',18714907,'27/12/2021',1087.00,'',0.00,'2021-12-27','1900-01-01',1000.00,75.00),('2163',18715136,'29/01/2021',1358.00,'18/03/2021',1331.28,'2021-01-29','2021-03-18',1300.00,50.00),('0248',18715516,'24/12/2021',1887.00,'',0.00,'2021-12-24','1900-01-01',1800.00,75.00),('1B9D',18720243,'20/12/2021',587.00,'',0.00,'2021-12-20','1900-01-01',500.00,75.00),('8282',18721993,'03/01/2021',1058.00,'',0.00,'2021-01-03','1900-01-01',1000.00,50.00),('0NO4',18722173,'18/06/2021',587.00,'',0.00,'2021-06-18','1900-01-01',500.00,75.00),('0NO4',18722173,'23/01/2021',558.00,'',0.00,'2021-01-23','1900-01-01',500.00,50.00),('6617',18727495,'04/01/2021',3958.00,'',0.00,'2021-01-04','1900-01-01',3900.00,50.00),('12QM',18727834,'15/07/2021',787.00,'',0.00,'2021-07-15','1900-01-01',700.00,75.00),('1HX3',18728964,'15/10/2021',1887.00,'',0.00,'2021-10-15','1900-01-01',1800.00,75.00),('0Y4X',18736561,'19/12/2021',3387.00,'',0.00,'2021-12-19','1900-01-01',3300.00,75.00),('0Y4X',18736652,'21/11/2021',587.00,'',0.00,'2021-11-21','1900-01-01',500.00,75.00),('0Y4X',18736652,'15/06/2021',1087.00,'',0.00,'2021-06-15','1900-01-01',1000.00,75.00),('0WVW',18738955,'23/06/2021',2187.00,'',0.00,'2021-06-23','1900-01-01',2100.00,75.00),('0NO4',18743526,'08/05/2021',558.00,'',0.00,'2021-05-08','1900-01-01',500.00,50.00),('0WVW',18745257,'08/02/2021',858.00,'',0.00,'2021-02-08','1900-01-01',800.00,50.00),('0XQP',18750166,'27/08/2021',687.00,'',0.00,'2021-08-27','1900-01-01',600.00,75.00),('0289',18755710,'10/10/2021',587.00,'',0.00,'2021-10-10','1900-01-01',500.00,75.00),('0289',18755710,'09/10/2021',1787.00,'',0.00,'2021-10-09','1900-01-01',1700.00,75.00),('0289',18755710,'14/01/2021',1058.00,'',0.00,'2021-01-14','1900-01-01',1000.00,50.00),('0289',18755843,'04/12/2021',3187.00,'',0.00,'2021-12-04','1900-01-01',3100.00,75.00),('0289',18755843,'20/11/2021',3187.00,'',0.00,'2021-11-20','1900-01-01',3100.00,75.00),('0PQ2',18756130,'25/11/2021',987.00,'',0.00,'2021-11-25','1900-01-01',900.00,75.00),('0SU8',18759621,'02/11/2021',1187.00,'',0.00,'2021-11-02','1900-01-01',1100.00,75.00),('5629',18761601,'02/12/2021',1687.00,'',0.00,'2021-12-02','1900-01-01',1600.00,75.00),('8140',18761924,'31/12/2021',987.00,'',0.00,'2021-12-31','1900-01-01',900.00,75.00),('0XB3',18772012,'03/05/2021',658.00,'',0.00,'2021-05-03','1900-01-01',600.00,50.00),('3005',18778589,'06/11/2021',2087.00,'',0.00,'2021-11-06','1900-01-01',2000.00,75.00),('15AI',18780064,'14/11/2021',1087.00,'',0.00,'2021-11-14','1900-01-01',1000.00,75.00),('0P4F',18787507,'04/07/2021',1687.00,'',0.00,'2021-07-04','1900-01-01',1600.00,75.00),('15PG',18789933,'05/05/2021',3058.00,'',0.00,'2021-05-05','1900-01-01',3000.00,50.00),('0YG3',18789958,'19/12/2021',3687.00,'',0.00,'2021-12-19','1900-01-01',3600.00,75.00),('0YG3',18789990,'06/09/2021',2587.00,'',0.00,'2021-09-06','1900-01-01',2500.00,75.00),('0YG3',18790014,'23/12/2021',3387.00,'',0.00,'2021-12-23','1900-01-01',3300.00,75.00),('14QO',18792671,'31/07/2021',2587.00,'',0.00,'2021-07-31','1900-01-01',2500.00,75.00),('9218',18800359,'31/10/2021',1087.00,'',0.00,'2021-10-31','1900-01-01',1000.00,75.00),('0UA2',18802454,'30/12/2021',1587.00,'',0.00,'2021-12-30','1900-01-01',1500.00,75.00),('0OFY',18806992,'15/12/2021',987.00,'',0.00,'2021-12-15','1900-01-01',900.00,75.00),('0OFY',18806992,'15/01/2021',1058.00,'',0.00,'2021-01-15','1900-01-01',1000.00,50.00),('0OFY',18806992,'14/01/2021',1058.00,'',0.00,'2021-01-14','1900-01-01',1000.00,50.00),('0O9Y',18814715,'25/09/2021',587.00,'',0.00,'2021-09-25','1900-01-01',500.00,75.00),('0O9Y',18814715,'10/09/2021',587.00,'',0.00,'2021-09-10','1900-01-01',500.00,75.00),('0Y8F',18817494,'07/02/2021',1058.00,'',0.00,'2021-02-07','1900-01-01',1000.00,50.00),('0Y8F',18817494,'17/01/2021',958.00,'',0.00,'2021-01-17','1900-01-01',900.00,50.00),('0Y8F',18817593,'18/01/2021',958.00,'',0.00,'2021-01-18','1900-01-01',900.00,50.00),('0419',18818690,'22/01/2021',1058.00,'',0.00,'2021-01-22','1900-01-01',1000.00,50.00),('0WVW',18822841,'06/02/2021',2258.00,'',0.00,'2021-02-06','1900-01-01',2200.00,50.00),('0PUO',18825588,'20/01/2021',958.00,'',0.00,'2021-01-20','1900-01-01',900.00,50.00),('0U1N',18832576,'09/01/2021',1058.00,'',0.00,'2021-01-09','1900-01-01',1000.00,50.00),('0WVW',18836015,'20/06/2021',887.00,'',0.00,'2021-06-20','1900-01-01',800.00,75.00),('0YAT',18840942,'19/12/2021',787.00,'',0.00,'2021-12-19','1900-01-01',700.00,75.00),('10ZD',18844449,'13/11/2021',887.00,'',0.00,'2021-11-13','1900-01-01',800.00,75.00),('10ZD',18844449,'14/08/2021',887.00,'',0.00,'2021-08-14','1900-01-01',800.00,75.00),('0YL6',18846824,'07/02/2021',1058.00,'',0.00,'2021-02-07','1900-01-01',1000.00,50.00),('0YL6',18846857,'28/12/2021',1887.00,'',0.00,'2021-12-28','1900-01-01',1800.00,75.00),('0YL6',18846873,'13/02/2021',1458.00,'',0.00,'2021-02-13','1900-01-01',1400.00,50.00),('0YL6',18847368,'16/02/2021',1058.00,'',0.00,'2021-02-16','1900-01-01',1000.00,50.00),('0YL6',18847541,'05/01/2021',1258.00,'',0.00,'2021-01-05','1900-01-01',1200.00,50.00),('0YL6',18847657,'14/02/2021',1658.00,'',0.00,'2021-02-14','1900-01-01',1600.00,50.00),('0YL6',18847707,'20/09/2021',937.00,'',0.00,'2021-09-20','1900-01-01',850.00,75.00),('0YL6',18847756,'24/03/2021',1758.00,'',0.00,'2021-03-24','1900-01-01',1700.00,50.00),('0YL6',18847764,'13/12/2021',1887.00,'',0.00,'2021-12-13','1900-01-01',1800.00,75.00),('0YL6',18847764,'15/01/2021',1058.00,'',0.00,'2021-01-15','1900-01-01',1000.00,50.00),('0YL6',18847863,'14/05/2021',1058.00,'',0.00,'2021-05-14','1900-01-01',1000.00,50.00),('0YL6',18848127,'13/03/2021',558.00,'',0.00,'2021-03-13','1900-01-01',500.00,50.00),('0YL6',18848259,'10/03/2021',1058.00,'',0.00,'2021-03-10','1900-01-01',1000.00,50.00),('0YL6',18848309,'02/03/2021',558.00,'',0.00,'2021-03-02','1900-01-01',500.00,50.00),('0YL6',18848382,'05/07/2021',587.00,'',0.00,'2021-07-05','1900-01-01',500.00,75.00),('0YL6',18848390,'13/01/2021',958.00,'',0.00,'2021-01-13','1900-01-01',900.00,50.00),('0YL6',18848572,'19/12/2021',2087.00,'',0.00,'2021-12-19','1900-01-01',2000.00,75.00),('0YL6',18848689,'16/02/2021',558.00,'',0.00,'2021-02-16','1900-01-01',500.00,50.00),('0YL6',18848762,'13/01/2021',1258.00,'',0.00,'2021-01-13','1900-01-01',1200.00,50.00),('2163',18851246,'14/05/2021',1358.00,'',0.00,'2021-05-14','1900-01-01',1300.00,50.00),('15AI',18851816,'16/09/2021',987.00,'',0.00,'2021-09-16','1900-01-01',900.00,75.00),('15AI',18851881,'23/12/2021',787.00,'',0.00,'2021-12-23','1900-01-01',700.00,75.00),('15AI',18852038,'20/09/2021',1187.00,'',0.00,'2021-09-20','1900-01-01',1100.00,75.00),('15AI',18852053,'21/11/2021',587.00,'',0.00,'2021-11-21','1900-01-01',500.00,75.00),('15AI',18852319,'14/08/2021',987.00,'',0.00,'2021-08-14','1900-01-01',900.00,75.00),('0YL8',18859181,'15/01/2021',1058.00,'',0.00,'2021-01-15','1900-01-01',1000.00,50.00),('0YL8',18859249,'02/01/2021',1658.00,'',0.00,'2021-01-02','1900-01-01',1600.00,50.00),('0YL8',18859272,'15/02/2021',758.00,'',0.00,'2021-02-15','1900-01-01',700.00,50.00),('0404',18870089,'20/02/2021',2858.00,'',0.00,'2021-02-20','1900-01-01',2800.00,50.00),('2305',18870386,'01/12/2021',587.00,'',0.00,'2021-12-01','1900-01-01',500.00,75.00),('0YKW',18870550,'07/03/2021',658.00,'',0.00,'2021-03-07','1900-01-01',600.00,50.00),('1EUY',18871699,'30/12/2021',3987.00,'',0.00,'2021-12-30','1900-01-01',3900.00,75.00),('0OGB',18875617,'31/03/2021',1358.00,'',0.00,'2021-03-31','1900-01-01',1300.00,50.00),('9435',18886994,'22/06/2021',2087.00,'',0.00,'2021-06-22','1900-01-01',2000.00,75.00),('0N9A',18895607,'08/10/2021',1987.00,'',0.00,'2021-10-08','1900-01-01',1900.00,75.00),('0XZQ',18898734,'29/01/2021',858.00,'',0.00,'2021-01-29','1900-01-01',800.00,50.00),('0NO4',18900274,'10/05/2021',758.00,'',0.00,'2021-05-10','1900-01-01',700.00,50.00),('1D7K',18910752,'23/12/2021',1087.00,'',0.00,'2021-12-23','1900-01-01',1000.00,75.00),('0YAT',18910984,'13/04/2021',1058.00,'',0.00,'2021-04-13','1900-01-01',1000.00,50.00),('0YNO',18922849,'02/06/2021',1387.00,'',0.00,'2021-06-02','1900-01-01',1300.00,75.00),('0YNO',18923250,'06/03/2021',758.00,'',0.00,'2021-03-06','1900-01-01',700.00,50.00),('0YNY',18925529,'04/08/2021',2387.00,'',0.00,'2021-08-04','1900-01-01',2300.00,75.00),('0YNZ',18926220,'24/08/2021',1987.00,'',0.00,'2021-08-24','1900-01-01',1900.00,75.00),('0YNZ',18926220,'21/01/2021',1558.00,'',0.00,'2021-01-21','1900-01-01',1500.00,50.00),('7861',18933499,'19/01/2021',1058.00,'',0.00,'2021-01-19','1900-01-01',1000.00,50.00),('107U',18940049,'04/12/2021',787.00,'',0.00,'2021-12-04','1900-01-01',700.00,75.00),('2305',18941849,'03/12/2021',2287.00,'',0.00,'2021-12-03','1900-01-01',2200.00,75.00),('3429',18944363,'17/09/2021',2787.00,'',0.00,'2021-09-17','1900-01-01',2700.00,75.00),('15H8',18945683,'03/02/2021',658.00,'',0.00,'2021-02-03','1900-01-01',600.00,50.00),('0R5B',18951376,'13/12/2021',787.00,'',0.00,'2021-12-13','1900-01-01',700.00,75.00),('0R5B',18951376,'16/04/2021',758.00,'',0.00,'2021-04-16','1900-01-01',700.00,50.00),('11VR',18957811,'04/02/2021',558.00,'',0.00,'2021-02-04','1900-01-01',500.00,50.00),('14I6',18967471,'11/06/2021',887.00,'',0.00,'2021-06-11','1900-01-01',800.00,75.00),('0O0N',18972265,'10/09/2021',2487.00,'',0.00,'2021-09-10','1900-01-01',2400.00,75.00),('0289',18973149,'05/03/2021',1658.00,'',0.00,'2021-03-05','1900-01-01',1600.00,50.00),('175Z',18981068,'24/08/2021',1087.00,'',0.00,'2021-08-24','1900-01-01',1000.00,75.00),('175Z',18981068,'09/07/2021',1387.00,'',0.00,'2021-07-09','1900-01-01',1300.00,75.00),('0215',18988295,'24/06/2021',2787.00,'',0.00,'2021-06-24','1900-01-01',2700.00,75.00),('7621',18990861,'28/03/2021',558.00,'',0.00,'2021-03-28','1900-01-01',500.00,50.00),('0SSN',18991067,'01/09/2021',1387.00,'',0.00,'2021-09-01','1900-01-01',1300.00,75.00),('17DY',18991455,'11/09/2021',587.00,'',0.00,'2021-09-11','1900-01-01',500.00,75.00),('0WVW',18995845,'26/04/2021',1258.00,'',0.00,'2021-04-26','1900-01-01',1200.00,50.00),('0WVW',18995845,'13/01/2021',558.00,'',0.00,'2021-01-13','1900-01-01',500.00,50.00),('17DY',18998336,'18/01/2021',1158.00,'',0.00,'2021-01-18','1900-01-01',1100.00,50.00),('1HV3',19015122,'18/12/2021',3587.00,'',0.00,'2021-12-18','1900-01-01',3500.00,75.00),('0OD1',19018928,'11/02/2021',758.00,'',0.00,'2021-02-11','1900-01-01',700.00,50.00),('0YST',19025980,'13/12/2021',687.00,'',0.00,'2021-12-13','1900-01-01',600.00,75.00),('13A6',19026103,'02/01/2021',858.00,'',0.00,'2021-01-02','1900-01-01',800.00,50.00),('0QIS',19029263,'16/01/2021',1458.00,'',0.00,'2021-01-16','1900-01-01',1400.00,50.00),('2257',19030931,'25/09/2021',787.00,'',0.00,'2021-09-25','1900-01-01',700.00,75.00),('0TSV',19041425,'15/12/2021',1087.00,'',0.00,'2021-12-15','1900-01-01',1000.00,75.00),('1B7K',19041623,'10/03/2021',558.00,'',0.00,'2021-03-10','1900-01-01',500.00,50.00),('2980',19042282,'02/12/2021',1387.00,'',0.00,'2021-12-02','1900-01-01',1300.00,75.00),('8140',19048594,'03/11/2021',1487.00,'',0.00,'2021-11-03','1900-01-01',1400.00,75.00),('8140',19048669,'05/12/2021',1087.00,'',0.00,'2021-12-05','1900-01-01',1000.00,75.00),('8140',19048677,'17/12/2021',1387.00,'',0.00,'2021-12-17','1900-01-01',1300.00,75.00),('0SAQ',19055342,'19/03/2021',1358.00,'',0.00,'2021-03-19','1900-01-01',1300.00,50.00),('0SAQ',19055342,'08/01/2021',1358.00,'',0.00,'2021-01-08','1900-01-01',1300.00,50.00),('7861',19057348,'02/12/2021',1987.00,'',0.00,'2021-12-02','1900-01-01',1900.00,75.00),('0YSY',19059476,'23/01/2021',658.00,'',0.00,'2021-01-23','1900-01-01',600.00,50.00),('187E',19067248,'03/04/2021',1758.00,'',0.00,'2021-04-03','1900-01-01',1700.00,50.00),('1AJZ',19069277,'08/01/2021',1658.00,'',0.00,'2021-01-08','1900-01-01',1600.00,50.00),('6411',19072602,'18/09/2021',787.00,'',0.00,'2021-09-18','1900-01-01',700.00,75.00),('0YJV',19072875,'15/02/2021',1058.00,'',0.00,'2021-02-15','1900-01-01',1000.00,50.00),('0YUZ',19073832,'30/01/2021',1358.00,'',0.00,'2021-01-30','1900-01-01',1300.00,50.00),('0YQ7',19076215,'02/08/2021',3587.00,'',0.00,'2021-08-02','1900-01-01',3500.00,75.00),('0YCV',19076835,'17/09/2021',1387.00,'',0.00,'2021-09-17','1900-01-01',1300.00,75.00),('0YMH',19082270,'01/02/2021',4058.00,'',0.00,'2021-02-01','1900-01-01',4000.00,50.00),('0YMH',19082999,'23/01/2021',2258.00,'',0.00,'2021-01-23','1900-01-01',2200.00,50.00),('0YUF',19094226,'25/11/2021',587.00,'',0.00,'2021-11-25','1900-01-01',500.00,75.00),('0YUF',19094283,'29/03/2021',958.00,'',0.00,'2021-03-29','1900-01-01',900.00,50.00),('1GXB',19094317,'27/08/2021',587.00,'',0.00,'2021-08-27','1900-01-01',500.00,75.00),('5490',19098524,'22/09/2021',5387.00,'',0.00,'2021-09-22','1900-01-01',5300.00,75.00),('0YMW',19100148,'09/01/2021',1258.00,'',0.00,'2021-01-09','1900-01-01',1200.00,50.00),('5383',19101823,'31/10/2021',1087.00,'',0.00,'2021-10-31','1900-01-01',1000.00,75.00),('3709',19105584,'13/03/2021',558.00,'',0.00,'2021-03-13','1900-01-01',500.00,50.00),('07R0',19117480,'08/02/2021',1058.00,'',0.00,'2021-02-08','1900-01-01',1000.00,50.00),('9218',19118363,'27/08/2021',1087.00,'',0.00,'2021-08-27','1900-01-01',1000.00,75.00),('0WOM',19118652,'18/12/2021',787.00,'',0.00,'2021-12-18','1900-01-01',700.00,75.00),('0YTP',19122845,'23/10/2021',1187.00,'',0.00,'2021-10-23','1900-01-01',1100.00,75.00),('0YTP',19122944,'13/12/2021',987.00,'',0.00,'2021-12-13','1900-01-01',900.00,75.00),('0YTP',19122951,'16/12/2021',1587.00,'',0.00,'2021-12-16','1900-01-01',1500.00,75.00),('1019',19137140,'19/01/2021',1558.00,'',0.00,'2021-01-19','1900-01-01',1500.00,50.00),('0289',19140904,'20/12/2021',1687.00,'',0.00,'2021-12-20','1900-01-01',1600.00,75.00),('0YAT',19146455,'06/02/2021',958.00,'',0.00,'2021-02-06','1900-01-01',900.00,50.00),('0O4U',19146927,'25/10/2021',837.00,'',0.00,'2021-10-25','1900-01-01',750.00,75.00),('0O4U',19146927,'08/03/2021',958.00,'',0.00,'2021-03-08','1900-01-01',900.00,50.00),('0YXP',19150028,'02/03/2021',1558.00,'',0.00,'2021-03-02','1900-01-01',1500.00,50.00),('0ZXB',19152933,'17/10/2021',1887.00,'',0.00,'2021-10-17','1900-01-01',1800.00,75.00),('0YAT',19163997,'10/10/2021',1287.00,'',0.00,'2021-10-10','1900-01-01',1200.00,75.00),('15S2',19170778,'20/01/2021',1158.00,'04/03/2021',1152.11,'2021-01-20','2021-03-04',1100.00,50.00),('1CWX',19171107,'09/02/2021',1158.00,'',0.00,'2021-02-09','1900-01-01',1100.00,50.00),('0PE0',19172089,'19/07/2021',1587.00,'',0.00,'2021-07-19','1900-01-01',1500.00,75.00),('0USD',19172691,'14/11/2021',987.00,'',0.00,'2021-11-14','1900-01-01',900.00,75.00),('0USD',19172691,'02/11/2021',1787.00,'',0.00,'2021-11-02','1900-01-01',1700.00,75.00),('0PHG',19175488,'18/12/2021',1087.00,'',0.00,'2021-12-18','1900-01-01',1000.00,75.00),('2340',19181189,'10/09/2021',587.00,'',0.00,'2021-09-10','1900-01-01',500.00,75.00),('1C0O',19189067,'06/12/2021',2587.00,'',0.00,'2021-12-06','1900-01-01',2500.00,75.00),('1C0O',19189109,'15/05/2021',1058.00,'',0.00,'2021-05-15','1900-01-01',971.00,75.00),('0264',19198332,'07/10/2021',2087.00,'',0.00,'2021-10-07','1900-01-01',2000.00,75.00),('0Z0W',19210913,'11/05/2021',758.00,'',0.00,'2021-05-11','1900-01-01',700.00,50.00),('0Z0W',19210913,'02/05/2021',758.00,'',0.00,'2021-05-02','1900-01-01',700.00,50.00),('15PG',19211903,'04/12/2021',2087.00,'',0.00,'2021-12-04','1900-01-01',2000.00,75.00),('0YAT',19215615,'12/03/2021',758.00,'',0.00,'2021-03-12','1900-01-01',700.00,50.00),('0O1S',19217595,'03/01/2021',1358.00,'',0.00,'2021-01-03','1900-01-01',1300.00,50.00),('0136',19223809,'31/12/2021',1287.00,'',0.00,'2021-12-31','1900-01-01',1200.00,75.00),('0YVS',19227297,'15/09/2021',1887.00,'',0.00,'2021-09-15','1900-01-01',1800.00,75.00),('5383',19228824,'29/10/2021',1387.00,'',0.00,'2021-10-29','1900-01-01',1300.00,75.00),('0UIQ',19242916,'29/01/2021',3358.00,'',0.00,'2021-01-29','1900-01-01',3300.00,50.00),('0XV4',19243393,'16/10/2021',1287.00,'',0.00,'2021-10-16','1900-01-01',1200.00,75.00),('6991',19246743,'12/11/2021',687.00,'',0.00,'2021-11-12','1900-01-01',600.00,75.00),('0289',19247048,'13/02/2021',1058.00,'',0.00,'2021-02-13','1900-01-01',1000.00,50.00),('3497',19248699,'30/01/2021',1758.00,'',0.00,'2021-01-30','1900-01-01',1700.00,50.00),('3497',19248699,'16/01/2021',1758.00,'',0.00,'2021-01-16','1900-01-01',1700.00,50.00),('1ILD',19250679,'16/11/2021',687.00,'',0.00,'2021-11-16','1900-01-01',600.00,75.00),('0YZQ',19250729,'27/07/2021',1487.00,'',0.00,'2021-07-27','1900-01-01',1400.00,75.00),('5233',19253145,'15/06/2021',587.00,'',0.00,'2021-06-15','1900-01-01',500.00,75.00),('4505',19253798,'05/08/2021',787.00,'',0.00,'2021-08-05','1900-01-01',700.00,75.00),('0VH6',19253830,'03/10/2021',787.00,'',0.00,'2021-10-03','1900-01-01',700.00,75.00),('0RUZ',19254333,'16/01/2021',558.00,'',0.00,'2021-01-16','1900-01-01',500.00,50.00),('0Z3S',19257542,'02/09/2021',1987.00,'',0.00,'2021-09-02','1900-01-01',1900.00,75.00),('0Z3S',19257583,'23/05/2021',837.00,'',0.00,'2021-05-23','1900-01-01',750.00,75.00),('0Z3S',19257781,'24/05/2021',587.00,'',0.00,'2021-05-24','1900-01-01',500.00,75.00),('0Z23',19260611,'04/12/2021',1087.00,'',0.00,'2021-12-04','1900-01-01',1000.00,75.00),('0Z23',19260991,'08/03/2021',858.00,'',0.00,'2021-03-08','1900-01-01',800.00,50.00),('4505',19261957,'11/08/2021',3887.00,'',0.00,'2021-08-11','1900-01-01',3800.00,75.00),('0YHP',19269273,'05/10/2021',587.00,'16/11/2021',563.70,'2021-10-05','2021-11-16',500.00,75.00),('0Z37',19270297,'26/03/2021',558.00,'',0.00,'2021-03-26','1900-01-01',500.00,50.00),('8584',19270495,'15/04/2021',1058.00,'',0.00,'2021-04-15','1900-01-01',1000.00,50.00),('1909',19280916,'07/01/2021',1258.00,'',0.00,'2021-01-07','1900-01-01',1200.00,50.00),('1BC8',19281229,'08/07/2021',1687.00,'',0.00,'2021-07-08','1900-01-01',1600.00,75.00),('1BC8',19281229,'01/07/2021',1587.00,'',0.00,'2021-07-01','1900-01-01',1500.00,75.00),('17DY',19294719,'03/01/2021',1558.00,'',0.00,'2021-01-03','1900-01-01',1500.00,50.00),('2163',19296797,'18/12/2021',987.00,'',0.00,'2021-12-18','1900-01-01',900.00,75.00),('5460',19299965,'14/12/2021',2287.00,'',0.00,'2021-12-14','1900-01-01',2200.00,75.00),('07R0',19305622,'20/01/2021',558.00,'',0.00,'2021-01-20','1900-01-01',500.00,50.00),('0OTQ',19307479,'06/11/2021',887.00,'',0.00,'2021-11-06','1900-01-01',800.00,75.00),('0OTQ',19307479,'21/10/2021',1087.00,'',0.00,'2021-10-21','1900-01-01',1000.00,75.00),('8140',19309327,'08/11/2021',1487.00,'',0.00,'2021-11-08','1900-01-01',1400.00,75.00),('0Z51',19310580,'03/02/2021',1858.00,'',0.00,'2021-02-03','1900-01-01',1800.00,50.00),('2305',19311745,'11/03/2021',858.00,'',0.00,'2021-03-11','1900-01-01',800.00,50.00),('2305',19311745,'20/02/2021',1158.00,'',0.00,'2021-02-20','1900-01-01',1100.00,50.00),('2305',19311752,'23/12/2021',5687.00,'',0.00,'2021-12-23','1900-01-01',5600.00,75.00),('0O1S',19313725,'17/04/2021',858.00,'',0.00,'2021-04-17','1900-01-01',800.00,50.00),('0O1S',19313725,'05/01/2021',858.00,'',0.00,'2021-01-05','1900-01-01',800.00,50.00),('0125',19314954,'05/03/2021',1058.00,'',0.00,'2021-03-05','1900-01-01',1000.00,50.00),('0125',19314954,'29/01/2021',1058.00,'',0.00,'2021-01-29','1900-01-01',1000.00,50.00),('1GE5',19316553,'19/05/2021',658.00,'',0.00,'2021-05-19','1900-01-01',571.00,75.00),('0NYC',19319045,'09/01/2021',858.00,'',0.00,'2021-01-09','1900-01-01',800.00,50.00),('0NYC',19319045,'03/01/2021',758.00,'',0.00,'2021-01-03','1900-01-01',700.00,50.00),('1CZU',19320472,'10/04/2021',558.00,'',0.00,'2021-04-10','1900-01-01',500.00,50.00),('0Z6U',19320514,'02/12/2021',3687.00,'',0.00,'2021-12-02','1900-01-01',3600.00,75.00),('0Z6U',19320571,'12/11/2021',1287.00,'',0.00,'2021-11-12','1900-01-01',1200.00,75.00),('1CZU',19320571,'11/10/2021',587.00,'',0.00,'2021-10-11','1900-01-01',500.00,75.00),('1CZU',19320712,'08/01/2021',1958.00,'',0.00,'2021-01-08','1900-01-01',1900.00,50.00),('0Z6U',19320894,'20/06/2021',1887.00,'',0.00,'2021-06-20','1900-01-01',1800.00,75.00),('0Z6U',19321025,'27/12/2021',4387.00,'',0.00,'2021-12-27','1900-01-01',4300.00,75.00),('0Z6U',19321025,'26/03/2021',4058.00,'',0.00,'2021-03-26','1900-01-01',4000.00,50.00),('0Z6U',19321132,'11/02/2021',1058.00,'',0.00,'2021-02-11','1900-01-01',1000.00,50.00),('0Z6U',19321272,'06/01/2021',1958.00,'',0.00,'2021-01-06','1900-01-01',1900.00,50.00),('0Z6U',19321280,'07/07/2021',687.00,'',0.00,'2021-07-07','1900-01-01',600.00,75.00),('1CZU',19321298,'08/01/2021',2658.00,'',0.00,'2021-01-08','1900-01-01',2600.00,50.00),('1CZU',19321306,'13/01/2021',558.00,'',0.00,'2021-01-13','1900-01-01',500.00,50.00),('0Z6U',19321447,'18/01/2021',3058.00,'',0.00,'2021-01-18','1900-01-01',3000.00,50.00),('0Z6U',19321777,'01/12/2021',2287.00,'',0.00,'2021-12-01','1900-01-01',2200.00,75.00),('1CZU',19321777,'08/01/2021',2358.00,'',0.00,'2021-01-08','1900-01-01',2300.00,50.00),('0Z6U',19321926,'20/03/2021',4058.00,'',0.00,'2021-03-20','1900-01-01',4000.00,50.00),('0Z6U',19322049,'03/12/2021',787.00,'',0.00,'2021-12-03','1900-01-01',700.00,75.00),('0Z6U',19322114,'22/11/2021',1987.00,'',0.00,'2021-11-22','1900-01-01',1900.00,75.00),('0Z6U',19322130,'30/04/2021',2058.00,'',0.00,'2021-04-30','1900-01-01',2000.00,50.00),('0Z6U',19322148,'01/12/2021',2087.00,'',0.00,'2021-12-01','1900-01-01',2000.00,75.00),('0Z6U',19322197,'15/03/2021',2058.00,'',0.00,'2021-03-15','1900-01-01',2000.00,50.00),('0Z6U',19322221,'04/03/2021',4058.00,'',0.00,'2021-03-04','1900-01-01',4000.00,50.00),('0Z6U',19322338,'22/12/2021',4087.00,'',0.00,'2021-12-22','1900-01-01',4000.00,75.00),('0Z6U',19322338,'05/01/2021',1558.00,'',0.00,'2021-01-05','1900-01-01',1500.00,50.00),('0Z6U',19322387,'12/12/2021',1087.00,'',0.00,'2021-12-12','1900-01-01',1000.00,75.00),('1CZU',19322452,'08/01/2021',1058.00,'',0.00,'2021-01-08','1900-01-01',1000.00,50.00),('0Z6U',19322924,'16/12/2021',2987.00,'',0.00,'2021-12-16','1900-01-01',2900.00,75.00),('0Z6U',19323393,'15/03/2021',1058.00,'',0.00,'2021-03-15','1900-01-01',1000.00,50.00),('0Z6U',19323443,'30/12/2021',3087.00,'',0.00,'2021-12-30','1900-01-01',3000.00,75.00),('0Z6U',19323708,'07/12/2021',1387.00,'',0.00,'2021-12-07','1900-01-01',1300.00,75.00),('0Z6U',19324045,'17/12/2021',1087.00,'',0.00,'2021-12-17','1900-01-01',1000.00,75.00),('0Z6U',19324243,'06/12/2021',1087.00,'',0.00,'2021-12-06','1900-01-01',1000.00,75.00),('1CZU',19324243,'11/10/2021',2091.00,'',0.00,'2021-10-11','1900-01-01',2004.00,75.00),('14QO',19324250,'14/02/2021',558.00,'',0.00,'2021-02-14','1900-01-01',500.00,50.00),('0Z6U',19324318,'20/11/2021',1087.00,'',0.00,'2021-11-20','1900-01-01',1000.00,75.00),('0Z6U',19324318,'21/07/2021',1087.00,'',0.00,'2021-07-21','1900-01-01',1000.00,75.00),('14QO',19324557,'20/08/2021',1187.00,'',0.00,'2021-08-20','1900-01-01',1100.00,75.00),('0Z6U',19325067,'31/12/2021',1987.00,'',0.00,'2021-12-31','1900-01-01',1900.00,75.00),('0YUG',19325398,'06/12/2021',5087.00,'',0.00,'2021-12-06','1900-01-01',5000.00,75.00),('0QJR',19325778,'01/12/2021',1687.00,'',0.00,'2021-12-01','1900-01-01',1600.00,75.00),('0QJR',19325828,'31/12/2021',3087.00,'',0.00,'2021-12-31','1900-01-01',3000.00,75.00),('0QJR',19326297,'31/07/2021',2487.00,'',0.00,'2021-07-31','1900-01-01',2400.00,75.00),('0QJR',19326362,'16/12/2021',2187.00,'',0.00,'2021-12-16','1900-01-01',2100.00,75.00),('0QJR',19326461,'04/05/2021',4058.00,'',0.00,'2021-05-04','1900-01-01',4000.00,50.00),('0WVW',19326685,'16/01/2021',1758.00,'',0.00,'2021-01-16','1900-01-01',1700.00,50.00),('0WVW',19326768,'15/01/2021',1258.00,'',0.00,'2021-01-15','1900-01-01',1200.00,50.00),('0WVW',19327501,'15/02/2021',1258.00,'',0.00,'2021-02-15','1900-01-01',1200.00,50.00),('0WVW',19327709,'26/07/2021',3087.00,'',0.00,'2021-07-26','1900-01-01',3000.00,75.00),('0WVW',19328087,'26/07/2021',3087.00,'',0.00,'2021-07-26','1900-01-01',3000.00,75.00),('0WVW',19328145,'22/02/2021',1258.00,'',0.00,'2021-02-22','1900-01-01',1200.00,50.00),('0WVW',19328517,'18/06/2021',3087.00,'',0.00,'2021-06-18','1900-01-01',3000.00,75.00),('0Z6I',19330216,'29/03/2021',1258.00,'',0.00,'2021-03-29','1900-01-01',1200.00,50.00),('0Z6I',19330216,'25/03/2021',1258.00,'',0.00,'2021-03-25','1900-01-01',1200.00,50.00),('0Z49',19333228,'16/08/2021',687.00,'',0.00,'2021-08-16','1900-01-01',600.00,75.00),('0XB3',19334754,'12/02/2021',758.00,'',0.00,'2021-02-12','1900-01-01',700.00,50.00),('0XNX',19340462,'26/09/2021',787.00,'',0.00,'2021-09-26','1900-01-01',700.00,75.00),('0YLR',19340694,'27/02/2021',2358.00,'',0.00,'2021-02-27','1900-01-01',2300.00,50.00),('0YLR',19340694,'18/01/2021',3058.00,'',0.00,'2021-01-18','1900-01-01',3000.00,50.00),('0YLR',19340728,'23/01/2021',2158.00,'',0.00,'2021-01-23','1900-01-01',2100.00,50.00),('0YLR',19341122,'02/01/2021',2158.00,'',0.00,'2021-01-02','1900-01-01',2100.00,50.00),('0YLR',19341163,'15/01/2021',1958.00,'',0.00,'2021-01-15','1900-01-01',1900.00,50.00),('0YLR',19341213,'25/02/2021',2558.00,'',0.00,'2021-02-25','1900-01-01',2500.00,50.00),('0YLR',19341221,'27/02/2021',2158.00,'',0.00,'2021-02-27','1900-01-01',2100.00,50.00),('0YLR',19341221,'13/02/2021',2158.00,'',0.00,'2021-02-13','1900-01-01',2100.00,50.00),('0YLR',19341304,'16/01/2021',2558.00,'',0.00,'2021-01-16','1900-01-01',2500.00,50.00),('0YLR',19341361,'15/01/2021',1958.00,'',0.00,'2021-01-15','1900-01-01',1900.00,50.00),('0YLR',19341502,'14/02/2021',1058.00,'31/03/2021',1057.79,'2021-02-14','2021-03-31',1000.00,50.00),('0YLR',19341692,'27/02/2021',1408.00,'',0.00,'2021-02-27','1900-01-01',1350.00,50.00),('0YLR',19341973,'16/01/2021',1958.00,'',0.00,'2021-01-16','1900-01-01',1900.00,50.00),('0YLR',19342021,'02/01/2021',2258.00,'',0.00,'2021-01-02','1900-01-01',2200.00,50.00),('0YLR',19342302,'27/02/2021',2258.00,'',0.00,'2021-02-27','1900-01-01',2200.00,50.00),('0YLR',19342310,'27/02/2021',2158.00,'',0.00,'2021-02-27','1900-01-01',2100.00,50.00),('0121',19344183,'11/02/2021',558.00,'',0.00,'2021-02-11','1900-01-01',500.00,50.00),('1I3R',19344886,'19/12/2021',1387.00,'',0.00,'2021-12-19','1900-01-01',1300.00,75.00),('0Z67',19344902,'05/01/2021',4058.00,'',0.00,'2021-01-05','1900-01-01',4000.00,50.00),('0Z67',19344951,'10/01/2021',2058.00,'',0.00,'2021-01-10','1900-01-01',2000.00,50.00),('1BVJ',19345057,'08/02/2021',758.00,'',0.00,'2021-02-08','1900-01-01',700.00,50.00),('1I3R',19345198,'03/12/2021',2287.00,'',0.00,'2021-12-03','1900-01-01',2200.00,75.00),('1BVJ',19345511,'30/11/2021',3087.00,'',0.00,'2021-11-30','1900-01-01',3000.00,75.00),('1BVJ',19345651,'11/12/2021',2387.00,'',0.00,'2021-12-11','1900-01-01',2300.00,75.00),('1I3R',19345941,'01/11/2021',1387.00,'',0.00,'2021-11-01','1900-01-01',1300.00,75.00),('0Z67',19345982,'08/02/2021',4058.00,'',0.00,'2021-02-08','1900-01-01',4000.00,50.00),('0842',19350859,'23/06/2021',2587.00,'',0.00,'2021-06-23','1900-01-01',2500.00,75.00),('0SPM',19353424,'30/01/2021',2258.00,'',0.00,'2021-01-30','1900-01-01',2200.00,50.00),('0YLR',19354844,'28/02/2021',2258.00,'',0.00,'2021-02-28','1900-01-01',2200.00,50.00),('0YLR',19354984,'19/01/2021',1558.00,'10/03/2021',1551.36,'2021-01-19','2021-03-10',1500.00,50.00),('0YLR',19355098,'11/02/2021',1558.00,'',0.00,'2021-02-11','1900-01-01',1500.00,50.00),('0YLR',19355668,'16/02/2021',2458.00,'07/04/2021',2407.00,'2021-02-16','2021-04-07',2400.00,50.00),('0YLR',19355858,'11/02/2021',1558.00,'',0.00,'2021-02-11','1900-01-01',1500.00,50.00),('0YLR',19356534,'30/01/2021',4058.00,'',0.00,'2021-01-30','1900-01-01',4000.00,50.00),('0YLR',19356757,'06/02/2021',1508.00,'',0.00,'2021-02-06','1900-01-01',1450.00,50.00),('6516',19357334,'03/11/2021',587.00,'',0.00,'2021-11-03','1900-01-01',500.00,75.00),('1G9D',19366582,'04/12/2021',1087.00,'',0.00,'2021-12-04','1900-01-01',1000.00,75.00),('0108',19369313,'21/12/2021',2087.00,'',0.00,'2021-12-21','1900-01-01',2000.00,75.00),('0108',19369313,'01/12/2021',4087.00,'',0.00,'2021-12-01','1900-01-01',4000.00,75.00),('0YYT',19378728,'12/12/2021',687.00,'',0.00,'2021-12-12','1900-01-01',600.00,75.00),('0YYT',19378835,'31/07/2021',1087.00,'',0.00,'2021-07-31','1900-01-01',1000.00,75.00),('0YYT',19378868,'17/10/2021',1987.00,'',0.00,'2021-10-17','1900-01-01',1900.00,75.00),('0YYT',19378868,'04/10/2021',1987.00,'',0.00,'2021-10-04','1900-01-01',1900.00,75.00),('0289',19381995,'18/10/2021',987.00,'',0.00,'2021-10-18','1900-01-01',900.00,75.00),('0289',19382092,'17/06/2021',1387.00,'',0.00,'2021-06-17','1900-01-01',1300.00,75.00),('0289',19382100,'04/05/2021',1258.00,'',0.00,'2021-05-04','1900-01-01',1200.00,50.00),('0Y4X',19392497,'19/12/2021',6087.00,'',0.00,'2021-12-19','1900-01-01',6000.00,75.00),('0OFY',19396357,'20/12/2021',1087.00,'',0.00,'2021-12-20','1900-01-01',1000.00,75.00),('0O4U',19397728,'21/05/2021',1058.00,'',0.00,'2021-05-21','1900-01-01',971.00,75.00),('0ULQ',19398841,'15/12/2021',587.00,'',0.00,'2021-12-15','1900-01-01',500.00,75.00),('0VI4',19400555,'17/07/2021',3787.00,'03/09/2021',3787.00,'2021-07-17','2021-09-03',3700.00,75.00),('0WVW',19400977,'12/07/2021',3087.00,'',0.00,'2021-07-12','1900-01-01',3000.00,75.00),('0WVW',19400977,'22/02/2021',1258.00,'',0.00,'2021-02-22','1900-01-01',1200.00,50.00),('0WMU',19402189,'24/07/2021',2687.00,'',0.00,'2021-07-24','1900-01-01',2600.00,75.00),('0YLR',19402437,'17/02/2021',2358.00,'',0.00,'2021-02-17','1900-01-01',2300.00,50.00),('0YLR',19402437,'04/01/2021',2358.00,'',0.00,'2021-01-04','1900-01-01',2300.00,50.00),('0YLR',19402973,'15/02/2021',1558.00,'',0.00,'2021-02-15','1900-01-01',1500.00,50.00),('0YLR',19403682,'06/01/2021',1258.00,'',0.00,'2021-01-06','1900-01-01',1200.00,50.00),('0YLR',19403781,'06/02/2021',1558.00,'',0.00,'2021-02-06','1900-01-01',1500.00,50.00),('0YLR',19404144,'19/02/2021',1458.00,'',0.00,'2021-02-19','1900-01-01',1400.00,50.00),('0YLR',19404227,'16/02/2021',1658.00,'',0.00,'2021-02-16','1900-01-01',1600.00,50.00),('0YLR',19404276,'12/02/2021',1458.00,'',0.00,'2021-02-12','1900-01-01',1400.00,50.00),('0YLR',19404490,'30/01/2021',2258.00,'',0.00,'2021-01-30','1900-01-01',2200.00,50.00),('0YLR',19404490,'04/01/2021',1658.00,'',0.00,'2021-01-04','1900-01-01',1600.00,50.00),('0YLR',19404672,'29/01/2021',1458.00,'',0.00,'2021-01-29','1900-01-01',1400.00,50.00),('11BI',19404789,'13/04/2021',558.00,'',0.00,'2021-04-13','1900-01-01',500.00,50.00),('0YLR',19405034,'15/02/2021',958.00,'',0.00,'2021-02-15','1900-01-01',900.00,50.00),('0YLR',19405059,'02/01/2021',1758.00,'',0.00,'2021-01-02','1900-01-01',1700.00,50.00),('0YLR',19405273,'01/02/2021',2658.00,'',0.00,'2021-02-01','1900-01-01',2600.00,50.00),('0YLR',19405299,'15/01/2021',2558.00,'',0.00,'2021-01-15','1900-01-01',2500.00,50.00),('0YLR',19405521,'14/01/2021',2658.00,'',0.00,'2021-01-14','1900-01-01',2600.00,50.00),('0YLR',19405620,'19/02/2021',1858.00,'',0.00,'2021-02-19','1900-01-01',1800.00,50.00),('0YLR',19405620,'06/01/2021',1858.00,'',0.00,'2021-01-06','1900-01-01',1800.00,50.00),('0YLR',19405695,'30/01/2021',3058.00,'',0.00,'2021-01-30','1900-01-01',3000.00,50.00),('0YLR',19405729,'02/03/2021',1658.00,'',0.00,'2021-03-02','1900-01-01',1600.00,50.00),('0YLR',19405786,'29/01/2021',2758.00,'',0.00,'2021-01-29','1900-01-01',2700.00,50.00),('0YLR',19406032,'30/01/2021',2558.00,'',0.00,'2021-01-30','1900-01-01',2500.00,50.00),('0YLR',19406396,'12/02/2021',558.00,'',0.00,'2021-02-12','1900-01-01',500.00,50.00),('0YLR',19406438,'28/02/2021',2458.00,'',0.00,'2021-02-28','1900-01-01',2400.00,50.00),('0YLR',19406461,'06/02/2021',1558.00,'',0.00,'2021-02-06','1900-01-01',1500.00,50.00),('0663',19409820,'06/08/2021',1087.00,'',0.00,'2021-08-06','1900-01-01',1000.00,75.00),('0ZAP',19415751,'19/03/2021',3658.00,'',0.00,'2021-03-19','1900-01-01',3600.00,50.00),('0Z52',19418060,'27/12/2021',1087.00,'',0.00,'2021-12-27','1900-01-01',1000.00,75.00),('1B9D',19423425,'28/02/2021',1958.00,'',0.00,'2021-02-28','1900-01-01',1900.00,50.00),('0Z7S',19428671,'05/03/2021',1658.00,'',0.00,'2021-03-05','1900-01-01',1600.00,50.00),('0XE2',19435171,'24/03/2021',1258.00,'',0.00,'2021-03-24','1900-01-01',1200.00,50.00),('0SX0',19436096,'01/07/2021',1287.00,'',0.00,'2021-07-01','1900-01-01',1200.00,75.00),('0108',19436187,'29/01/2021',2558.00,'',0.00,'2021-01-29','1900-01-01',2500.00,50.00),('07R0',19436989,'15/02/2021',758.00,'',0.00,'2021-02-15','1900-01-01',700.00,50.00),('0Z3S',19442888,'20/12/2021',2687.00,'',0.00,'2021-12-20','1900-01-01',2600.00,75.00),('0Z3S',19442888,'02/12/2021',2587.00,'',0.00,'2021-12-02','1900-01-01',2500.00,75.00),('0UGU',19445972,'18/12/2021',787.00,'27/01/2022',773.18,'2021-12-18','2022-01-27',700.00,75.00),('0Y8F',19447457,'01/02/2021',1158.00,'',0.00,'2021-02-01','1900-01-01',1100.00,50.00),('0P4F',19448232,'03/02/2021',958.00,'',0.00,'2021-02-03','1900-01-01',900.00,50.00),('0ZC7',19455377,'05/06/2021',587.00,'',0.00,'2021-06-05','1900-01-01',500.00,75.00),('8140',19455799,'15/08/2021',587.00,'',0.00,'2021-08-15','1900-01-01',500.00,75.00),('8140',19455849,'25/01/2021',3058.00,'',0.00,'2021-01-25','1900-01-01',3000.00,50.00),('9377',19468297,'16/01/2021',1758.00,'',0.00,'2021-01-16','1900-01-01',1700.00,50.00),('1879',19471929,'15/12/2021',987.00,'',0.00,'2021-12-15','1900-01-01',900.00,75.00),('18AD',19472869,'11/05/2021',858.00,'',0.00,'2021-05-11','1900-01-01',800.00,50.00),('7174',19473727,'07/10/2021',1187.00,'',0.00,'2021-10-07','1900-01-01',1100.00,75.00),('0OGB',19486398,'07/05/2021',2358.00,'',0.00,'2021-05-07','1900-01-01',2300.00,50.00),('0ZCG',19486711,'24/05/2021',1087.00,'',0.00,'2021-05-24','1900-01-01',1000.00,75.00),('6516',19488360,'06/11/2021',587.00,'',0.00,'2021-11-06','1900-01-01',500.00,75.00),('0YJV',19496017,'14/01/2021',1058.00,'',0.00,'2021-01-14','1900-01-01',1000.00,50.00),('109S',19499946,'14/12/2021',2487.00,'',0.00,'2021-12-14','1900-01-01',2400.00,75.00),('0Z70',19499946,'19/01/2021',1858.00,'',0.00,'2021-01-19','1900-01-01',1800.00,50.00),('109S',19500073,'06/12/2021',587.00,'',0.00,'2021-12-06','1900-01-01',500.00,75.00),('109S',19500453,'27/12/2021',2087.00,'',0.00,'2021-12-27','1900-01-01',2000.00,75.00),('0Z70',19500701,'01/01/2021',758.00,'',0.00,'2021-01-01','1900-01-01',700.00,50.00),('0Z70',19500743,'15/01/2021',558.00,'',0.00,'2021-01-15','1900-01-01',500.00,50.00),('0Z70',19500784,'12/03/2021',658.00,'',0.00,'2021-03-12','1900-01-01',600.00,50.00),('109S',19500792,'25/12/2021',1387.00,'',0.00,'2021-12-25','1900-01-01',1300.00,75.00),('0Z70',19500842,'28/01/2021',858.00,'',0.00,'2021-01-28','1900-01-01',800.00,50.00),('0Z70',19501279,'10/01/2021',2058.00,'',0.00,'2021-01-10','1900-01-01',2000.00,50.00),('109S',19501378,'27/11/2021',587.00,'',0.00,'2021-11-27','1900-01-01',500.00,75.00),('109S',19501477,'02/09/2021',787.00,'',0.00,'2021-09-02','1900-01-01',700.00,75.00),('109S',19501501,'18/03/2021',1458.00,'',0.00,'2021-03-18','1900-01-01',1400.00,50.00),('109S',19501501,'05/02/2021',1458.00,'',0.00,'2021-02-05','1900-01-01',1400.00,50.00),('109S',19502038,'04/02/2021',1858.00,'',0.00,'2021-02-04','1900-01-01',1800.00,50.00),('109S',19502087,'03/12/2021',687.00,'',0.00,'2021-12-03','1900-01-01',600.00,75.00),('109S',19502251,'03/02/2021',558.00,'',0.00,'2021-02-03','1900-01-01',500.00,50.00),('0Z70',19502277,'15/01/2021',1058.00,'',0.00,'2021-01-15','1900-01-01',1000.00,50.00),('0Z70',19502608,'09/04/2021',558.00,'',0.00,'2021-04-09','1900-01-01',500.00,50.00),('18RP',19503051,'12/01/2021',558.00,'',0.00,'2021-01-12','1900-01-01',500.00,50.00),('109S',19503200,'17/12/2021',787.00,'',0.00,'2021-12-17','1900-01-01',700.00,75.00),('0Z70',19503309,'26/03/2021',1358.00,'',0.00,'2021-03-26','1900-01-01',1300.00,50.00),('0Z70',19503390,'01/01/2021',1158.00,'',0.00,'2021-01-01','1900-01-01',1100.00,50.00),('0Z70',19503549,'19/06/2021',787.00,'',0.00,'2021-06-19','1900-01-01',700.00,75.00),('109S',19503747,'29/12/2021',1387.00,'',0.00,'2021-12-29','1900-01-01',1300.00,75.00),('0Z70',19504034,'13/02/2021',658.00,'',0.00,'2021-02-13','1900-01-01',600.00,50.00),('109S',19504323,'29/11/2021',1387.00,'',0.00,'2021-11-29','1900-01-01',1300.00,75.00),('0Z70',19504323,'09/02/2021',758.00,'',0.00,'2021-02-09','1900-01-01',700.00,50.00),('0Z70',19504422,'05/01/2021',1358.00,'',0.00,'2021-01-05','1900-01-01',1300.00,50.00),('0Z70',19504604,'21/02/2021',958.00,'',0.00,'2021-02-21','1900-01-01',900.00,50.00),('109S',19504786,'14/12/2021',587.00,'',0.00,'2021-12-14','1900-01-01',500.00,75.00),('0Z70',19505262,'11/01/2021',608.00,'',0.00,'2021-01-11','1900-01-01',550.00,50.00),('0Z70',19505262,'02/01/2021',858.00,'',0.00,'2021-01-02','1900-01-01',800.00,50.00),('0Z70',19506146,'28/01/2021',958.00,'',0.00,'2021-01-28','1900-01-01',900.00,50.00),('0Z70',19506153,'07/01/2021',1258.00,'',0.00,'2021-01-07','1900-01-01',1200.00,50.00),('0Z70',19506369,'14/01/2021',1358.00,'',0.00,'2021-01-14','1900-01-01',1300.00,50.00),('0Z70',19507318,'07/01/2021',1458.00,'',0.00,'2021-01-07','1900-01-01',1400.00,50.00),('0Z70',19508670,'20/03/2021',1458.00,'',0.00,'2021-03-20','1900-01-01',1400.00,50.00),('0Z70',19508688,'01/01/2021',1158.00,'',0.00,'2021-01-01','1900-01-01',1100.00,50.00),('0Z70',19508894,'16/06/2021',587.00,'',0.00,'2021-06-16','1900-01-01',500.00,75.00),('0XXC',19511526,'23/03/2021',558.00,'',0.00,'2021-03-23','1900-01-01',500.00,50.00),('1CCL',19514041,'08/02/2021',558.00,'',0.00,'2021-02-08','1900-01-01',500.00,50.00),('0U1J',19517440,'21/11/2021',1087.00,'',0.00,'2021-11-21','1900-01-01',1000.00,75.00),('1I3R',19517853,'18/09/2021',2587.00,'',0.00,'2021-09-18','1900-01-01',2500.00,75.00),('1I3R',19517945,'14/11/2021',1187.00,'',0.00,'2021-11-14','1900-01-01',1100.00,75.00),('0Z67',19517945,'12/01/2021',558.00,'',0.00,'2021-01-12','1900-01-01',500.00,50.00),('1I3R',19518026,'05/10/2021',2687.00,'',0.00,'2021-10-05','1900-01-01',2600.00,75.00),('0WNN',19518059,'26/06/2021',2387.00,'',0.00,'2021-06-26','1900-01-01',2300.00,75.00),('1I3R',19518372,'01/12/2021',3287.00,'',0.00,'2021-12-01','1900-01-01',3200.00,75.00),('1I3R',19518372,'02/11/2021',3387.00,'',0.00,'2021-11-02','1900-01-01',3300.00,75.00),('1I3R',19518661,'18/10/2021',587.00,'',0.00,'2021-10-18','1900-01-01',500.00,75.00),('0Z67',19518950,'15/01/2021',2158.00,'',0.00,'2021-01-15','1900-01-01',2100.00,50.00),('0WNN',19519156,'19/11/2021',1887.00,'',0.00,'2021-11-19','1900-01-01',1800.00,75.00),('0WNN',19519180,'01/11/2021',3187.00,'',0.00,'2021-11-01','1900-01-01',3100.00,75.00),('1BVJ',19519503,'03/12/2021',1487.00,'',0.00,'2021-12-03','1900-01-01',1400.00,75.00),('1BVJ',19519503,'27/03/2021',1058.00,'',0.00,'2021-03-27','1900-01-01',1000.00,50.00),('0Z67',19519693,'16/01/2021',1458.00,'',0.00,'2021-01-16','1900-01-01',1400.00,50.00),('1I3R',19520337,'02/11/2021',2087.00,'',0.00,'2021-11-02','1900-01-01',2000.00,75.00),('0108',19520717,'01/12/2021',6087.00,'',0.00,'2021-12-01','1900-01-01',6000.00,75.00),('110Q',19521269,'27/04/2021',658.00,'',0.00,'2021-04-27','1900-01-01',600.00,50.00),('0WVW',19521830,'06/07/2021',3687.00,'',0.00,'2021-07-06','1900-01-01',3600.00,75.00),('0WVW',19521830,'01/03/2021',1558.00,'',0.00,'2021-03-01','1900-01-01',1500.00,50.00),('0V0F',19522366,'17/12/2021',1487.00,'',0.00,'2021-12-17','1900-01-01',1400.00,75.00),('0V0F',19522366,'03/03/2021',1058.00,'',0.00,'2021-03-03','1900-01-01',1000.00,50.00),('0ZEP',19522960,'02/01/2021',858.00,'',0.00,'2021-01-02','1900-01-01',800.00,50.00),('0ZEP',19523018,'11/01/2021',658.00,'',0.00,'2021-01-11','1900-01-01',600.00,50.00),('0289',19524628,'04/07/2021',2087.00,'',0.00,'2021-07-04','1900-01-01',2000.00,75.00),('1AZI',19525690,'07/01/2021',2558.00,'',0.00,'2021-01-07','1900-01-01',2500.00,50.00),('1FRA',19529502,'02/08/2021',1287.00,'',0.00,'2021-08-02','1900-01-01',1200.00,75.00),('1FRA',19529502,'03/07/2021',1087.00,'',0.00,'2021-07-03','1900-01-01',1000.00,75.00),('0TVM',19535061,'31/10/2021',687.00,'',0.00,'2021-10-31','1900-01-01',600.00,75.00),('0TVM',19535061,'18/10/2021',1787.00,'',0.00,'2021-10-18','1900-01-01',1700.00,75.00),('0XWC',19536580,'04/11/2021',587.00,'',0.00,'2021-11-04','1900-01-01',500.00,75.00),('0Z67',19538149,'19/03/2021',2058.00,'',0.00,'2021-03-19','1900-01-01',2000.00,50.00),('0Z67',19538149,'03/02/2021',2058.00,'',0.00,'2021-02-03','1900-01-01',2000.00,50.00),('0QZL',19542133,'04/01/2021',1758.00,'',0.00,'2021-01-04','1900-01-01',1700.00,50.00),('4687',19547918,'15/05/2021',2258.00,'',0.00,'2021-05-15','1900-01-01',2171.00,75.00),('1C23',19548114,'14/01/2021',1458.00,'',0.00,'2021-01-14','1900-01-01',1400.00,50.00),('0Z6I',19549872,'10/01/2021',1458.00,'',0.00,'2021-01-10','1900-01-01',1400.00,50.00),('0Z6I',19549872,'05/01/2021',1458.00,'',0.00,'2021-01-05','1900-01-01',1400.00,50.00),('0221',19550037,'29/01/2021',958.00,'',0.00,'2021-01-29','1900-01-01',900.00,50.00),('0V0F',19552645,'16/06/2021',2087.00,'04/08/2021',2064.38,'2021-06-16','2021-08-04',2000.00,75.00),('0YOW',19554179,'13/12/2021',1587.00,'',0.00,'2021-12-13','1900-01-01',1500.00,75.00),('9449',19557453,'24/12/2021',2587.00,'',0.00,'2021-12-24','1900-01-01',2500.00,75.00),('9449',19557461,'24/04/2021',1058.00,'',0.00,'2021-04-24','1900-01-01',1000.00,50.00),('1DR4',19560408,'20/12/2021',3087.00,'',0.00,'2021-12-20','1900-01-01',3000.00,75.00),('0SDT',19563329,'26/10/2021',1287.00,'',0.00,'2021-10-26','1900-01-01',1200.00,75.00),('1D5M',19564244,'15/10/2021',1087.00,'',0.00,'2021-10-15','1900-01-01',1000.00,75.00),('0XZ7',19565704,'11/09/2021',887.00,'',0.00,'2021-09-11','1900-01-01',800.00,75.00),('2305',19567502,'09/02/2021',1558.00,'',0.00,'2021-02-09','1900-01-01',1500.00,50.00),('0RUZ',19568328,'24/01/2021',1558.00,'',0.00,'2021-01-24','1900-01-01',1500.00,50.00),('8230',19570118,'16/02/2021',1058.00,'',0.00,'2021-02-16','1900-01-01',1000.00,50.00),('0YPC',19571256,'05/09/2021',887.00,'',0.00,'2021-09-05','1900-01-01',800.00,75.00),('13EG',19573625,'27/02/2021',658.00,'',0.00,'2021-02-27','1900-01-01',600.00,50.00),('0T9Y',19574128,'18/12/2021',1287.00,'',0.00,'2021-12-18','1900-01-01',1200.00,75.00),('2741',19579788,'17/09/2021',1087.00,'',0.00,'2021-09-17','1900-01-01',1000.00,75.00),('3706',19582220,'29/12/2021',1487.00,'',0.00,'2021-12-29','1900-01-01',1400.00,75.00),('8858',19584937,'18/12/2021',2587.00,'',0.00,'2021-12-18','1900-01-01',2500.00,75.00),('0ZBP',19587831,'20/07/2021',1087.00,'',0.00,'2021-07-20','1900-01-01',1000.00,75.00),('0YZQ',19588078,'06/04/2021',608.00,'',0.00,'2021-04-06','1900-01-01',550.00,50.00),('6410',19588946,'04/01/2021',558.00,'',0.00,'2021-01-04','1900-01-01',500.00,50.00),('1019',19589183,'16/10/2021',1887.00,'',0.00,'2021-10-16','1900-01-01',1800.00,75.00),('0YLR',19591643,'01/03/2021',3258.00,'',0.00,'2021-03-01','1900-01-01',3200.00,50.00),('0YLR',19591650,'30/01/2021',2358.00,'',0.00,'2021-01-30','1900-01-01',2300.00,50.00),('0YLR',19591676,'17/02/2021',758.00,'',0.00,'2021-02-17','1900-01-01',700.00,50.00),('0YLR',19591676,'30/01/2021',558.00,'',0.00,'2021-01-30','1900-01-01',500.00,50.00),('8140',19593243,'17/12/2021',1487.00,'',0.00,'2021-12-17','1900-01-01',1400.00,75.00),('8140',19593243,'02/12/2021',1487.00,'',0.00,'2021-12-02','1900-01-01',1400.00,75.00),('8140',19593292,'17/11/2021',1187.00,'',0.00,'2021-11-17','1900-01-01',1100.00,75.00),('9377',19597095,'08/02/2021',2458.00,'',0.00,'2021-02-08','1900-01-01',2400.00,50.00),('9377',19597129,'19/07/2021',2087.00,'',0.00,'2021-07-19','1900-01-01',2000.00,75.00),('9377',19598085,'15/12/2021',1087.00,'',0.00,'2021-12-15','1900-01-01',1000.00,75.00),('14OH',19602218,'21/09/2021',1587.00,'',0.00,'2021-09-21','1900-01-01',1500.00,75.00),('2305',19605534,'19/01/2021',558.00,'',0.00,'2021-01-19','1900-01-01',500.00,50.00),('0RAW',19611441,'29/10/2021',2387.00,'',0.00,'2021-10-29','1900-01-01',2300.00,75.00),('0XG5',19611565,'21/12/2021',3587.00,'',0.00,'2021-12-21','1900-01-01',3500.00,75.00),('0Z9C',19612092,'26/01/2021',758.00,'',0.00,'2021-01-26','1900-01-01',700.00,50.00),('0YAT',19612118,'10/05/2021',858.00,'',0.00,'2021-05-10','1900-01-01',800.00,50.00),('0SEX',19613777,'13/03/2021',1358.00,'',0.00,'2021-03-13','1900-01-01',1300.00,50.00),('0Z8U',19615343,'18/10/2021',887.00,'',0.00,'2021-10-18','1900-01-01',800.00,75.00),('1902',19620665,'16/08/2021',587.00,'',0.00,'2021-08-16','1900-01-01',500.00,75.00),('0VTW',19622091,'23/12/2021',1887.00,'',0.00,'2021-12-23','1900-01-01',1800.00,75.00),('1EUY',19622505,'28/03/2021',1058.00,'',0.00,'2021-03-28','1900-01-01',1000.00,50.00),('0PL6',19639913,'17/09/2021',1087.00,'',0.00,'2021-09-17','1900-01-01',1000.00,75.00),('0289',19645522,'26/02/2021',1458.00,'',0.00,'2021-02-26','1900-01-01',1400.00,50.00),('0289',19645589,'14/10/2021',887.00,'',0.00,'2021-10-14','1900-01-01',800.00,75.00),('0W58',19653302,'25/06/2021',687.00,'',0.00,'2021-06-25','1900-01-01',600.00,75.00),('109S',19661834,'25/12/2021',1487.00,'',0.00,'2021-12-25','1900-01-01',1400.00,75.00),('13RQ',19667716,'23/04/2021',2958.00,'',0.00,'2021-04-23','1900-01-01',2900.00,50.00),('0YAT',19668508,'09/10/2021',787.00,'',0.00,'2021-10-09','1900-01-01',700.00,75.00),('5383',19670587,'12/08/2021',787.00,'',0.00,'2021-08-12','1900-01-01',700.00,75.00),('4687',19675123,'17/12/2021',1287.00,'',0.00,'2021-12-17','1900-01-01',1200.00,75.00),('4687',19675123,'15/01/2021',1758.00,'',0.00,'2021-01-15','1900-01-01',1700.00,50.00),('4687',19675131,'19/01/2021',1758.00,'',0.00,'2021-01-19','1900-01-01',1700.00,50.00),('8282',19676659,'08/01/2021',1658.00,'',0.00,'2021-01-08','1900-01-01',1600.00,50.00),('0XUW',19679463,'02/11/2021',887.00,'',0.00,'2021-11-02','1900-01-01',800.00,75.00),('0VNR',19682384,'27/03/2021',858.00,'',0.00,'2021-03-27','1900-01-01',800.00,50.00),('0WMP',19684745,'31/08/2021',987.00,'',0.00,'2021-08-31','1900-01-01',900.00,75.00),('2305',19685585,'21/11/2021',6587.00,'',0.00,'2021-11-21','1900-01-01',6500.00,75.00),('2305',19685585,'05/04/2021',4058.00,'',0.00,'2021-04-05','1900-01-01',4000.00,50.00),('3468',19686328,'23/12/2021',2487.00,'',0.00,'2021-12-23','1900-01-01',2400.00,75.00),('3468',19686328,'05/03/2021',2058.00,'',0.00,'2021-03-05','1900-01-01',2000.00,50.00),('0UGI',19687466,'06/09/2021',1587.00,'',0.00,'2021-09-06','1900-01-01',1500.00,75.00),('15MG',19687987,'30/01/2021',558.00,'',0.00,'2021-01-30','1900-01-01',500.00,50.00),('15MG',19687987,'17/01/2021',1658.00,'',0.00,'2021-01-17','1900-01-01',1600.00,50.00),('2741',19688399,'30/10/2021',1387.00,'',0.00,'2021-10-30','1900-01-01',1300.00,75.00),('2741',19688399,'10/10/2021',1187.00,'',0.00,'2021-10-10','1900-01-01',1100.00,75.00),('0XXA',19692029,'04/12/2021',837.00,'',0.00,'2021-12-04','1900-01-01',750.00,75.00),('0OTQ',19694488,'01/12/2021',1087.00,'',0.00,'2021-12-01','1900-01-01',1000.00,75.00),('109S',19702125,'19/10/2021',587.00,'',0.00,'2021-10-19','1900-01-01',500.00,75.00),('0Z70',19702125,'14/01/2021',558.00,'',0.00,'2021-01-14','1900-01-01',500.00,50.00),('5979',19702745,'22/01/2021',558.00,'',0.00,'2021-01-22','1900-01-01',500.00,50.00),('0Z8U',19704659,'15/11/2021',2287.00,'',0.00,'2021-11-15','1900-01-01',2200.00,75.00),('0Z8U',19704667,'16/11/2021',1987.00,'',0.00,'2021-11-16','1900-01-01',1900.00,75.00),('0QRX',19706878,'15/08/2021',587.00,'',0.00,'2021-08-15','1900-01-01',500.00,75.00),('0T9G',19708890,'27/02/2021',558.00,'',0.00,'2021-02-27','1900-01-01',500.00,50.00),('9377',19709112,'03/05/2021',858.00,'',0.00,'2021-05-03','1900-01-01',800.00,50.00),('9377',19709591,'15/12/2021',1587.00,'',0.00,'2021-12-15','1900-01-01',1500.00,75.00),('0PBV',19714690,'04/09/2021',1287.00,'',0.00,'2021-09-04','1900-01-01',1200.00,75.00),('122S',19715978,'28/08/2021',587.00,'',0.00,'2021-08-28','1900-01-01',500.00,75.00),('3005',19722529,'05/06/2021',1087.00,'',0.00,'2021-06-05','1900-01-01',1000.00,75.00),('0XXA',19723212,'28/07/2021',1087.00,'',0.00,'2021-07-28','1900-01-01',1000.00,75.00),('0ZDS',19729490,'19/11/2021',787.00,'',0.00,'2021-11-19','1900-01-01',700.00,75.00),('0YOV',19732932,'05/11/2021',587.00,'',0.00,'2021-11-05','1900-01-01',500.00,75.00),('0YOV',19732932,'05/11/2021',587.00,'',0.00,'2021-11-05','1900-01-01',500.00,75.00),('0UJK',19734920,'23/09/2021',787.00,'',0.00,'2021-09-23','1900-01-01',700.00,75.00),('0REL',19735216,'14/01/2021',958.00,'',0.00,'2021-01-14','1900-01-01',900.00,50.00),('8140',19736776,'16/01/2021',1258.00,'',0.00,'2021-01-16','1900-01-01',1200.00,50.00),('8140',19736776,'02/01/2021',1258.00,'',0.00,'2021-01-02','1900-01-01',1200.00,50.00),('0NO4',19741586,'13/02/2021',558.00,'',0.00,'2021-02-13','1900-01-01',500.00,50.00),('18G6',19743780,'07/12/2021',1587.00,'',0.00,'2021-12-07','1900-01-01',1500.00,75.00),('3597',19743863,'08/01/2021',1558.00,'',0.00,'2021-01-08','1900-01-01',1500.00,50.00),('0289',19747047,'16/04/2021',1558.00,'',0.00,'2021-04-16','1900-01-01',1500.00,50.00),('0289',19747088,'11/10/2021',1087.00,'',0.00,'2021-10-11','1900-01-01',1000.00,75.00),('0ZK1',19748862,'22/04/2021',858.00,'',0.00,'2021-04-22','1900-01-01',800.00,50.00),('0SD7',19750942,'27/12/2021',1387.00,'',0.00,'2021-12-27','1900-01-01',1300.00,75.00),('0TEO',19751072,'02/08/2021',1787.00,'',0.00,'2021-08-02','1900-01-01',1700.00,75.00),('1CCL',19753896,'19/09/2021',687.00,'',0.00,'2021-09-19','1900-01-01',600.00,75.00),('7402',19762657,'08/01/2021',1458.00,'',0.00,'2021-01-08','1900-01-01',1400.00,50.00),('0V0F',19764281,'16/01/2021',958.00,'',0.00,'2021-01-16','1900-01-01',900.00,50.00),('2011',19767110,'19/07/2021',1587.00,'',0.00,'2021-07-19','1900-01-01',1500.00,75.00),('0QBB',19768951,'01/05/2021',2258.00,'',0.00,'2021-05-01','1900-01-01',2200.00,50.00),('8734',19770007,'15/01/2021',858.00,'',0.00,'2021-01-15','1900-01-01',800.00,50.00),('0P6N',19772367,'07/11/2021',687.00,'',0.00,'2021-11-07','1900-01-01',600.00,75.00),('0NO4',19773183,'04/05/2021',658.00,'',0.00,'2021-05-04','1900-01-01',600.00,50.00),('13KL',19775105,'04/05/2021',1058.00,'',0.00,'2021-05-04','1900-01-01',1000.00,50.00),('18P2',19775477,'06/08/2021',1087.00,'',0.00,'2021-08-06','1900-01-01',1000.00,75.00),('18ZY',19781202,'17/10/2021',687.00,'',0.00,'2021-10-17','1900-01-01',600.00,75.00),('18ZY',19781202,'09/10/2021',687.00,'',0.00,'2021-10-09','1900-01-01',600.00,75.00),('7861',19786904,'04/07/2021',2487.00,'',0.00,'2021-07-04','1900-01-01',2400.00,75.00),('0ZQ1',19789262,'17/07/2021',587.00,'',0.00,'2021-07-17','1900-01-01',500.00,75.00),('0ZQ1',19789270,'16/08/2021',1287.00,'',0.00,'2021-08-16','1900-01-01',1200.00,75.00),('0YBM',19791193,'24/01/2021',858.00,'',0.00,'2021-01-24','1900-01-01',800.00,50.00),('1GYK',19798875,'17/12/2021',887.00,'',0.00,'2021-12-17','1900-01-01',800.00,75.00),('0O5J',19801059,'06/07/2021',1287.00,'',0.00,'2021-07-06','1900-01-01',1200.00,75.00),('0O5J',19801059,'05/01/2021',858.00,'',0.00,'2021-01-05','1900-01-01',800.00,50.00),('0Y4X',19801067,'09/10/2021',6087.00,'',0.00,'2021-10-09','1900-01-01',6000.00,75.00),('0ZRS',19803824,'10/12/2021',1387.00,'',0.00,'2021-12-10','1900-01-01',1300.00,75.00),('0ZRS',19803881,'14/07/2021',1187.00,'',0.00,'2021-07-14','1900-01-01',1100.00,75.00),('0ZRS',19804095,'15/06/2021',787.00,'',0.00,'2021-06-15','1900-01-01',700.00,75.00),('0ZRS',19804335,'03/06/2021',987.00,'',0.00,'2021-06-03','1900-01-01',900.00,75.00),('0YLR',19807577,'16/02/2021',1558.00,'',0.00,'2021-02-16','1900-01-01',1500.00,50.00),('0ULQ',19808245,'06/12/2021',1987.00,'',0.00,'2021-12-06','1900-01-01',1900.00,75.00),('0WVW',19808807,'09/06/2021',687.00,'',0.00,'2021-06-09','1900-01-01',600.00,75.00),('0V0F',19809110,'23/11/2021',2187.00,'',0.00,'2021-11-23','1900-01-01',2100.00,75.00),('0V0F',19809110,'03/01/2021',1758.00,'',0.00,'2021-01-03','1900-01-01',1700.00,50.00),('0ZUL',19809391,'09/02/2021',858.00,'',0.00,'2021-02-09','1900-01-01',800.00,50.00),('0ZUL',19809391,'11/01/2021',2158.00,'',0.00,'2021-01-11','1900-01-01',2100.00,50.00),('0RUZ',19813138,'27/06/2021',687.00,'',0.00,'2021-06-27','1900-01-01',600.00,75.00),('0RSF',19817337,'11/11/2021',1087.00,'',0.00,'2021-11-11','1900-01-01',1000.00,75.00),('0RSF',19817337,'23/08/2021',1087.00,'',0.00,'2021-08-23','1900-01-01',1000.00,75.00),('5233',19817386,'15/01/2021',758.00,'',0.00,'2021-01-15','1900-01-01',700.00,50.00),('10E8',19818178,'22/12/2021',687.00,'',0.00,'2021-12-22','1900-01-01',600.00,75.00),('5528',19822519,'04/12/2021',3087.00,'',0.00,'2021-12-04','1900-01-01',3000.00,75.00),('1HZP',19825975,'20/09/2021',1787.00,'',0.00,'2021-09-20','1900-01-01',1700.00,75.00),('1HZP',19825975,'05/08/2021',1787.00,'',0.00,'2021-08-05','1900-01-01',1700.00,75.00),('18A6',19828045,'01/12/2021',687.00,'',0.00,'2021-12-01','1900-01-01',600.00,75.00),('0NO4',19838804,'08/01/2021',658.00,'',0.00,'2021-01-08','1900-01-01',600.00,50.00),('0NWS',19840875,'29/01/2021',2058.00,'',0.00,'2021-01-29','1900-01-01',2000.00,50.00),('0NWS',19840875,'22/01/2021',2058.00,'',0.00,'2021-01-22','1900-01-01',2000.00,50.00),('0YKJ',19841360,'16/06/2021',587.00,'',0.00,'2021-06-16','1900-01-01',500.00,75.00),('0VNR',19842046,'09/01/2021',758.00,'',0.00,'2021-01-09','1900-01-01',700.00,50.00),('3468',19847961,'15/03/2021',958.00,'',0.00,'2021-03-15','1900-01-01',900.00,50.00),('2305',19852599,'11/11/2021',3887.00,'',0.00,'2021-11-11','1900-01-01',3800.00,75.00),('0WYA',19853118,'23/04/2021',1158.00,'',0.00,'2021-04-23','1900-01-01',1100.00,50.00),('0WVW',19857192,'26/06/2021',2187.00,'',0.00,'2021-06-26','1900-01-01',2100.00,75.00),('0WVW',19857192,'16/02/2021',858.00,'',0.00,'2021-02-16','1900-01-01',800.00,50.00),('0ZU4',19859735,'09/10/2021',1587.00,'',0.00,'2021-10-09','1900-01-01',1500.00,75.00),('0ZU4',19859800,'17/09/2021',787.00,'',0.00,'2021-09-17','1900-01-01',700.00,75.00),('0ZUN',19871458,'17/10/2021',587.00,'',0.00,'2021-10-17','1900-01-01',500.00,75.00),('1609',19871680,'09/01/2021',1258.00,'',0.00,'2021-01-09','1900-01-01',1200.00,50.00),('0430',19874213,'13/11/2021',1087.00,'',0.00,'2021-11-13','1900-01-01',1000.00,75.00),('8794',19882455,'10/01/2021',558.00,'',0.00,'2021-01-10','1900-01-01',500.00,50.00),('0PLW',19883446,'28/08/2021',587.00,'',0.00,'2021-08-28','1900-01-01',500.00,75.00),('0X1W',19884519,'04/09/2021',1087.00,'',0.00,'2021-09-04','1900-01-01',1000.00,75.00),('14RC',19884667,'31/01/2021',658.00,'',0.00,'2021-01-31','1900-01-01',600.00,50.00),('1494',19917848,'02/04/2021',858.00,'',0.00,'2021-04-02','1900-01-01',800.00,50.00),('0PR6',19919455,'22/02/2021',2158.00,'',0.00,'2021-02-22','1900-01-01',2100.00,50.00),('0QZX',19924778,'05/02/2021',3258.00,'',0.00,'2021-02-05','1900-01-01',3200.00,50.00),('1C0O',19927813,'06/12/2021',1187.00,'',0.00,'2021-12-06','1900-01-01',1100.00,75.00),('1IMX',19934652,'13/12/2021',587.00,'',0.00,'2021-12-13','1900-01-01',500.00,75.00),('0NWS',19947381,'05/02/2021',558.00,'',0.00,'2021-02-05','1900-01-01',500.00,50.00),('2740',19949379,'27/06/2021',1187.00,'',0.00,'2021-06-27','1900-01-01',1100.00,75.00),('0US9',19951276,'11/12/2021',1087.00,'',0.00,'2021-12-11','1900-01-01',1000.00,75.00),('0US9',19951292,'19/10/2021',1687.00,'08/12/2021',1224.95,'2021-10-19','2021-12-08',1600.00,75.00),('0YZH',19952621,'25/04/2021',1058.00,'',0.00,'2021-04-25','1900-01-01',1000.00,50.00),('0ZLW',19953017,'05/03/2021',858.00,'',0.00,'2021-03-05','1900-01-01',800.00,50.00),('0ZLW',19953199,'17/02/2021',1958.00,'',0.00,'2021-02-17','1900-01-01',1900.00,50.00),('0ZZP',19953744,'20/09/2021',6587.00,'',0.00,'2021-09-20','1900-01-01',6500.00,75.00),('1874',19968262,'07/01/2021',3158.00,'',0.00,'2021-01-07','1900-01-01',3100.00,50.00),('0SSN',19979632,'12/05/2021',1258.00,'',0.00,'2021-05-12','1900-01-01',1200.00,50.00),('9757',19980382,'22/05/2021',1887.00,'',0.00,'2021-05-22','1900-01-01',1800.00,75.00),('4133',19981182,'17/09/2021',3287.00,'',0.00,'2021-09-17','1900-01-01',3200.00,75.00),('6782',19989656,'22/12/2021',2687.00,'',0.00,'2021-12-22','1900-01-01',2600.00,75.00),('1019',19997642,'21/08/2021',2487.00,'',0.00,'2021-08-21','1900-01-01',2400.00,75.00),('0SHW',19999242,'30/01/2021',2358.00,'',0.00,'2021-01-30','1900-01-01',2300.00,50.00),('0ZMT',20000014,'22/10/2021',987.00,'',0.00,'2021-10-22','1900-01-01',900.00,75.00),('0289',20002440,'19/07/2021',1387.00,'',0.00,'2021-07-19','1900-01-01',1300.00,75.00),('0289',20002481,'09/07/2021',1287.00,'',0.00,'2021-07-09','1900-01-01',1200.00,75.00),('7300',20005187,'16/11/2021',587.00,'',0.00,'2021-11-16','1900-01-01',500.00,75.00),('7300',20005187,'02/10/2021',587.00,'',0.00,'2021-10-02','1900-01-01',500.00,75.00),('2163',20007084,'17/01/2021',1058.00,'',0.00,'2021-01-17','1900-01-01',1000.00,50.00),('0R5B',20009726,'19/11/2021',587.00,'',0.00,'2021-11-19','1900-01-01',500.00,75.00),('0YLR',20010898,'26/02/2021',1158.00,'',0.00,'2021-02-26','1900-01-01',1100.00,50.00),('1I3R',20019931,'29/10/2021',3587.00,'',0.00,'2021-10-29','1900-01-01',3500.00,75.00),('0XB9',20027645,'20/12/2021',587.00,'',0.00,'2021-12-20','1900-01-01',500.00,75.00),('1HNY',20029427,'26/12/2021',587.00,'',0.00,'2021-12-26','1900-01-01',500.00,75.00),('134N',20031910,'30/12/2021',1587.00,'',0.00,'2021-12-30','1900-01-01',1500.00,75.00),('134N',20031910,'01/10/2021',1587.00,'',0.00,'2021-10-01','1900-01-01',1500.00,75.00),('0Z70',20033544,'10/07/2021',687.00,'',0.00,'2021-07-10','1900-01-01',600.00,75.00),('0NIA',20034849,'06/01/2021',2058.00,'',0.00,'2021-01-06','1900-01-01',2000.00,50.00),('0U2L',20035309,'15/12/2021',1187.00,'',0.00,'2021-12-15','1900-01-01',1100.00,75.00),('9393',20035929,'02/07/2021',1187.00,'19/08/2021',515.66,'2021-07-02','2021-08-19',1100.00,75.00),('104S',20043766,'17/11/2021',4687.00,'',0.00,'2021-11-17','1900-01-01',4600.00,75.00),('07R0',20051322,'02/01/2021',1158.00,'',0.00,'2021-01-02','1900-01-01',1100.00,50.00),('0VHP',20052767,'18/10/2021',787.00,'',0.00,'2021-10-18','1900-01-01',700.00,75.00),('0VGL',20053419,'14/08/2021',687.00,'',0.00,'2021-08-14','1900-01-01',600.00,75.00),('0ZDS',20059523,'16/01/2021',658.00,'',0.00,'2021-01-16','1900-01-01',600.00,50.00),('17W1',20060141,'02/12/2021',987.00,'',0.00,'2021-12-02','1900-01-01',900.00,75.00),('0ZDS',20060349,'01/01/2021',858.00,'',0.00,'2021-01-01','1900-01-01',800.00,50.00),('0W0C',20062030,'27/09/2021',587.00,'',0.00,'2021-09-27','1900-01-01',500.00,75.00),('8873',20063350,'20/02/2021',1658.00,'',0.00,'2021-02-20','1900-01-01',1600.00,50.00),('0QZL',20063673,'16/12/2021',4387.00,'',0.00,'2021-12-16','1900-01-01',4300.00,75.00),('0T29',20065025,'16/10/2021',1587.00,'',0.00,'2021-10-16','1900-01-01',1500.00,75.00),('0V0F',20065843,'20/09/2021',1587.00,'',0.00,'2021-09-20','1900-01-01',1500.00,75.00),('0V0F',20065900,'05/06/2021',3887.00,'',0.00,'2021-06-05','1900-01-01',3800.00,75.00),('12T7',20069522,'21/06/2021',587.00,'',0.00,'2021-06-21','1900-01-01',500.00,75.00),('0ZQM',20070090,'03/11/2021',787.00,'',0.00,'2021-11-03','1900-01-01',700.00,75.00),('2305',20071858,'06/08/2021',1887.00,'',0.00,'2021-08-06','1900-01-01',1800.00,75.00),('0Z70',20077830,'22/01/2021',1458.00,'',0.00,'2021-01-22','1900-01-01',1400.00,50.00),('0ZRZ',20078382,'03/11/2021',1087.00,'',0.00,'2021-11-03','1900-01-01',1000.00,75.00),('0ZRZ',20078606,'21/11/2021',2087.00,'',0.00,'2021-11-21','1900-01-01',2000.00,75.00),('0ZRZ',20078606,'12/02/2021',1058.00,'',0.00,'2021-02-12','1900-01-01',1000.00,50.00),('0ZRZ',20078630,'28/07/2021',1087.00,'',0.00,'2021-07-28','1900-01-01',1000.00,75.00),('0ZRZ',20078697,'23/02/2021',558.00,'',0.00,'2021-02-23','1900-01-01',500.00,50.00),('0ZRZ',20078887,'03/12/2021',1587.00,'',0.00,'2021-12-03','1900-01-01',1500.00,75.00),('0ZRZ',20079471,'20/07/2021',1087.00,'',0.00,'2021-07-20','1900-01-01',1000.00,75.00),('0ZRZ',20079638,'21/09/2021',1087.00,'',0.00,'2021-09-21','1900-01-01',1000.00,75.00),('0T9G',20084158,'12/02/2021',558.00,'',0.00,'2021-02-12','1900-01-01',500.00,50.00),('1HM9',20084968,'15/11/2021',1587.00,'',0.00,'2021-11-15','1900-01-01',1500.00,75.00),('7861',20087409,'15/01/2021',958.00,'',0.00,'2021-01-15','1900-01-01',900.00,50.00),('0V0F',20091153,'18/01/2021',2258.00,'',0.00,'2021-01-18','1900-01-01',2200.00,50.00),('2305',20092441,'05/01/2021',923.00,'',0.00,'2021-01-05','1900-01-01',865.00,50.00),('2305',20092466,'18/12/2021',3087.00,'',0.00,'2021-12-18','1900-01-01',3000.00,75.00),('9234',20096178,'03/02/2021',558.00,'',0.00,'2021-02-03','1900-01-01',500.00,50.00),('16JQ',20104634,'22/01/2021',1558.00,'',0.00,'2021-01-22','1900-01-01',1500.00,50.00),('0NX1',20105391,'31/12/2021',2787.00,'',0.00,'2021-12-31','1900-01-01',2700.00,75.00),('0ZOG',20108890,'02/02/2021',758.00,'',0.00,'2021-02-02','1900-01-01',700.00,50.00),('3468',20110227,'11/06/2021',2587.00,'',0.00,'2021-06-11','1900-01-01',2500.00,75.00),('9757',20112785,'18/10/2021',587.00,'',0.00,'2021-10-18','1900-01-01',500.00,75.00),('109S',20113312,'30/12/2021',587.00,'',0.00,'2021-12-30','1900-01-01',500.00,75.00),('108V',20118931,'17/08/2021',887.00,'',0.00,'2021-08-17','1900-01-01',800.00,75.00),('2317',20119749,'30/01/2021',1058.00,'',0.00,'2021-01-30','1900-01-01',1000.00,50.00),('3610',20119913,'03/10/2021',1587.00,'',0.00,'2021-10-03','1900-01-01',1500.00,75.00),('1C0O',20120788,'17/01/2021',3358.00,'',0.00,'2021-01-17','1900-01-01',3300.00,50.00),('1C0O',20120788,'13/01/2021',3358.00,'',0.00,'2021-01-13','1900-01-01',3300.00,50.00),('0WYA',20122990,'08/01/2021',1158.00,'',0.00,'2021-01-08','1900-01-01',1100.00,50.00),('0289',20126835,'13/12/2021',2387.00,'',0.00,'2021-12-13','1900-01-01',2300.00,75.00),('0289',20126983,'15/01/2021',1058.00,'',0.00,'2021-01-15','1900-01-01',1000.00,50.00),('0O5J',20127346,'22/02/2021',758.00,'',0.00,'2021-02-22','1900-01-01',700.00,50.00),('0WVW',20131249,'18/01/2021',858.00,'',0.00,'2021-01-18','1900-01-01',800.00,50.00),('106C',20133252,'18/12/2021',687.00,'',0.00,'2021-12-18','1900-01-01',600.00,75.00),('0O4U',20141586,'13/12/2021',887.00,'',0.00,'2021-12-13','1900-01-01',800.00,75.00),('0ZMT',20145892,'10/08/2021',1587.00,'',0.00,'2021-08-10','1900-01-01',1500.00,75.00),('1E2F',20147625,'25/11/2021',1087.00,'',0.00,'2021-11-25','1900-01-01',1000.00,75.00),('1HB6',20152492,'12/12/2021',1087.00,'',0.00,'2021-12-12','1900-01-01',1000.00,75.00),('0ZW1',20152492,'01/01/2021',758.00,'',0.00,'2021-01-01','1900-01-01',700.00,50.00),('0ZVW',20157533,'05/02/2021',2058.00,'',0.00,'2021-02-05','1900-01-01',2000.00,50.00),('0WYT',20168068,'24/01/2021',758.00,'',0.00,'2021-01-24','1900-01-01',700.00,50.00),('9377',20169090,'02/07/2021',3387.00,'19/08/2021',3365.55,'2021-07-02','2021-08-19',3300.00,75.00),('9377',20169454,'20/11/2021',2187.00,'',0.00,'2021-11-20','1900-01-01',2100.00,75.00),('9435',20171229,'14/11/2021',2387.00,'',0.00,'2021-11-14','1900-01-01',2300.00,75.00),('9377',20176582,'30/11/2021',587.00,'',0.00,'2021-11-30','1900-01-01',500.00,75.00),('0WVW',20187134,'10/01/2021',558.00,'',0.00,'2021-01-10','1900-01-01',500.00,50.00),('0WVW',20187167,'23/02/2021',1258.00,'',0.00,'2021-02-23','1900-01-01',1200.00,50.00),('0WVW',20187175,'21/06/2021',787.00,'',0.00,'2021-06-21','1900-01-01',700.00,75.00),('0XYU',20195053,'28/07/2021',587.00,'',0.00,'2021-07-28','1900-01-01',500.00,75.00),('5383',20195749,'28/11/2021',1287.00,'',0.00,'2021-11-28','1900-01-01',1200.00,75.00),('0108',20196598,'07/12/2021',1887.00,'',0.00,'2021-12-07','1900-01-01',1800.00,75.00),('0USD',20198909,'06/11/2021',1487.00,'',0.00,'2021-11-06','1900-01-01',1400.00,75.00),('0ULQ',20201356,'06/09/2021',1087.00,'',0.00,'2021-09-06','1900-01-01',1000.00,75.00),('2305',20201752,'27/02/2021',1658.00,'',0.00,'2021-02-27','1900-01-01',1600.00,50.00),('1DZD',20202867,'02/07/2021',1887.00,'',0.00,'2021-07-02','1900-01-01',1800.00,75.00),('0ZUL',20208658,'07/02/2021',558.00,'',0.00,'2021-02-07','1900-01-01',500.00,50.00),('0YGM',20216842,'02/08/2021',1887.00,'',0.00,'2021-08-02','1900-01-01',1800.00,75.00),('0V0F',20218400,'16/01/2021',1158.00,'',0.00,'2021-01-16','1900-01-01',1100.00,50.00),('10DZ',20219739,'04/02/2021',2058.00,'',0.00,'2021-02-04','1900-01-01',2000.00,50.00),('10DZ',20219770,'05/05/2021',1058.00,'',0.00,'2021-05-05','1900-01-01',1000.00,50.00),('10DZ',20220000,'02/02/2021',1058.00,'',0.00,'2021-02-02','1900-01-01',1000.00,50.00),('10DZ',20220026,'29/03/2021',1058.00,'',0.00,'2021-03-29','1900-01-01',1000.00,50.00),('0NO4',20222303,'20/01/2021',1358.00,'',0.00,'2021-01-20','1900-01-01',1300.00,50.00),('0WOM',20222352,'23/12/2021',887.00,'',0.00,'2021-12-23','1900-01-01',800.00,75.00),('4774',20223590,'16/02/2021',1858.00,'',0.00,'2021-02-16','1900-01-01',1800.00,50.00),('5242',20223814,'23/12/2021',1087.00,'',0.00,'2021-12-23','1900-01-01',1000.00,75.00),('5242',20223814,'17/12/2021',1087.00,'',0.00,'2021-12-17','1900-01-01',1000.00,75.00),('9757',20227641,'17/09/2021',787.00,'',0.00,'2021-09-17','1900-01-01',700.00,75.00),('10AW',20229175,'03/08/2021',3687.00,'',0.00,'2021-08-03','1900-01-01',3600.00,75.00),('2257',20229449,'07/03/2021',758.00,'',0.00,'2021-03-07','1900-01-01',700.00,50.00),('109S',20229605,'05/11/2021',887.00,'',0.00,'2021-11-05','1900-01-01',800.00,75.00),('0289',20239018,'26/11/2021',1087.00,'',0.00,'2021-11-26','1900-01-01',1000.00,75.00),('138Q',20243382,'17/08/2021',1287.00,'',0.00,'2021-08-17','1900-01-01',1200.00,75.00),('12SQ',20247474,'25/01/2021',2558.00,'',0.00,'2021-01-25','1900-01-01',2500.00,50.00),('10DK',20247763,'21/08/2021',687.00,'',0.00,'2021-08-21','1900-01-01',600.00,75.00),('0TIE',20252300,'20/12/2021',4087.00,'',0.00,'2021-12-20','1900-01-01',4000.00,75.00),('0TIE',20252300,'06/12/2021',4087.00,'',0.00,'2021-12-06','1900-01-01',4000.00,75.00),('0WVW',20253753,'16/02/2021',1258.00,'',0.00,'2021-02-16','1900-01-01',1200.00,50.00),('1D5M',20254074,'19/10/2021',2387.00,'',0.00,'2021-10-19','1900-01-01',2300.00,75.00),('2034',20260840,'28/09/2021',987.00,'',0.00,'2021-09-28','1900-01-01',900.00,75.00),('0SWI',20264651,'02/10/2021',1687.00,'',0.00,'2021-10-02','1900-01-01',1600.00,75.00),('17A6',20267050,'01/01/2021',658.00,'',0.00,'2021-01-01','1900-01-01',600.00,50.00),('0Y5K',20271284,'15/02/2021',1558.00,'',0.00,'2021-02-15','1900-01-01',1500.00,50.00),('0SEG',20271961,'06/12/2021',587.00,'',0.00,'2021-12-06','1900-01-01',500.00,75.00),('0SEG',20271961,'28/11/2021',587.00,'',0.00,'2021-11-28','1900-01-01',500.00,75.00),('0U6U',20274130,'12/12/2021',1087.00,'',0.00,'2021-12-12','1900-01-01',1000.00,75.00),('10D2',20276507,'18/10/2021',1087.00,'',0.00,'2021-10-18','1900-01-01',1000.00,75.00),('10D5',20276622,'03/07/2021',1087.00,'',0.00,'2021-07-03','1900-01-01',1000.00,75.00),('10D6',20276770,'26/10/2021',587.00,'',0.00,'2021-10-26','1900-01-01',500.00,75.00),('12YQ',20276796,'30/10/2021',6087.00,'',0.00,'2021-10-30','1900-01-01',6000.00,75.00),('10FU',20277372,'11/01/2021',1658.00,'',0.00,'2021-01-11','1900-01-01',1600.00,50.00),('0108',20280053,'14/10/2021',587.00,'',0.00,'2021-10-14','1900-01-01',500.00,75.00),('0254',20284071,'05/12/2021',2687.00,'',0.00,'2021-12-05','1900-01-01',2600.00,75.00),('10FS',20287470,'30/01/2021',658.00,'',0.00,'2021-01-30','1900-01-01',600.00,50.00),('10FS',20287470,'02/01/2021',558.00,'',0.00,'2021-01-02','1900-01-01',500.00,50.00),('1I6P',20287546,'10/12/2021',687.00,'',0.00,'2021-12-10','1900-01-01',600.00,75.00),('10FS',20287611,'05/01/2021',558.00,'',0.00,'2021-01-05','1900-01-01',500.00,50.00),('10FS',20287637,'12/02/2021',1458.00,'',0.00,'2021-02-12','1900-01-01',1400.00,50.00),('1EUY',20288577,'29/09/2021',1587.00,'',0.00,'2021-09-29','1900-01-01',1500.00,75.00),('0PY5',20290649,'01/12/2021',1287.00,'',0.00,'2021-12-01','1900-01-01',1200.00,75.00),('1I6P',20299574,'27/12/2021',1087.00,'',0.00,'2021-12-27','1900-01-01',1000.00,75.00),('1I6P',20299582,'20/12/2021',587.00,'',0.00,'2021-12-20','1900-01-01',500.00,75.00),('1I6P',20299582,'31/08/2021',587.00,'',0.00,'2021-08-31','1900-01-01',500.00,75.00),('1I6P',20299616,'31/12/2021',687.00,'',0.00,'2021-12-31','1900-01-01',600.00,75.00),('10FS',20299657,'15/01/2021',558.00,'',0.00,'2021-01-15','1900-01-01',500.00,50.00),('10II',20310033,'18/12/2021',1387.00,'',0.00,'2021-12-18','1900-01-01',1300.00,75.00),('9377',20316071,'29/09/2021',5287.00,'',0.00,'2021-09-29','1900-01-01',5200.00,75.00),('9377',20316071,'14/09/2021',4887.00,'',0.00,'2021-09-14','1900-01-01',4800.00,75.00),('1717',20316147,'18/03/2021',658.00,'',0.00,'2021-03-18','1900-01-01',600.00,50.00),('2055',20317244,'06/12/2021',1687.00,'',0.00,'2021-12-06','1900-01-01',1600.00,75.00),('0YAT',20318051,'15/01/2021',1058.00,'',0.00,'2021-01-15','1900-01-01',1000.00,50.00),('0ULQ',20318408,'01/02/2021',1058.00,'',0.00,'2021-02-01','1900-01-01',1000.00,50.00),('0452',20321717,'20/09/2021',2787.00,'08/11/2021',894.36,'2021-09-20','2021-11-08',2700.00,75.00),('0452',20321717,'05/01/2021',2758.00,'',0.00,'2021-01-05','1900-01-01',2700.00,50.00),('10IG',20323747,'03/09/2021',887.00,'',0.00,'2021-09-03','1900-01-01',800.00,75.00),('10IG',20323895,'31/08/2021',587.00,'',0.00,'2021-08-31','1900-01-01',500.00,75.00),('0108',20326146,'13/03/2021',2458.00,'',0.00,'2021-03-13','1900-01-01',2400.00,50.00),('0TSV',20327292,'09/10/2021',587.00,'',0.00,'2021-10-09','1900-01-01',500.00,75.00),('0NO4',20329322,'14/05/2021',1058.00,'',0.00,'2021-05-14','1900-01-01',1000.00,50.00),('9757',20330957,'04/06/2021',1087.00,'',0.00,'2021-06-04','1900-01-01',1000.00,75.00),('0OBN',20343216,'18/12/2021',3287.00,'',0.00,'2021-12-18','1900-01-01',3200.00,75.00),('0OBN',20343216,'10/06/2021',3587.00,'',0.00,'2021-06-10','1900-01-01',3500.00,75.00),('0XB5',20345930,'07/01/2021',1458.00,'',0.00,'2021-01-07','1900-01-01',1400.00,50.00),('1H86',20346136,'07/12/2021',1587.00,'',0.00,'2021-12-07','1900-01-01',1500.00,75.00),('10CH',20346292,'10/09/2021',887.00,'',0.00,'2021-09-10','1900-01-01',800.00,75.00),('0QKU',20347829,'30/04/2021',558.00,'',0.00,'2021-04-30','1900-01-01',500.00,50.00),('2257',20350963,'22/08/2021',1087.00,'',0.00,'2021-08-22','1900-01-01',1000.00,75.00),('0108',20350997,'01/12/2021',4087.00,'',0.00,'2021-12-01','1900-01-01',4000.00,75.00),('1023',20352357,'01/03/2021',758.00,'',0.00,'2021-03-01','1900-01-01',700.00,50.00),('10A7',20356382,'03/02/2021',1858.00,'',0.00,'2021-02-03','1900-01-01',1800.00,50.00),('10BV',20357505,'17/04/2021',558.00,'',0.00,'2021-04-17','1900-01-01',500.00,50.00),('0RSF',20360186,'14/11/2021',1087.00,'',0.00,'2021-11-14','1900-01-01',1000.00,75.00),('0SX0',20360392,'16/03/2021',1058.00,'',0.00,'2021-03-16','1900-01-01',1000.00,50.00),('0SX0',20360392,'01/03/2021',558.00,'',0.00,'2021-03-01','1900-01-01',500.00,50.00),('0T9G',20362992,'12/02/2021',558.00,'',0.00,'2021-02-12','1900-01-01',500.00,50.00),('0YZ4',20364188,'27/01/2021',1558.00,'',0.00,'2021-01-27','1900-01-01',1500.00,50.00),('0YZ4',20364279,'08/10/2021',2687.00,'',0.00,'2021-10-08','1900-01-01',2600.00,75.00),('0108',20366241,'01/12/2021',1687.00,'',0.00,'2021-12-01','1900-01-01',1600.00,75.00),('0108',20366241,'04/03/2021',2658.00,'',0.00,'2021-03-04','1900-01-01',2600.00,50.00),('7085',20372405,'21/03/2021',558.00,'',0.00,'2021-03-21','1900-01-01',500.00,50.00),('0ZUI',20378519,'26/12/2021',1087.00,'',0.00,'2021-12-26','1900-01-01',1000.00,75.00),('10LJ',20382586,'09/07/2021',1387.00,'',0.00,'2021-07-09','1900-01-01',1300.00,75.00),('0T58',20386140,'05/10/2021',587.00,'',0.00,'2021-10-05','1900-01-01',500.00,75.00),('0470',20389250,'01/02/2021',658.00,'',0.00,'2021-02-01','1900-01-01',600.00,50.00),('0TFG',20390480,'17/11/2021',1087.00,'',0.00,'2021-11-17','1900-01-01',1000.00,75.00),('10JS',20393211,'10/01/2021',758.00,'',0.00,'2021-01-10','1900-01-01',700.00,50.00),('1HX5',20393534,'13/12/2021',1087.00,'',0.00,'2021-12-13','1900-01-01',1000.00,75.00),('3855',20395380,'30/03/2021',558.00,'',0.00,'2021-03-30','1900-01-01',500.00,50.00),('10KY',20398442,'24/12/2021',3687.00,'',0.00,'2021-12-24','1900-01-01',3600.00,75.00),('10KY',20398541,'01/10/2021',887.00,'',0.00,'2021-10-01','1900-01-01',800.00,75.00),('10KY',20398657,'07/06/2021',1187.00,'',0.00,'2021-06-07','1900-01-01',1100.00,75.00),('10KY',20398814,'16/11/2021',2087.00,'',0.00,'2021-11-16','1900-01-01',2000.00,75.00),('10KY',20398921,'06/09/2021',1287.00,'',0.00,'2021-09-06','1900-01-01',1200.00,75.00),('10KY',20399622,'21/01/2021',858.00,'',0.00,'2021-01-21','1900-01-01',800.00,50.00),('10KY',20399630,'03/12/2021',1387.00,'',0.00,'2021-12-03','1900-01-01',1300.00,75.00),('10KY',20399630,'09/01/2021',1058.00,'',0.00,'2021-01-09','1900-01-01',1000.00,50.00),('10KY',20400966,'12/03/2021',1258.00,'',0.00,'2021-03-12','1900-01-01',1200.00,50.00),('10KY',20400966,'16/01/2021',1258.00,'',0.00,'2021-01-16','1900-01-01',1200.00,50.00),('10K3',20405866,'15/10/2021',1887.00,'',0.00,'2021-10-15','1900-01-01',1800.00,75.00),('9554',20407516,'27/06/2021',787.00,'',0.00,'2021-06-27','1900-01-01',700.00,75.00),('13EG',20414017,'01/01/2021',658.00,'',0.00,'2021-01-01','1900-01-01',600.00,50.00),('1EUY',20415790,'19/03/2021',1858.00,'',0.00,'2021-03-19','1900-01-01',1800.00,50.00),('6617',20419354,'05/01/2021',2758.00,'',0.00,'2021-01-05','1900-01-01',2700.00,50.00),('0289',20424743,'15/11/2021',587.00,'',0.00,'2021-11-15','1900-01-01',500.00,75.00),('6782',20432589,'06/01/2021',2758.00,'',0.00,'2021-01-06','1900-01-01',2700.00,50.00),('3776',20436226,'08/01/2021',858.00,'',0.00,'2021-01-08','1900-01-01',800.00,50.00),('10L7',20438396,'09/12/2021',587.00,'',0.00,'2021-12-09','1900-01-01',500.00,75.00),('10NW',20438719,'31/10/2021',2087.00,'',0.00,'2021-10-31','1900-01-01',2000.00,75.00),('10NW',20439113,'02/10/2021',1087.00,'',0.00,'2021-10-02','1900-01-01',1000.00,75.00),('10NW',20439444,'12/06/2021',2287.00,'',0.00,'2021-06-12','1900-01-01',2200.00,75.00),('0NO4',20444394,'01/07/2021',2987.00,'',0.00,'2021-07-01','1900-01-01',2900.00,75.00),('10MC',20445581,'25/09/2021',687.00,'',0.00,'2021-09-25','1900-01-01',600.00,75.00),('0XLP',20460176,'11/12/2021',687.00,'',0.00,'2021-12-11','1900-01-01',600.00,75.00),('0T9G',20464517,'14/01/2021',558.00,'',0.00,'2021-01-14','1900-01-01',500.00,50.00),('10C0',20466470,'05/12/2021',1087.00,'',0.00,'2021-12-05','1900-01-01',1000.00,75.00),('0OBU',20467239,'22/06/2021',3187.00,'',0.00,'2021-06-22','1900-01-01',3100.00,75.00),('10KY',20467783,'11/04/2021',558.00,'',0.00,'2021-04-11','1900-01-01',500.00,50.00),('10KY',20467791,'17/11/2021',4087.00,'',0.00,'2021-11-17','1900-01-01',4000.00,75.00),('10KY',20467817,'24/07/2021',1087.00,'',0.00,'2021-07-24','1900-01-01',1000.00,75.00),('10KY',20467833,'17/04/2021',2058.00,'',0.00,'2021-04-17','1900-01-01',2000.00,50.00),('10KY',20467866,'23/01/2021',2058.00,'',0.00,'2021-01-23','1900-01-01',2000.00,50.00),('10KY',20467940,'08/12/2021',1087.00,'',0.00,'2021-12-08','1900-01-01',1000.00,75.00),('10KY',20468203,'21/12/2021',2087.00,'',0.00,'2021-12-21','1900-01-01',2000.00,75.00),('18AY',20475869,'17/12/2021',1387.00,'',0.00,'2021-12-17','1900-01-01',1300.00,75.00),('1HB6',20482865,'11/11/2021',2287.00,'',0.00,'2021-11-11','1900-01-01',2200.00,75.00),('7860',20486098,'22/11/2021',1087.00,'',0.00,'2021-11-22','1900-01-01',1000.00,75.00),('0XZ7',20487047,'21/10/2021',1187.00,'',0.00,'2021-10-21','1900-01-01',1100.00,75.00),('0T8P',20491809,'08/08/2021',1987.00,'',0.00,'2021-08-08','1900-01-01',1900.00,75.00),('9305',20495743,'17/11/2021',787.00,'',0.00,'2021-11-17','1900-01-01',700.00,75.00),('8140',20500500,'19/01/2021',2858.00,'',0.00,'2021-01-19','1900-01-01',2800.00,50.00),('8140',20500559,'09/05/2021',558.00,'',0.00,'2021-05-09','1900-01-01',500.00,50.00),('8140',20500559,'09/01/2021',658.00,'',0.00,'2021-01-09','1900-01-01',600.00,50.00),('2859',20501482,'24/12/2021',1087.00,'',0.00,'2021-12-24','1900-01-01',1000.00,75.00),('2859',20501615,'26/03/2021',858.00,'',0.00,'2021-03-26','1900-01-01',800.00,50.00),('0VS4',20503041,'19/12/2021',787.00,'',0.00,'2021-12-19','1900-01-01',700.00,75.00),('1HT4',20505954,'25/12/2021',1387.00,'',0.00,'2021-12-25','1900-01-01',1300.00,75.00),('0405',20519559,'11/01/2021',1258.00,'',0.00,'2021-01-11','1900-01-01',1200.00,50.00),('0PX2',20523486,'07/08/2021',687.00,'',0.00,'2021-08-07','1900-01-01',600.00,75.00),('0ZMW',20526299,'19/05/2021',558.00,'',0.00,'2021-05-19','1900-01-01',471.00,75.00),('1EUY',20526828,'21/12/2021',3487.00,'',0.00,'2021-12-21','1900-01-01',3400.00,75.00),('0P1Z',20528840,'28/09/2021',1087.00,'',0.00,'2021-09-28','1900-01-01',1000.00,75.00),('9435',20529673,'18/01/2021',2758.00,'',0.00,'2021-01-18','1900-01-01',2700.00,50.00),('0YAT',20530903,'22/08/2021',1087.00,'',0.00,'2021-08-22','1900-01-01',1000.00,75.00),('0WFC',20536298,'03/09/2021',3387.00,'21/10/2021',3353.25,'2021-09-03','2021-10-21',3300.00,75.00),('1BC8',20536512,'08/09/2021',887.00,'',0.00,'2021-09-08','1900-01-01',800.00,75.00),('0TWG',20536629,'20/02/2021',4058.00,'',0.00,'2021-02-20','1900-01-01',4000.00,50.00),('18VY',20538781,'12/02/2021',658.00,'',0.00,'2021-02-12','1900-01-01',600.00,50.00),('10S1',20539011,'20/08/2021',2087.00,'',0.00,'2021-08-20','1900-01-01',2000.00,75.00),('10S1',20539045,'07/12/2021',1587.00,'',0.00,'2021-12-07','1900-01-01',1500.00,75.00),('10S1',20539094,'04/10/2021',587.00,'',0.00,'2021-10-04','1900-01-01',500.00,75.00),('10S1',20539169,'09/06/2021',587.00,'',0.00,'2021-06-09','1900-01-01',500.00,75.00),('10S1',20539961,'20/11/2021',1787.00,'',0.00,'2021-11-20','1900-01-01',1700.00,75.00),('10S1',20540068,'16/08/2021',3087.00,'',0.00,'2021-08-16','1900-01-01',3000.00,75.00),('10S1',20540142,'27/09/2021',2387.00,'',0.00,'2021-09-27','1900-01-01',2300.00,75.00),('10S1',20540266,'04/12/2021',587.00,'',0.00,'2021-12-04','1900-01-01',500.00,75.00),('10S1',20540431,'22/10/2021',1987.00,'',0.00,'2021-10-22','1900-01-01',1900.00,75.00),('0NO4',20544094,'21/05/2021',1058.00,'',0.00,'2021-05-21','1900-01-01',971.00,75.00),('0965',20544128,'02/03/2021',1058.00,'',0.00,'2021-03-02','1900-01-01',1000.00,50.00),('0X62',20546859,'05/02/2021',758.00,'',0.00,'2021-02-05','1900-01-01',700.00,50.00),('101M',20549549,'13/11/2021',1787.00,'',0.00,'2021-11-13','1900-01-01',1700.00,75.00),('0QRX',20550737,'09/05/2021',558.00,'',0.00,'2021-05-09','1900-01-01',500.00,50.00),('0ZU4',20551370,'01/01/2021',1358.00,'',0.00,'2021-01-01','1900-01-01',1300.00,50.00),('1FZ1',20559977,'20/11/2021',687.00,'',0.00,'2021-11-20','1900-01-01',600.00,75.00),('0WI4',20560702,'02/10/2021',687.00,'11/11/2021',680.50,'2021-10-02','2021-11-11',600.00,75.00),('0289',20562971,'13/02/2021',2158.00,'',0.00,'2021-02-13','1900-01-01',2100.00,50.00),('0289',20563227,'03/02/2021',558.00,'',0.00,'2021-02-03','1900-01-01',500.00,50.00),('1I3R',20567673,'20/12/2021',1487.00,'',0.00,'2021-12-20','1900-01-01',1400.00,75.00),('0Z67',20567699,'15/01/2021',1358.00,'',0.00,'2021-01-15','1900-01-01',1300.00,50.00),('0V0F',20574323,'30/01/2021',2958.00,'',0.00,'2021-01-30','1900-01-01',2900.00,50.00),('101M',20586426,'05/08/2021',1587.00,'',0.00,'2021-08-05','1900-01-01',1500.00,75.00),('18AY',20588018,'24/01/2021',1058.00,'',0.00,'2021-01-24','1900-01-01',1000.00,50.00),('10U4',20588224,'15/01/2021',1458.00,'',0.00,'2021-01-15','1900-01-01',1400.00,50.00),('10U4',20588224,'01/01/2021',1458.00,'',0.00,'2021-01-01','1900-01-01',1400.00,50.00),('10U4',20590253,'02/12/2021',1587.00,'',0.00,'2021-12-02','1900-01-01',1500.00,75.00),('10U4',20590485,'30/01/2021',1058.00,'',0.00,'2021-01-30','1900-01-01',1000.00,50.00),('10U4',20590501,'10/06/2021',1487.00,'',0.00,'2021-06-10','1900-01-01',1400.00,75.00),('10U4',20590592,'05/10/2021',1587.00,'',0.00,'2021-10-05','1900-01-01',1500.00,75.00),('10U4',20590709,'31/07/2021',887.00,'',0.00,'2021-07-31','1900-01-01',800.00,75.00),('10U4',20590717,'17/11/2021',987.00,'',0.00,'2021-11-17','1900-01-01',900.00,75.00),('10U4',20590758,'17/12/2021',2687.00,'',0.00,'2021-12-17','1900-01-01',2600.00,75.00),('10U4',20590758,'15/01/2021',958.00,'',0.00,'2021-01-15','1900-01-01',900.00,50.00),('0WGU',20591020,'05/02/2021',1358.00,'',0.00,'2021-02-05','1900-01-01',1300.00,50.00),('0YYJ',20591186,'20/12/2021',987.00,'',0.00,'2021-12-20','1900-01-01',900.00,75.00),('10N0',20591889,'23/12/2021',887.00,'',0.00,'2021-12-23','1900-01-01',800.00,75.00),('10N0',20591889,'08/11/2021',887.00,'',0.00,'2021-11-08','1900-01-01',800.00,75.00),('10SZ',20594982,'12/03/2021',858.00,'',0.00,'2021-03-12','1900-01-01',800.00,50.00),('10SZ',20595120,'15/12/2021',1487.00,'',0.00,'2021-12-15','1900-01-01',1400.00,75.00),('10SZ',20595120,'15/01/2021',1158.00,'',0.00,'2021-01-15','1900-01-01',1100.00,50.00),('10SZ',20595153,'10/02/2021',958.00,'',0.00,'2021-02-10','1900-01-01',900.00,50.00),('0298',20599254,'21/07/2021',1487.00,'',0.00,'2021-07-21','1900-01-01',1400.00,75.00),('0PSU',20600201,'11/03/2021',2058.00,'',0.00,'2021-03-11','1900-01-01',2000.00,50.00),('0QIS',20602108,'11/01/2021',3458.00,'',0.00,'2021-01-11','1900-01-01',3400.00,50.00),('109S',20603882,'11/08/2021',6587.00,'',0.00,'2021-08-11','1900-01-01',6500.00,75.00),('8140',20605861,'29/01/2021',2058.00,'',0.00,'2021-01-29','1900-01-01',2000.00,50.00),('8140',20605887,'24/11/2021',1587.00,'',0.00,'2021-11-24','1900-01-01',1500.00,75.00),('0VBI',20606018,'01/08/2021',1487.00,'',0.00,'2021-08-01','1900-01-01',1400.00,75.00),('0256',20608311,'03/12/2021',1587.00,'',0.00,'2021-12-03','1900-01-01',1500.00,75.00),('2305',20609251,'04/12/2021',3787.00,'',0.00,'2021-12-04','1900-01-01',3700.00,75.00),('2305',20609251,'18/02/2021',3158.00,'',0.00,'2021-02-18','1900-01-01',3100.00,50.00),('2305',20609251,'04/02/2021',3158.00,'',0.00,'2021-02-04','1900-01-01',3100.00,50.00),('0NVF',20610028,'10/12/2021',787.00,'',0.00,'2021-12-10','1900-01-01',700.00,75.00),('1IGN',20612065,'17/12/2021',687.00,'',0.00,'2021-12-17','1900-01-01',600.00,75.00),('10SZ',20617999,'17/09/2021',1287.00,'',0.00,'2021-09-17','1900-01-01',1200.00,75.00),('3429',20618484,'03/11/2021',2087.00,'',0.00,'2021-11-03','1900-01-01',2000.00,75.00),('3429',20618484,'28/10/2021',1087.00,'',0.00,'2021-10-28','1900-01-01',1000.00,75.00),('0QE6',20619094,'29/01/2021',3158.00,'',0.00,'2021-01-29','1900-01-01',3100.00,50.00),('9613',20621496,'05/09/2021',787.00,'',0.00,'2021-09-05','1900-01-01',700.00,75.00),('0PLW',20627444,'12/03/2021',558.00,'',0.00,'2021-03-12','1900-01-01',500.00,50.00),('0Z67',20629028,'03/08/2021',2687.00,'',0.00,'2021-08-03','1900-01-01',2600.00,75.00),('1609',20633186,'03/12/2021',787.00,'',0.00,'2021-12-03','1900-01-01',700.00,75.00),('1609',20633186,'17/11/2021',787.00,'',0.00,'2021-11-17','1900-01-01',700.00,75.00),('4687',20638730,'30/10/2021',1587.00,'',0.00,'2021-10-30','1900-01-01',1500.00,75.00),('0023',20640108,'07/02/2021',858.00,'',0.00,'2021-02-07','1900-01-01',800.00,50.00),('0P1Z',20641239,'19/11/2021',3687.00,'',0.00,'2021-11-19','1900-01-01',3600.00,75.00),('7301',20653648,'14/02/2021',558.00,'',0.00,'2021-02-14','1900-01-01',500.00,50.00),('1IMX',20658274,'16/11/2021',587.00,'',0.00,'2021-11-16','1900-01-01',500.00,75.00),('0SHK',20661427,'18/02/2021',958.00,'',0.00,'2021-02-18','1900-01-01',900.00,50.00),('0289',20674883,'15/04/2021',1658.00,'',0.00,'2021-04-15','1900-01-01',1600.00,50.00),('0289',20676656,'07/09/2021',687.00,'',0.00,'2021-09-07','1900-01-01',600.00,75.00),('19YE',20679080,'17/01/2021',2558.00,'',0.00,'2021-01-17','1900-01-01',2500.00,50.00),('1JJB',20679791,'04/10/2021',887.00,'',0.00,'2021-10-04','1900-01-01',800.00,75.00),('1DDT',20680278,'06/01/2021',1658.00,'',0.00,'2021-01-06','1900-01-01',1600.00,50.00),('0WGU',20680518,'20/02/2021',1458.00,'',0.00,'2021-02-20','1900-01-01',1400.00,50.00),('0S8D',20686010,'01/05/2021',2158.00,'',0.00,'2021-05-01','1900-01-01',2100.00,50.00),('0U5B',20687091,'13/02/2021',2558.00,'',0.00,'2021-02-13','1900-01-01',2500.00,50.00),('175Z',20697801,'06/12/2021',1787.00,'',0.00,'2021-12-06','1900-01-01',1700.00,75.00),('0O4U',20697850,'22/12/2021',1587.00,'',0.00,'2021-12-22','1900-01-01',1500.00,75.00),('0V0F',20698213,'15/01/2021',1558.00,'',0.00,'2021-01-15','1900-01-01',1500.00,50.00),('0XXC',20699070,'12/12/2021',1287.00,'',0.00,'2021-12-12','1900-01-01',1200.00,75.00),('1019',20700969,'16/09/2021',1587.00,'',0.00,'2021-09-16','1900-01-01',1500.00,75.00),('1019',20700969,'16/01/2021',1658.00,'',0.00,'2021-01-16','1900-01-01',1600.00,50.00),('13EG',20708533,'24/08/2021',787.00,'01/10/2021',784.34,'2021-08-24','2021-10-01',700.00,75.00),('0R4L',20708566,'31/10/2021',987.00,'',0.00,'2021-10-31','1900-01-01',900.00,75.00),('7860',20715462,'12/12/2021',887.00,'',0.00,'2021-12-12','1900-01-01',800.00,75.00),('0W05',20719050,'13/08/2021',687.00,'',0.00,'2021-08-13','1900-01-01',600.00,75.00),('0TQF',20727855,'24/01/2021',1558.00,'',0.00,'2021-01-24','1900-01-01',1500.00,50.00),('0QE5',20729463,'13/09/2021',787.00,'',0.00,'2021-09-13','1900-01-01',700.00,75.00),('3758',20731303,'15/02/2021',658.00,'',0.00,'2021-02-15','1900-01-01',600.00,50.00),('0215',20739132,'19/08/2021',1587.00,'',0.00,'2021-08-19','1900-01-01',1500.00,75.00),('10WT',20742169,'11/10/2021',587.00,'',0.00,'2021-10-11','1900-01-01',500.00,75.00),('10WT',20742268,'18/02/2021',558.00,'',0.00,'2021-02-18','1900-01-01',500.00,50.00),('10WT',20742375,'07/12/2021',1387.00,'',0.00,'2021-12-07','1900-01-01',1300.00,75.00),('10WT',20742656,'07/05/2021',558.00,'',0.00,'2021-05-07','1900-01-01',500.00,50.00),('10WT',20742664,'14/01/2021',1058.00,'',0.00,'2021-01-14','1900-01-01',1000.00,50.00),('10WT',20742722,'24/03/2021',558.00,'',0.00,'2021-03-24','1900-01-01',500.00,50.00),('10WT',20743035,'26/03/2021',558.00,'',0.00,'2021-03-26','1900-01-01',500.00,50.00),('10WT',20743159,'07/01/2021',1358.00,'',0.00,'2021-01-07','1900-01-01',1300.00,50.00),('0OBN',20743530,'11/12/2021',1187.00,'',0.00,'2021-12-11','1900-01-01',1100.00,75.00),('10WT',20743738,'28/08/2021',1487.00,'',0.00,'2021-08-28','1900-01-01',1400.00,75.00),('10WT',20743878,'20/11/2021',1587.00,'',0.00,'2021-11-20','1900-01-01',1500.00,75.00),('10WT',20744736,'24/08/2021',1287.00,'',0.00,'2021-08-24','1900-01-01',1200.00,75.00),('10WT',20744769,'25/09/2021',1387.00,'',0.00,'2021-09-25','1900-01-01',1300.00,75.00),('10WT',20744926,'23/01/2021',658.00,'',0.00,'2021-01-23','1900-01-01',600.00,50.00),('10WT',20745170,'24/07/2021',587.00,'',0.00,'2021-07-24','1900-01-01',500.00,75.00),('10WT',20745246,'14/08/2021',1087.00,'',0.00,'2021-08-14','1900-01-01',1000.00,75.00),('10WT',20745501,'20/09/2021',1337.00,'',0.00,'2021-09-20','1900-01-01',1250.00,75.00),('10WT',20745568,'19/09/2021',687.00,'',0.00,'2021-09-19','1900-01-01',600.00,75.00),('10VB',20750311,'23/02/2021',858.00,'',0.00,'2021-02-23','1900-01-01',800.00,50.00),('10VB',20750345,'15/12/2021',2387.00,'',0.00,'2021-12-15','1900-01-01',2300.00,75.00),('8819',20752515,'21/03/2021',1858.00,'',0.00,'2021-03-21','1900-01-01',1800.00,50.00),('0WRW',20753620,'31/08/2021',1087.00,'',0.00,'2021-08-31','1900-01-01',1000.00,75.00),('0ZOG',20756284,'15/05/2021',858.00,'',0.00,'2021-05-15','1900-01-01',771.00,75.00),('1AJZ',20756409,'25/12/2021',4087.00,'',0.00,'2021-12-25','1900-01-01',4000.00,75.00),('1AJZ',20756409,'04/05/2021',1958.00,'',0.00,'2021-05-04','1900-01-01',1900.00,50.00),('0ZOG',20756433,'04/02/2021',1058.00,'',0.00,'2021-02-04','1900-01-01',1000.00,50.00),('0ZOG',20756458,'02/02/2021',858.00,'',0.00,'2021-02-02','1900-01-01',800.00,50.00),('0P1Z',20757670,'17/09/2021',1787.00,'',0.00,'2021-09-17','1900-01-01',1700.00,75.00),('159T',20759833,'06/03/2021',558.00,'',0.00,'2021-03-06','1900-01-01',500.00,50.00),('8461',20760153,'08/10/2021',887.00,'',0.00,'2021-10-08','1900-01-01',800.00,75.00),('0O4U',20761896,'05/02/2021',2158.00,'',0.00,'2021-02-05','1900-01-01',2100.00,50.00),('3709',20771788,'07/01/2021',558.00,'',0.00,'2021-01-07','1900-01-01',500.00,50.00),('10GA',20777918,'13/02/2021',1158.00,'',0.00,'2021-02-13','1900-01-01',1100.00,50.00),('10GA',20781126,'12/12/2021',1287.00,'',0.00,'2021-12-12','1900-01-01',1200.00,75.00),('10GA',20781126,'01/01/2021',1358.00,'',0.00,'2021-01-01','1900-01-01',1300.00,50.00),('9218',20782835,'15/08/2021',1837.00,'',0.00,'2021-08-15','1900-01-01',1750.00,75.00),('0O4U',20783411,'05/03/2021',1258.00,'',0.00,'2021-03-05','1900-01-01',1200.00,50.00),('113A',20784328,'08/02/2021',758.00,'',0.00,'2021-02-08','1900-01-01',700.00,50.00),('5979',20787032,'27/10/2021',1687.00,'',0.00,'2021-10-27','1900-01-01',1600.00,75.00),('0YTP',20787255,'05/01/2021',958.00,'',0.00,'2021-01-05','1900-01-01',900.00,50.00),('10GA',20792834,'02/12/2021',1687.00,'',0.00,'2021-12-02','1900-01-01',1600.00,75.00),('6502',20796280,'01/08/2021',3187.00,'',0.00,'2021-08-01','1900-01-01',3100.00,75.00),('10WT',20796512,'08/01/2021',828.00,'',0.00,'2021-01-08','1900-01-01',770.00,50.00),('7095',20797916,'05/12/2021',1087.00,'',0.00,'2021-12-05','1900-01-01',1000.00,75.00),('9435',20798682,'16/11/2021',4087.00,'',0.00,'2021-11-16','1900-01-01',4000.00,75.00),('115R',20805966,'09/01/2021',558.00,'',0.00,'2021-01-09','1900-01-01',500.00,50.00),('115R',20806279,'21/01/2021',558.00,'',0.00,'2021-01-21','1900-01-01',500.00,50.00),('0WVS',20806493,'04/10/2021',1587.00,'',0.00,'2021-10-04','1900-01-01',1500.00,75.00),('0WVW',20807137,'14/08/2021',3087.00,'',0.00,'2021-08-14','1900-01-01',3000.00,75.00),('0WVW',20807145,'17/06/2021',3087.00,'',0.00,'2021-06-17','1900-01-01',3000.00,75.00),('0WVW',20807145,'18/01/2021',1258.00,'',0.00,'2021-01-18','1900-01-01',1200.00,50.00),('0WVW',20807418,'19/06/2021',3087.00,'',0.00,'2021-06-19','1900-01-01',3000.00,75.00),('0WVW',20807608,'10/08/2021',3087.00,'',0.00,'2021-08-10','1900-01-01',3000.00,75.00),('0WVW',20807624,'05/04/2021',1258.00,'',0.00,'2021-04-05','1900-01-01',1200.00,50.00),('0WVW',20807764,'20/01/2021',1258.00,'',0.00,'2021-01-20','1900-01-01',1200.00,50.00),('0T16',20808028,'28/12/2021',2087.00,'',0.00,'2021-12-28','1900-01-01',2000.00,75.00),('0T16',20808028,'27/06/2021',587.00,'',0.00,'2021-06-27','1900-01-01',500.00,75.00),('14UM',20808259,'28/12/2021',687.00,'',0.00,'2021-12-28','1900-01-01',600.00,75.00),('8140',20809026,'31/12/2021',887.00,'',0.00,'2021-12-31','1900-01-01',800.00,75.00),('8140',20809026,'29/01/2021',1458.00,'',0.00,'2021-01-29','1900-01-01',1400.00,50.00),('0NO4',20811600,'05/01/2021',958.00,'',0.00,'2021-01-05','1900-01-01',900.00,50.00),('0S5X',20811659,'29/12/2021',1887.00,'',0.00,'2021-12-29','1900-01-01',1800.00,75.00),('17EF',20812269,'30/11/2021',1087.00,'',0.00,'2021-11-30','1900-01-01',1000.00,75.00),('0ZMW',20814992,'08/02/2021',558.00,'',0.00,'2021-02-08','1900-01-01',500.00,50.00),('1BDT',20816872,'14/02/2021',4058.00,'',0.00,'2021-02-14','1900-01-01',4000.00,50.00),('0YLR',20819702,'04/01/2021',1158.00,'',0.00,'2021-01-04','1900-01-01',1100.00,50.00),('116T',20820585,'31/12/2021',3087.00,'',0.00,'2021-12-31','1900-01-01',3000.00,75.00),('07RA',20821690,'03/10/2021',1187.00,'',0.00,'2021-10-03','1900-01-01',1100.00,75.00),('9218',20824074,'24/09/2021',1487.00,'',0.00,'2021-09-24','1900-01-01',1400.00,75.00),('0254',20829461,'20/11/2021',4787.00,'',0.00,'2021-11-20','1900-01-01',4700.00,75.00),('0YYJ',20830824,'06/01/2021',1358.00,'',0.00,'2021-01-06','1900-01-01',1300.00,50.00),('0Y1J',20832135,'05/09/2021',787.00,'',0.00,'2021-09-05','1900-01-01',700.00,75.00),('2305',20838868,'06/09/2021',1587.00,'',0.00,'2021-09-06','1900-01-01',1500.00,75.00),('0PLW',20841797,'31/01/2021',558.00,'',0.00,'2021-01-31','1900-01-01',500.00,50.00),('114Y',20842308,'25/06/2021',687.00,'',0.00,'2021-06-25','1900-01-01',600.00,75.00),('1609',20844528,'02/07/2021',787.00,'',0.00,'2021-07-02','1900-01-01',700.00,75.00),('0X8R',20849824,'11/02/2021',558.00,'',0.00,'2021-02-11','1900-01-01',500.00,50.00),('1132',20857728,'04/12/2021',1187.00,'',0.00,'2021-12-04','1900-01-01',1100.00,75.00),('11A3',20865820,'08/01/2021',558.00,'',0.00,'2021-01-08','1900-01-01',500.00,50.00),('0OOB',20867784,'18/12/2021',2687.00,'',0.00,'2021-12-18','1900-01-01',2600.00,75.00),('0215',20871158,'27/11/2021',1087.00,'',0.00,'2021-11-27','1900-01-01',1000.00,75.00),('175Z',20873782,'04/01/2021',1158.00,'',0.00,'2021-01-04','1900-01-01',1100.00,50.00),('10CW',20880720,'19/12/2021',3587.00,'',0.00,'2021-12-19','1900-01-01',3500.00,75.00),('8794',20881801,'24/04/2021',558.00,'',0.00,'2021-04-24','1900-01-01',500.00,50.00),('2305',20883419,'28/11/2021',987.00,'',0.00,'2021-11-28','1900-01-01',900.00,75.00),('2305',20883419,'15/11/2021',2087.00,'',0.00,'2021-11-15','1900-01-01',2000.00,75.00),('2305',20883450,'06/11/2021',1987.00,'',0.00,'2021-11-06','1900-01-01',1900.00,75.00),('0S86',20889382,'08/02/2021',858.00,'',0.00,'2021-02-08','1900-01-01',800.00,50.00),('6617',20892022,'02/01/2021',2058.00,'',0.00,'2021-01-02','1900-01-01',2000.00,50.00),('0VHM',20892337,'27/05/2021',587.00,'',0.00,'2021-05-27','1900-01-01',500.00,75.00),('0ZDS',20893152,'05/12/2021',987.00,'',0.00,'2021-12-05','1900-01-01',900.00,75.00),('9053',20893400,'30/10/2021',1087.00,'',0.00,'2021-10-30','1900-01-01',1000.00,75.00),('0289',20898433,'08/07/2021',4087.00,'',0.00,'2021-07-08','1900-01-01',4000.00,75.00),('0RSF',20900874,'21/12/2021',787.00,'',0.00,'2021-12-21','1900-01-01',700.00,75.00),('18T8',20907663,'28/09/2021',1287.00,'',0.00,'2021-09-28','1900-01-01',1200.00,75.00),('18T8',20907663,'28/08/2021',587.00,'',0.00,'2021-08-28','1900-01-01',500.00,75.00),('0YOV',20910378,'02/12/2021',4187.00,'',0.00,'2021-12-02','1900-01-01',4100.00,75.00),('115C',20911004,'27/12/2021',1287.00,'',0.00,'2021-12-27','1900-01-01',1200.00,75.00),('0YL6',20911483,'13/12/2021',1787.00,'',0.00,'2021-12-13','1900-01-01',1700.00,75.00),('0YL6',20911483,'24/09/2021',1287.00,'',0.00,'2021-09-24','1900-01-01',1200.00,75.00),('1019',20911780,'01/12/2021',3987.00,'',0.00,'2021-12-01','1900-01-01',3900.00,75.00),('0UU3',20915369,'22/10/2021',1487.00,'01/12/2021',1473.87,'2021-10-22','2021-12-01',1400.00,75.00),('6415',20920534,'20/07/2021',787.00,'',0.00,'2021-07-20','1900-01-01',700.00,75.00),('1DHD',20921276,'12/02/2021',558.00,'',0.00,'2021-02-12','1900-01-01',500.00,50.00),('8140',20922167,'27/12/2021',1787.00,'',0.00,'2021-12-27','1900-01-01',1700.00,75.00),('8140',20922167,'07/12/2021',1087.00,'',0.00,'2021-12-07','1900-01-01',1000.00,75.00),('1040',20922761,'23/08/2021',587.00,'',0.00,'2021-08-23','1900-01-01',500.00,75.00),('5629',20924437,'23/12/2021',1987.00,'',0.00,'2021-12-23','1900-01-01',1900.00,75.00),('10AW',20925475,'27/11/2021',2087.00,'',0.00,'2021-11-27','1900-01-01',2000.00,75.00),('1HX3',20933271,'24/07/2021',3087.00,'',0.00,'2021-07-24','1900-01-01',3000.00,75.00),('0YAT',20934162,'01/01/2021',1058.00,'',0.00,'2021-01-01','1900-01-01',1000.00,50.00),('0WVW',20935201,'24/02/2021',1258.00,'',0.00,'2021-02-24','1900-01-01',1200.00,50.00),('0WVW',20935201,'27/01/2021',1258.00,'',0.00,'2021-01-27','1900-01-01',1200.00,50.00),('10XJ',20935789,'17/11/2021',587.00,'',0.00,'2021-11-17','1900-01-01',500.00,75.00),('113C',20936183,'19/03/2021',558.00,'',0.00,'2021-03-19','1900-01-01',500.00,50.00),('0SSN',20939955,'15/02/2021',1358.00,'',0.00,'2021-02-15','1900-01-01',1300.00,50.00),('8357',20941696,'07/01/2021',658.00,'',0.00,'2021-01-07','1900-01-01',600.00,50.00),('0254',20941746,'30/12/2021',1887.00,'',0.00,'2021-12-30','1900-01-01',1800.00,75.00),('0V8A',20944021,'19/06/2021',787.00,'',0.00,'2021-06-19','1900-01-01',700.00,75.00),('0TCI',20946893,'30/08/2021',2287.00,'',0.00,'2021-08-30','1900-01-01',2200.00,75.00),('0Z67',20949947,'18/01/2021',1358.00,'',0.00,'2021-01-18','1900-01-01',1300.00,50.00),('9377',20950804,'21/07/2021',2087.00,'',0.00,'2021-07-21','1900-01-01',2000.00,75.00),('0NWS',20953154,'09/02/2021',2058.00,'',0.00,'2021-02-09','1900-01-01',2000.00,50.00),('0W5Q',20954400,'23/02/2021',558.00,'',0.00,'2021-02-23','1900-01-01',500.00,50.00),('0X58',20954913,'22/10/2021',587.00,'',0.00,'2021-10-22','1900-01-01',500.00,75.00),('0OGB',20955886,'15/01/2021',1358.00,'',0.00,'2021-01-15','1900-01-01',1300.00,50.00),('0R1F',20958609,'15/02/2021',1458.00,'',0.00,'2021-02-15','1900-01-01',1400.00,50.00),('1APE',20959557,'16/01/2021',558.00,'',0.00,'2021-01-16','1900-01-01',500.00,50.00),('3380',20960050,'06/02/2021',658.00,'',0.00,'2021-02-06','1900-01-01',600.00,50.00),('11D9',20961801,'23/08/2021',1587.00,'',0.00,'2021-08-23','1900-01-01',1500.00,75.00),('11D9',20961843,'18/02/2021',1958.00,'',0.00,'2021-02-18','1900-01-01',1900.00,50.00),('0YLR',20964342,'04/01/2021',2158.00,'',0.00,'2021-01-04','1900-01-01',2100.00,50.00),('2139',20964839,'15/01/2021',1458.00,'',0.00,'2021-01-15','1900-01-01',1400.00,50.00),('2034',20966750,'05/12/2021',887.00,'',0.00,'2021-12-05','1900-01-01',800.00,75.00),('2034',20966750,'23/10/2021',587.00,'',0.00,'2021-10-23','1900-01-01',500.00,75.00),('11BI',20968137,'16/04/2021',1558.00,'',0.00,'2021-04-16','1900-01-01',1500.00,50.00),('11BI',20968145,'15/01/2021',1258.00,'',0.00,'2021-01-15','1900-01-01',1200.00,50.00),('0254',20970844,'01/09/2021',3087.00,'',0.00,'2021-09-01','1900-01-01',3000.00,75.00),('0PCL',20973707,'20/10/2021',787.00,'',0.00,'2021-10-20','1900-01-01',700.00,75.00),('0PCL',20973707,'02/02/2021',2158.00,'',0.00,'2021-02-02','1900-01-01',2100.00,50.00),('0PCL',20973707,'17/01/2021',2158.00,'',0.00,'2021-01-17','1900-01-01',2100.00,50.00),('0PCL',20973715,'02/12/2021',3787.00,'',0.00,'2021-12-02','1900-01-01',3700.00,75.00),('0PCL',20973715,'30/01/2021',2858.00,'',0.00,'2021-01-30','1900-01-01',2800.00,50.00),('0WGU',20974150,'22/02/2021',558.00,'',0.00,'2021-02-22','1900-01-01',500.00,50.00),('0WGU',20974275,'08/01/2021',1358.00,'',0.00,'2021-01-08','1900-01-01',1300.00,50.00),('0O5J',20975611,'28/03/2021',1558.00,'',0.00,'2021-03-28','1900-01-01',1500.00,50.00),('0PIN',20978714,'07/05/2021',1258.00,'',0.00,'2021-05-07','1900-01-01',1200.00,50.00),('0ZG3',20978995,'25/09/2021',4087.00,'',0.00,'2021-09-25','1900-01-01',4000.00,75.00),('4957',20982872,'29/05/2021',587.00,'',0.00,'2021-05-29','1900-01-01',500.00,75.00),('0OD1',20987855,'13/01/2021',1358.00,'',0.00,'2021-01-13','1900-01-01',1300.00,50.00),('0S77',20989281,'11/01/2021',608.00,'',0.00,'2021-01-11','1900-01-01',550.00,50.00),('0NVR',20995783,'01/10/2021',2087.00,'',0.00,'2021-10-01','1900-01-01',2000.00,75.00),('0YAT',20999116,'08/10/2021',787.00,'',0.00,'2021-10-08','1900-01-01',700.00,75.00),('5818',21000922,'06/08/2021',787.00,'',0.00,'2021-08-06','1900-01-01',700.00,75.00),('5818',21000922,'02/02/2021',958.00,'',0.00,'2021-02-02','1900-01-01',900.00,50.00),('0Z70',21001565,'05/01/2021',758.00,'',0.00,'2021-01-05','1900-01-01',700.00,50.00),('0YUF',21004411,'28/08/2021',1287.00,'',0.00,'2021-08-28','1900-01-01',1200.00,75.00),('0YUF',21004411,'14/08/2021',1287.00,'',0.00,'2021-08-14','1900-01-01',1200.00,75.00),('10WT',21011606,'03/02/2021',558.00,'',0.00,'2021-02-03','1900-01-01',500.00,50.00),('10WT',21012075,'21/10/2021',1187.00,'',0.00,'2021-10-21','1900-01-01',1100.00,75.00),('10WT',21012232,'07/02/2021',558.00,'',0.00,'2021-02-07','1900-01-01',500.00,50.00),('10WT',21012653,'04/05/2021',558.00,'',0.00,'2021-05-04','1900-01-01',500.00,50.00),('10WT',21013347,'06/12/2021',587.00,'',0.00,'2021-12-06','1900-01-01',500.00,75.00),('10WT',21013438,'06/08/2021',1087.00,'',0.00,'2021-08-06','1900-01-01',1000.00,75.00),('10WT',21013578,'15/04/2021',558.00,'',0.00,'2021-04-15','1900-01-01',500.00,50.00),('10WT',21014196,'02/01/2021',1558.00,'',0.00,'2021-01-02','1900-01-01',1500.00,50.00),('10WT',21014824,'09/06/2021',787.00,'',0.00,'2021-06-09','1900-01-01',700.00,75.00),('10WT',21014949,'04/02/2021',1058.00,'',0.00,'2021-02-04','1900-01-01',1000.00,50.00),('10WT',21015045,'13/04/2021',1058.00,'',0.00,'2021-04-13','1900-01-01',1000.00,50.00),('10WT',21015177,'26/12/2021',2087.00,'',0.00,'2021-12-26','1900-01-01',2000.00,75.00),('10WT',21015177,'08/01/2021',1258.00,'',0.00,'2021-01-08','1900-01-01',1200.00,50.00),('10WT',21015185,'27/11/2021',1287.00,'',0.00,'2021-11-27','1900-01-01',1200.00,75.00),('10WT',21015185,'27/01/2021',1258.00,'',0.00,'2021-01-27','1900-01-01',1200.00,50.00),('10WT',21015268,'06/11/2021',1387.00,'',0.00,'2021-11-06','1900-01-01',1300.00,75.00),('10WT',21015698,'11/02/2021',558.00,'',0.00,'2021-02-11','1900-01-01',500.00,50.00),('1494',21017678,'14/11/2021',587.00,'',0.00,'2021-11-14','1900-01-01',500.00,75.00),('0QMC',21017868,'07/05/2021',558.00,'',0.00,'2021-05-07','1900-01-01',500.00,50.00),('0SQD',21019096,'15/08/2021',787.00,'',0.00,'2021-08-15','1900-01-01',700.00,75.00),('13ZF',21019203,'13/11/2021',4587.00,'',0.00,'2021-11-13','1900-01-01',4500.00,75.00),('0289',21020326,'02/02/2021',3758.00,'',0.00,'2021-02-02','1900-01-01',3700.00,50.00),('0289',21020359,'16/12/2021',1887.00,'',0.00,'2021-12-16','1900-01-01',1800.00,75.00),('0289',21020359,'04/12/2021',1887.00,'',0.00,'2021-12-04','1900-01-01',1800.00,75.00),('9757',21021142,'07/08/2021',1787.00,'',0.00,'2021-08-07','1900-01-01',1700.00,75.00),('109S',21025705,'30/09/2021',587.00,'',0.00,'2021-09-30','1900-01-01',500.00,75.00),('0OR0',21029350,'08/01/2021',758.00,'',0.00,'2021-01-08','1900-01-01',700.00,50.00),('11HJ',21030440,'03/02/2021',1058.00,'24/03/2021',28.98,'2021-02-03','2021-03-24',1000.00,50.00),('11HJ',21030499,'29/01/2021',1558.00,'',0.00,'2021-01-29','1900-01-01',1500.00,50.00),('11HJ',21030499,'18/01/2021',1558.00,'',0.00,'2021-01-18','1900-01-01',1500.00,50.00),('11HJ',21030549,'27/12/2021',2587.00,'',0.00,'2021-12-27','1900-01-01',2500.00,75.00),('11HJ',21030713,'08/03/2021',2558.00,'',0.00,'2021-03-08','1900-01-01',2500.00,50.00),('11HJ',21031950,'16/03/2021',1558.00,'',0.00,'2021-03-16','1900-01-01',1500.00,50.00),('11HJ',21032214,'22/03/2021',1058.00,'',0.00,'2021-03-22','1900-01-01',1000.00,50.00),('11HJ',21032487,'23/08/2021',2087.00,'',0.00,'2021-08-23','1900-01-01',2000.00,75.00),('11HJ',21032487,'24/06/2021',1087.00,'',0.00,'2021-06-24','1900-01-01',1000.00,75.00),('11HJ',21032503,'07/01/2021',1258.00,'',0.00,'2021-01-07','1900-01-01',1200.00,50.00),('11HJ',21032552,'06/01/2021',1158.00,'',0.00,'2021-01-06','1900-01-01',1100.00,50.00),('11HJ',21032768,'01/05/2021',1058.00,'',0.00,'2021-05-01','1900-01-01',1000.00,50.00),('11HJ',21032875,'04/08/2021',1587.00,'',0.00,'2021-08-04','1900-01-01',1500.00,75.00),('11HJ',21032891,'18/08/2021',1087.00,'06/10/2021',1081.90,'2021-08-18','2021-10-06',1000.00,75.00),('11HJ',21033030,'26/05/2021',587.00,'',0.00,'2021-05-26','1900-01-01',500.00,75.00),('11HJ',21033071,'27/08/2021',787.00,'14/10/2021',783.98,'2021-08-27','2021-10-14',700.00,75.00),('11HJ',21033436,'19/12/2021',2687.00,'',0.00,'2021-12-19','1900-01-01',2600.00,75.00),('11HJ',21033451,'15/01/2021',2158.00,'',0.00,'2021-01-15','1900-01-01',2100.00,50.00),('0WVW',21033469,'20/06/2021',1587.00,'',0.00,'2021-06-20','1900-01-01',1500.00,75.00),('11HJ',21033477,'23/12/2021',2687.00,'',0.00,'2021-12-23','1900-01-01',2600.00,75.00),('11HJ',21033477,'19/01/2021',2158.00,'',0.00,'2021-01-19','1900-01-01',2100.00,50.00),('11HJ',21033576,'17/01/2021',2158.00,'',0.00,'2021-01-17','1900-01-01',2100.00,50.00),('11HJ',21033584,'17/12/2021',2687.00,'',0.00,'2021-12-17','1900-01-01',2600.00,75.00),('11HJ',21033592,'04/02/2021',1058.00,'',0.00,'2021-02-04','1900-01-01',1000.00,50.00),('11HJ',21033782,'04/10/2021',2587.00,'',0.00,'2021-10-04','1900-01-01',2500.00,75.00),('11HJ',21033824,'18/02/2021',2558.00,'',0.00,'2021-02-18','1900-01-01',2500.00,50.00),('101M',21035464,'14/11/2021',1187.00,'',0.00,'2021-11-14','1900-01-01',1100.00,75.00),('101M',21035464,'20/08/2021',587.00,'',0.00,'2021-08-20','1900-01-01',500.00,75.00),('11HJ',21035480,'25/07/2021',587.00,'',0.00,'2021-07-25','1900-01-01',500.00,75.00),('0RSF',21040340,'08/04/2021',658.00,'',0.00,'2021-04-08','1900-01-01',600.00,50.00),('2305',21040811,'26/01/2021',558.00,'',0.00,'2021-01-26','1900-01-01',500.00,50.00),('2117',21040845,'11/10/2021',1087.00,'',0.00,'2021-10-11','1900-01-01',1000.00,75.00),('2741',21043542,'09/09/2021',587.00,'',0.00,'2021-09-09','1900-01-01',500.00,75.00),('8493',21043799,'24/08/2021',1587.00,'',0.00,'2021-08-24','1900-01-01',1500.00,75.00),('8493',21043799,'16/08/2021',1087.00,'',0.00,'2021-08-16','1900-01-01',1000.00,75.00),('5979',21044912,'26/12/2021',1587.00,'',0.00,'2021-12-26','1900-01-01',1500.00,75.00),('11I0',21050752,'27/12/2021',1387.00,'',0.00,'2021-12-27','1900-01-01',1300.00,75.00),('0YZ4',21051594,'03/03/2021',658.00,'',0.00,'2021-03-03','1900-01-01',600.00,50.00),('0YZ4',21051594,'02/02/2021',1508.00,'',0.00,'2021-02-02','1900-01-01',1450.00,50.00),('1019',21051859,'17/09/2021',1087.00,'',0.00,'2021-09-17','1900-01-01',1000.00,75.00),('1CFI',21052972,'20/12/2021',1387.00,'',0.00,'2021-12-20','1900-01-01',1300.00,75.00),('0VS4',21056148,'24/03/2021',558.00,'',0.00,'2021-03-24','1900-01-01',500.00,50.00),('0YLR',21061908,'22/02/2021',1058.00,'',0.00,'2021-02-22','1900-01-01',1000.00,50.00),('109S',21062518,'21/12/2021',752.00,'',0.00,'2021-12-21','1900-01-01',665.00,75.00),('0ZX1',21065172,'19/06/2021',1087.00,'',0.00,'2021-06-19','1900-01-01',1000.00,75.00),('0XCE',21066196,'29/12/2021',787.00,'',0.00,'2021-12-29','1900-01-01',700.00,75.00),('0QCX',21070784,'26/12/2021',1887.00,'',0.00,'2021-12-26','1900-01-01',1800.00,75.00),('1HZJ',21072798,'01/11/2021',2287.00,'',0.00,'2021-11-01','1900-01-01',2200.00,75.00),('0V0F',21072970,'29/01/2021',1558.00,'',0.00,'2021-01-29','1900-01-01',1500.00,50.00),('11IZ',21076054,'17/01/2021',4058.00,'',0.00,'2021-01-17','1900-01-01',4000.00,50.00),('8140',21076989,'25/11/2021',3487.00,'',0.00,'2021-11-25','1900-01-01',3400.00,75.00),('0X58',21078373,'04/10/2021',587.00,'',0.00,'2021-10-04','1900-01-01',500.00,75.00),('0QEX',21085477,'24/10/2021',587.00,'',0.00,'2021-10-24','1900-01-01',500.00,75.00),('0OAG',21086384,'30/01/2021',1558.00,'',0.00,'2021-01-30','1900-01-01',1500.00,50.00),('0ZRN',21086996,'17/11/2021',1087.00,'',0.00,'2021-11-17','1900-01-01',1000.00,75.00),('0ZRN',21087044,'02/08/2021',1487.00,'',0.00,'2021-08-02','1900-01-01',1400.00,75.00),('0WVW',21088265,'10/05/2021',1258.00,'',0.00,'2021-05-10','1900-01-01',1200.00,50.00),('0WVW',21088695,'19/05/2021',758.00,'',0.00,'2021-05-19','1900-01-01',671.00,75.00),('1DV6',21090873,'17/11/2021',687.00,'',0.00,'2021-11-17','1900-01-01',600.00,75.00),('0WVW',21091574,'15/05/2021',1258.00,'',0.00,'2021-05-15','1900-01-01',1171.00,75.00),('0WVW',21091590,'15/04/2021',1258.00,'',0.00,'2021-04-15','1900-01-01',1200.00,50.00),('0YNY',21091699,'21/07/2021',587.00,'',0.00,'2021-07-21','1900-01-01',500.00,75.00),('0SVW',21092242,'11/02/2021',1058.00,'',0.00,'2021-02-11','1900-01-01',1000.00,50.00),('11HT',21093323,'28/12/2021',2987.00,'',0.00,'2021-12-28','1900-01-01',2900.00,75.00),('11HT',21093505,'24/03/2021',558.00,'',0.00,'2021-03-24','1900-01-01',500.00,50.00),('11HT',21093513,'18/05/2021',2858.00,'',0.00,'2021-05-18','1900-01-01',2771.00,75.00),('11HT',21093513,'15/01/2021',2658.00,'',0.00,'2021-01-15','1900-01-01',2600.00,50.00),('11HT',21093554,'06/12/2021',2187.00,'',0.00,'2021-12-06','1900-01-01',2100.00,75.00),('11HT',21093745,'28/08/2021',1587.00,'',0.00,'2021-08-28','1900-01-01',1500.00,75.00),('0136',21095310,'31/12/2021',2587.00,'',0.00,'2021-12-31','1900-01-01',2500.00,75.00),('0136',21095310,'15/12/2021',2387.00,'',0.00,'2021-12-15','1900-01-01',2300.00,75.00),('0YMW',21096755,'24/01/2021',858.00,'',0.00,'2021-01-24','1900-01-01',800.00,50.00),('0108',21098322,'01/12/2021',1787.00,'',0.00,'2021-12-01','1900-01-01',1700.00,75.00),('1040',21103916,'18/10/2021',1887.00,'',0.00,'2021-10-18','1900-01-01',1800.00,75.00),('0XGR',21105663,'16/11/2021',1087.00,'',0.00,'2021-11-16','1900-01-01',1000.00,75.00),('0XGR',21105754,'05/12/2021',587.00,'',0.00,'2021-12-05','1900-01-01',500.00,75.00),('113F',21105986,'20/11/2021',1287.00,'',0.00,'2021-11-20','1900-01-01',1200.00,75.00),('0NO4',21108857,'18/02/2021',758.00,'',0.00,'2021-02-18','1900-01-01',700.00,50.00),('0NO4',21112693,'14/01/2021',1058.00,'',0.00,'2021-01-14','1900-01-01',1000.00,50.00),('0R0S',21114368,'03/12/2021',1587.00,'',0.00,'2021-12-03','1900-01-01',1500.00,75.00),('0R0S',21114368,'28/08/2021',1587.00,'',0.00,'2021-08-28','1900-01-01',1500.00,75.00),('0OFY',21124409,'01/11/2021',787.00,'',0.00,'2021-11-01','1900-01-01',700.00,75.00),('0OTQ',21124730,'16/01/2021',858.00,'25/02/2021',840.73,'2021-01-16','2021-02-25',800.00,50.00),('0YLR',21125190,'05/02/2021',1498.00,'',0.00,'2021-02-05','1900-01-01',1440.00,50.00),('0X6F',21128848,'03/01/2021',658.00,'',0.00,'2021-01-03','1900-01-01',600.00,50.00),('3973',21131941,'06/07/2021',987.00,'',0.00,'2021-07-06','1900-01-01',900.00,75.00),('0WGU',21136247,'29/01/2021',558.00,'',0.00,'2021-01-29','1900-01-01',500.00,50.00),('113Y',21144894,'22/12/2021',787.00,'',0.00,'2021-12-22','1900-01-01',700.00,75.00),('0WYX',21147905,'31/12/2021',787.00,'',0.00,'2021-12-31','1900-01-01',700.00,75.00),('0WYX',21147905,'26/11/2021',787.00,'',0.00,'2021-11-26','1900-01-01',700.00,75.00),('11IM',21149398,'31/12/2021',687.00,'',0.00,'2021-12-31','1900-01-01',600.00,75.00),('11IM',21149992,'25/07/2021',587.00,'',0.00,'2021-07-25','1900-01-01',500.00,75.00),('11IM',21149992,'12/07/2021',587.00,'',0.00,'2021-07-12','1900-01-01',500.00,75.00),('0UPD',21150511,'26/12/2021',587.00,'',0.00,'2021-12-26','1900-01-01',500.00,75.00),('0Z9O',21151428,'26/06/2021',687.00,'',0.00,'2021-06-26','1900-01-01',600.00,75.00),('0W5Q',21151550,'15/01/2021',2558.00,'',0.00,'2021-01-15','1900-01-01',2500.00,50.00),('16QQ',21160775,'04/01/2021',1658.00,'',0.00,'2021-01-04','1900-01-01',1600.00,50.00),('0ZTK',21161377,'06/11/2021',3487.00,'',0.00,'2021-11-06','1900-01-01',3400.00,75.00),('0289',21168158,'01/04/2021',1058.00,'',0.00,'2021-04-01','1900-01-01',1000.00,50.00),('0289',21168208,'22/09/2021',787.00,'',0.00,'2021-09-22','1900-01-01',700.00,75.00),('0289',21168208,'16/03/2021',958.00,'',0.00,'2021-03-16','1900-01-01',900.00,50.00),('10HO',21168687,'06/02/2021',858.00,'',0.00,'2021-02-06','1900-01-01',800.00,50.00),('0086',21175393,'18/01/2021',958.00,'',0.00,'2021-01-18','1900-01-01',900.00,50.00),('2305',21175740,'07/11/2021',1087.00,'',0.00,'2021-11-07','1900-01-01',1000.00,75.00),('2305',21175740,'28/02/2021',1058.00,'',0.00,'2021-02-28','1900-01-01',1000.00,50.00),('0XE2',21175906,'17/06/2021',1587.00,'',0.00,'2021-06-17','1900-01-01',1500.00,75.00),('6795',21178934,'04/01/2021',1558.00,'',0.00,'2021-01-04','1900-01-01',1500.00,50.00),('0NSX',21179080,'25/11/2021',2087.00,'',0.00,'2021-11-25','1900-01-01',2000.00,75.00),('0WVW',21179312,'04/08/2021',3087.00,'',0.00,'2021-08-04','1900-01-01',3000.00,75.00),('0W1Z',21180245,'12/06/2021',587.00,'',0.00,'2021-06-12','1900-01-01',500.00,75.00),('2305',21182068,'18/02/2021',3358.00,'',0.00,'2021-02-18','1900-01-01',3300.00,50.00),('11L3',21182183,'26/08/2021',687.00,'',0.00,'2021-08-26','1900-01-01',600.00,75.00),('0WYA',21185400,'19/02/2021',558.00,'',0.00,'2021-02-19','1900-01-01',500.00,50.00),('5545',21189469,'16/12/2021',1287.00,'',0.00,'2021-12-16','1900-01-01',1200.00,75.00),('0YAT',21193628,'11/06/2021',687.00,'21/07/2021',686.13,'2021-06-11','2021-07-21',600.00,75.00),('0VO8',21195045,'24/02/2021',658.00,'',0.00,'2021-02-24','1900-01-01',600.00,50.00),('7411',21197082,'21/05/2021',2558.00,'',0.00,'2021-05-21','1900-01-01',2471.00,75.00),('1JT0',21198783,'07/12/2021',887.00,'',0.00,'2021-12-07','1900-01-01',800.00,75.00),('0NT0',21204581,'03/02/2021',1858.00,'',0.00,'2021-02-03','1900-01-01',1800.00,50.00),('7266',21204979,'30/05/2021',587.00,'',0.00,'2021-05-30','1900-01-01',500.00,75.00),('7266',21204979,'16/03/2021',558.00,'',0.00,'2021-03-16','1900-01-01',500.00,50.00),('0OFY',21205315,'16/08/2021',1087.00,'',0.00,'2021-08-16','1900-01-01',1000.00,75.00),('1FAX',21205760,'17/05/2021',558.00,'25/06/2021',558.00,'2021-05-17','2021-06-25',471.00,75.00),('9377',21205901,'02/12/2021',3387.00,'',0.00,'2021-12-02','1900-01-01',3300.00,75.00),('9377',21205901,'04/01/2021',2758.00,'',0.00,'2021-01-04','1900-01-01',2700.00,50.00),('8140',21211065,'18/12/2021',1987.00,'',0.00,'2021-12-18','1900-01-01',1900.00,75.00),('0SSN',21213863,'22/05/2021',2087.00,'',0.00,'2021-05-22','1900-01-01',2000.00,75.00),('0O5J',21217229,'02/10/2021',4287.00,'',0.00,'2021-10-02','1900-01-01',4200.00,75.00),('9220',21221148,'13/02/2021',4058.00,'',0.00,'2021-02-13','1900-01-01',4000.00,50.00),('9572',21224282,'23/01/2021',1258.00,'',0.00,'2021-01-23','1900-01-01',1200.00,50.00),('10OX',21224662,'19/02/2021',2258.00,'',0.00,'2021-02-19','1900-01-01',2200.00,50.00),('2150',21228572,'12/02/2021',1058.00,'',0.00,'2021-02-12','1900-01-01',1000.00,50.00),('0NO4',21230636,'07/05/2021',2858.00,'',0.00,'2021-05-07','1900-01-01',2800.00,50.00),('0121',21231527,'12/01/2021',1058.00,'',0.00,'2021-01-12','1900-01-01',1000.00,50.00),('10KY',21232137,'12/02/2021',558.00,'',0.00,'2021-02-12','1900-01-01',500.00,50.00),('15UE',21234802,'02/12/2021',4887.00,'',0.00,'2021-12-02','1900-01-01',4800.00,75.00),('0PUG',21238134,'14/09/2021',887.00,'',0.00,'2021-09-14','1900-01-01',800.00,75.00),('1183',21240254,'17/12/2021',787.00,'',0.00,'2021-12-17','1900-01-01',700.00,75.00),('0SAB',21241682,'19/08/2021',587.00,'',0.00,'2021-08-19','1900-01-01',500.00,75.00),('0SAB',21241682,'06/08/2021',887.00,'',0.00,'2021-08-06','1900-01-01',800.00,75.00),('0RBZ',21243829,'09/01/2021',758.00,'',0.00,'2021-01-09','1900-01-01',700.00,50.00),('0QCX',21247721,'01/09/2021',1187.00,'',0.00,'2021-09-01','1900-01-01',1100.00,75.00),('0QCX',21247721,'24/08/2021',1487.00,'',0.00,'2021-08-24','1900-01-01',1400.00,75.00),('0V48',21258488,'22/12/2021',2987.00,'',0.00,'2021-12-22','1900-01-01',2900.00,75.00),('0R0S',21261862,'17/07/2021',1487.00,'',0.00,'2021-07-17','1900-01-01',1400.00,75.00),('0O4U',21261896,'23/12/2021',587.00,'',0.00,'2021-12-23','1900-01-01',500.00,75.00),('0155',21265954,'15/01/2021',558.00,'',0.00,'2021-01-15','1900-01-01',500.00,50.00),('10WT',21266895,'20/01/2021',658.00,'',0.00,'2021-01-20','1900-01-01',600.00,50.00),('0O4U',21272919,'06/01/2021',1058.00,'',0.00,'2021-01-06','1900-01-01',1000.00,50.00),('0WGU',21273297,'31/01/2021',1158.00,'',0.00,'2021-01-31','1900-01-01',1100.00,50.00),('11SK',21274352,'15/02/2021',2058.00,'',0.00,'2021-02-15','1900-01-01',2000.00,50.00),('0S77',21277785,'05/01/2021',958.00,'',0.00,'2021-01-05','1900-01-01',900.00,50.00),('0U3V',21280615,'18/06/2021',1287.00,'',0.00,'2021-06-18','1900-01-01',1200.00,75.00),('0X58',21284070,'30/06/2021',1187.00,'',0.00,'2021-06-30','1900-01-01',1100.00,75.00),('9516',21285333,'14/02/2021',758.00,'',0.00,'2021-02-14','1900-01-01',700.00,50.00),('9516',21285333,'03/02/2021',1258.00,'',0.00,'2021-02-03','1900-01-01',1200.00,50.00),('2305',21288139,'28/01/2021',2758.00,'',0.00,'2021-01-28','1900-01-01',2700.00,50.00),('0NO4',21292016,'13/04/2021',1458.00,'',0.00,'2021-04-13','1900-01-01',1400.00,50.00),('2163',21299862,'10/04/2021',1558.00,'',0.00,'2021-04-10','1900-01-01',1500.00,50.00),('0WSY',21304084,'14/08/2021',1387.00,'',0.00,'2021-08-14','1900-01-01',1300.00,75.00),('12FJ',21305339,'08/12/2021',2687.00,'',0.00,'2021-12-08','1900-01-01',2600.00,75.00),('10WT',21306840,'09/01/2021',858.00,'',0.00,'2021-01-09','1900-01-01',800.00,50.00),('1CZR',21310040,'05/02/2021',758.00,'',0.00,'2021-02-05','1900-01-01',700.00,50.00),('8140',21325279,'15/01/2021',2058.00,'',0.00,'2021-01-15','1900-01-01',2000.00,50.00),('8140',21325345,'08/06/2021',687.00,'',0.00,'2021-06-08','1900-01-01',600.00,75.00),('11IP',21331293,'14/02/2021',1058.00,'',0.00,'2021-02-14','1900-01-01',1000.00,50.00),('0WVW',21336995,'23/07/2021',3087.00,'22/09/2021',3062.12,'2021-07-23','2021-09-22',3000.00,75.00),('11V1',21338512,'10/03/2021',2058.00,'',0.00,'2021-03-10','1900-01-01',2000.00,50.00),('11TF',21339213,'05/12/2021',587.00,'',0.00,'2021-12-05','1900-01-01',500.00,75.00),('3776',21341342,'08/01/2021',558.00,'',0.00,'2021-01-08','1900-01-01',500.00,50.00),('0YOV',21344817,'08/05/2021',1558.00,'',0.00,'2021-05-08','1900-01-01',1500.00,50.00),('0WVW',21352505,'12/03/2021',1258.00,'',0.00,'2021-03-12','1900-01-01',1200.00,50.00),('11L1',21353206,'08/10/2021',1787.00,'',0.00,'2021-10-08','1900-01-01',1700.00,75.00),('11VL',21353834,'03/01/2021',658.00,'',0.00,'2021-01-03','1900-01-01',600.00,50.00),('3044',21354923,'03/03/2021',2808.00,'',0.00,'2021-03-03','1900-01-01',2750.00,50.00),('0NO4',21355664,'04/07/2021',1487.00,'',0.00,'2021-07-04','1900-01-01',1400.00,75.00),('0YQT',21360524,'06/02/2021',1358.00,'',0.00,'2021-02-06','1900-01-01',1300.00,50.00),('11WX',21361324,'20/09/2021',687.00,'',0.00,'2021-09-20','1900-01-01',600.00,75.00),('0ZOG',21364120,'05/09/2021',1087.00,'',0.00,'2021-09-05','1900-01-01',1000.00,75.00),('0Z7A',21364831,'30/01/2021',758.00,'',0.00,'2021-01-30','1900-01-01',700.00,50.00),('0Z7A',21364831,'13/01/2021',758.00,'',0.00,'2021-01-13','1900-01-01',700.00,50.00),('10BH',21366208,'19/01/2021',1558.00,'',0.00,'2021-01-19','1900-01-01',1500.00,50.00),('0RRJ',21368253,'12/05/2021',1558.00,'',0.00,'2021-05-12','1900-01-01',1500.00,50.00),('0T2U',21377999,'02/10/2021',2587.00,'',0.00,'2021-10-02','1900-01-01',2500.00,75.00),('0QY6',21384037,'09/12/2021',1987.00,'',0.00,'2021-12-09','1900-01-01',1900.00,75.00),('17W1',21388772,'09/10/2021',1587.00,'',0.00,'2021-10-09','1900-01-01',1500.00,75.00),('0YLR',21399597,'08/01/2021',1258.00,'',0.00,'2021-01-08','1900-01-01',1200.00,50.00),('0254',21401427,'28/08/2021',2387.00,'',0.00,'2021-08-28','1900-01-01',2300.00,75.00),('9449',21402664,'25/07/2021',1387.00,'',0.00,'2021-07-25','1900-01-01',1300.00,75.00),('0V0F',21403027,'30/09/2021',2087.00,'17/11/2021',2017.21,'2021-09-30','2021-11-17',2000.00,75.00),('0419',21409123,'01/02/2021',1858.00,'',0.00,'2021-02-01','1900-01-01',1800.00,50.00),('0Z37',21413174,'11/03/2021',758.00,'',0.00,'2021-03-11','1900-01-01',700.00,50.00),('1494',21414032,'19/03/2021',658.00,'',0.00,'2021-03-19','1900-01-01',600.00,50.00),('1B7K',21419239,'17/09/2021',587.00,'',0.00,'2021-09-17','1900-01-01',500.00,75.00),('1B7K',21419528,'16/10/2021',587.00,'',0.00,'2021-10-16','1900-01-01',500.00,75.00),('0YQ7',21427521,'04/10/2021',2487.00,'',0.00,'2021-10-04','1900-01-01',2400.00,75.00),('0YQ7',21427521,'25/04/2021',1058.00,'',0.00,'2021-04-25','1900-01-01',1000.00,50.00),('11VK',21435920,'23/08/2021',1087.00,'',0.00,'2021-08-23','1900-01-01',1000.00,75.00),('11VK',21435979,'03/08/2021',1587.00,'',0.00,'2021-08-03','1900-01-01',1500.00,75.00),('11VK',21435979,'02/03/2021',1458.00,'',0.00,'2021-03-02','1900-01-01',1400.00,50.00),('11GF',21438015,'16/01/2021',658.00,'',0.00,'2021-01-16','1900-01-01',600.00,50.00),('11GF',21438072,'08/01/2021',1058.00,'',0.00,'2021-01-08','1900-01-01',1000.00,50.00),('0YAT',21439898,'28/11/2021',887.00,'',0.00,'2021-11-28','1900-01-01',800.00,75.00),('2305',21442819,'20/11/2021',1887.00,'',0.00,'2021-11-20','1900-01-01',1800.00,75.00),('2305',21442827,'17/02/2021',558.00,'',0.00,'2021-02-17','1900-01-01',500.00,50.00),('0RAW',21447255,'15/01/2021',1558.00,'',0.00,'2021-01-15','1900-01-01',1500.00,50.00),('9377',21452149,'05/01/2021',1058.00,'',0.00,'2021-01-05','1900-01-01',1000.00,50.00),('11VR',21456181,'22/02/2021',1558.00,'',0.00,'2021-02-22','1900-01-01',1500.00,50.00),('0WOM',21456272,'17/12/2021',587.00,'',0.00,'2021-12-17','1900-01-01',500.00,75.00),('11VR',21456629,'11/01/2021',1358.00,'',0.00,'2021-01-11','1900-01-01',1300.00,50.00),('11VR',21456736,'21/01/2021',558.00,'',0.00,'2021-01-21','1900-01-01',500.00,50.00),('0OQJ',21460860,'19/12/2021',2587.00,'',0.00,'2021-12-19','1900-01-01',2500.00,75.00),('1I3R',21463526,'02/12/2021',4887.00,'',0.00,'2021-12-02','1900-01-01',4800.00,75.00),('0108',21467832,'12/06/2021',4987.00,'',0.00,'2021-06-12','1900-01-01',4900.00,75.00),('0108',21467832,'14/05/2021',4058.00,'',0.00,'2021-05-14','1900-01-01',4000.00,50.00),('0S77',21468608,'22/01/2021',858.00,'',0.00,'2021-01-22','1900-01-01',800.00,50.00),('0SX0',21471842,'23/03/2021',858.00,'',0.00,'2021-03-23','1900-01-01',800.00,50.00),('0121',21473236,'01/12/2021',2787.00,'',0.00,'2021-12-01','1900-01-01',2700.00,75.00),('0R53',21473335,'14/01/2021',958.00,'',0.00,'2021-01-14','1900-01-01',900.00,50.00),('15AI',21475215,'16/01/2021',858.00,'',0.00,'2021-01-16','1900-01-01',800.00,50.00),('0N94',21475868,'31/12/2021',2087.00,'',0.00,'2021-12-31','1900-01-01',2000.00,75.00),('0N94',21475868,'03/01/2021',1158.00,'',0.00,'2021-01-03','1900-01-01',1100.00,50.00),('0S77',21476411,'30/01/2021',1358.00,'',0.00,'2021-01-30','1900-01-01',1300.00,50.00),('0YAT',21477831,'25/09/2021',587.00,'',0.00,'2021-09-25','1900-01-01',500.00,75.00),('0NIA',21485909,'13/11/2021',687.00,'',0.00,'2021-11-13','1900-01-01',600.00,75.00),('0NIA',21485909,'04/01/2021',558.00,'',0.00,'2021-01-04','1900-01-01',500.00,50.00),('11WC',21491568,'24/08/2021',2387.00,'',0.00,'2021-08-24','1900-01-01',2300.00,75.00),('0ZUQ',21502372,'21/05/2021',2058.00,'',0.00,'2021-05-21','1900-01-01',1971.00,75.00),('0419',21505102,'25/09/2021',587.00,'',0.00,'2021-09-25','1900-01-01',500.00,75.00),('0Z70',21516588,'09/05/2021',558.00,'',0.00,'2021-05-09','1900-01-01',500.00,50.00),('0PMO',21517271,'22/10/2021',587.00,'',0.00,'2021-10-22','1900-01-01',500.00,75.00),('0VI4',21518253,'20/05/2021',1558.00,'',0.00,'2021-05-20','1900-01-01',1471.00,75.00),('0QCX',21521349,'15/10/2021',987.00,'',0.00,'2021-10-15','1900-01-01',900.00,75.00),('0PSU',21522867,'19/01/2021',3058.00,'',0.00,'2021-01-19','1900-01-01',3000.00,50.00),('0289',21523212,'05/03/2021',1158.00,'',0.00,'2021-03-05','1900-01-01',1100.00,50.00),('8140',21524079,'01/03/2021',2558.00,'',0.00,'2021-03-01','1900-01-01',2500.00,50.00),('2305',21524913,'02/01/2021',3058.00,'',0.00,'2021-01-02','1900-01-01',3000.00,50.00),('10WT',21524921,'05/12/2021',587.00,'',0.00,'2021-12-05','1900-01-01',500.00,75.00),('10WT',21524962,'13/02/2021',558.00,'',0.00,'2021-02-13','1900-01-01',500.00,50.00),('8478',21528153,'03/04/2021',1958.00,'',0.00,'2021-04-03','1900-01-01',1900.00,50.00),('121S',21533161,'19/09/2021',1087.00,'',0.00,'2021-09-19','1900-01-01',1000.00,75.00),('0YAT',21539945,'26/12/2021',1087.00,'',0.00,'2021-12-26','1900-01-01',1000.00,75.00),('16UH',21541040,'17/12/2021',587.00,'',0.00,'2021-12-17','1900-01-01',500.00,75.00),('5588',21545900,'15/02/2021',2958.00,'',0.00,'2021-02-15','1900-01-01',2900.00,50.00),('5588',21545900,'13/01/2021',1258.00,'',0.00,'2021-01-13','1900-01-01',1200.00,50.00),('0TXK',21548094,'22/09/2021',1187.00,'',0.00,'2021-09-22','1900-01-01',1100.00,75.00),('0TXK',21548094,'07/08/2021',1187.00,'',0.00,'2021-08-07','1900-01-01',1100.00,75.00),('0SDT',21550801,'24/10/2021',2187.00,'',0.00,'2021-10-24','1900-01-01',2100.00,75.00),('0SDT',21550801,'11/02/2021',1758.00,'',0.00,'2021-02-11','1900-01-01',1700.00,50.00),('0OSA',21552278,'22/01/2021',658.00,'',0.00,'2021-01-22','1900-01-01',600.00,50.00),('0W5Q',21552641,'07/01/2021',558.00,'',0.00,'2021-01-07','1900-01-01',500.00,50.00),('0ZW7',21554423,'13/02/2021',858.00,'',0.00,'2021-02-13','1900-01-01',800.00,50.00),('0298',21554894,'05/11/2021',1087.00,'',0.00,'2021-11-05','1900-01-01',1000.00,75.00),('0XKI',21564711,'15/11/2021',1087.00,'',0.00,'2021-11-15','1900-01-01',1000.00,75.00),('0063',21571740,'17/09/2021',1087.00,'',0.00,'2021-09-17','1900-01-01',1000.00,75.00),('0WOM',21574207,'28/11/2021',587.00,'',0.00,'2021-11-28','1900-01-01',500.00,75.00),('7300',21576020,'17/12/2021',1487.00,'',0.00,'2021-12-17','1900-01-01',1400.00,75.00),('194I',21577317,'12/11/2021',1687.00,'',0.00,'2021-11-12','1900-01-01',1600.00,75.00),('0ZDV',21581004,'06/12/2021',987.00,'',0.00,'2021-12-06','1900-01-01',900.00,75.00),('0PN4',21581004,'15/01/2021',558.00,'',0.00,'2021-01-15','1900-01-01',500.00,50.00),('0T29',21582358,'05/03/2021',958.00,'',0.00,'2021-03-05','1900-01-01',900.00,50.00),('2741',21582473,'28/11/2021',587.00,'',0.00,'2021-11-28','1900-01-01',500.00,75.00),('0ZF4',21584578,'16/01/2021',1358.00,'',0.00,'2021-01-16','1900-01-01',1300.00,50.00),('11SP',21584842,'20/01/2021',558.00,'',0.00,'2021-01-20','1900-01-01',500.00,50.00),('0W1P',21587605,'08/06/2021',987.00,'',0.00,'2021-06-08','1900-01-01',900.00,75.00),('19A0',21591656,'09/05/2021',3658.00,'',0.00,'2021-05-09','1900-01-01',3600.00,50.00),('19A0',21591664,'09/09/2021',3487.00,'',0.00,'2021-09-09','1900-01-01',3400.00,75.00),('1HV3',21591854,'25/11/2021',2087.00,'',0.00,'2021-11-25','1900-01-01',2000.00,75.00),('1HV3',21591854,'23/10/2021',1087.00,'',0.00,'2021-10-23','1900-01-01',1000.00,75.00),('19A0',21592027,'02/12/2021',4187.00,'',0.00,'2021-12-02','1900-01-01',4100.00,75.00),('19A0',21592027,'17/01/2021',3058.00,'',0.00,'2021-01-17','1900-01-01',3000.00,50.00),('0YLR',21597018,'10/02/2021',2558.00,'',0.00,'2021-02-10','1900-01-01',2500.00,50.00),('0ZOG',21603584,'25/01/2021',658.00,'',0.00,'2021-01-25','1900-01-01',600.00,50.00),('11AP',21607866,'11/01/2021',1058.00,'',0.00,'2021-01-11','1900-01-01',1000.00,50.00),('10XB',21613179,'19/09/2021',6587.00,'',0.00,'2021-09-19','1900-01-01',6500.00,75.00),('10XB',21613575,'10/11/2021',2087.00,'',0.00,'2021-11-10','1900-01-01',2000.00,75.00),('10XB',21613625,'20/11/2021',5087.00,'',0.00,'2021-11-20','1900-01-01',5000.00,75.00),('10XB',21613708,'29/10/2021',6087.00,'',0.00,'2021-10-29','1900-01-01',6000.00,75.00),('0OGB',21617378,'27/01/2021',3758.00,'',0.00,'2021-01-27','1900-01-01',3700.00,50.00),('0PQ2',21620059,'05/12/2021',687.00,'',0.00,'2021-12-05','1900-01-01',600.00,75.00),('0W1Z',21621552,'06/07/2021',687.00,'',0.00,'2021-07-06','1900-01-01',600.00,75.00),('125H',21622279,'11/02/2021',958.00,'',0.00,'2021-02-11','1900-01-01',900.00,50.00),('2163',21624234,'27/03/2021',858.00,'',0.00,'2021-03-27','1900-01-01',800.00,50.00),('12BB',21626346,'16/02/2021',1758.00,'',0.00,'2021-02-16','1900-01-01',1700.00,50.00),('12BB',21626510,'04/01/2021',1858.00,'',0.00,'2021-01-04','1900-01-01',1800.00,50.00),('0035',21629019,'02/12/2021',2787.00,'',0.00,'2021-12-02','1900-01-01',2700.00,75.00),('0035',21629019,'10/06/2021',1087.00,'',0.00,'2021-06-10','1900-01-01',1000.00,75.00),('10WT',21637780,'17/04/2021',958.00,'',0.00,'2021-04-17','1900-01-01',900.00,50.00),('0XXI',21640610,'05/11/2021',687.00,'',0.00,'2021-11-05','1900-01-01',600.00,75.00),('1CLL',21643713,'26/11/2021',1087.00,'',0.00,'2021-11-26','1900-01-01',1000.00,75.00),('0WVW',21645593,'13/08/2021',6587.00,'',0.00,'2021-08-13','1900-01-01',6500.00,75.00),('15TN',21648191,'20/01/2021',958.00,'',0.00,'2021-01-20','1900-01-01',900.00,50.00),('15TN',21648324,'06/01/2021',858.00,'',0.00,'2021-01-06','1900-01-01',800.00,50.00),('10FD',21654322,'12/02/2021',1058.00,'',0.00,'2021-02-12','1900-01-01',1000.00,50.00),('10FD',21654322,'05/02/2021',1058.00,'',0.00,'2021-02-05','1900-01-01',1000.00,50.00),('10FD',21654322,'08/01/2021',1358.00,'',0.00,'2021-01-08','1900-01-01',1300.00,50.00),('105X',21658612,'24/11/2021',2487.00,'',0.00,'2021-11-24','1900-01-01',2400.00,75.00),('2305',21661764,'22/01/2021',1158.00,'',0.00,'2021-01-22','1900-01-01',1100.00,50.00),('0053',21662614,'25/02/2021',1158.00,'',0.00,'2021-02-25','1900-01-01',1100.00,50.00),('10S1',21664479,'30/07/2021',1187.00,'',0.00,'2021-07-30','1900-01-01',1100.00,75.00),('0YLR',21665161,'06/01/2021',558.00,'',0.00,'2021-01-06','1900-01-01',500.00,50.00),('12C7',21671680,'18/12/2021',887.00,'',0.00,'2021-12-18','1900-01-01',800.00,75.00),('0P4F',21673520,'11/01/2021',558.00,'',0.00,'2021-01-11','1900-01-01',500.00,50.00),('0W5Q',21674767,'12/01/2021',1558.00,'',0.00,'2021-01-12','1900-01-01',1500.00,50.00),('1JRY',21677869,'23/10/2021',687.00,'',0.00,'2021-10-23','1900-01-01',600.00,75.00),('0OGB',21681440,'04/12/2021',3087.00,'',0.00,'2021-12-04','1900-01-01',3000.00,75.00),('2305',21683008,'14/01/2021',1358.00,'',0.00,'2021-01-14','1900-01-01',1300.00,50.00),('123N',21683545,'23/06/2021',1087.00,'',0.00,'2021-06-23','1900-01-01',1000.00,75.00),('2054',21683875,'18/12/2021',3987.00,'',0.00,'2021-12-18','1900-01-01',3900.00,75.00),('5528',21684741,'14/01/2021',1558.00,'',0.00,'2021-01-14','1900-01-01',1500.00,50.00),('14OL',21687900,'24/01/2021',1358.00,'',0.00,'2021-01-24','1900-01-01',1300.00,50.00),('13Q1',21689765,'11/09/2021',687.00,'',0.00,'2021-09-11','1900-01-01',600.00,75.00),('0405',21692801,'06/12/2021',3887.00,'',0.00,'2021-12-06','1900-01-01',3800.00,75.00),('0RZN',21694021,'07/01/2021',3358.00,'',0.00,'2021-01-07','1900-01-01',3300.00,50.00),('1CC2',21695242,'26/09/2021',587.00,'',0.00,'2021-09-26','1900-01-01',500.00,75.00),('1274',21701792,'13/02/2021',1058.00,'',0.00,'2021-02-13','1900-01-01',1000.00,50.00),('0RSF',21703244,'09/01/2021',958.00,'',0.00,'2021-01-09','1900-01-01',900.00,50.00),('1GBH',21708037,'12/12/2021',1387.00,'',0.00,'2021-12-12','1900-01-01',1300.00,75.00),('9076',21708508,'03/11/2021',2087.00,'',0.00,'2021-11-03','1900-01-01',2000.00,75.00),('12G3',21716139,'08/02/2021',558.00,'',0.00,'2021-02-08','1900-01-01',500.00,50.00),('0RAW',21717707,'14/09/2021',2687.00,'',0.00,'2021-09-14','1900-01-01',2600.00,75.00),('3429',21717749,'02/12/2021',1287.00,'',0.00,'2021-12-02','1900-01-01',1200.00,75.00),('10A7',21717954,'12/03/2021',1658.00,'',0.00,'2021-03-12','1900-01-01',1600.00,50.00),('12QM',21721212,'25/11/2021',587.00,'',0.00,'2021-11-25','1900-01-01',500.00,75.00),('1747',21721667,'07/05/2021',1458.00,'',0.00,'2021-05-07','1900-01-01',1400.00,50.00),('0QEG',21722947,'27/11/2021',1687.00,'',0.00,'2021-11-27','1900-01-01',1600.00,75.00),('11II',21727763,'01/11/2021',587.00,'',0.00,'2021-11-01','1900-01-01',500.00,75.00),('11II',21728084,'24/12/2021',587.00,'',0.00,'2021-12-24','1900-01-01',500.00,75.00),('11II',21728118,'05/03/2021',558.00,'',0.00,'2021-03-05','1900-01-01',500.00,50.00),('3776',21729769,'05/02/2021',958.00,'',0.00,'2021-02-05','1900-01-01',900.00,50.00),('18EB',21729793,'25/01/2021',858.00,'',0.00,'2021-01-25','1900-01-01',800.00,50.00),('15S2',21729934,'15/01/2021',1058.00,'',0.00,'2021-01-15','1900-01-01',1000.00,50.00),('0XI9',21732243,'12/01/2021',558.00,'',0.00,'2021-01-12','1900-01-01',500.00,50.00),('11HJ',21745229,'05/01/2021',2358.00,'',0.00,'2021-01-05','1900-01-01',2300.00,50.00),('0289',21748793,'21/12/2021',1687.00,'',0.00,'2021-12-21','1900-01-01',1600.00,75.00),('2305',21749338,'18/12/2021',6587.00,'',0.00,'2021-12-18','1900-01-01',6500.00,75.00),('12CC',21752621,'17/12/2021',787.00,'',0.00,'2021-12-17','1900-01-01',700.00,75.00),('12CC',21752621,'03/12/2021',887.00,'',0.00,'2021-12-03','1900-01-01',800.00,75.00),('12WW',21755343,'01/12/2021',1187.00,'',0.00,'2021-12-01','1900-01-01',1100.00,75.00),('11WS',21758016,'06/08/2021',587.00,'',0.00,'2021-08-06','1900-01-01',500.00,75.00),('0S8D',21760848,'22/12/2021',2287.00,'',0.00,'2021-12-22','1900-01-01',2200.00,75.00),('0S8D',21760848,'22/01/2021',658.00,'',0.00,'2021-01-22','1900-01-01',600.00,50.00),('2305',21760871,'07/01/2021',558.00,'',0.00,'2021-01-07','1900-01-01',500.00,50.00),('2305',21760905,'06/12/2021',2287.00,'',0.00,'2021-12-06','1900-01-01',2200.00,75.00),('0QA7',21763347,'07/05/2021',1058.00,'',0.00,'2021-05-07','1900-01-01',1000.00,50.00),('19SO',21767314,'13/08/2021',587.00,'',0.00,'2021-08-13','1900-01-01',500.00,75.00),('2578',21769914,'21/11/2021',587.00,'',0.00,'2021-11-21','1900-01-01',500.00,75.00),('2578',21769914,'06/06/2021',1587.00,'',0.00,'2021-06-06','1900-01-01',1500.00,75.00),('2305',21769930,'03/01/2021',2058.00,'',0.00,'2021-01-03','1900-01-01',2000.00,50.00),('0234',21774591,'21/12/2021',1987.00,'',0.00,'2021-12-21','1900-01-01',1900.00,75.00),('10IG',21777206,'16/09/2021',987.00,'',0.00,'2021-09-16','1900-01-01',900.00,75.00),('12I7',21778386,'02/02/2021',858.00,'',0.00,'2021-02-02','1900-01-01',800.00,50.00),('107U',21782941,'17/10/2021',687.00,'',0.00,'2021-10-17','1900-01-01',600.00,75.00),('0Y4X',21783568,'07/12/2021',3387.00,'',0.00,'2021-12-07','1900-01-01',3300.00,75.00),('0Y4X',21783568,'05/07/2021',3287.00,'',0.00,'2021-07-05','1900-01-01',3200.00,75.00),('0PU8',21788336,'02/10/2021',887.00,'',0.00,'2021-10-02','1900-01-01',800.00,75.00),('1AB3',21788658,'07/01/2021',558.00,'24/02/2021',558.00,'2021-01-07','2021-02-24',500.00,50.00),('0NIS',21789011,'05/12/2021',1387.00,'',0.00,'2021-12-05','1900-01-01',1300.00,75.00),('0Z37',21796289,'18/12/2021',1487.00,'',0.00,'2021-12-18','1900-01-01',1400.00,75.00),('2305',21798863,'14/01/2021',1958.00,'',0.00,'2021-01-14','1900-01-01',1900.00,50.00),('2305',21798863,'02/01/2021',3358.00,'',0.00,'2021-01-02','1900-01-01',3300.00,50.00),('0U5O',21799432,'02/07/2021',1687.00,'',0.00,'2021-07-02','1900-01-01',1600.00,75.00),('15ZW',21799507,'21/02/2021',958.00,'',0.00,'2021-02-21','1900-01-01',900.00,50.00),('15ZW',21799507,'14/01/2021',1158.00,'',0.00,'2021-01-14','1900-01-01',1100.00,50.00),('0452',21800180,'23/06/2021',5087.00,'',0.00,'2021-06-23','1900-01-01',5000.00,75.00),('5383',21801493,'01/11/2021',787.00,'',0.00,'2021-11-01','1900-01-01',700.00,75.00),('121L',21807268,'19/09/2021',587.00,'',0.00,'2021-09-19','1900-01-01',500.00,75.00),('0P5Y',21808621,'20/11/2021',787.00,'',0.00,'2021-11-20','1900-01-01',700.00,75.00),('6617',21813027,'15/01/2021',1558.00,'04/03/2021',1554.08,'2021-01-15','2021-03-04',1500.00,50.00),('0WVW',21821970,'24/07/2021',1087.00,'',0.00,'2021-07-24','1900-01-01',1000.00,75.00),('0298',21830526,'25/11/2021',787.00,'',0.00,'2021-11-25','1900-01-01',700.00,75.00),('0298',21830526,'28/09/2021',687.00,'',0.00,'2021-09-28','1900-01-01',600.00,75.00),('6617',21836051,'17/01/2021',1458.00,'05/03/2021',1454.92,'2021-01-17','2021-03-05',1400.00,50.00),('6617',21836234,'13/01/2021',2058.00,'',0.00,'2021-01-13','1900-01-01',2000.00,50.00),('9377',21837380,'22/11/2021',2087.00,'',0.00,'2021-11-22','1900-01-01',2000.00,75.00),('9377',21837398,'12/11/2021',2087.00,'',0.00,'2021-11-12','1900-01-01',2000.00,75.00),('0RAW',21839113,'16/12/2021',1287.00,'',0.00,'2021-12-16','1900-01-01',1200.00,75.00),('0RAW',21839188,'09/01/2021',558.00,'',0.00,'2021-01-09','1900-01-01',500.00,50.00),('0289',21843420,'04/12/2021',1087.00,'',0.00,'2021-12-04','1900-01-01',1000.00,75.00),('0357',21843537,'01/12/2021',1487.00,'',0.00,'2021-12-01','1900-01-01',1400.00,75.00),('0QOU',21846290,'15/11/2021',1487.00,'',0.00,'2021-11-15','1900-01-01',1400.00,75.00),('0WVW',21847645,'19/06/2021',1087.00,'',0.00,'2021-06-19','1900-01-01',1000.00,75.00),('0WVW',21847710,'08/08/2021',1587.00,'',0.00,'2021-08-08','1900-01-01',1500.00,75.00),('0WVW',21847793,'11/07/2021',2087.00,'',0.00,'2021-07-11','1900-01-01',2000.00,75.00),('0WVW',21847884,'13/02/2021',1258.00,'',0.00,'2021-02-13','1900-01-01',1200.00,50.00),('0WVW',21848098,'15/02/2021',1258.00,'',0.00,'2021-02-15','1900-01-01',1200.00,50.00),('0WVW',21848155,'02/03/2021',1258.00,'',0.00,'2021-03-02','1900-01-01',1200.00,50.00),('0WVW',21848601,'24/04/2021',1258.00,'',0.00,'2021-04-24','1900-01-01',1200.00,50.00),('0WVW',21848742,'22/01/2021',1258.00,'',0.00,'2021-01-22','1900-01-01',1200.00,50.00),('1AFR',21848809,'29/11/2021',1087.00,'',0.00,'2021-11-29','1900-01-01',1000.00,75.00),('0WVW',21849062,'06/01/2021',1258.00,'',0.00,'2021-01-06','1900-01-01',1200.00,50.00),('0WVW',21849351,'23/07/2021',3087.00,'22/09/2021',3068.38,'2021-07-23','2021-09-22',3000.00,75.00),('0WVW',21849419,'29/05/2021',1087.00,'',0.00,'2021-05-29','1900-01-01',1000.00,75.00),('0WVW',21849591,'05/01/2021',1258.00,'',0.00,'2021-01-05','1900-01-01',1200.00,50.00),('0WVW',21849690,'22/07/2021',3087.00,'',0.00,'2021-07-22','1900-01-01',3000.00,75.00),('0WVW',21849690,'21/01/2021',1258.00,'',0.00,'2021-01-21','1900-01-01',1200.00,50.00),('0WVW',21849724,'20/07/2021',3087.00,'17/09/2021',3000.54,'2021-07-20','2021-09-17',3000.00,75.00),('0WVW',21849971,'11/06/2021',3087.00,'',0.00,'2021-06-11','1900-01-01',3000.00,75.00),('0WVW',21850060,'14/05/2021',1258.00,'',0.00,'2021-05-14','1900-01-01',1200.00,50.00),('0WVW',21850342,'25/06/2021',3087.00,'',0.00,'2021-06-25','1900-01-01',3000.00,75.00),('0WVW',21850433,'21/06/2021',3087.00,'',0.00,'2021-06-21','1900-01-01',3000.00,75.00),('0WVW',21850631,'03/01/2021',1258.00,'',0.00,'2021-01-03','1900-01-01',1200.00,50.00),('0WVW',21850771,'02/02/2021',1258.00,'',0.00,'2021-02-02','1900-01-01',1200.00,50.00),('0WVW',21850987,'23/07/2021',3087.00,'',0.00,'2021-07-23','1900-01-01',3000.00,75.00),('7223',21852850,'19/01/2021',658.00,'',0.00,'2021-01-19','1900-01-01',600.00,50.00),('12DR',21854062,'14/12/2021',4987.00,'',0.00,'2021-12-14','1900-01-01',4900.00,75.00),('0WVW',21860549,'26/01/2021',1258.00,'',0.00,'2021-01-26','1900-01-01',1200.00,50.00),('121S',21862032,'17/08/2021',587.00,'24/09/2021',523.34,'2021-08-17','2021-09-24',500.00,75.00),('0WVW',21862297,'22/01/2021',1258.00,'',0.00,'2021-01-22','1900-01-01',1200.00,50.00),('0QEX',21863147,'22/07/2021',687.00,'',0.00,'2021-07-22','1900-01-01',600.00,75.00),('0WVW',21863626,'26/03/2021',1258.00,'',0.00,'2021-03-26','1900-01-01',1200.00,50.00),('9757',21866082,'29/05/2021',1387.00,'',0.00,'2021-05-29','1900-01-01',1300.00,75.00),('7302',21866835,'13/12/2021',2087.00,'',0.00,'2021-12-13','1900-01-01',2000.00,75.00),('3710',21868690,'18/11/2021',1687.00,'',0.00,'2021-11-18','1900-01-01',1600.00,75.00),('3710',21868690,'16/01/2021',1558.00,'',0.00,'2021-01-16','1900-01-01',1500.00,50.00),('2741',21869300,'11/12/2021',887.00,'',0.00,'2021-12-11','1900-01-01',800.00,75.00),('0WVW',21870795,'24/06/2021',587.00,'',0.00,'2021-06-24','1900-01-01',500.00,75.00),('12IP',21875265,'15/11/2021',2887.00,'',0.00,'2021-11-15','1900-01-01',2800.00,75.00),('12IP',21875380,'11/03/2021',3158.00,'',0.00,'2021-03-11','1900-01-01',3100.00,50.00),('127Y',21886320,'04/02/2021',1658.00,'',0.00,'2021-02-04','1900-01-01',1600.00,50.00),('127Y',21886791,'18/01/2021',1558.00,'',0.00,'2021-01-18','1900-01-01',1500.00,50.00),('0YAT',21887674,'10/01/2021',558.00,'',0.00,'2021-01-10','1900-01-01',500.00,50.00),('0YAT',21887690,'26/12/2021',1087.00,'',0.00,'2021-12-26','1900-01-01',1000.00,75.00),('0YAT',21887690,'08/01/2021',1058.00,'',0.00,'2021-01-08','1900-01-01',1000.00,50.00),('0108',21889746,'30/01/2021',4058.00,'',0.00,'2021-01-30','1900-01-01',4000.00,50.00),('0QZ1',21896162,'23/01/2021',558.00,'',0.00,'2021-01-23','1900-01-01',500.00,50.00),('0QZ1',21896162,'07/01/2021',1058.00,'',0.00,'2021-01-07','1900-01-01',1000.00,50.00),('4337',21906474,'18/03/2021',658.00,'',0.00,'2021-03-18','1900-01-01',600.00,50.00),('12OD',21909858,'24/11/2021',1087.00,'',0.00,'2021-11-24','1900-01-01',1000.00,75.00),('12OD',21909932,'15/06/2021',1287.00,'',0.00,'2021-06-15','1900-01-01',1200.00,75.00),('12OD',21910005,'17/02/2021',958.00,'',0.00,'2021-02-17','1900-01-01',900.00,50.00),('3132',21910641,'11/12/2021',2087.00,'',0.00,'2021-12-11','1900-01-01',2000.00,75.00),('3132',21910641,'17/01/2021',1558.00,'',0.00,'2021-01-17','1900-01-01',1500.00,50.00),('0QEG',21911383,'15/01/2021',3658.00,'',0.00,'2021-01-15','1900-01-01',3600.00,50.00),('107P',21912449,'06/12/2021',687.00,'',0.00,'2021-12-06','1900-01-01',600.00,75.00),('12LF',21919386,'07/01/2021',3658.00,'',0.00,'2021-01-07','1900-01-01',3600.00,50.00),('12LF',21919394,'11/01/2021',1558.00,'',0.00,'2021-01-11','1900-01-01',1500.00,50.00),('12LF',21919436,'29/01/2021',2358.00,'',0.00,'2021-01-29','19